Content,ReviewID
"[u'newton', u'frills', u'broadway', u'nights', u'happy', u'safe', u'district', u'issues', u'walking', u'streets', u'night', u'subway', u'minutes', u'times', u'square', u'minutes', u'lower', u'manhattan', u'choice', u'reasonably', u'priced', u'restaurants', u'minute', u'walk', u'clean', u'well', u'presented', u'room', u'excellent', u'money', u've', u'central', u'manhattan', u'choose', u'save', u'night', u'bit', u'centre', u'newton', u'convenient', u'choice']",UR86254295
"[u'located', u'broadway', u'miles', u'famous', u'bit', u'mins', u'walk', u'central', u'park', u'subway', u'stations', u'doorstep', u'mins', u'subway', u'time', u'square', u'hesitated', u'book', u'weeks', u'ahead', u'august', u'shared', u'bathroom', u'washbasin', u'room', u'booked', u'basis', u'reviews', u'justified', u'location', u'rooms', u'en', u'suite', u'bathrooms', u'time', u'place', u'clean', u'cramped', u'lift', u'causing', u'problems', u'people', u'porter', u'broke', u'hours', u'breakfast', u'facilities', u'varied', u'places', u'short', u'walk', u'lot', u'open', u'hrs', u'day', u'accommodations', u'reviewed', u'holiday']",UR83704671
"[u'hubby', u'returned', u'week', u'holiday', u'nyc', u'newton', u'deal', u'expedia', u'selected', u'room', u'shared', u'bathroom', u'meant', u'enjoy', u'nights', u'favourite', u'city', u'blink', u'lovely', u'lobby', u'entrance', u'rooms', u'comfortable', u'bonus', u'microwave', u'full', u'sized', u'fridge', u'flat', u'screen', u'tv', u'room', u'shared', u'bathroom', u'wasn', u't', u'issue', u'main', u'impeccably', u'clean', u'rest', u'inconsiderate', u'guest', u'left', u'bathroom', u'desirable', u'state', u'display', u'sign', u'advising', u'guests', u'leave', u'facilities', u'expect', u'find', u'room', u'cleaned', u'fresh', u'towels', u'daily', u'housekeeping', u'maintenance', u'staff', u'work', u'extremely', u'hard', u'happy', u'help', u'storing', u'luggage', u'day', u'departure', u'conveniently', u'located', u'subway', u'street', u'located', u'directly', u'money', u'invested', u'week', u'day', u'unlimited', u'subway', u'pass', u'monies', u'worth', u'travelled', u'manhattan', u'walked', u'brooklyn', u'bridge', u'jumped', u'subway', u'train', u'express', u'train', u'times', u'square', u'minutes', u'train', u'stops', u'stops', u'definitely', u'recommend', u'time', u'save', u'pennies', u'enjoy', u'bathroom', u'hope', u'review', u'informative']",UR67918083
"[u'nights', u'newton', u'junior', u'deluxe', u'suite', u'comfortable', u'queen', u'beds', u'small', u'sitting', u'area', u'kitchenette', u'sink', u'microwave', u'refrigerator', u'rooms', u'clean', u'bathroom', u'updated', u'spotless', u'signs', u'bedbugs', u'undergoing', u'cosmetic', u'updates', u'paint', u'wallpaper', u'elevator', u'small', u'slow', u'negative', u'conveniently', u'located', u'street', u'subway', u'three', u'lines', u'express', u'trains', u'short', u'ride', u'times', u'square', u'easy', u'access', u'crosstown', u'buses', u'diner', u'doors', u'manhattan', u'diner', u'breakfast', u'starbucks', u'dunkin', u'donuts', u'block', u'definately', u'return', u'newton']",UR98664825
"[u've', u'poor', u'reviews', u'wanted', u'story', u'rate', u'average', u'average', u'aaa', u'member', u'approved', u'facilities', u'clean', u'basic', u'accommodations', u'intend', u'room', u'sleeping', u'lot', u'hanging', u'room', u'elevator', u'slow', u'single', u'room', u'smallest', u'room', u've', u'lovely', u'room', u'needed', u'single', u'bed', u'actual', u'closet', u'rack', u'room', u'night', u'stand', u'usual', u'small', u'bureau', u'drawers', u'tv', u'top', u'bathroom', u'modern', u'bath', u'shower', u'comb', u'hair', u'dryer', u'clean', u'problems', u'employees', u'pleasant', u'price', u't', u'beat', u'paid', u'tax', u'night', u'single', u'bath', u'broadway', u'sts', u'bus', u'stopping', u'block', u'subway', u'half', u'block', u'bus', u'runs', u'minutes', u'night', u'sundays', u'lots', u'stores', u'buy', u'snacks', u'soda', u'drug', u'store', u'items', u'restaurants', u'fruit', u'vegetable', u'grocery', u'store', u'half', u'block', u'feel', u'manhattan', u'people', u'live', u'bad', u'traffic', u'minutes', u'mid', u'town', u'minutes', u'ideal', u'sightseeing', u'plays', u'mid', u'town', u'definitely', u'return', u'comment', u'experience', u'felt', u'safe', u'neighborhood', u'older', u'woman', u'staying', u'lockers', u'room', u'lobby', u'store', u'luggage', u'day', u'check', u'leave', u'town']",UR6122660
"[u've', u'newton', u'three', u'times', u'price', u'pay', u'differ', u'review', u'suggested', u'clean', u'contrary', u'clean', u'housekeeping', u'service', u'efficient', u'thorough', u'unobtrrusive', u'frills', u'fine', u'mints', u'pillow', u'kinds', u'comfy', u'perks', u'pay', u'three', u'times', u'clean', u'comfortable', u'place', u'decent', u'rate', u'newton', u'business']",UR4738627
"[u'cleaned', u'day', u'service', u'people', u'staff', u'proved', u'flexible', u'wi', u'fi', u'tv', u'time', u'shame', u'don', u't', u'vision', u'location', u'perfect', u'subway']",UR120695978
"[u'newton', u'nights', u'basic', u'accommodation', u'fairly', u'clean', u'walls', u'bit', u'thin', u'side', u'bed', u'comfy', u'place', u'sleep', u'recommend', u'location', u'bad', u'metro', u'min', u'time', u'square', u'walk', u'min', u'pleasant', u'problems', u'lift', u'staff', u'polite', u'funny', u'smell', u'bad', u'smell', u'basic', u'scary']",UR4068065
"[u'booked', u'newton', u'bit', u'concerned', u'staying', u'st', u'worry', u'location', u'excellent', u'subway', u'station', u'yrds', u'door', u'express', u'train', u'time', u'sq', u'minutes', u'central', u'park', u'close', u'natural', u'history', u'museum', u'bronx', u'zoo', u'reached', u'subway', u'well', u'worth', u'visit', u'couple', u'blocks', u'columbus', u'ave', u'loads', u'bars', u'restaurants', u'highly', u'recommend', u'gabriela', u'mexican', u'restaurant', u'bar', u'well', u'restaurant', u'roth', u'steakhouse', u'superb', u'bit', u'treat', u'diner', u'door', u'well', u'breakfast', u'check', u'fast', u'friendly', u'room', u'en', u'suite', u'bed', u'comfy', u'room', u'clean', u'quiet', u'room', u'meant', u'wasn', u't', u'natural', u'light', u'recommend', u'staying', u'imagine', u'traffic', u'noise', u'front', u'staff', u'met', u'reception', u'housekeeper', u'maintenance', u'man', u'friendly', u'trip', u'york', u'definitely']",UR42646621
"[u'fine', u'booking', u'online', u'choose', u'double', u'room', u'double', u'double', u'called', u'front', u'desk', u'told', u'double', u'rooms', u'size', u'double', u'double', u'rooms', u'fewer', u'bed', u'travelling', u'party', u'rooms', u'walking', u'space', u'thought', u'double', u'room', u'suitable', u'turned', u'terrible', u'mistake', u'room', u'checked', u'barely', u'bigger', u'size', u'double', u'bed', u'feet', u'bed', u'walls', u'room', u'extra', u'double', u'bed', u'front', u'desk', u'complained', u'misrepresentation', u'told', u'reservation', u'double', u'room', u'honored', u'pressed', u'bit', u'room', u'singles', u'apology', u'sort', u'day', u'walked', u'corner', u'quality', u'larger', u'room', u'queen', u'bed', u'arrangements', u'cancel', u'rest', u'newton', u'bottom', u'drawn', u'guidebook', u'reviews', u'big', u'rooms', u'book', u'double', u'double', u'double', u'booked', u'expensive', u'guarantee', u'tiny', u'room']",UR2908670
"[u'location', u'clean', u'bathroom', u'spotless', u'beautiful', u'price', u'cancel', u'days', u'reserved', u'daughter', u'left', u'hospital', u'sooner', u'problem', u'highly', u'recommend', u'people', u'city', u'love', u'sites', u'city', u'eventhough', u'live', u'boro', u'worth', u'convenience', u'sure', u'parking', u'garage', u'discounts', u'free', u'parking', u'sincerely', u'pat']",UR100524888
"[u'searched', u'trip', u'advisor', u'reasonably', u'priced', u'nyc', u'booked', u'newton', u'booked', u'lower', u'rate', u'rebooked', u'husband', u'frequent', u'nyc', u'visitors', u'budget', u'spend', u'time', u'room', u'stays', u'location', u'newton', u'located', u'street', u'express', u'red', u'subway', u'express', u'train', u'stops', u'times', u'square', u'theatre', u'district', u'room', u'spacious', u'compared', u'average', u'nyc', u'budget', u'room', u'queen', u'bed', u'desk', u'brand', u'refrigerator', u'microwave', u'closet', u'walk', u'case', u'bathroom', u'beautiful', u'pedestal', u'sink', u'terrazzo', u'tiles', u'popular', u'curved', u'shower', u'rod', u'extremely', u'pleased', u'definitely', u'consider', u'future']",UR10769894
"[u'visited', u'nights', u'aug', u'option', u'double', u'room', u'shared', u'bathroom', u'wernt', u'going', u'room', u'time', u'needed', u'bathroom', u'showering', u'suited', u'room', u'floor', u'small', u'expected', u'york', u'room', u'clean', u'shared', u'bathroom', u'thing', u'worried', u'wasn', u't', u'problem', u'thinking', u'booking', u'rooms', u'shared', u'bathroom', u'dont', u'worry', u'shared', u'rooms', u'worry', u'location', u'bit', u'metro', u'midtown', u'couple', u'minutes', u'easy', u'well', u'priced', u'well', u'worth', u'money', u'ticks', u'boxes', u'budge', u'spend', u'money', u'shopping', u'sightseeing', u'avoid', u'high', u'price', u'midtown', u'urge', u'consider', u'fantastic', u'gem', u'uptown', u'nyc']",UR120384571
"[u'disappointed', u'press', u'expected', u'room', u'clean', u'location', u'floor', u'room', u'noisy', u'night', u'long', u'room', u'dark', u'desk', u'staff', u'unhelpful', u'unsympathetic', u'room', u've', u'york', u'city', u'rate', u'satisfied', u'decided', u'based', u'reviews', u'wanted', u'awake', u'night', u'long', u'loud', u'partying', u'rented', u'dorm', u'room', u'lot', u'money']",UR7672059
"[u'friend', u'shared', u'room', u'nights', u'double', u'comfortable', u'bed', u'shared', u'bathroom', u'sure', u'sharing', u'bathroom', u'clean', u'close', u'subway', u'bus', u'laguardia', u'plethora', u'coffee', u'shops', u'restaurants', u'well', u'guess', u'nyc', u'restaurants', u'night', u'ate', u'metro', u'diver', u'service', u'food', u'friend', u'livesnearby', u'agrees', u'price', u'extended', u'weekend', u'york', u'city', u'usual', u'wonderful', u'friendly', u'people', u'food', u'culture', u'nyc', u'experience']",UR16035842
"[u'staff', u'phenomenal', u'friendly', u'suggestions', u'early', u'check', u'luggage', u'storage', u'perfectly', u'located', u'st', u'subway', u'station', u'riverside', u'park', u'central', u'park', u'weekend', u'walked', u'subway', u'time', u'room', u'exceeded', u'expectations', u'view', u'room', u'spacious', u'bathroom', u'clean', u'beds', u'comfortable', u'wifi', u'internet', u'access', u'flat', u'panel', u'tv', u'elevator', u'bit', u'peculiar', u'worked', u'fast', u'floor', u'ride', u'room', u'cumbersome', u'plan', u'staying', u'time', u'visit', u'nyc']",UR15809910
"[u'nights', u'newton', u'floor', u'perfect', u'taxi', u'friendly', u'doorman', u'welcomed', u'luggages', u'staff', u'spoke', u'french', u'perfectly', u'recommend', u'location', u'close', u'metro', u'street', u'dinners', u'entrance', u'chinese', u'indian', u'restaurants', u'lots', u'shops', u'starbucks', u'dunking', u'donuts', u'delis', u'supermarket', u'restaurant', u'recommend', u'ouest', u'restaurant', u'boulevard', u'going', u'west', u'cinema', u'sport', u'center', u'visible', u'room', u'window', u'room', u'clean', u'big', u'flat', u'screen', u'tv', u'wall', u'fridge', u'microwave', u'coffee', u'machine', u'ice', u'box', u'bathroom', u'small', u'bath', u'shower', u'airdryer', u'cupboard', u'iron', u'table', u'big', u'keep', u'cases', u'room', u'well', u'cleaned', u'day', u'double', u'bed', u'room', u'queen', u'size', u'view', u'broadway', u'blvd', u'room']",UR22343593
"[u'enjoyed', u'booked', u'twin', u'twin', u'sized', u'room', u'twin', u'beds', u'microwave', u'refrigerator', u'flat', u'screen', u'tv', u'bathroom', u'small', u'clean', u'rooms', u'bathrooms', u'redone', u'year', u'half', u'ago', u'fresh', u'clean', u'newton', u'located', u'real', u'neighborhood', u'upper', u'west', u'side', u'subway', u'block', u'bus', u'runs', u'broadway', u'dining', u'places', u'nearby', u'drug', u'store', u'block', u'coin', u'laundry', u'corner', u't', u'view', u'window', u'looked', u'buildings', u'thing', u'room', u'quiet', u'room', u'room', u'noise', u'mentioned', u'elavator', u'pretty', u'slow', u'problem', u'mattresses', u'firm', u'guess', u'posture', u'll', u'definitely', u'returning', u'newton', u'real', u'bargain', u'expensive', u'city']",UR13135039
"[u'well', u'big', u'city', u'answer', u'newton', u'offer', u'second', u'list', u'minor', u'irritations', u'bed', u'bugs', u'surface', u'remedied', u'type', u'cor', u'flooring', u'tired', u'left', u'paint', u'brushes', u'room', u'isn', u't', u'enormous', u'don', u't', u'day', u'cos', u'wife', u'macy', u'penny', u'sight', u'big', u'apple', u'facilities', u'fridge', u'microwave', u'coffee', u'maker', u'tv', u'allow', u'breakfast', u'room', u'provide', u'ingredients', u'save', u'money', u'road', u'quicker', u'mentioned', u'contributor', u'mentioned', u'bed', u'comfortable', u'shower', u'room', u'cleaner', u'job', u'morning', u'internet', u'access', u'foyer', u'adequate', u'diner', u'adjacent', u'fine', u'city', u'diner', u'blocks', u'broadway', u'superb', u'wary', u'tax', u'service', u'adds', u'restaurant', u'tab', u'famiglia', u'pizza', u'house', u'corner', u'amsterdam', u'brilliant', u'pizzas', u'metro', u'minute', u'station', u'ion', u'express', u'minutes', u'time', u'square', u'additionally', u'week', u'weekly', u'metro', u'pass', u'fantastic', u'love', u'city', u'sadly', u'airfares', u'ridiculous', u'hope', u'doesn', u't', u'returning', u'finally', u'importantly', u'staff', u'staff', u'true', u'professionals', u'extra', u'yard', u'time', u'aback', u'remembered', u't', u'life', u'eduardo', u'born', u'blessed', u'biggest', u'grin', u'ready', u'chat', u'charles', u'landry', u'box', u'people', u'haven', u't', u'learnt', u'excellent', u'hosts', u'born', u'problem', u'blessed', u'superb', u'senses', u'humour', u'personality', u'matt', u'betty']",UR102448063
"[u'chose', u'basis', u'positive', u'reviews', u'tripadvisor', u'location', u'ten', u'minutes', u'express', u'train', u'times', u'square', u'general', u'money', u'rooms', u'tiny', u'spotless', u'clean', u'corridors', u'clean', u'bit', u'disappointed', u'desk', u'day', u'person', u'assisted', u'efficiently', u'extra', u'word', u'smile', u'enthusiastic', u'reviews', u'dealing', u'staff', u'members', u'better', u'plenty', u'places', u'breakfast', u'diner', u'mentioned', u'reviews', u'renovated', u'caf', u'europa', u'lot', u'general', u'recommend']",UR93990287
"[u'nights', u'business', u'room', u'large', u'clean', u'well', u'appointed', u'quiet', u'bathroom', u'fixtures', u'wireless', u'internet', u'flat', u'screen', u'tv', u'small', u'coffee', u'maker', u'front', u'desk', u'staff', u'junior', u'suite', u'night', u'simply', u'steal']",UR54990846
"[u'neat', u'place', u'labor', u'day', u'weekend', u'single', u'room', u'happened', u'pop', u'open', u'snagged', u'wasn', u't', u'room', u'pretty', u'spacious', u'desk', u'remodeling', u'fan', u'hideous', u'bedspreads', u'bathroom', u'gorgeous', u'front', u'desk', u'service', u'paid', u'wifi', u'bummer', u'albeit', u'cheap', u'definitely', u'return']",UR118039422
"[u'finished', u'degree', u'late', u'march', u'columbia', u'university', u'graduation', u'husband', u'family', u'situated', u'absolutely', u'location', u'university', u'blocks', u'central', u'park', u'subway', u'restaurants', u'gennaro', u'pio', u'pio', u'acqua', u'carmine', u'starbucks', u'located', u'block', u'duane', u'reade', u'diner', u'downstairs', u'excellent', u'don', u't', u'worry', u'forget', u'trip', u'fingertips', u'staff', u'accomodating', u'checked', u'upgrade', u't', u'realize', u'absolutely', u'grateful', u'year', u'father', u'spacious', u'room', u'clean', u'rooms', u'family', u'large', u'refrigerators', u'store', u'drinks', u'food', u'bought', u'tremendous', u'character', u'stairs', u'stairwells', u'elevator', u'older', u'building', u'elevator', u'small', u'runs', u'pace', u'stairs', u'fine', u'bathrooms', u'redone', u'checked', u'beds', u'linens', u'arrival', u'clean', u'hallways', u'smell', u'smoke', u'rooms', u'weren', u't', u'bothered', u'travel', u'people', u'globe', u'hertz', u'parking', u'garage', u'corner', u'offered', u'rate', u'night', u'fact', u'parked', u'nyc', u'bargain', u'rate', u'recommend', u'newton', u'staff', u'attentive', u'place', u'absolute', u'charm', u'bypass', u'chain', u'day']",UR111680745
"[u'room', u'room', u'veiw', u'smelt', u'smoke', u'smoking', u'room', u'dating', u'clean']",UR4691831
"[u'nicely', u'priced', u'location', u'problems', u'annoying', u'person', u'front', u'desk', u'charles', u'unfriendly', u'reason', u'feel', u'unfriendliness', u'opened', u'mouth', u'checked', u'time', u'pass', u'front', u'desk', u'feel', u'passing', u'front', u'grudge', u'heater', u'work', u'late', u'december', u'temperature', u'reported', u'problem', u'front', u'desk', u'repair', u'person', u'fixed', u'service', u'person', u'working', u'heater', u'making', u'noise', u'sounds', u'banging', u'pipe', u'hammer', u'hard', u'asked', u'normal', u'told', u'couple', u'met', u'elevator', u'talking', u'problem', u'normal', u'wi', u'fi', u'costs', u'day', u'security', u'code', u'changed', u'day', u'start', u'days', u'locker', u'costs', u'day', u'start', u'free']",UR52405005
"[u'impressed', u'room', u'perfect', u'girls', u'mum', u'teenager', u'year', u'olds', u'roomy', u'clean', u'guys', u'reception', u'friendly', u'diner', u'door', u'perfect', u'breakfast', u'location', u'brilliant', u'stops', u'express', u'subway', u'times', u'square', u'minutes', u'subway', u'opposite', u'minutes', u'walk', u'central', u'park', u'loved']",UR68562052
"[u'returned', u'trip', u'nyc', u'newton', u'experience', u'night', u'encountered', u'group', u'people', u'arrived', u'late', u'noisy', u'morning', u'asked', u'desk', u'clerk', u'move', u'room', u'hesitation', u'problem', u'noise', u'rooms', u'clean', u'newton', u'location', u'access', u'subway', u'restaurants', u'walking', u'distance', u'central', u'park', u'newton', u'moderately', u'priced', u'well', u'worth', u'staff', u'eduardo', u'bell', u'captain', u'landry', u'andrew', u'charles', u'desk', u'clerks', u'asked', u'happy', u'assist', u'definitely', u'nyc', u'making', u'enjoyable']",UR88044564
"[u'wonderful', u'staff', u'rooms', u'clean', u'rooms', u'nyc', u'small', u'definitly']",UR18485202
"[u'spent', u'days', u'starting', u'point', u'exploring', u'ny', u'elevator', u'wasn', u't', u'working', u'days', u'hassle', u'free', u'experience', u'room', u'small', u'side', u'cleaning', u'thing', u'missed', u'free', u'wi', u'fi', u'meant', u'visits', u'starbucks', u'location', u'perfect', u'central', u'park', u'close', u'subway', u'station', u'metres', u'door', u'diner', u'breakfast', u'restaurants', u'nearby', u'amsterdam', u'ave', u'definitely']",UR118853213
"[u'wife', u'daughter', u'spent', u'nights', u'newton', u'hesitate', u'recommend', u'experience', u'arrival', u'departure', u'wonderful', u'staff', u'charles', u'alex', u'professional', u'visit', u'york', u'celebrating', u'daughter', u'st', u'birthday', u'special', u'memorable', u'jr', u'suite', u'spacious', u'comfortable', u'lighting', u'options', u'clean', u'queen', u'sized', u'beds', u'full', u'location', u'broadway', u'convenient', u'easy', u'close', u'access', u'subway', u'feel', u'safety', u'concerns', u'reasonably', u'priced', u'restaurants', u'close', u'downside', u'accommodation', u'hard', u'mattresses', u'definitely', u'newton']",UR21907371
"[u'room', u'clean', u'small', u'second', u'floor', u'facing', u'broadway', u'flags', u'flapped', u'night', u'street', u'noise', u'unbelieveable', u'shoe', u'shiner', u'claimed', u'front', u'door', u'prime', u'location', u'shining', u'carried', u'conversations', u'loudly', u'night', u'hear', u'garbage', u'trucks', u'noisy', u'elevator', u'slow', u'walked', u'stairs', u'luggage', u'check', u'second', u'morning', u'hot', u'water', u't', u'work', u'maid', u'things', u'closer', u'action', u'west', u'side', u'lower', u'better', u'full', u'day', u'site', u'worth', u'pay', u'better', u'place', u'sleep', u'night', u'place', u'cheap', u'building', u'person', u'definitely', u'worth', u'money', u'save', u'place']",UR2771276
"[u'girlfriend', u'nights', u'room', u'queen', u'bed', u'private', u'bathroom', u'location', u'madness', u'main', u'tourist', u'shopping', u'areas', u'close', u'express', u'subway', u'easily', u'walkable', u'central', u'park', u'small', u'room', u'cramped', u'flat', u'screen', u'tv', u'microwave', u'fridge', u'staff', u'downsides', u'price', u'average', u'sort', u'place', u'ny', u'expensive', u'standards', u'close', u'christmas', u'wifi', u'day', u'password', u'midday', u'day', u'free', u'password', u'duration', u'additionally', u'couldn', u't', u'check', u'pm', u'pm', u'price', u'excellent', u'better', u'deal', u'rate', u'hostels']",UR23105647
"[u'wife', u'spent', u'week', u'early', u'july', u'newton', u'happy', u'choice', u'sure', u'building', u'isn', u't', u'exactly', u'rooms', u'small', u'nyc', u'price', u'range', u'shouldn', u't', u'expect', u'shiny', u'spacious', u'despite', u'age', u'room', u'impeccable', u'condition', u'clean', u'air', u'conditioner', u'keep', u'room', u'cool', u'degree', u'day', u'hum', u'drown', u'traffic', u'noise', u'room', u'floor', u'window', u'broadway', u'neighborhood', u'breakfast', u'dinner', u'opportunities', u'blocks']",UR3762354
"[u'brought', u'managers', u'nyc', u'business', u'trip', u'nights', u'friendly', u'staff', u'restaurant', u'recommendations', u'location', u'close', u'subway', u'three', u'rooms', u'pleasant', u'cost', u'reasonable']",UR3290704
"[u'days', u'late', u'july', u'keep', u'guests', u'luggage', u'short', u'period', u'contrary', u'fee', u'based', u'system', u'keep', u'hours', u'lunch', u'vicinity', u'check', u'negative', u'aspect', u'refusal', u'maid', u'help', u'wife', u'open', u'door', u'toilet', u'public', u'carlos', u'brazil']",UR116495253
"[u'newton', u'nights', u'money', u'comparison', u'worried', u'center', u'nyc', u'don', u't', u'subway', u'station', u'minute', u'walk', u'pretty', u'nyc', u'brooklyn', u'easily', u'plenty', u'shops', u'area', u'rite', u'aid', u'duane', u'reade', u'door', u'handy', u'central', u'park', u'blocks', u'walk', u'downtown', u'rooms', u'updated', u'standard', u'hilton', u'rooms', u'twin', u'bed', u'room', u'size', u'cleaned', u'well', u'day', u'empty', u'fridge', u'room', u'storing', u'food', u'water', u'fridge', u'stocked', u'priced', u'mini', u'bar', u'products', u'gonna', u'hallways', u'updating', u'clean', u'staff', u'friendly', u'helped', u'plan', u'visits', u'city', u'booked', u'taxi', u'airport', u'pointless', u'spending', u'money', u'central', u'location', u'quick', u'subway', u'kinda', u'quieter', u'place', u'sleep', u'definately', u'reccomend', u'staying', u'newton', u'money', u'location']",UR8670197
"[u'room', u'exceptionally', u'comfortable', u'clean', u'shared', u'bathroom', u'dust', u'spotless', u'noise', u'heard', u'room', u'noise', u'minimal', u'location', u'upper', u'west', u'side', u'blocks', u'central', u'park', u'starbucks', u'bank', u'america', u'atm', u'gourmet', u'caf', u'charming', u'boutique', u'nail', u'spa', u'subway', u'access', u'jan', u'eduardo', u'andrew', u'charles', u'staff', u'dedication', u'second', u'exceeded', u'expectations', u'forward', u'ny', u'holiday', u'll', u'definitely', u'newton', u'xx']",UR114949795
"[u'looked', u'decent', u'budget', u'manhattan', u'finally', u'opted', u'newton', u'glad', u'room', u'small', u'partly', u'space', u'fridge', u'microwave', u'big', u'sleep', u'experience', u'shared', u'bath', u'room', u'wasn', u't', u'inconvenience', u'sort', u'staff', u'location', u'wonderful', u'don', u't', u'understand', u'bad', u'reviews', u'neighborhood', u'upper', u'west', u'side', u'beautiful', u'walking', u'distance', u'carmine', u'eateries', u'subway', u'station', u'half', u'block', u'elevator', u'wasn', u't', u'bad', u've', u'ridden', u'slower', u'serviceable', u'wasn', u't', u'luxury', u'wanted', u'luxury', u'manhattan', u'cost', u'night', u'definitely']",UR80996067
"[u'january', u'travel', u'business', u'spoiled', u'corp', u'travel', u'department', u'grandaughter', u'born', u'parents', u'live', u'upper', u'west', u'side', u'columbia', u'newton', u'ideal', u'location', u'visit', u'looked', u'clean', u'problems', u'heat', u'room', u'hot', u'room', u'heat', u'shut', u'fixed', u'opening', u'windows', u'view', u'windows', u'building', u'elevator', u'broke', u'checking', u'handicapped', u'wife', u'slow', u'trip', u'flights', u'price', u'queen', u'jr', u'suite', u'location', u'decent', u'visit', u'set', u'realistic', u'expectations', u'don', u't', u'spend', u'time', u'grinding', u'teeth', u'granddaughter', u'absolutly', u'beautiful', u'exceptional', u'intelligence', u't', u'visiting', u'newton']",UR3007228
