Content,ReviewID
"[u'traveled', u'mid', u'week', u'kids', u'tow', u'located', u'upper', u'west', u'side', u'subway', u'stops', u'street', u'easy', u'parking', u'corner', u'discount', u'hrs', u'plenty', u'dining', u'options', u'couple', u'blocks', u'newly', u'remodeled', u'well', u'basic', u'modern', u'amenities', u'expect', u'room', u'double', u'queen', u'suite', u'provide', u'plenty', u'space', u'beds', u'firm', u'view', u'window', u'bad', u'quiet', u'fragrance', u'cleaning', u'supplies', u'including', u'room', u'deal', u'breaker', u'arrival', u'room', u'smelled', u'strong', u'perfume', u'asked', u'room', u'receptionist', u'room', u'type', u'service', u'typical', u'staff', u'courteous', u'questions', u'requests', u'closer', u'times', u'square', u'time', u'amenities', u'top', u'list']",UR54743187
"[u'location', u'newton', u'situated', u'upper', u'west', u'side', u'proximity', u'subway', u'central', u'park', u'restaurants', u'cafes', u'well', u'shops', u'hard', u'better', u'location', u'safe', u'neighbourhood', u'consider', u'disappointed', u'secondly', u'accommodation', u'double', u'room', u'floor', u'overlooking', u'broadway', u'requested', u'time', u'booking', u'clean', u'comfortable', u'warm', u'spacious', u'don', u't', u'wrong', u'room', u'big', u'tiny', u'size', u'single', u'traveller', u'guess', u'smaller', u'side', u'people', u'perfect', u'mentioned', u'previous', u'comments', u'coffee', u'machine', u'free', u'coffee', u'sachets', u'extremely', u'appreciated', u'fridge', u'sure', u'guests', u'appreciated', u'fact', u'microwave', u'oven', u'room', u'impression', u'designed', u'rooms', u'guest', u'comfort', u'mind', u'foremost', u'bathroom', u'small', u'awkwardly', u'designed', u'clean', u'shower', u'quality', u'towels', u'cleaned', u'day', u'mess', u'shower', u'curtain', u'superbly', u'clean', u'lucky', u'shower', u'curtain', u'altogether', u'furniture', u'luxurious', u'functional', u'picked', u'discounted', u'store', u'sake', u'sort', u'table', u'chairs', u'rooms', u'basically', u'furniture', u'simple', u'practical', u'wasn', u't', u'sure', u'bedsheets', u'days', u'crispy', u'sheets', u'day', u'worn', u'discarded', u'altogether', u'newer', u'time', u'couple', u'times', u'change', u'sheets', u'constitute', u'top', u'sheet', u'mattress', u'mattress', u'sheet', u'top', u't', u'staff', u'wouldn', u't', u'staff', u'friendly', u'efficient', u'book', u'course', u'efficiency', u'combined', u'genuine', u'courteous', u'friendliness', u'long', u'winter', u'blues', u'staff', u'members', u'case', u'problem', u'atmosphere', u'bit', u'lighter', u'welcoming', u'smiles', u'finally', u'definitely', u'newton', u'recommended', u'friends', u'visit', u'nyc', u'regular', u'basis', u'hard', u'find', u'nicer', u'rates', u'location']",UR25006854
"[u'girlfriend', u'nights', u'sept', u'sept', u'place', u'central', u'park', u'walk', u'minutes', u'block', u'subway', u'safe', u'neighbourhood', u'recommended', u'york', u'room', u'flatscreentv', u'shared', u'bath', u'clean', u'wait', u'minutes', u'days', u'time', u'save', u'money', u'shared', u'bath', u'cheers']",UR5890066
"[u'returned', u'weekend', u'newton', u'happy', u'place', u'clean', u'staff', u'polite', u'check', u'check', u'easy', u'waits', u'complications', u'elevator', u'bit', u'slow', u'fortunate', u'wait', u'room', u'clean', u'basic', u'amenities', u'plush', u'nicer', u'expected', u'staff', u'accommodating', u'example', u'asked', u'extra', u'towels', u'received', u'booked', u'double', u'double', u'room', u'freaked', u'shared', u'bathroom', u'concept', u'called', u'reservation', u'assure', u'bath', u'morning', u'hot', u'showers', u'third', u'guest', u'cold', u'water', u'waited', u'minutes', u'water', u'warm', u'beds', u'firm', u'mentioned', u'reviews', u'feet', u'day', u'welcomed', u'response', u'complaints', u'previous', u'reviewers', u'noise', u'windows', u'thin', u'walls', u'rattling', u'heaters', u'york', u'city', u'buildings', u'older', u'hear', u'things', u'moved', u'nyc', u'months', u'ago', u'building', u'similiar', u'apartment', u'apartments', u'friends', u'professionals', u'college', u'graduates', u'masters', u'doctorate', u'degrees', u'decent', u'standards', u'living', u'feel', u'noise', u'issues', u'newton', u'encountered', u'city', u't', u'trip', u'farm', u'beach', u'city', u'quiet', u'place', u'slept', u'rock', u'friends', u'quieter', u'places', u'lived', u'york', u'complete', u'silence', u'order', u'sleep', u'bring', u'earplugs', u'hear', u'noise', u'posh', u'downtown', u'location', u'express', u'train', u'crosstown', u'bus', u'feet', u't', u'concerned', u'distance', u'times', u'square', u'train', u'downtown', u'stops', u'close', u'proximity', u'subway', u'east', u'side', u'crosstown', u'bus', u'metro', u'card', u'works', u'free', u'transfer', u'bus', u'subway', u'vice', u'versa', u'check', u'hopstop', u'advice', u'public', u'transportation', u'routes', u'yorkers', u'help', u'directions', u'personally', u'prefer', u'people', u'live', u'middle', u'tourist', u'chaos', u'midtown', u'upper', u'west', u'side', u'neighborhood', u'celebrities', u'live', u'restaurants', u'lemongrass', u'grill', u'doors', u'thai', u'mama', u'mexico', u'broadway', u'st', u'fun', u'festive', u'mexican', u'restaurant', u'hear', u'carmine', u'family', u'style', u'italian', u'place', u'st', u'carmine', u'tal', u'bagels', u'authentic', u'york', u'bagel', u'tom', u'restaurant', u'broadway', u'suzanne', u'vega', u'wrote', u'tom', u'diner', u'recognize', u'shots', u'restaurant', u'seinfeld', u'food', u'spectacular', u'pop', u'culture', u'historic', u'cafe', u'con', u'leche', u'cuban', u'dominican', u'food', u'location', u'amsterdam', u't', u'st', u'noticed', u'location', u'amsterdam', u't', u'don', u't', u'find', u'food', u'stops', u'plenty', u'restaurants', u'block', u'columbus', u'amsterdam', u'town', u'guests', u'cafe', u'lalo', u't', u'broadway', u'amsterdam', u'featured', u've', u'mail', u'cute', u'place', u'extensive', u'dessert', u'menu', u'dessert', u'meal', u'conclusion', u'luxurious', u'place', u'york', u'city', u'don', u't', u'newton', u'expect', u'pay', u'night', u'decent', u'clean', u'place', u'sleep', u'location', u'manhattan', u'recommend', u'newton', u'pay', u'deal', u'save', u'money', u'shopping', u'plays', u'sightseeing', u'meals']",UR3171213
"[u'description', u'accurate', u'star', u'reasonably', u'priced', u'well', u'located', u'columbia', u'university', u'located', u'perfectly', u'located', u'rooms', u'small', u'service', u'impressive', u'impressive', u'fact', u'answer', u'reviews', u'personally']",UR34433197
"[u'newton', u'excellent', u'money', u'standard', u'rooms', u'bit', u'fashioned', u'decoration', u't', u'big', u'space', u'suitcases', u'putting', u'items', u'cleaned', u'thoroughly', u'day', u'ac', u'handy', u'ny', u'hottest', u'summer', u'bathrooms', u'spacey', u'adivse', u'bring', u'hairdryer', u'barely', u'location', u'wise', u'situated', u'subway', u'station', u'three', u'lines', u'block', u'subway', u'station', u'central', u'park', u'lines', u'halt', u'express', u'trains', u'sure', u'times', u'square', u'minutes', u'easy', u'head', u'downtown', u'located', u'city', u'center', u'night', u'sleep', u'problems', u'noise', u'kind', u'computers', u'lobby', u'online', u'minutes', u'staff', u'reception', u'friendly', u'street', u'starbucks', u'european', u'bakery', u'caf', u'eat', u'breakfast']",UR73563616
"[u'searching', u'decent', u'accommodations', u'york', u'city', u'price', u'won', u't', u'bankrupt', u'reserved', u'twin', u'room', u'night', u'considered', u'inexpensive', u'york', u'standards', u'looked', u'tiny', u'photo', u'website', u'reviews', u'site', u'decided', u'delight', u'twins', u'overbooked', u'arrived', u'upgraded', u'double', u'room', u'costs', u'double', u'bed', u'twin', u'small', u'larger', u'twin', u'room', u'space', u'move', u'feeling', u'claustrophobic', u'room', u'desk', u'microwave', u'fridge', u'flat', u'screen', u'tv', u'mounted', u'wall', u'toiletries', u'bathroom', u'mattress', u'comfortable', u'clean', u'staff', u'friendly', u'returned', u'check', u'leaving', u'luggage', u'earlier', u'day', u'bag', u'brought', u'room', u'budget', u'doesn', u't', u'typical', u'amenities', u'larger', u'place', u'site', u'restaurant', u'gift', u'shop', u'york', u'things', u'doorstep', u'doesn', u't', u'matter', u'computers', u'lobby', u'pay', u'sure', u'wouldn', u't', u'happy', u'smaller', u'room', u'wouldn', u't', u'lucky', u'time', u'reasonable', u'price', u'clean', u'accommodations']",UR20514626
"[u'newton', u'nights', u'week', u'pleasant', u'surprise', u'room', u'private', u'bath', u'basic', u'upholstery', u'dated', u'bed', u'comfy', u'bathroom', u'clean', u'hot', u'water', u'day', u't', u'evidence', u'creepy', u'crawlies', u'written', u'reviews', u'main', u'concerns', u'agree', u'funny', u'smell', u'bad', u'side', u'room', u'hot', u'couldn', u't', u'adjust', u'radiator', u'sleep', u'windows', u'air', u'con', u'november', u'lift', u'slow', u'ninth', u'floor', u'wasn', u't', u'option', u'walk', u'wait', u'long', u'staff', u'friendly', u'accomodating', u'chat', u'fab', u'location', u'subway', u'close', u'runs', u'straight', u'manhatten', u'mins', u'times', u'square', u'big', u'interchange', u'aswell', u'close', u'central', u'park', u'natural', u'history', u'museum', u'half', u'hour', u'min', u'walk', u'avenue', u'lots', u'eateries', u'thoroughly', u'recommend', u'lemongrass', u'grill', u'couple', u'doors', u'recomend', u'newton', u'crash', u'long', u'day', u'sightseeing', u'time', u'visit', u'york']",UR4112647
"[u'positive', u'things', u'arrived', u'early', u'morning', u'check', u'bigger', u'room', u'price', u'room', u'needed', u'bathroom', u'bath', u'tub', u'personally', u'love', u'mention', u'close', u'subway', u'starbucks', u'shops', u'restaurants', u'life', u'easier', u't', u'brave', u'cold', u'weather', u'night', u'staff', u'super']",UR53130942
"[u'wonderful', u'place', u'nyc', u'reading', u'reviews', u'settled', u'newton', u'price', u'close', u'location', u'subway', u'central', u'park', u'booked', u'receive', u'confirmation', u'number', u'booking', u'agent', u'called', u'friendly', u'desk', u'clerk', u'confirmed', u'reservation', u'emailed', u'checked', u'problems', u'room', u'queen', u'size', u'beds', u'top', u'floor', u'lots', u'lots', u'room', u'beds', u'comfortable', u'firm', u'lots', u'pillows', u'room', u'bathroom', u'immaculate', u'small', u'plenty', u'room', u'person', u'lots', u'clean', u'towels', u'ammenities', u'shampoo', u'conditioner', u'staying', u'longer', u'advantage', u'microwave', u'refrigerator', u'room', u'key', u'west', u'diner', u'adjacent', u'prices', u'lots', u'tasty', u'food', u'open', u'pm', u'problem', u'fault', u'city', u'tearing', u'street', u'front', u'jackhammer', u'work', u'began', u'startling', u'wake', u'call', u'remember', u'construction', u'nyc', u'central', u'park', u'blooks', u'subway', u'block', u'convenient', u'night', u'staff', u'invisible', u'needed', u'professional', u'gracious', u'baseball', u'game', u'day', u'checked', u't', u'mind', u'holding', u'luggage', u'game', u'pm', u'definately']",UR15310450
"[u'group', u'nyc', u'weekend', u'newton', u'lovely', u'staff', u'efficient', u'gracious', u'accommodating', u'rooms', u'comfortable', u'clean', u'price', u'location']",UR95000107
"[u'picked', u'proximity', u'columbia', u'midtown', u'upper', u'east', u'side', u'lacked', u'charm', u'deal', u'price', u'small', u'lobby', u'area', u'check', u'counter', u'wasn', u't', u'inviting', u'missed', u'continental', u'breakfast', u'place', u'snacks', u'coffee', u'claim', u'aaa', u'wouldn', u't', u'honor', u'aaa', u'card', u'aaa', u'discount', u'reserved', u'room', u'online', u'online', u'price', u'paid', u'higher', u'quoted', u'brochure', u'pluses', u'room', u'perfectly', u'clean', u'block', u'metro', u'easy', u'nyc', u'midtown', u'soho', u'considered', u'wouldn', u't']",UR12458154
"[u'despite', u'hiccoughs', u'booking', u'confirmation', u'staff', u'arrived', u'room', u'faciliaites', u'queen', u'beds', u'small', u'kitchen', u'area', u'microwave', u'bathroom', u'wetroom', u'area', u'ideally', u'located', u'main', u'subway', u'street', u'express', u'brooklyn', u'bound', u'train', u'takes', u'heart', u'times', u'sqaure', u'minutes']",UR20181854
"[u'love', u'second', u'visit', u'rooms', u'small', u'elevator', u'admittedly', u'slow', u'rates', u'reasonable', u'staff', u'rooms', u'clean', u'bathrooms', u'redone', u'rooms', u'refrigerators', u'microwaves', u'air', u'conditioners', u'types', u'rooms', u'smaller', u'friend', u'shared', u'room', u'twin', u'beds', u'size', u'adequate', u'basically', u'slept', u'cheaper', u've', u'bus', u'subway', u'stops', u'block', u'area', u'safe', u'night', u'bus', u'theater', u'problem', u'lots', u'restaurants', u'longgrain', u'telio', u'popover', u'cafe', u'city', u'diner', u'blocks', u'broadway', u'amsterdam', u't', u'wait', u'visit', u'internet', u'night', u'considering', u'price', u'rooms']",UR75704288
"[u'decided', u'choose', u'newton', u'reviews', u'site', u'impressed', u'newton', u'room', u'single', u'beds', u'private', u'bathroom', u'cost', u'payed', u'night', u'website', u'room', u'clean', u'bathroom', u'staff', u'location', u'perfect', u'located', u'subway', u'stations', u'starbucks', u'banks', u'restaurants', u'expacting', u'view', u'dissapointed', u'room', u'bit', u'small', u'remember', u'star', u'gurantee', u'difference', u'york', u'city', u'spent', u'days', u'outdoors']",UR13384055
"[u'eleven', u'night', u'perfect', u'situated', u'subway', u'station', u'clean', u'comfortable', u'ideal', u'lift', u'bit', u'slow', u'problem', u'lifetime', u'minute', u'reasonably', u'priced', u'staff', u'friendly', u'busy', u'busy', u'stuff', u'minutes', u'time', u'square', u'subway', u'peace', u'lovely', u'walks', u'situated', u'minutes', u'central', u'park', u'riverside', u'lots', u'food', u'possibilities', u'short', u'subway', u'spin', u'bakery', u'road', u'perfect', u'cuppa', u'panina', u'salads', u'pizza', u'diners', u'nearby', u'decent', u'restaurants', u'newton', u'ticked', u'boxes', u'forward', u'going']",UR84486726
"[u'wife', u'newton', u'nights', u'based', u'reviews', u'online', u't', u'expect', u'reviewers', u'excellent', u'fortunate', u'upgraded', u'double', u'double', u'suite', u'suite', u'renovated', u'carpet', u'furniture', u'bathroom', u'tile', u'suite', u'big', u'nyc', u'standards', u'loved', u'mistake', u'building', u'cosmetic', u'improvements', u'heating', u'system', u'window', u'unit', u'air', u'conditioning', u'surpassed', u'terrific', u'bargain', u'confirm', u'desk', u'days', u'booking', u'online', u'desk', u't', u'requested', u'double', u'double', u'problem', u'noting', u'called']",UR3086066
"[u'area', u'check', u'website', u'book', u'searching', u'sites', u'determined', u'website', u'rate', u'knowing', u'varying', u'sizes', u'ny', u'rooms', u'called', u'size', u'room', u'told', u'queen', u'fully', u'booked', u'dates', u'disappointed', u'site', u'easily', u'booked', u'queen', u'room', u'room', u'tiny', u'asked', u'front', u'desk', u'largest', u'room', u'rate', u'told', u'twin', u'double', u'beds', u'asked', u'fully', u'booked', u'day', u'wifi', u'work', u'room', u'easily', u'moved', u'small', u'queen', u'better', u'values', u'ny', u'bathrooms', u'superior', u'door', u'eatery', u'place', u'avoid', u'upper', u'west', u'side', u'wat', u'close', u'barnard', u'columbia', u'worth', u'thing', u'subway', u'expensive', u'don', u'brown', u'brownchild']",UR8399579
"[u've', u'night', u'newton', u'room', u'junior', u'suite', u'huge', u'clean', u'well', u'looked', u'staff', u'friendly', u'noise', u'guests', u'problem', u'shuttle', u'buses', u'parked', u'window', u'subway', u'wasn', u't', u'working', u'properly', u'nights', u'lift', u'isn', u't', u'slow', u'somtimes', u'wait', u'couple', u'minutes', u'location', u'subway', u'ideal', u'plenty', u'places', u'eat', u'drink', u'area', u'recommend', u'dive', u'bar', u'amsterdam', u'avenue', u'round', u'corner', u'metro', u'diner', u'broadway', u'st', u'streets', u'breakfast', u'recommend', u'newton']",UR82184908
"[u'nights', u'price', u'left', u'leave', u'clean', u'pleanty', u'towles', u'cups', u'ice', u'night', u'cool', u'walking', u'fixed', u'problems', u'check', u'prompt', u'harldy', u'guest', u'heard', u'surpirsed', u'complained', u'noise', u'middle', u'night', u'key', u'west', u'diner', u'door', u'variety', u'affordable', u'breakfast', u'loved', u'duane', u'reade', u'pharmacy', u'corner', u'handy', u'time', u'atm', u'pharmacy', u'mcdonadl', u'cents', u'subway', u'station', u'street', u'walking', u'room', u'store', u'luggage', u'internet', u'access', u'cents', u'minute', u'downside', u'firm', u'beds', u'feels', u'floor', u'thin', u'pillows', u've', u'accomsted', u'pillowtop', u'mattress', u'thick', u'pillows', u'yeah', u'day', u'hours', u'water', u'brown', u'smelled', u'luckly', u'bathroom', u'stuff', u'thing', u'size', u'room', u'fine', u'thing', u'beds', u'bathroom', u'barely', u'space', u'left', u'bathroom', u'closet', u'held', u'clothes', u'pleanty', u'drawers', u'bathroom', u'big', u'mirror', u'spacious', u'fit', u'people', u'comfortably']",UR5323870
"[u'newton', u'conveniently', u'located', u'fancy', u'upper', u'west', u'side', u'half', u'block', u'street', u'metro', u'station', u'midtown', u'minutes', u'property', u'bit', u'outdated', u'elevator', u'iwas', u'kind', u'slow', u'room', u'big', u'nyc', u'standards', u'furniture', u'curtains', u'carpet', u'surely', u'benefit', u'update', u'bathroom', u'clean', u'spacious', u'looked', u'tacky', u'movie', u'front', u'desk', u'staff', u'room', u'pm', u'night', u'shift', u'guy', u'friendly', u'asked', u'razor', u'blade', u'instructed', u'door', u'convenience', u'store', u'minor', u'issue', u'pretty', u'expensive', u'rate', u'usd', u'double', u'room', u'night', u'comment', u'insult', u'injury', u'nyc', u'prices', u'crazy', u'left', u'feeling', u'paid', u'room', u'worth', u'sure', u'night', u'sleep', u'rate', u'third', u'paid']",UR121564398
"[u'booked', u'newton', u'partly', u'reviews', u'site', u'mistake', u'arrived', u'late', u'night', u'train', u'connection', u'staff', u'opportunity', u'bedroom', u'left', u'looked', u'accepted', u'despite', u'called', u'twin', u'absolutely', u'tiny', u'bed', u'person', u'room', u'move', u'looked', u'disgusting', u'complained', u'night', u'staff', u'problem', u'sorted', u'morning', u'morning', u'course', u'turned', u'difficult', u'solve', u'upgraded', u'normal', u'size', u'room', u'huge', u'amount', u'daily', u'rate', u'chosen', u'rate', u'charged', u'expensive', u'city', u'convinced', u'scam', u'repeated', u'customers', u'future', u'careful', u'book', u'avoid']",UR19673373
"[u'newton', u'location', u'broadway', u'lots', u'restaurants', u'convenient', u'stores', u'door', u'subway', u'express', u'travel', u'times', u'square', u'stops', u'min', u'walk', u'central', u'park', u'natural', u'history', u'museum', u'rooms', u'decent', u'size', u'money', u'heart', u'downtown', u'easy']",UR123462974
"[u'month', u'teenaged', u'son', u'excellent', u'quiet', u'retreat', u'rest', u'bouts', u'experiencing', u'wonderful', u'overwhelming', u'city', u'subway', u'huge', u'deliver', u'virtually', u'front', u'door', u'rooms', u'fancy', u'beds', u'comfortable', u'clean', u'quiet', u'front', u'desk', u'staff', u'polite', u'exceptional']",UR118021409
"[u'farther', u'uptown', u've', u'newton', u'empire', u'group', u'deal', u'three', u'nights', u'including', u'tax', u'received', u'reviews', u'tripadvisor', u'expedia', u'weren', u't', u'disappointed', u'rooms', u'clean', u'bright', u'proximity', u'st', u'station', u'subway', u'option', u'local', u'express', u'headed', u'downtown', u'blocks', u'gotham', u'wine', u'spirits', u'reasonable', u'prices', u'dock', u'oyster', u'bar', u'sesame', u'tuna', u'blue', u'points', u'barzini', u'market', u'verify', u'quoted', u'rate', u'sign', u'registered', u'rate', u'night', u'increased', u'brought', u'clerk', u'attention', u'registering', u'hesitation', u'honored', u'original', u'quote', u'definitely', u'advantage', u'newton', u'rates', u'undoubtedly']",UR24624531
"[u'family', u'adults', u'teens', u'june', u'family', u'wedding', u'sjr', u'suite', u'queen', u'beds', u'accommodations', u'tight', u'sitting', u'room', u'provided', u'breathing', u'space', u'pleasant', u'trip', u'immaculate', u'wood', u'polished', u'corners', u'clean', u'place', u'price', u'tolerable', u'york', u'upper', u'west', u'side', u'subway', u'street', u'navigating', u'easy', u'excellent', u'restaurants', u'close', u'ny', u'weekend', u'trip', u'parking', u'isn', u't', u'outrageous', u'york', u'll']",UR113945249
"[u'thought', u'price', u'bit', u'york', u'knowing', u'walk', u'room', u'spotless', u'free', u'upgrade', u'junior', u'suite', u'microwave', u'fridge', u'staff', u'friendly', u'neighbourhood', u'people', u'friendly', u'restaurants', u'reasonably', u'priced', u'stores', u'shopping', u'times', u'square', u'mainstream', u'big', u'chains', u'year', u'sure']",UR2605525
"[u'newton', u'week', u'york', u'tourism', u'led', u'reviews', u'shared', u'disappointed', u'rooms', u'shared', u'bathroom', u'clean', u'entire', u'time', u'housekeeping', u'reaches', u'european', u'standards', u'news', u'reception', u'welcoming', u'enjoy', u'connection', u'metro', u'station', u'front', u'door', u'pay', u'dollars', u'wireless', u'day', u'differently', u'reviews', u'survive', u'goo', u'deal']",UR66463378
"[u'moved', u'newton', u'unpleasant', u'experence', u'times', u'square', u'burgled', u'left', u'clothes', u'stood', u'paid', u'approx', u'night', u'room', u'double', u'beds', u'bathroom', u'front', u'desk', u'courteous', u'times', u'maid', u'maria', u'spotlessly', u'clean', u't', u'encounter', u'heating', u'noise', u'problems', u'heart', u'city', u'subway', u'service', u'closeby', u'user', u'friendly', u'quiet', u'location', u'hustle', u'bustle', u'times', u'square', u'definately', u'book', u'trip', u'york', u'ps', u'shoe', u'cleaning', u'man', u'cheerful', u'chappy']",UR2988263
"[u'clean', u'room', u'spacious', u'well', u'designed', u'visiting', u'family', u'city', u'convenient', u'place', u'sleep', u'view', u'room', u'interior', u'courtyard', u'fine', u'quiet', u'reserved', u'room', u'double', u'beds', u'upgraded', u'junior', u'suite']",UR50332544
"[u'nights', u'superb', u'location', u'hopping', u'subway', u'spotless', u'rooms', u'friendly', u'staff', u'making', u'york', u'pleasant', u'definitely', u'recommend']",UR115870093
"[u'origianlly', u'booked', u'street', u'turned', u'appauling', u'thing', u'wireless', u'internet', u'sooo', u'glad', u'laptop', u'straight', u'york', u'night', u'nights', u'luckly', u'newton', u'caught', u'eye', u'room', u'special', u'offer', u'grabbed', u'bargain', u'staff', u'friendly', u'porter', u'cool', u'character', u'staff', u'knowledge', u'people', u'skills', u'talked', u'grunting', u'moaning', u'situated', u'meters', u'subway', u'times', u'sq', u'st', u'mins', u'fantastic', u'location', u'trouble', u'shops', u'mins', u'chemist', u'liquor', u'newsagents', u'hrs', u'maccie', u'moan', u'small', u'moan', u'internet', u'dollars', u'day', u'thought', u'pretty', u'expensive', u'hey', u'cheaper', u'internet', u'cafe', u'cheers', u'guys']",UR33661953
"[u'impressed', u'rooms', u'clean', u'comfortable', u'newly', u'decorated', u'staff', u'friendly', u'location', u'broadway', u'base', u'exploring', u'city', u'tube', u'taxi', u'easily', u'walk', u'going', u'york', u'time', u'definately', u'recommend', u'place', u'friends', u'quality', u'door', u'reviews', u'infested', u'cockroaches', u'paid', u'quid', u'night', u'midashotels', u'definately', u'loads', u'shops', u'bars', u'restaurants']",UR3502174
"[u'visiting', u'york', u'tourist', u'base', u'frills', u'spent', u'nights', u'adequate', u'money', u'compared', u'centrally', u'located', u'manhattan', u'rooms', u'chose', u'suite', u'family', u'clean', u'provided', u'sufficient', u'space', u'despite', u'located', u'upper', u'west', u'side', u'minute', u'walk', u'central', u'park', u'closeness', u'street', u'subway', u'compensates', u'ride', u'minutes', u'depending', u'express', u'train', u'reach', u'street', u'times', u'square', u'key', u'west', u'diner', u'located', u'door', u'convenient', u'place', u'breakfast', u'food', u'evening', u'required', u'restaurants', u'couple', u'blocks', u'definitely', u'visiting', u'york', u'future']",UR8407344
"[u'oct', u'nights', u'husband', u'teenage', u'children', u'initially', u'desk', u'clerk', u'booking', u'agent', u'double', u'rooms', u'asked', u'double', u'twin', u'matter', u'sorted', u'floors', u'apart', u'rooms', u'real', u'check', u'time', u'hrs', u'rooms', u'small', u'expected', u'ny', u'comfortable', u'clean', u'beds', u'well', u'stocked', u'clean', u'bathrooms', u'roms', u'fridge', u'microwave', u'handy', u'rooms', u'cleaned', u'day', u'desk', u'staff', u'friendly', u'maps', u'subway', u'buses', u'general', u'travel', u'advice', u'quiet', u'location', u'mins', u'stops', u'subway', u'times', u'square', u'ny', u'yorker', u'street', u'traffic', u'honking', u'face', u'newton', u'location', u'change', u'loved', u'key', u'west', u'diner', u'door', u'reasonably', u'priced', u'large', u'breakfasts', u'fab', u'fresh', u'fruit', u'salad', u'juice', u'takeout', u'cost', u'airport', u'cab', u'going', u'airport', u'flat', u'fare', u'coming', u'aware', u'paid', u'extra', u'newark', u'worth', u'people', u'bus', u'train', u'bit', u'cheaper', u'better', u'yorker', u'staff', u'unfriendly', u'unhelpful', u'generally', u'grotty', u'recommend', u'newton', u'people', u'reasonably', u'priced', u'quiet', u'location', u'easily', u'accessible', u'centre', u'town', u'large', u'rooms', u'high', u'luxury', u'higher', u'cost', u'definitely']",UR10282953
