Content,ReviewID
"[u'impressed', u'clean', u'staff', u'friendly', u'location', u'room', u'largest', u've', u'europe', u't', u'notice', u'paper', u'thin', u'walls', u'considerable', u'amount', u'noise', u'heard', u'street', u'mind', u'christmas', u'eve', u'saturday', u'night', u'spaniards', u'north', u'americans', u'gather', u'inside', u'homes', u'totally', u'recommend']",UR122745388
"[u'enjoyed', u'three', u'night', u'agree', u'reviewers', u'walls', u'paper', u'thin', u'barcelona', u'well', u'equipped', u'quiet', u'night', u'rest', u'located', u'popular', u'tourist', u'locations', u'price', u'location', u'breakfast', u'plentiful', u'varied', u'coffee', u'service', u'difficult', u'busy', u'time', u'person', u'individual', u'cup', u'machines', u'location', u'excellent', u've', u'priced', u'region', u'rented', u'apartments', u'choice', u'despite', u'minor', u'issues', u'thin', u'walls', u'situated', u'mirrors', u'room', u'spotless', u'corners', u'bathroom', u'offer', u'guests', u'endless', u'bottles', u'water', u'free', u'location', u'wonderful', u'lovely', u'rooftop', u'terrace', u'pool', u'lounge', u'chairs', u'bit', u'chilly', u'trip', u'warmer', u'months', u'imagine', u'excellent', u'spot', u'unwind', u'long', u'day', u'touring', u'working']",UR121114618
"[u'lovely', u'staff', u'facilities', u'blighted', u'fact', u'walls', u'paper', u'thin', u'hear', u'person', u'door', u'coughing', u'room', u'anytime', u'corridor', u'floor', u'hear', u'opened', u'door', u'room', u'floor', u'shook', u'pretty', u'relaxed', u'noise', u'levels', u'time', u'appreciate', u'staying', u'centre', u'barcelona', u'hear', u'people', u'streets', u'price', u'swankiness', u'skimping', u'wall', u'thickness', u'bit', u'mistake']",UR119666494
"[u'main', u'path', u'center', u'interesting', u'find', u'area', u'explored', u'foot', u'lanes', u'pedestrian', u'streets', u'edge', u'gothic', u'town', u'area', u'bit', u'touristy', u'time', u'barcelona', u'location', u'couple', u'blocks', u'excellent', u'bars', u'tapas', u'places', u'street', u'life', u'couple', u'blocks', u'quiet', u'main', u'street', u'wise', u'room', u'upper', u'floor', u'avoid', u'street', u'pedestrian', u'noise', u'rooms', u'newly', u'renovated', u'windows', u'soundproofing', u'rooms', u'furnished', u'modern', u'cheap', u'style', u'comfortable', u'spacious', u'rare', u'expensive', u'downtown', u'barcelona', u'wifi', u'included', u'pc', u'station', u'floor', u'convenient', u'business', u'traveler', u'restaurant', u'downstairs', u'serves', u'included', u'buffet', u'breakfast', u'quality', u'selection', u'acceptable', u'hear', u'asian', u'fusion', u'food', u'dinner', u'proximity', u'tapas', u'spanish', u'places', u'nearby', u'wanted', u'local', u'staff', u'proficient', u'manner', u'service', u'professional', u'price', u'location', u'style', u'balance', u'hesitate', u'biz', u'personal', u'travel']",UR122880948
"[u'colleague', u'robbed', u'entered', u'room', u'card', u'opened', u'safe', u'box', u'electronic', u'code', u'net', u'book', u'camera', u'lot', u'money', u'manager', u'staff', u'incredibly', u'unconcerned', u'called', u'police', u'half', u'hour', u'arguing', u'colleague', u'wait', u'till', u'morning', u'manager', u'told', u'waited', u'leave', u'despite', u'system', u'registers', u'entry', u'room', u't', u'bother', u'check', u'card', u'open', u'room', u'precise', u'period', u'time', u'mentioned', u'refunding', u'statement', u'things', u'safe', u'boxes', u'rooms', u'responsibility', u'recommendation', u'don', u't', u'option', u'bring', u'values', u'leave', u'room']",UR30394130
