Content,ReviewID
"[u'feeling', u'view', u'creek', u'stunning', u'skyscrappers', u'background', u'forget', u'tallest', u'burj', u'dubai', u'interiors', u'pool', u'gym', u'city', u'center', u'staff', u'boutique', u'paying', u'big', u'bucks', u'star', u'choice', u'dubai', u'sure', u'staying', u'visit', u'dubai']",UR26371036
"[u'visiting', u'dubai', u'time', u'range', u'star', u'picked', u'favorite', u'reason', u'wanted', u'quiet', u'located', u'dubai', u'star', u'loud', u'night', u'clubs', u'bars', u'rest', u'stars', u'stars', u'dry', u'stars', u'dry', u'don', u't', u'night', u'club', u'apart', u'apartment', u'minutes', u'walking', u'distance', u'deira', u'city', u'centar', u'popular', u'shopping', u'malls', u'excellent', u'clean', u'spacious', u'rooms', u'apartments', u'beautiful', u'view', u'dubai', u'creek', u'driving', u'involved', u'extremly', u'practical', u'located', u'creek', u'side', u'area', u'absolute', u'recommendation', u'location', u'confort', u'visiting', u'business', u'leisure']",UR58107913
"[u'star', u'boutique', u'nights', u'chose', u'location', u'close', u'creek', u'deira', u'city', u'centre', u'dubai', u'knew', u'wanted', u'star', u'boutique', u'perfect', u'location', u'thrilled', u'room', u'bedroom', u'apartment', u'booked', u'interrupted', u'view', u'creek', u'bur', u'dubai', u'corner', u'balcony', u'huge', u'kitchen', u'large', u'lounge', u'area', u'needed', u't', u'restaurants', u'room', u'service', u'quick', u'food', u'dishwasher', u't', u'work', u'brought', u'fairy', u'liquid', u'needed', u'wash', u't', u'matter', u'left', u'side', u'morning', u'washed', u'afternoon', u'real', u'dubai', u'dhows', u'creek', u'day', u'normal', u'life', u'place', u'opinion']",UR23893382
"[u'deal', u'nights', u'points', u'studio', u'apartments', u'clean', u'well', u'equipt', u'spacious', u'bus', u'nearby', u'metro', u'course', u'taxis', u'cheap', u'staff', u'friendly', u'aware', u'building', u'door', u'heard', u'banging', u'opposite', u'side', u'imagine', u'awful', u'informed', u'currently', u'half', u'pool', u'lovely', u'quiet', u'overlooked', u'builders', u'pod', u'block', u'noise', u'fire', u'alarms', u'times', u'nervous', u'false', u'alarm', u'alarms', u'sensitive', u'floor', u'top', u'return', u'prefer', u'higher', u'floor', u'book', u'ensure', u'building', u'site', u'super', u'time']",UR48115832
"[u'star', u'boutique', u'amazing', u'minute', u'drive', u'airport', u'city', u'centre', u'booked', u'bedroom', u'apartment', u'stunning', u'apartments', u'well', u'equipped', u'spacious', u'beautifully', u'decorated', u'clean', u'felt', u'staff', u'friendly', u'work', u'hard', u'provide', u'service', u'resident', u'manager', u'absolutely', u'charming', u'internet', u'cost', u'dhs', u'hour', u'definitely', u'staying']",UR38959888
"[u'night', u'extended', u'originally', u'night', u'transit', u'coming', u'munich', u'location', u'central', u'rooms', u'decoration', u'bathroom', u'showers', u'area', u'major', u'advantage', u'dubai', u'busy', u'streets', u'proximity', u'airport', u'drawback', u'avilability', u'parking', u'lots', u'case', u'rented', u'car']",UR31192823
"[u'word', u'excellent', u'wrote', u'gotta', u'min', u'characters', u'small', u'cozy', u'dont', u'unwanted', u'music', u'clock', u'night', u'usual', u'scene', u'money', u'staff', u'excellent', u'airport', u'expo', u'walking', u'distance', u'city', u'centre', u'food', u'excellent', u'chef', u'maestro', u'indian', u'food']",UR65238237
"[u'well', u'located', u'apartments', u'close', u'creek', u'developing', u'metro', u'room', u'reasonable', u'size', u'kitchenette', u'price', u'dubai', u'expected', u'taxi', u'dubai', u'yards', u'metro', u'station', u'corner', u'creek', u'choice', u'reasonable', u'standard', u'reasonable', u'location', u'reasonable', u'price']",UR68501476
