Content,ReviewID
"[u'started', u'room', u'small', u'clean', u'bigger', u'room', u'view', u'moved', u'room', u'wonderful', u'love', u'closet', u'space', u'view', u'price', u'paid', u'rooms', u'expensive', u'month', u'clean', u'staff', u'maid', u'daily', u'clean', u'towels', u'needed', u'towels', u'leave', u'bed', u'everyday', u'coffee', u'maker', u'room', u'soda', u'machine', u'corner', u'room', u'small', u'ants', u'running', u'bathroom', u'fear', u'ant', u'killer', u'spray', u'solve', u'problem', u'resturant', u'busy', u'choice', u'eat', u'plaza', u'quebradilla', u'lots', u'choices', u'resturants', u'room', u'problems', u'stood', u'place', u'weeks', u'pools', u'clean', u'side', u'swing', u'love', u'birds', u'seat', u'enjoy', u'view', u'ocean']",UR88594267
"[u'family', u'spent', u'night', u'puerto', u'rico', u'vistamar', u'property', u'located', u'side', u'mountain', u'view', u'ocean', u'highway', u'runs', u'ocean', u'parador', u'trucks', u'heard', u'accelerating', u'airbrakes', u'depending', u'direction', u'highway', u'coquis', u'chirped', u'merrily', u'night', u'awakened', u'roosters', u'morning', u'countryside', u'rooster', u'property', u'basically', u'pretty', u'clean', u'bit', u'dated']",UR4829297
"[u'beutiful', u'view', u'lot', u'things', u'fixed', u'place', u'price', u'average', u'problem', u'type', u'paradores', u'island', u'goverment', u'tourism', u'company', u'support', u'type', u'bussiness', u'places', u'administrator', u'deals', u'promote', u'inside', u'tourism', u'things', u'work', u'better', u'beutiful', u'view', u'lot', u'stuff', u'fixed']",UR124756396
"[u'view', u'positive', u'mountain', u'dated', u'worn', u'room', u'rented', u'balcony', u'exceptional', u'view', u'coastline', u'guajataca', u'tunnel', u'guajataca', u'beach', u'room', u'provided', u'clean', u'stiff', u'king', u'sized', u'bed', u'night', u'atmosphere', u'tired', u'dated', u'maintained', u'disappointing', u'night', u'hot', u'water', u'st', u'person', u'evening', u'shower', u'existent', u'jacuzzi', u'tub', u'broken', u'noise', u'highway', u'amplified', u'room', u'major', u'party', u'noise', u'well', u'early', u'morning', u'hours', u'waitress', u'spoke', u'english', u'cook', u'food', u'allowed', u'bed', u'starving', u'positive', u'passed', u'breakfast', u'return']",UR25815742
"[u'pros', u'room', u'spectacular', u'view', u'ocean', u'parts', u'guajataca', u'king', u'bed', u'comfortable', u'hot', u'water', u'closet', u'spacious', u'room', u'acceptable', u'cons', u'noisy', u'small', u'big', u'room', u'lamps', u'working', u'tv', u'working', u'phone', u'working', u'refrigerator', u'coffee', u'maker', u'internet', u'access', u'rooms', u'bath', u'curtains', u'dirty', u'bathroom', u'small', u'maid', u'clean', u'room', u'leave', u'organized', u'maid', u'bed', u'clean', u'towels', u'paying', u'complained', u'tv', u'horrible', u'service', u'pool', u'deep', u'ft', u'kids', u'pool', u'huge', u'cockroach', u'awful', u'tennis', u'court', u'deteriorated', u'additional', u'recreational', u'facilities', u'gym', u'basketball', u'ect', u'pool', u'hours', u'pm', u'majority', u'pm', u'dinner', u'time', u'pm', u'pm', u'inclusive', u'offer', u'included', u'drinks', u'mentioned', u'waited', u'food', u'ready', u'guest', u'food', u'boring', u'place', u'thing', u'love', u'beautiful', u'view']",UR62974575
"[u'water', u'service', u't', u'fund', u'guys', u't', u'fault']",UR117373210
"[u'chose', u'place', u'location', u'vintage', u'marginally', u'pool', u'weekend', u'crowded', u'locals', u'drinking', u'partying', u'hours', u'signs', u'pool', u'supposed', u'close', u'pm', u'loud', u'music', u'drinking', u'continued', u'night', u'morning', u'long', u'desk', u'majority', u'business', u'activity', u'tourists', u'rooms', u'phone', u'work', u'bugs', u'bathroom', u'floor', u'wet', u'shower', u'cracks', u'allowed', u'leak', u'place', u'area']",UR5424055
"[u'night', u'night', u'trip', u'pr', u'disappointed', u'chose', u'expensive', u'room', u'crappy', u'kind', u'super', u'worse', u'food', u'terrible', u'breakfast', u'freshly', u'juice', u't', u'carribean', u'staff', u'provide', u'quality', u'service', u'figure', u'treated', u'well', u'view', u'built', u'cliff', u'highway', u'cliff', u'beach', u'constant', u'humming', u'cars', u't', u'walk', u'beach', u'closest', u'beach', u'kind', u'surfers', u'enjoy', u'swimmer', u'suicide', u'hill', u'short', u'drive', u'cross', u'highway', u'closest', u'beach', u'minute', u'drive', u'totally', u'worth', u'going', u'recommend', u'finding', u'place', u'beach', u'vistamar', u'worth', u'pay', u'cheapest', u'room', u'rate']",UR21115691
