Content,ReviewID
"[u'vancouver', u'days', u'vacation', u'rosellen', u'suites', u'close', u'stanley', u'park', u'visit', u'aquarium', u'museums', u'lookout', u'dining', u'galore', u'denman', u'street', u'friendly', u'knowledgeable', u'staff', u'helped', u'find', u'ways', u'attractions', u'needed', u'sweet', u'large', u'clean', u'beds', u'comfortable', u'full', u'kitchen', u'tvs', u'recommend', u'rosellen', u'suites', u'stanley', u'park', u'families', u'visiting', u'vancouver', u'pleasant']",UR122265847
"[u'enjoyed', u'staying', u'friends', u'location', u'walking', u'robson', u'st', u'denman', u'stanley', u'park', u'bedrooms', u'sofa', u'bed', u'sleep', u'comfortably', u'well', u'equipped', u'kitchen', u'breakfast', u'snacks', u'tag', u'assistant', u'allowed', u'park', u'day', u'santa', u'claus', u'parade', u'booked', u'priceline', u'planning']",UR122897600
"[u'ski', u'trip', u'mother', u'law', u'friend', u'husband', u'toddlers', u'stopped', u'vancouver', u'whistler', u'rosellen', u'suites', u'incredibly', u'low', u'price', u'clean', u'comfortable', u'bedroom', u'apartment', u'sleeper', u'sofa', u'easily', u'accommodated', u'full', u'well', u'appointed', u'kitchen', u'terrific', u'tv', u'provided', u'crib', u'charge', u'located', u'quiet', u'neighborhood', u'offers', u'reserved', u'parking', u'spots', u'proprietors', u'friendly', u'walking', u'distance', u'restaurants', u'pretty', u'playground', u'park', u'short', u'drive', u'attractions', u'bargain', u'definitely', u'aware', u'parking', u'accessed', u'pretty', u'steep', u'stairs']",UR118498603
"[u'husband', u'young', u'son', u'canadian', u'holiday', u'location', u'superb', u'residential', u'area', u'stanley', u'park', u'road', u'minutes', u'walk', u'main', u'shopping', u'area', u'member', u'staff', u'met', u'son', u'ill', u'day', u'needed', u'assistance', u'suites', u'lack', u'modern', u'amenities', u'lovely', u'staff', u'excellent', u'location', u'definitely', u'return']",UR116577114
"[u'families', u'nights', u'bedroom', u'bathroom', u'executive', u'suite', u'bedroom', u'bathroom', u'suite', u'upgrades', u'booked', u'location', u'short', u'walk', u'stanley', u'park', u'international', u'fireworks', u'competition', u'beds', u'comfortable', u'apartments', u'clean', u'staff', u'friendly', u'recommend', u'place', u'downtown']",UR116574376
"[u'happy', u'location', u'clean', u'spacious', u'walking', u'distance', u'restaurants', u'shops', u'quiet', u'staff', u'friendly', u'recommend', u'family', u'group', u'steps', u'beautiful', u'stanley', u'park', u'ocean', u'highly', u'recommend', u'property', u'vcr', u'definitely']",UR121696187
"[u'rosellen', u'suites', u'preferred', u'lodging', u'business', u'pleasure', u'trips', u'vancouver', u'island', u'trails', u'stanley', u'park', u'walking', u'running', u'biking', u'quick', u'minute', u'walk', u'bayshore', u'minutes', u'walk', u'city', u'center', u'lively', u'robson', u'street', u'suites', u'well', u'furnished', u'sized', u'quiet', u'staff', u'friendly', u'arrived', u'late', u'travel', u'glitches', u'staff', u'late', u'check', u'convenient', u'safeway', u'convenient', u'stores', u'coffee', u'shops', u'wine', u'shops', u'variety', u'small', u'restaurants', u'blocks', u'denman', u'street', u'noisy', u'stressful', u'business', u'day', u'wonderful', u'relax', u'quiet', u'room', u'rosellen']",UR123715977
"[u'vancouver', u'nights', u'late', u'pm', u'lobby', u'opening', u'hour', u'pm', u't', u'late', u'check', u'place', u'fault', u't', u'called', u'number', u'intercom', u'system', u'couple', u't', u'unlock', u'key', u'box', u'luckiely', u'met', u'couple', u'checked', u'late', u'well', u'passcode', u'unlock', u'keybox', u'room', u'floor', u'probabely', u'worst', u'unit', u'building', u'bathrom', u'corridor', u'bedrooms', u'street', u'kitchen', u'entrance', u'garage', u'bedroom', u'eough', u'bed', u'room', u'small', u'side', u'kitchen', u'small', u'equipped', u'dissapointed', u'bathroom', u'bedroom', u'suite', u'bathroom', u'small', u'door', u'building', u'ding', u'remodeling', u'noisy', u'booked', u't', u'expect', u'rent', u'car', u't', u'reserve', u'parking', u'spot', u'rented', u'car', u'minute', u'decision', u'front', u'desk', u'closed', u'phone', u'calls', u'hold', u'arrange', u'parking', u'space', u'house', u'keeping', u'week', u'fine', u'location', u'blocks', u'busy', u'street', u'shops', u'restaurant', u'convenient', u'stanley', u'park', u'short', u'stroll', u'check', u'day', u'store', u'baggage', u'front', u'desk', u'half', u'day', u'print', u'boarding', u'pass', u'front', u'desk', u'pleasant', u'area', u'time']",UR18985130
"[u'situation', u'apartment', u'flooded', u'accommodations', u'entire', u'city', u'sold', u'friends', u'recommended', u'rosellen', u'suites', u'sold', u'accommodate', u'eventually', u'suite', u'feel', u'arrived', u'couldn', u't', u'compassionate', u'situation', u'going', u'recommended', u'recommend']",UR116287666
"[u'outstanding', u'customer', u'service', u'clean', u'comfortable', u'extras', u'vancouver', u'wonderful', u'experience', u'close', u'parks', u'walking', u'distance', u'vancouver', u'attractions']",UR119935698
"[u'rosellen', u'staff', u'friendly', u'room', u'nicely', u'decorated', u'well', u'equipped', u'comfortable', u'location', u'awesome', u'close', u'beach', u'park', u'shopping', u'downtown', u'quiet', u'neighbourhood', u'terrific', u'offers', u'll', u've', u'recommended', u'friends', u'regularly']",UR106045428
"[u'agree', u'place', u'family', u'apartment', u'located', u'quiet', u'residential', u'street', u'block', u'stanley', u'park', u'walking', u'distance', u'restaurants', u'market', u'robson', u'st', u'shopping', u'room', u'sleep', u'family', u'sofa', u'bed', u'living', u'rm', u'small', u'bedroom', u'fully', u'equipped', u'kitchen', u'dining', u'room', u'affordable', u'quiet', u'clean', u'parking', u'isn', u't', u'alley', u'complain', u'return', u'vancouver']",UR10349354
"[u'arrived', u'late', u'foundd', u'front', u'desk', u'installed', u'pointed', u'direction', u'food', u'drink', u'room', u'imaginatively', u'decorated', u'fun', u'bedrooms', u'small', u'included', u'climbing', u'bed', u'window', u'withstanding', u'place', u'suited', u'well', u'equiped', u'basic', u'stuff', u'definately', u'fault', u'location', u'better']",UR70293217
"[u'rosellen', u'suites', u'comfortable', u'affordable', u'accessible', u'convenient', u'clean', u'accommodating', u'group', u'weekend', u'rosellen', u'suites', u'definitely', u'return', u'rooms', u'amenities', u'clean', u'comfortable', u'location', u'central', u'banks', u'grocery', u'stores', u'liquor', u'stores', u'experience', u'enjoyable', u'exemplary', u'customer', u'service', u'received', u'owners', u'kind', u'caring', u'ensure']",UR110039694
"[u'booked', u'nights', u'rosellen', u'suites', u'online', u'chosen', u'proximity', u'stanley', u'park', u'closer', u'looked', u'maps', u'front', u'door', u'turn', u'left', u'block', u'warmly', u'greeted', u'ken', u'proceeded', u'needed', u'area', u'located', u'map', u'upgrade', u'bedroom', u'suite', u'suite', u'delighted', u'full', u'kitchen', u'well', u'equipped', u'foyer', u'desks', u'dining', u'alcove', u'master', u'bedroom', u'walk', u'closet', u'basket', u'goodies', u'including', u'popcorn', u'microwave', u'needed', u'tv', u'thing', u'doable', u'small', u'space', u'bathroom', u'storing', u'toiletries', u'hand', u'totally', u'generous', u'towels', u'providing', u'ended', u'needing', u'training', u'fundraising', u'event', u'early', u'fall', u'walkable', u'location', u'major', u'highlight', u'circumnavigate', u'park', u'walk', u'downtown', u'distance', u'mile', u'returned', u'park', u'times', u'logged', u'miles', u'needed', u'beautiful', u'surroundings', u'check', u'rhododendron', u'gardens', u'lovely', u'walk', u'close', u'rosellen', u'located', u'quiet', u'residential', u'area', u'blocks', u'local', u'restaurant', u'shopping', u'scene', u'kind', u'cuisine', u'european', u'pension', u'restaurant', u'room', u'service', u'loved', u'quiet', u'approach', u'includes', u'peaceful', u'sounds', u'fountain', u'outdoor', u'front', u'court', u'leaving', u'park', u'manager', u'coupons', u'aquarium', u'general', u'level', u'attentiveness', u'experienced', u'definitely']",UR115094009
"[u'clean', u'apt', u'neighbourhood', u'bed', u'suite', u'disappointingly', u'smaller', u'pic', u'website', u'smoking', u'room', u'won', u't', u'offered', u'suite', u'place', u'bedroom', u'window', u'faced', u'side', u'exit', u'extremely', u'noisy', u'night', u'bathroom', u'tiny', u'worn', u't', u'loudness', u'control', u'permanently', u'altered', u'couldn', u't', u'hear', u'well', u'turned', u'full', u'volume', u'staff', u'friendly', u'knowledgeable', u'area', u'neighbourhood', u'lovely', u'close', u'shopping', u'robson', u'st', u'stanley', u'park', u'lots', u'restaurants', u'nearby', u'definitely', u'smoke', u'bigger', u'room', u'book', u'balcony']",UR15234758
"[u'ladies', u'shared', u'bedroom', u'suite', u'rosellen', u'suites', u'weekend', u'suite', u'ground', u'floor', u'totally', u'unacceptable', u'asked', u'suite', u'suite', u'originally', u'allocated', u'smelt', u'moldy', u'decor', u'dated', u'scruffy', u'offered', u'suite', u'floor', u'day', u'extra', u'better', u'condition', u'modern', u't', u'suite', u'tatty', u'torn', u'net', u'curtains', u'half', u'modernized', u'kitchen', u'granite', u'tops', u't', u'change', u'units', u'appliances', u'curtains', u'scruffy', u'fire', u'cover', u'looked', u'terrible', u'common', u'areas', u'renovated', u'linen', u'clean', u'apartment', u'warm', u'bedrooms', u'bathrooms', u'apartment', u'size', u'enjoy', u'apartments', u'ad', u'location', u'short', u'visit', u'vancouver', u'concierge', u'directed', u'fish', u'restaurant', u'stanley', u'park', u'short', u'walk', u'holiday', u'apartments', u'houses', u'price', u'worst', u'staff', u'pleasant', u'reviews', u'assume', u'writers', u'staying', u'apartment']",UR127713070
"[u'reception', u'staff', u'wonderful', u'rosellen', u'apartment', u'building', u'converted', u'rental', u'units', u'spacious', u'location', u'bit', u'dodgey', u'convienent', u'clean', u'dated', u'doesn', u't', u'feel']",UR116633109
