Content,ReviewID
"[u'february', u'enjoyed', u'location', u'perfect', u'walking', u'distance', u'food', u'entertainment', u'room', u'bit', u'small', u'clean', u'well', u'appointed', u'loved', u'wet', u'bar', u'ipod', u'docking', u'station', u'breakfast', u'better', u'friendly', u'staff', u'front', u'desk', u'understaffed', u'friendly', u'price', u'definitely']",UR125862879
"[u'wife', u'visit', u'chicago', u'times', u'year', u'leisure', u'springhill', u'suites', u'exception', u'employee', u'dealt', u'sincere', u'smile', u'help', u'fortunate', u'corner', u'room', u'view', u'roomy', u'quiet', u'heard', u'person', u'thing', u'change', u'room', u'larger', u'tv', u'provided', u'adequate', u'easy', u'block', u'walk', u'michigan', u'avenue', u'shops', u'restaurants', u'bars', u'area', u'providing', u'blocks', u'south', u'chicago', u'river', u'providing', u'plenty', u'opportunity', u'sight', u'parking', u'big', u'cities', u'expensive', u'adjoining', u'garage', u'park', u'night', u'expensive', u'garages', u'close', u'lazy', u'search', u'time', u'chicago', u'springhill', u'suites', u'choice']",UR108925043
"[u'brought', u'girls', u'wife', u'chicago', u'cheer', u'marathon', u'springhill', u'suites', u'awesome', u'mile', u'start', u'race', u'thick', u'things', u'downtown', u'staff', u'incredibly', u'pleasant', u'professional', u'met', u'runners', u'kids', u'room', u'contemporary', u'well', u'furnished', u'suite', u'pool', u'top', u'floors', u'noisy', u'screaming', u'kids', u'mine', u'swear', u'loved', u'sanctuary', u'recommend', u'highly']",UR84804051
"[u'staff', u'super', u'friendly', u'absolutely', u'thing', u'shares', u'amenities', u'marriott', u'residence', u'inn', u'pool', u'area', u'crowded', u'pool', u'cold', u'hot', u'tub', u'small', u'bad', u'experience', u'room', u'clean', u'view', u'city', u'walk', u'michigan', u'ave', u'wasn', u't', u'bad', u'min', u'breakfast', u'room', u't', u'hair', u'dryer', u'beds', u'uncomfortable', u'teenager', u'complained', u'suite', u't', u'separated', u'couch', u'area', u'advertised', u'couch', u'beds', u'defeated', u'purpose', u'light', u'sleeping', u'area', u'paid', u'staying', u'springhill', u'worth', u'penny', u'paid', u'wasn', u't', u'close', u'league']",UR107509806
"[u'spent', u'nights', u'october', u'fantastic', u'king', u'suite', u'exactly', u'pictures', u'online', u'lots', u'room', u'adults', u'share', u'clean', u'amenities', u'room', u'including', u'powerful', u'hairdryer', u'iron', u'full', u'size', u'ironing', u'board', u'microwave', u'fridge', u'king', u'size', u'bed', u'pull', u'couch', u'comforatble', u'hour', u'store', u'located', u'recption', u'well', u'lounge', u'friendly', u'staff', u'allowed', u'early', u'morning', u'check', u'requesting', u'advance', u'bag', u'storage', u'check', u'breakfast', u'buffet', u'excellent', u'hot', u'cold', u'options', u'including', u'eggs', u'sausage', u'waffles', u'fruits', u'cereal', u'well', u'coffee', u'tea', u'station', u'free', u'internet', u'printer', u'lobby', u'friendly', u'door', u'staff', u'excellent', u'directions', u'hail', u'cabs', u'location', u'feature', u'walking', u'distance', u'major', u'sites', u'metro', u'stops', u'definitely']",UR47879237
"[u'place', u'chicago', u'location', u'walking', u'distance', u'chicago', u'main', u'attractions', u'choice', u'rooms', u'clean', u'spacious', u'comfortable', u'people', u'working', u'help', u'satisfy', u'surely', u'future', u'trips', u'chicago']",UR117983204
"[u'trip', u'chicago', u'questions', u'restaurants', u'transportation', u'neighborhoods', u'staff', u'friendly', u'extremely', u'answering', u'questions', u'stereotypical', u'myth', u'chicagoans', u'dispelled', u'visit', u'couldn', u't', u'attentive', u'staff', u'comfortable', u'accomadations', u'night']",UR96130991
"[u'expect', u'occupancy', u'room', u'taxes', u'charges', u'taxes', u'room', u'rate', u'night', u'misleading', u'annoying', u'charge', u'night', u'incidental', u'fee', u'case', u'damages', u'charges', u'vexing', u'fact', u'takes', u'long', u'fee', u'reimbursed', u'card', u'front', u'desk', u'staff', u'explains', u'hold', u'reimbursed', u'card', u'doesn', u't', u'matter', u'called', u'money', u'time', u'charge', u'reversed', u'three', u'nights', u'additional', u'charge', u'privilege', u'occupying', u'bed', u'hangs', u'towels', u'produces', u'garbage', u'room', u'sleep', u'find', u'charge', u'unacceptable', u'intrusive', u'borderline', u'insulting', u'll', u'avoid', u'marriott', u'properties', u'future', u'additionally', u'atm', u'machine', u'service', u'entire', u'visit', u'closest', u'atm', u'block']",UR84645658
"[u'location', u'amazing', u'located', u'train', u'blocks', u'newer', u'property', u'springhill', u'residence', u'inn', u'combined', u'staff', u'extremely', u'reception', u'ladies', u'breakfast', u'pleasant', u'lobby', u'functionable', u'cozy', u'fireplace', u'wii', u'kids', u'breakfast', u'meal', u'day', u'springhill', u'suites', u'seriously', u'selection', u'breakfast', u'mini', u'fridge', u'microwave', u'rooms', u'wifi', u'connection', u'rooms', u'small', u'point', u'open', u'bottom', u'portion', u'window', u'fresh', u'air', u'chicago', u'city', u'restaurant', u'choices', u'plenty', u'comfortable', u'convenient']",UR126484954
"[u'springhill', u'suites', u'river', u'north', u'weeks', u'ago', u'missing', u'arrived', u'hours', u'check', u'problems', u'early', u'check', u'including', u'extra', u'requests', u'staff', u'work', u'suggesting', u'restaurants', u'nearby', u'travel', u'directions', u'room', u'big', u'allow', u'three', u'people', u'breathe', u'big', u'suites', u'embassy', u'partition', u'opposed', u'divided', u'wall', u'room', u'clean', u'comfortable', u't', u'emphasize', u'secure', u'feel', u'rooms', u'big', u'impersonal', u'quiet', u'beautiful', u'location', u'ideal', u'blocks', u'espn', u'zone', u'hard', u'rock', u'cafe', u'house', u'blues', u'michigan', u'ave', u'felt', u'safe', u'finally', u'breakfast', u'area', u'food', u'employees', u'veronica', u'll', u'meet', u't', u'highly', u'recommend', u't', u'wait']",UR47114169
"[u'spent', u'short', u'wknd', u'getaway', u'location', u'valet', u'parked', u'car', u'parking', u'garage', u'broke', u'vehicle', u'stole', u'gps', u'ipod', u'items', u'stored', u'sight', u'staff', u'valet', u'service', u'assured', u'replaced', u'fill', u'form', u'mailed', u'letter', u'responsible', u'items', u'left', u'vehicle', u'parkers', u'beware']",UR26833322
"[u'river', u'north', u'area', u'chicago', u'choose', u'basically', u'ended', u'based', u'combination', u'availability', u'price', u'location', u'location', u'visitors', u'chicago', u'seriously', u'consider', u'river', u'north', u'base', u'center', u'close', u'river', u'north', u'area', u'variety', u'restaurants', u'pubs', u'map', u'springhill', u'suites', u'shares', u'building', u'sister', u'brand', u'residence', u'inn', u'lobby', u'registration', u'second', u'floor', u'enter', u'dearborn', u'walk', u'left', u'elevator', u'springhill', u'registration', u'desk', u'walk', u'residence', u'inn', u'registration', u'north', u'side', u'building', u'springhill', u'suites', u'building', u'isn', u't', u'architecturally', u'pleasing', u'interior', u'pleasant', u'exceeds', u'expectations', u'lobby', u'complete', u'fireplace', u'comfortable', u'chairs', u'sofas', u'wii', u'set', u'gaming', u'free', u'breakfast', u'area', u'large', u'area', u'lobby', u'talking', u'breakfast', u'complaints', u'better', u'average', u'eggs', u'sausage', u'oatmeal', u'waffles', u'fruit', u'baked', u'goods', u'types', u'check', u'efficient', u'friendly', u'front', u'desk', u'person', u'printing', u'public', u'transportation', u'schedules', u'mention', u'lake', u'clark', u'subway', u'station', u'short', u'minute', u'walk', u'don', u't', u'mind', u'walking', u'public', u'transportation', u'served', u'well', u'public', u'transportaton', u'nights', u'room', u'floor', u'top', u'floor', u'location', u'pool', u'workout', u'center', u'floor', u'level', u'view', u'decent', u'john', u'hancock', u'building', u'wrigley', u'buildin', u'views', u'east', u'floor', u'rooms', u'sure', u'floors', u'don', u't', u'walk', u'room', u'elevator', u'rooms', u'occupied', u'quiet', u'solid', u'walls', u'quiet', u'people', u'room', u'king', u'bed', u'spacious', u'rooms', u'double', u'beds', u'springhill', u'suites', u'semi', u'partioned', u'area', u'serves', u'sitting', u'work', u'area', u'desk', u'sofa', u'attached', u'chaise', u'sink', u'mini', u'fridge', u'microwave', u'free', u'wired', u'internet', u'connection', u'sure', u'wireless', u'bottom', u'portion', u'window', u'smaller', u'windows', u'popped', u'open', u'fresh', u'air', u'idea', u'nosiy', u'keep', u'open', u'despite', u'weather', u'windows', u'closed', u'tight', u'city', u'noises', u'held', u'muffled', u'din', u'city', u'noise', u'issue', u'bed', u'extremely', u'comfortable', u'shower', u'water', u'temperature', u'pressure', u'maintenance', u'cleanliness', u'bathroom', u'room', u'general', u'class', u'long', u'cost', u'remains', u'competitive', u'definitey', u'consider', u'staying', u'future', u'trips', u'chicago']",UR113768640
"[u'property', u'immaculate', u'enjoyed', u'recommend', u'individuals', u'families', u'business', u'pleasure', u'location', u'amenities', u'overal']",UR22597806
"[u'location', u'price', u'reservations', u'agent', u'front', u'desk', u'staff', u'valet', u'breakfast', u'staff', u'extremely', u'friendly', u'efficient', u'room', u'spacious', u'clean', u'arrived', u'day', u'early', u'reseravation', u'accomodating']",UR26265251
"[u'sunday', u'night', u'king', u'suite', u'clean', u'location', u'walked', u'christmas', u'mart', u'mag', u'mile', u'river', u'room', u'isn', u't', u'huge', u'big', u'adult', u'daughter', u'front', u'desk', u'staff', u'incredibly', u'friendly', u'enjoyed', u'chatting', u'time', u'passed', u'lobby', u'breakfast', u'ordinary', u'staff', u'beakfast', u'friendly', u'parked', u'corner', u'sterling', u'park', u'hours']",UR51349002
"[u'fantastic', u'location', u'blocks', u'mile', u'shopping', u'restaurants', u'bars', u'closer', u'harry', u'caray', u'fantastic', u'food', u'fun', u'waiters', u'corner', u'howl', u'moon', u'bar', u'blast', u'thing', u'marriott', u'branded', u've', u'service', u'happy', u'working', u've', u'lots', u'isn', u't', u'case', u'service', u'suffers', u'marriott', u'feel', u'wasting', u'time', u'residence', u'inn', u'springhill', u'share', u'building', u'residence', u'wasn', u't', u'sh', u'rooms', u'bit', u'smaller', u'face', u'lake', u'high', u'floor', u'views', u't', u'spectacular', u'adequate', u'pullout', u'comfortable', u'lots', u'storage', u'mentioned', u'firehall', u'close', u'hear', u'lot', u'sirens', u'noise', u'pollution', u'chicago', u'extreme', u'laughed', u'noticed', u'bit', u'breakfast', u'residence', u'breakfast', u'springhill', u'residence', u'side', u'spacious', u'served', u'food', u'bacon', u'fruit', u'side', u'disappointing', u'wifi', u'easy', u'lobby', u'wii', u'kids', u'running', u'underfoot', u'floor', u'pool', u'tiny', u'gorgeous', u'views', u'gym', u'large', u'laundry', u'room', u'patio', u'locked', u'elevators', u'confusing', u'weren', u't', u'labeled', u'going', u'sure', u'fantastic', u'trip', u'time', u'residence', u'rooms', u'bigger', u'wouldn', u't', u'complain', u'springhill', u'thing', u'going', u'night', u'charges', u'cover', u'front', u'desk', u'passes', u'nearby', u'bars', u'saved', u'howl', u'moon', u'nearby', u'bars', u'bars', u'drop', u'cabfare', u'union', u'station', u'hassle', u'walking', u'el']",UR63071785
"[u'bang', u'buck', u'chicago', u'perfectly', u'located', u'center', u'town', u'classy', u'views', u'pool', u'hot', u'tub', u'service', u'amazing', u'included', u'breakfast']",UR115297420
"[u'times', u'visit', u'chicago', u'busy', u'amazingly', u'quiet', u'rooms', u'suites', u'compact', u'perfect', u'husband', u'greeted', u'warmly', u'staff', u'outgoing', u'friendly', u'features', u'including', u'breakfast', u'workout', u'room', u'enjoy', u'large', u'comfortable', u'lobby', u'fireplace', u'sit', u'relax', u'location', u'beat', u'walking', u'downtown', u'chicago']",UR105784672
"[u'spouse', u'teenage', u'girls', u'saturday', u'night', u'second', u'time', u'staying', u'experience', u'time', u'rooms', u'quiet', u'comfortable', u'loved', u'extra', u'sleeping', u'area', u'hideabed', u'pool', u'jacuzzi', u'open', u'pm', u'continental', u'breakfast', u'well', u'stocked', u'selection', u'staff', u'extremely', u'accomodating', u'friendly', u'parking', u'steep', u'guess', u'par', u'course', u'downtown', u'easily', u'walked', u'blocks', u'shopping', u'michigan', u'ave', u'return']",UR45357499
"[u'second', u'time', u'love', u'location', u'second', u'restaurants', u'bars', u'shopping', u'walking', u'distance', u'updated', u'springhill', u'style', u'comfortable', u'staff', u'staying', u'trip', u'chicago']",UR97118323
"[u'booked', u'website', u'price', u'don', u't', u'spend', u'extra', u'corner', u'king', u'suite', u'bedroom', u'suite', u'customer', u'service', u'valet', u'front', u'desk', u'average', u've', u'chicago', u'year', u'free', u'breakfast', u'buffet', u'average', u'well', u'hot', u'cold', u'quick', u'options', u'room', u'ready', u'sunday', u'check', u'suprise', u'pool', u'small', u'crowded', u'floor', u'kids', u'fun', u'lots', u'chlorine', u'suppose', u'thing', u'hot', u'tub', u'average', u'small', u'size']",UR17992749
"[u'year', u'chicago', u'mon', u'thurs', u'springhill', u'suites', u'service', u'level', u'provided', u'sean', u'front', u'desk', u'melanie', u'sales', u'exemplary', u'levels', u'sean', u'identified', u'room', u'preferences', u'week', u'question', u've', u'arrived', u'monday', u'nights', u'addition', u'incredible', u'level', u'service', u'genuine', u'sense', u'interest', u'experiences', u'chicago', u'rest', u'schedules', u'greatly', u'appreciated', u'melanie', u'sales', u'sure', u'team', u'staying', u'springhill', u'suites', u'correct', u'billing', u'rates', u'place', u'spite', u'confusion', u'times', u'sure', u'level', u'support', u'assignment', u'rate', u'marriott', u'property']",UR120590156
"[u'nights', u'suite', u'built', u'modern', u'clean', u'experienced', u'top', u'notch', u'service', u'time', u'pulled', u'front', u'time', u'left', u'valet', u'bellboys', u'toes', u'greeting', u'opening', u'doors', u'sight', u'approach', u'front', u'desk', u'staff', u'gracious', u'attentive', u'questions', u'city', u'patient', u'year', u'son', u'loves', u'lengthy', u'coversations', u'breakfast', u'included', u'essential', u'kids', u'husband', u'ate', u'waffle', u'stations', u'hot', u'foods', u'sausage', u'egg', u'patties', u'making', u'english', u'muffin', u'sandwiches', u'continental', u'breakfast', u'items', u'choose', u'double', u'room', u'modern', u'clean', u'sitting', u'area', u'sofa', u'sleeper', u'bit', u'bigger', u'kids', u'felt', u'tiny', u'bit', u'cramped', u'keeping', u'room', u'tidy', u'helped', u'location', u'perfect', u'walked', u'michigan', u'ave', u'caught', u'free', u'trolley', u'navy', u'pier', u'cab', u'rides', u'city', u'parking', u'bit', u'pricey', u'day', u'allowed', u'unlimited', u'privleges', u'excellent', u'downtown']",UR31280681
"[u'mom', u'returned', u'trip', u'chicago', u'enjoy', u'seasonal', u'atmosphere', u'city', u've', u'residence', u'inn', u'side', u'decided', u'springhill', u'suites', u'side', u'time', u'amenities', u'springhill', u'suites', u'comfortable', u'relaxed', u'feel', u'lobby', u'spacious', u'breakfast', u'area', u'staff', u'pleasant', u'smiling', u'full', u'hot', u'breakfast', u'wonderful', u'dining', u'area', u'bit', u'larger', u'clean', u'quiet', u'room', u'floor', u'lovely', u'city', u'views', u'chose', u'property', u'service', u'perfect', u'location', u'minute', u'walk', u'major', u'attraction', u'parks', u'shopping', u'dining', u'well', u'train', u'station', u'time', u'chicago', u'll', u'definitely']",UR121708460
"[u'friendly', u'staff', u'true', u'money', u'springhill', u'restaurant', u'area', u'don', u't', u'overpay', u'stuffy', u'brand', u'clean', u'lobby', u'complimentary', u'breakfast', u'rate', u'mins', u'walk', u'downtown', u'offices']",UR123372670
"[u'highly', u'recommend', u'chicago', u'general', u'service', u'people', u'food', u'clean', u'streets', u'worth', u'stars']",UR28018817
"[u'location', u'walking', u'downtown', u'rooms', u'clean', u'small', u'largest', u'bed', u'double', u'restuarant', u'bar', u'things', u'walking', u'distance', u'pool', u'top', u'building', u'view', u'city', u'expensive', u'downtown', u'parking', u'additional', u'fee']",UR115968706
"[u'starters', u'consider', u'rate', u'downtown', u'chicago', u'night', u'consider', u'nicer', u'river', u'north', u'area', u'keep', u'mind', u'driving', u'paying', u'day', u'park', u'car', u'park', u'valet', u'typical', u'downtown', u'chicago', u'unlimited', u'service', u'll', u'real', u'knocks', u'admittedly', u'neglible', u'lower', u'floors', u'weekends', u'hear', u'sirens', u'horns', u'time', u'time', u'fourth', u'floor', u'bugged', u'light', u'sleeper', u'consider', u'heard', u'regular', u'traffic', u'noise', u'big', u'personal', u'perspective', u'easy', u'access', u'low', u'cost', u'lot', u'families', u'weekend', u'kids', u'people', u'control', u'kids', u'weekdays', u'exclusively', u'business', u'travelers', u'lastly', u'room', u'storage', u'pretty', u'minimal', u'clothing', u'likes', u'small', u'closet', u'small', u'drawers', u't', u'deep', u'front', u'booked', u'room', u'double', u'beds', u'travelling', u'friends', u'concert', u'point', u'literally', u'sleep', u'nights', u'arrived', u'overbooked', u'fixed', u'separate', u'king', u'rooms', u'bonus', u'staff', u'helpfull', u'polite', u'rooms', u'simple', u'clean', u'functional', u'bed', u'isn', u't', u'comfortable', u'll', u'find', u'beds', u'coming', u'couldn', u't', u'easier', u'pretty', u'straight', u'shot', u'bit', u'nicer', u'attached', u'residence', u'inn', u'marriot', u'night', u'opinion', u'location', u'incredible', u'starters', u'river', u'north', u'business', u'river', u'going', u'chicago', u't', u'beat', u'restaurants', u'parks', u'museums', u'excellent', u'walking', u'distance', u'consider', u'miles', u'pool', u'touch', u'hordes', u'afforementioned', u'children', u'small', u'cool', u'view', u'hot', u'tub']",UR102220718
"[u'shares', u'building', u'marriott', u'residence', u'inn', u'plastic', u'fine', u'exceptional', u'attribute', u'location']",UR118135434
"[u'nye', u'weekend', u'suite', u'king', u'bed', u'sofa', u'living', u'area', u'bit', u'small', u'side', u'lot', u'room', u'store', u'luggage', u'bathroom', u'shower', u'tub', u'breakfast', u'crowded', u'door', u'enstein', u'bagels', u'neighborhood', u'bars', u'restaurants', u'bad', u'walk', u'michigan', u'ave', u'room', u'clean', u'place', u'crash', u'shopping', u'night', u'chicago']",UR124088334
"[u'recommend', u'reservation', u'conveniently', u'located', u'bus', u'train', u'plain', u'ol', u'walking', u'room', u'comfortable', u'pullout', u'couch', u'seating', u'area', u'nicely', u'appointed', u'bathrooms', u'clean', u'comfortable', u'bed', u'terrific', u'breakfast', u'included', u'morning', u'staff', u'member', u'begging', u'help', u'complaints', u'whatsoever']",UR62743748
"[u'husband', u'train', u'dearborn', u'mi', u'chicago', u'springhill', u'suites', u'chicago', u'downtown', u'cab', u'ride', u'amazing', u'weekend', u'centrally', u'located', u'walking', u'distance', u'restaurants', u'night', u'life', u'shopping', u'concierge', u'amazing', u'supplied', u'suggestions', u'dinner', u'free', u'entrance', u'howl', u'moon', u'steps', u'free', u'bottle', u'wine', u'celebrate', u'anniversary', u'breakfast', u'selection', u'better', u'eat', u'gluten', u'foods', u'lactose', u'intolerant', u'king', u'size', u'bed', u'room', u'comfortble', u'bouncy', u'price', u'pleased', u'springhill', u'suites']",UR123600806
"[u'highly', u'recommend', u'family', u'traveling', u'chicago', u'children', u'pull', u'couch', u'perfect', u'children', u'location', u'ideal', u'breakfast', u'convenient', u'better', u'usual', u'continental', u'breakfast', u'clean', u't', u'beat', u'price', u'summer', u'chicago', u'quiet', u'sleeping']",UR117157606
"[u'traveling', u'chicago', u'times', u'month', u'september', u'year', u'chosen', u'springhill', u'suites', u'chicago', u'downtown', u'river', u'north', u'time', u'disappointed', u'moment', u'check', u'feel', u'vip', u'staff', u'attentive', u'chicago', u'rooms', u'clean', u'spacious', u'frequent', u'traveller', u'coffee', u'machine', u'room', u'fridge', u'microwave', u'well', u'located', u'area', u'walking', u'distance', u'restaurants', u'hot', u'spots', u'sights', u'chicago', u'offer', u'disappointed', u'walk', u'sights', u'jump', u'train', u'sure', u'staff', u'highly', u'recommend', u'business', u'leisure', u'trip']",UR123911955
"[u'daughter', u'chicago', u'time', u'tour', u'portfolio', u'review', u'saic', u'idea', u'expect', u'springhill', u'suites', u'decided', u'location', u'number', u'points', u'worth', u'chance', u'pleasantly', u'surprised', u'stylish', u'decor', u'roomy', u'accommodations', u'friendly', u'staff', u'extra', u'safety', u'precautions', u'comfortable', u'traveling', u'women', u'reason', u'doesn', u't', u'stars', u'noisy', u'night', u'club', u'door', u'awake', u'evening', u'opened', u'roof', u'enjoy', u'lovely', u'night', u'request', u'numbered', u'room', u'avoid', u'issue', u'request', u'high', u'floor', u'definitely', u'place', u'chicago']",UR120421947
"[u'nights', u'conference', u'loved', u'amenities', u'day', u'long', u'coffee', u'tea', u'lobby', u'free', u'internet', u'warm', u'breakfast', u'suite', u'big', u'refrigerator', u'microwave', u'iron', u'hair', u'blower', u'room', u'clean', u'bright', u'time', u'quiet', u'thing', u'complain', u'music', u'weekend', u'nights', u'sure', u'music', u'sounded', u'bar', u'pop', u'fall', u'asleep', u'music', u'sure', u'bother', u'light', u'sleepers']",UR122843011
"[u'experience', u'positive', u'side', u'location', u'clean', u'rooms', u'pleasant', u'staff', u'exception', u'continental', u'breakfast', u'well', u'stocked', u'negative', u'side', u'requested', u'early', u'check', u'arrive', u'pm', u'check', u'time', u'began', u'pm', u'room', u'ready', u'excuse', u'front', u'desk', u'clerk', u'busy', u'granted', u'time', u'christmas', u'years', u'busy', u'worked', u'years', u'knew', u'busy', u'times', u'slows', u'times', u'better', u'term', u'mismanaged', u'pool', u'whirlpool', u'view', u'floor', u'small', u'side', u'number', u'people', u'busy', u'lines', u'wanted', u'breakfast', u'hard', u'find', u'place', u'sit', u'period', u'busy']",UR122260867
"[u'excellent', u'groups', u'high', u'school', u'students', u'senior', u'field', u'trip', u'job', u'accommadating', u'group', u'lots', u'families', u'groups', u'staying', u'friendly', u'custiodial', u'staff', u'breakfast', u'ladies', u'front', u'desk', u'group', u'sales', u'requests', u'excuted', u'directions', u'area', u'attractions', u'thier', u'public', u'transportation', u'location', u'lots', u'night', u'life', u'restaurants', u'minutes', u'station', u'definately']",UR82799607
"[u'wife', u'chicago', u'portion', u'honeymoon', u'time', u'room', u'large', u'clean', u'service', u'market', u'store', u'complimentary', u'breakfast', u'morning', u'selection', u'foods', u'decent', u'breakfast', u'staff', u'friendly', u'quick', u'clear', u'empty', u'tables', u'location', u'places', u'walking', u'distance', u'time', u'chicago']",UR116188036
"[u'money', u'major', u'city', u'clean', u'quiet', u'rooms', u'luxurious', u'comfortable', u'location', u'quality', u'wrong']",UR100563400
"[u'amazing', u'staff', u'money', u'indoor', u'pool', u'jacuzzi', u'free', u'wifi', u'breakfast']",UR122847392
"[u'springhill', u'suites', u'nights', u'business', u'trip', u'chicago', u'clean', u'conveniently', u'located', u'bus', u'el', u'train', u'public', u'transit', u'located', u'closeby', u'lots', u'restaurants', u'shopping', u'close', u'corner', u'suite', u'upper', u'floor', u'views', u'city', u'bathroom', u'spacious', u'clean', u'wireless', u'rooms', u'free', u'wired', u'internet', u'wireless', u'lobby', u'definitely', u'trip', u'chicago']",UR124898078
"[u'travel', u'chicago', u'business', u'week', u'year', u'half', u'staying', u'gem', u'staff', u'springhill', u'suites', u'call', u'duty', u'extremely', u'friendly', u'courteous', u'sure', u'enjoy', u'spacious', u'rooms', u'free', u'wi', u'fi', u'complimentary', u'breakfast', u'assortment', u'national', u'newspapers', u'highly', u'recommend', u'springhill', u'suites', u'visiting', u'chicago']",UR116529271
"[u'modern', u'updated', u'springhill', u'suites', u'rooms', u'basically', u'ordinary', u'size', u'room', u'sq', u'feet', u'divided', u'sitting', u'area', u'desk', u'small', u'refrigerator', u'bar', u'side', u'comfy', u'bed', u'closet', u'bathroom', u'room', u'clean', u'frills', u'consistent', u'well', u'lit', u'room', u'full', u'bathroom', u'half', u'second', u'free', u'included', u'breakfast', u'standard', u'springhill', u'pastries', u'eggs', u'yogurt', u'cereals', u'property', u'fitness', u'center', u'well', u'large', u'lobby', u'sitting', u'area', u'return', u'business', u'trip', u'solo', u'traveler', u'consistent', u'unwanted', u'surprises', u'staff', u'friendly', u'room', u'area', u'clean', u'location', u'walking', u'distance', u'chicago', u'events']",UR114430295
"[u'june', u'location', u'yards', u'free', u'trolley', u'navy', u'pier', u'amenities', u'wii', u'kids', u'front', u'desk', u'humid', u'swimming', u'pool', u'top', u'floor', u'awesome', u'city', u'views', u'complimentary', u'breakfast', u'service', u'awesome', u'suite', u'style', u'rooms', u'comfortably', u'fit', u'family', u'awesome', u'family', u'vacation']",UR117249596
"[u've', u'springhill', u'suites', u'time', u'rooms', u'clean', u'comfortable', u'staff', u'doormen', u'friendly', u'funny', u'location', u'convenient', u'michigan', u'ave', u'popular', u'attractions', u'well', u'red', u'bus', u'stops', u'staying']",UR125058681
