Content,ReviewID
"[u'impressions', u'julio', u'gonzalez', u'gentlemen', u'helping', u'curb', u'side', u'day', u'remembered', u'bags', u'cabs', u'suggestions', u'meals', u'tourist', u'tricks', u'check', u'service', u'women', u'tuesday', u'april', u't', u'names', u'accomodating', u'hints', u'trip', u'chicago', u'family', u'bring', u'comfortable', u'shoes', u'walk', u'short', u'city', u'blocks', u'don', u't', u'buy', u'day', u'trolly', u'bus', u'trap', u'visit', u'hancock', u'building', u'bar', u'observation', u'deck', u'recommendations', u'low', u'mid', u'cost', u'meals', u'plan', u'time', u'museum', u'science', u'industry']",UR105787639
"[u'marriott', u'rewards', u'member', u'received', u'alert', u'weeks', u'advance', u'rate', u'deal', u'property', u'jumped', u'save', u'night', u'property', u'clean', u'convenient', u'restaurants', u'subway', u'shopping', u'sightseeing', u'complimentary', u'breakfast', u'unusual', u'downtown', u'chicago', u'fitness', u'center', u'worked']",UR34006203
"[u'trip', u'chicago', u'city', u'springhillsuites', u'downtown', u'located', u'town', u'easy', u'attractions', u'room', u'clean', u'space', u'move', u'relax', u'busy', u'day', u'city', u'daily', u'breakfast', u'hot', u'pleasant', u'staff', u'helped', u'food', u'items', u'area', u'clean', u'reception', u'desk', u'occupied', u'variety', u'staff', u'member', u'advice', u'directions', u'attractions', u't', u'wait']",UR117251382
"[u'july', u'children', u'ages', u'location', u'public', u'transportation', u'clean', u'room', u'plentiful', u'breakfast', u'pool', u'area', u'secure', u'facility', u'negative', u'air', u'conditioning', u'cool', u'room', u'temps', u'extreme', u'week']",UR71390947
"[u'located', u'north', u'river', u'central', u'attractions', u'loop', u'area', u'nicely', u'furnished', u'clean', u'comfortable', u'issue', u'noise', u'traffic', u'crowd', u'saturday', u'night', u'college', u'football', u'game', u'rooters', u'honk', u'shout', u'wee', u'hours', u'enter', u'street', u'level', u'valet', u'attendant', u'elevator', u'flight', u'main', u'lobby', u'second', u'bank', u'elevators', u'room', u'card', u'needed', u'room', u'additional', u'level', u'security', u'free', u'breakfast', u'walked', u'field', u'museum', u'willis', u'tower', u'art', u'institute', u'shedd', u'aquarium', u'miracle', u'mile', u'train', u'milllenium', u'station', u'science', u'museum']",UR120092007
"[u'chicago', u'suburbs', u'downtown', u'events', u'work', u'friends', u'marriott', u'level', u'loop', u'river', u'north', u'favorite', u'location', u'night', u'life', u'restaurants', u'bars', u'clubs', u'house', u'blues', u'room', u'floor', u'terrific', u'views', u'city', u'lake', u'free', u'breakfast', u'lot', u'people', u'breakfast', u'area', u'sunday', u'morning', u'floor', u'managed', u'well', u'room', u'separate', u'sitting', u'area', u'small', u'wet', u'bar', u'separate', u'bedroom', u'separated', u'door', u'felt', u'rooms', u'beds', u'average', u'expect', u'level', u'definitely', u'recommend', u'wanting', u'spend', u'ton']",UR125452423
"[u'nights', u'family', u'christmas', u'years', u'rooms', u'reserved', u'ready', u'check', u'ready', u'pm', u'big', u'deal', u'front', u'desk', u'staff', u'friendly', u'despite', u'crush', u'guests', u'arriving', u'time', u'full', u'location', u'left', u'car', u'expensive', u'garage', u'time', u'short', u'block', u'walk', u'train', u'station', u'cvs', u'buy', u'transit', u'passes', u'day', u'covers', u'trains', u'subways', u'buses', u'metra', u'trains', u'lakeshore', u'blocks', u'direction', u'michigan', u'ave', u'shopping', u'district', u'plenty', u'restaurants', u'walking', u'distance', u'hot', u'tub', u'broken', u'st', u'night', u'fixed', u'night', u'breakfast', u'crowded']",UR122405057
"[u'well', u'received', u'reception', u'allowed', u'early', u'check', u'late', u'check', u'unusual', u'room', u'spacious', u'panoramic', u'view', u'floor', u'breakfast', u'complimentary', u'serves', u'variety', u'food', u'wii', u'reception', u'guests', u'free', u'time', u'location', u'lot', u'restraunt', u'nearby', u'well', u'equiped', u'gym', u'swimming', u'pool', u'recommend', u'business', u'travellers']",UR69300789
"[u'spent', u'weekend', u'things', u'experience', u'location', u'perfect', u'minute', u'walk', u'blue', u'takes', u'hare', u'literally', u'minute', u'walk', u'red', u'takes', u'felt', u'needed', u'car', u'grocery', u'store', u'nearby', u'minute', u'walk', u'wine', u'beer', u'store', u'fridge', u'room', u'clean', u'room', u'cramped', u'small', u'pull', u'sofa', u'downtown', u'room', u'quiet', u'breakfast', u'area', u'biggest', u've', u'well', u'stocked', u'time', u'busy', u'lots', u'people', u'eat', u'internet', u'access', u'lobby', u'checking', u'quick', u'mails', u'printing', u'boarding', u'passes', u'definitely', u'fortuante', u'chicago']",UR21954079
"[u'innovative', u'approach', u'combining', u'marriott', u'brands', u'middle', u'road', u'marriott', u'brands', u'rooftop', u'pool', u'beautiful', u'view', u'rooms', u'staff', u'friendly', u'cell', u'phone', u'reception', u'rooms', u'horrible', u'internet', u'reliable', u'decent']",UR118912283
"[u'planned', u'family', u'chicago', u'trip', u'grown', u'kids', u'grandkids', u'decent', u'location', u'wanted', u'offered', u'king', u'sofa', u'sleepers', u'kids', u'minute', u'special', u'offered', u'booked', u'rooms', u'small', u'suites', u'adequate', u'weren', u't', u'spending', u'lot', u'time', u'rooms', u'average', u'free', u'breakfast', u'included', u'pool', u'pretty', u'small', u'jam', u'packed', u'evenings', u'rooms', u'clean', u'staff', u'friendly', u'nearby', u'fire', u'station', u'calls', u'pretty', u'noisy', u'night']",UR115031318
"[u'wife', u'day', u'weekend', u'spent', u'day', u'lincoln', u'park', u'zoo', u'wrigley', u'field', u'navy', u'pier', u'grant', u'park', u'day', u'ideal', u'location', u'destinations', u'zoo', u'wrigley', u'field', u'cab', u'ride', u'navy', u'pier', u'block', u'walk', u'rooms', u'pretty', u'sized', u'fairly', u'modern', u'style', u'clean', u'quiet', u'room', u'downtown', u'chicago', u'expect', u'street', u'noise', u'noise', u'heard', u'floor', u'room', u'occasional', u'ambulance', u'fire', u'truck', u'siren', u'free', u'breakfast', u'buffet', u'waffles', u'eggs', u'sausage', u'cereal', u'bagels', u'fruits', u'complaints', u'tv', u'channels', u'high', u'def', u'fancy', u'flat', u'screen', u'tv', u'watch', u'going', u'flat', u'screen', u'tv', u'room', u'high', u'def', u'package', u'channels', u'high', u'def', u'kind', u'buying', u'porsche', u'gear', u'springhill', u'suites', u'neighboring', u'residence', u'inn', u'sharing', u'pool', u'hot', u'tub', u'pool', u'area', u'kind', u'crowded', u'noisy', u'times', u'don', u't', u'watch', u'tv', u'pool', u'type', u'person', u'complaints', u'won', u't', u'matter', u'suppose', u'scale']",UR115171132
"[u'arrival', u'check', u'smoothly', u'room', u'package', u'included', u'valet', u'parking', u'parking', u'garage', u'corner', u'elevator', u'inside', u'parking', u'garage', u'wouldn', u't', u'valet', u'service', u'corner', u'suite', u'views', u'city', u'furniture', u'modern', u'comfortable', u'isn', u't', u'door', u'separating', u'bedroom', u'sitting', u'area', u'suite', u'suites', u'bit', u'privacy', u'sleeping', u'pull', u'sofa', u'small', u'pool', u'hot', u'tub', u'floor', u'exercise', u'room', u'fine', u'area', u'clean', u'biggest', u'close', u'proximity', u'number', u'restaurants', u'front', u'desk', u'staff', u'provided', u'list', u'restaurants', u'walking', u'distance', u'checked', u'downside', u'fire', u'station', u'blocks', u'sirens', u'horns', u'blasting', u'night', u'long', u'hard', u'sleep', u've', u'chicago', u'times', u'bothered', u'noise', u'cars', u'passersby']",UR117987345
"[u'rooms', u'nicely', u'laid', u'rooms', u'seating', u'area', u'separated', u'bed', u'desk', u'floor', u'ceiling', u'divider', u'microwave', u'small', u'counter', u'refrigerator', u'freezer', u'coffee', u'maker', u'bar', u'sink', u'bathrooms', u'surprisingly', u'large', u'walk', u'shower', u'complimentary', u'breakfast', u'included', u'dining', u'area', u'pleanty', u'tables', u'space', u'lobby', u'area', u'spacious', u'shares', u'building', u'residence', u'inn', u'minor', u'inconvenience', u'ice', u'machines', u'vending', u'room', u'floors', u'lobby', u'floor', u'request', u'ice', u'inconvenient', u'floors', u'isn', u't', u'matter', u'going', u'hall', u'ice', u'machine', u'seconds', u'clean', u'comfortable', u'friendly', u'staff', u'well', u'located', u'river', u'north', u'area', u'close', u'restaurants', u'shopping']",UR124549508
"[u'nights', u'early', u'conference', u'staff', u'friendly', u'vibe', u'felt', u'secure', u'funny', u'intimate', u'guest', u'laundry', u'location', u'bit', u'better', u'expected', u'blocks', u'michigan', u'ave', u'nordstrom', u'lots', u'restaurants', u'convenience', u'stores', u'close', u'clean', u'comfortable', u'bed', u'facilites', u'room', u'free', u'internet', u'breakfast', u'setup', u'staff', u'friendly', u'varied', u'guests', u'families', u'expect', u'springhill', u'suites', u'chicago', u'keep']",UR65697503
"[u'nights', u'work', u'trip', u'chicago', u'room', u'needed', u'comfortable', u'bed', u'fridge', u'desk', u'space', u'sofa', u'area', u'safe', u'box', u'room', u'floor', u'facing', u'east', u'view', u'spectacular', u'fire', u'station', u'block', u'sirens', u'fire', u'trucks', u'annoying', u'free', u'wireless', u'pretty', u'slow', u'free', u'breakfast', u'food', u'mediocre', u'relaxed', u'style', u'food', u'room', u'coffee', u'bar', u'open', u'day', u'service', u'front', u'desk', u'staff', u'pleasant', u'waitress', u'breakfast', u'room', u'thing', u'keep', u'guests', u'call', u'snobby', u'noisy', u'families', u'lots', u'young', u'kids', u'running']",UR117056438
"[u'clean', u'room', u'seemingly', u'packed', u'families', u'teens', u'college', u'students', u'business', u'traveler', u'town', u'business', u'full', u'day', u'behavioral', u'field', u'ahead', u'sunday', u'needed', u'quiet', u'place', u'keep', u'well', u'saturday', u'night', u'dodging', u'loud', u'kids', u'elevators', u'passing', u'loud', u'rooms', u'thought', u'room', u'safe', u'quiet', u'nope', u'call', u'security', u'saturday', u'night', u'college', u'age', u'girls', u'room', u'door', u'returned', u'drunk', u'decided', u'shrieking', u'crying', u'slept', u'boyfriend', u'insert', u'explicative', u'choice', u'knock', u'drag', u'fight', u'complete', u'sounds', u'furniture', u'banging', u'credit', u'security', u't', u'hear', u'sunday', u'morning', u'teeming', u'families', u'check', u'elevator', u'literally', u'stopped', u'floors', u'fit', u'stops', u'minutes', u'riding', u'elevator', u'breakfast', u'room', u'crowded', u'appeared', u'kids', u'year', u'age', u'range', u'parents', u'einstein', u'bagels', u'door', u'knocked', u'average', u'poor', u'odd', u'shaped', u'room', u'terrible', u'lighting', u'glaring', u'fluorescent', u'light', u'bed', u'ended', u'awkwardly', u'moving', u'desk', u'lamp', u'bedside', u'table', u'enjoy', u'bedside', u'lighting', u'appropriate', u'reading', u'unwinding', u'things', u'better', u'weekend', u'kids', u'checked', u'pay', u'heed', u'terrible', u'poor', u'average', u'reviews', u'folks', u'weren', u't', u'town', u'special', u'shopping', u'theatre', u'bar', u'hopping', u'weekend', u'chicago', u'sure', u'family', u'friendly', u'place', u'plan', u'late', u'noisy', u'order', u'pizza', u'watch', u'tv', u'price', u'won', u't', u'letting', u'company', u'book', u'marriott', u'brand', u'chicago']",UR122207750
"[u'business', u'trip', u'chicago', u'nights', u'feb', u'surprised', u'live', u'chicago', u'familiar', u'area', u't', u'familiar', u'location', u'tiny', u'bit', u'beaten', u'path', u'isn', u't', u'michigan', u'avenue', u'blocks', u'service', u'excellent', u'desk', u'staff', u'friendly', u'room', u'corner', u'king', u'suite', u'enormous', u'major', u'city', u'room', u'clean', u'comfortable', u'walk', u'transportation', u'restaurants', u'art', u'institute', u'millennium', u'park', u'free', u'breakfast', u'daily', u'included', u'hot', u'things', u'eggs', u'waffles', u'highly', u'recommended']",UR57736124
"[u'marriott', u'standards', u'marriott', u'consistency', u'connected', u'marriott', u'free', u'breakfast', u't', u'remember', u'better', u'food', u'easily', u'walk', u'share', u'elevators', u'pool', u'lobbies', u'connected', u'rooms', u'small', u'typical', u'city', u'room', u'younger', u'kids', u'shared', u'double', u'bed', u'husband', u'double', u'year', u'pull', u'sofa', u'bed', u'room', u'decent', u'view', u'windows', u'open', u'refrigerator', u'location', u'lots', u'stuff', u'close', u'walked', u'rainforest', u'cafe', u'restaurant', u'parking', u'expensive', u'street', u'block', u'valet', u'park', u'lot', u'car', u'difficult', u'aaa', u'discount', u'received', u'price']",UR39722673
"[u'thanksgiving', u'nights', u'rate', u'low', u'compared', u'comparable', u'booking', u'online', u'highly', u'satisfied', u'amenities', u'convenience', u'lived', u'chicago', u'long', u'time', u'knew', u'location', u'couple', u'blocks', u'el', u'closer', u'bus', u'restaurants', u'shops', u'nearby', u'lobby', u'rooms', u'pleasantly', u'decorated', u'staff', u'handouts', u'front', u'desk', u'attractions', u'recommended', u'restaurants', u'included', u'breakfast', u'abundant', u'convenient', u'refrigerator', u'microwave', u'room', u'definitely']",UR79976474
"[u'fantastic', u'check', u'breeze', u'room', u'perfect', u'breakfast', u'expect', u'beat', u'location', u'close', u'middle', u'recommend', u'forward', u'returning']",UR83450686
"[u'suite', u'chains', u'decided', u'trendy', u'lamp', u'bad', u'bed', u'bad', u'customer', u'service', u'designed', u'room', u'room', u'service', u'vending', u'pay', u'enormous', u'price', u'mini', u'mart', u'soda']",UR108573643
"[u'completed', u'meeting', u'highly', u'recommend', u'responsive', u'group', u'offer', u'hassle', u'free', u'well', u'program', u'competitive', u'price']",UR105678113
"[u'chicago', u'nights', u'place', u'booked', u'option', u'river', u'north', u'area', u'rooms', u'spacious', u'decor', u'modern', u'layout', u'room', u'lot', u'floor', u'view', u'city', u'floor', u'ceiling', u'window']",UR38575752
"[u'fantastic', u'chicago', u'true', u'delight', u'brilliant', u'location', u'close', u'magnificant', u'mile', u'state', u'street', u'theatre', u'district', u'wanted', u'visit', u'sights', u'lots', u'shopping', u'staff', u'breakfast', u'included', u'price', u'bonus', u'free', u'access', u'internet', u'bought', u'tickets', u'online', u'dirty', u'dancing', u'cadillac', u'theatre', u'amazing', u'definately', u'recommend', u'discovered', u'restaurant', u'called', u'grand', u'lux', u'cafe', u'sister', u'company', u'cheesecake', u'factory', u'don', u't', u'wait', u'long', u'table', u'find', u'marshalls', u'ontario', u'ave', u'bargains', u'visiting', u'chicago', u'premium', u'outlet', u'centre', u'book', u'tour', u'greyline', u'tours', u'time', u'sights', u'recommend', u'john', u'hancock', u'tower', u'sears', u'tower', u'better', u'views', u'audio', u'tour', u'included', u'windy', u'city', u'fab', u'place', u'visit', u'definately', u'wouldn', u't', u'hesitate', u'springhill', u'suites']",UR21005095
"[u'paired', u'marriott', u'residence', u'inn', u'shared', u'lobbies', u'big', u'pleasant', u'public', u'areas', u'room', u'small', u'kitchen', u'area', u'flat', u'screen', u'tv', u'free', u'frills', u'breakfast', u'location', u'business', u'views']",UR39402376
"[u'friend', u'enjoy', u'relaxing', u'day', u'vacation', u'reservation', u'online', u'preferences', u'requested', u'early', u'check', u'arrived', u'pm', u'told', u'room', u'phone', u'number', u'stated', u'call', u'avilable', u'understand', u'big', u'city', u'rooms', u'high', u'demand', u'checked', u'bags', u'front', u'desk', u'street', u'harry', u'carays', u'returned', u'pm', u'room', u'waited', u'lobby', u'reapproached', u'front', u'desk', u'pm', u'check', u'time', u'check', u'time', u'finally', u'acknowledged', u'room', u'spa', u'hot', u'tub', u'service', u'told', u'ready', u'hour', u'happened', u'ended', u'enjoy', u'swimming', u'pool', u'liner', u'appeared', u'lifting', u'bottom', u'thought', u'needed', u'immidiate', u'service', u'room', u'modern', u'clean', u'location', u'pretty', u'price', u'experiences', u'marriott', u'property', u'breakfast', u'minutes', u'prior', u'time', u'advertised', u'appreciated', u'checking', u'asked', u'golden', u'rule', u'hospitality', u'industry', u'wrong', u'rate', u'fair', u'partly', u'cloudy', u'comparison', u'marriott']",UR119045783
"[u'station', u'grand', u'red', u'room', u'large', u'double', u'beds', u'working', u'desk', u'microwave', u'fridge', u'bathroom', u'shower', u'sink', u'large', u'flat', u'screen', u'tv', u'swimming', u'pool', u'small', u'smells', u'chlorate', u'lobby', u'laundry', u'floor', u'convenient', u'breakfast', u'room', u'big', u'choice', u'large', u'staff', u'friendly', u'better', u'food', u'market', u'store', u'streets', u'huron', u'street', u'find', u'tasty', u'food', u'small', u'market', u'reception', u'desk', u'buy', u'drinks', u'food', u'case', u'arrive', u'late', u'hungry', u'doors', u'rooms', u'slam', u'noisy', u'negative', u'point', u'lucky', u'neighbours', u'care', u'coming', u'late', u'leaving', u'early', u'case', u'floor', u'offers', u'free', u'wired', u'wifi', u'internet']",UR77745781
"[u'christmas', u'year', u'days', u'location', u'chicago', u'river', u'blocks', u'michigan', u'ave', u'restaurants', u'activities', u'walking', u'distance', u'check', u'easy', u'early', u'room', u'ready', u'suite', u'isn', u't', u'big', u'big', u'room', u'desk', u'partition', u'dividing', u'decor', u'room', u'clean', u'bathrooms', u'sink', u'bathroom', u'toilet', u'shower', u'personally', u'don', u't', u'regular', u'bathroom', u'setup', u'wasn', u't', u'bathtub', u'year', u'shower', u'bath', u'incovenient', u'sure', u'rooms', u'bathtubs', u'day', u'day', u'room', u'housekeeping', u'hadn', u't', u'cleaned', u'room', u'find', u'toilet', u'paper', u'towels', u'second', u'day', u'knocked', u'room', u'early', u'told', u'day', u'proceeded', u'knock', u'hour', u'inconsistent', u'service', u'price', u'paid', u'find', u'rooms', u'bathtubs']",UR122781878
"[u'breakfast', u'bonus', u'clean', u'family', u'friendly', u'brother', u'law', u'military', u'staying', u'room', u'car', u'broken', u'garage', u'payed', u'dollars', u'night', u'window', u'broken', u'sucked', u'better', u'security']",UR115052430
"[u'clean', u'friendly', u'staff', u'location', u'walk', u'loop', u'floor', u'view', u'rooms', u'person', u'family', u'double', u'suite', u'included', u'sofa', u'bed', u'mother', u'king', u'suite', u'rooms', u'large', u'mother', u'room', u'room', u'cramped', u'room', u'couldn', u't', u'spread', u'room', u'size', u'people', u'party', u'rooms', u'point', u'people', u'suite', u'downtown', u'breakfast', u'definitely', u'middle', u'road', u'belgian', u'wafflemaker', u'mini', u'boxes', u'cereal', u'bagels', u'toast', u'egg', u'dish', u'adequate', u'exciting', u'song', u'veronica', u'breakfast']",UR69959442
"[u'arrival', u'greeted', u'level', u'courtesy', u'friendliness', u'consistently', u'pleasant', u'location', u'local', u'restaurants', u'navy', u'pier', u'well', u'museums', u'easy', u'view', u'city', u'room', u'clean', u'comfortable', u'excercise', u'room', u'oldest', u'child', u'pool', u'provided', u'youngest', u'hours', u'fun', u'day', u'breakfast', u'offered', u'choices', u'enjoy', u'experience', u'staying', u'future']",UR106700707
"[u'returned', u'year', u'wonderful', u'year', u'annual', u'girls', u'weekend', u'front', u'desk', u'staff', u'top', u'notch', u'room', u'handicap', u'perfect', u'huge', u'bathroom', u'beds', u'comfortable', u'fridge', u'drinks', u'small', u'sofa', u'relax', u'breakfast', u'better', u'lot', u'people', u'eating', u'well', u'stocked', u'location', u'property', u't', u'beat', u'walk', u'shopping', u'state', u'street', u'problems', u'mutiple', u'train', u'stops', u'walking', u'distance']",UR117836833
"[u'husband', u'night', u'dec', u'requested', u'received', u'room', u'high', u'floor', u'view', u'city', u'studio', u'suite', u'perfect', u'staff', u'friendly', u'sure', u'received', u'luggage', u'valet', u'area', u'picked', u'arrived', u'left', u'bags', u'valet', u'bring', u'second', u'floor', u'check', u'left', u'checked', u'mentioned', u'clerk', u'asked', u'receipt', u'parking', u'ticket', u'worry', u'retrieved', u'sure', u'matched', u'bags', u'room', u'carpet', u'room', u'dark', u'dated', u'room', u'clean', u'bright', u'bathroom', u'facilities', u'adequate', u'shower', u'frustrated', u'coffee', u'pot', u'room', u'cup', u'time', u'regular', u'coffee', u'cup', u'packet', u'decaf', u'room', u'quiet', u'heard', u'siren', u'night', u'street', u'level', u'couch', u'chaise', u'reading', u'relaxing', u'definitely']",UR122682482
"[u'family', u'adults', u'year', u'nights', u'week', u'christmas', u'year', u'eve', u'pushed', u'loved', u'adjoining', u'residence', u'inn', u'couple', u'years', u'ago', u'friends', u'loved', u'room', u'springhill', u'suites', u'bit', u'inferior', u'cramped', u'fact', u'sofa', u'bed', u'well', u'king', u'size', u'bed', u'selling', u'point', u'sofa', u'bed', u'wound', u'unfolded', u'discovered', u'mattress', u'couldn', u't', u'inches', u'deep', u'definitely', u'comfortable', u'sleep', u'slept', u'couch', u'issue', u'room', u'despite', u'air', u'conditioning', u'set', u'december', u'room', u'warm', u'fact', u'vent', u'find', u'window', u'allowing', u'adequate', u'air', u'flow', u'breakfast', u'delicious', u'convenient', u'filling', u'early', u'spend', u'lot', u'time', u'find', u'place', u'sit', u'fact', u'indoor', u'swimming', u'pool', u'selling', u'point', u'hard', u'find', u'downtown', u'chicago', u'family', u'pool', u'swim', u'couldn', u't', u'water', u'longer', u'minutes', u'cold', u'location', u'excellent', u'starbucks', u'block', u'half', u'radius', u'sit', u'restaurants', u'including', u'harry', u'caray', u'rosebud', u'trattoria', u'street', u'casual', u'dining', u'places', u'nearby', u'well', u'red', u'blocks', u'northeast', u'purple', u'brown', u'lines', u'couple', u'blocks', u'west', u'magnificent', u'mile', u'walk', u'east', u'recommend', u'groups', u'wouldn', u't', u'sofa', u'bed', u'example', u'wouldn', u't', u'family', u'crowded', u'people']",UR122716169
"[u'anytime', u'travel', u'business', u'temporary', u'office', u'downtown', u'easiest', u'feel', u'city', u'visiting', u'downtown', u'thick', u'places', u'eat', u'drink', u'listen', u'music', u'close', u'fairly', u'safe', u'valet', u'special', u'rate', u'enjoyed', u'awesome', u'staff', u'well', u'building', u'slept', u'ate', u'relaxed', u'well', u'visit', u'll']",UR96282725
"[u'husband', u'spring', u'hill', u'suites', u'spending', u'weekend', u'downtown', u'pleased', u'check', u'prompt', u'efficient', u'kumar', u'friendly', u'room', u'floor', u'king', u'studio', u'clean', u'accomodating', u'lacking', u'location', u'fantastic', u'michigan', u'ave', u'navy', u'pier', u'walking', u'distance', u'restuarants', u'lacking', u'breakfast', u'busy', u'well', u'prepared', u'well', u'stocked', u'clean', u'veronica', u'valuable', u'employee', u'brightened', u'morning', u'highly', u'recommend']",UR116136906
"[u'returned', u'short', u'chicago', u'pleased', u'springhill', u'suites', u'posted', u'criticisms', u'room', u'sizes', u'felt', u'design', u'rooms', u'smart', u't', u'extra', u'room', u'drawers', u'inside', u'closet', u'works', u'well', u'room', u'double', u'beds', u'sofa', u'sleeper', u'fine', u'fact', u'ordered', u'dinner', u'sat', u'comfortably', u'sitting', u'room', u'rooms', u'exceptionally', u'clean', u'bright', u'appreciated', u'modern', u'style', u'things', u'ability', u'sleep', u'beds', u'extremely', u'comfortable', u'full', u't', u'hear', u'noise', u'room', u'stated', u'staff', u'friendly', u'room', u'long', u'knocked', u'door', u'sure', u'wanted', u'finally', u'add', u'scrimp', u'price', u'range', u'towels', u'quality', u'shower', u've', u'stated', u'beds', u'wall', u'thickness', u'square', u'footage', u'return', u'receive', u'better', u'quality', u'worth']",UR19625224
"[u'trip', u'chicago', u'wonderful', u'location', u'walk', u'river', u'city', u'attractions', u'enjoyed', u'pool', u'hot', u'tub', u'day', u'fitness', u'center', u'looked', u'altho', u't', u'included', u'bountiful', u'breakfast', u'morning', u'eggs', u'cereal', u'yogurt', u'waffles', u'room', u'comfortable', u'clean', u'regret', u'room', u'dresser', u'drawers', u'clothing', u'staff', u'friendly', u'definitely', u'return']",UR118021201
"[u'nights', u'pleased', u'breakfast', u'drawback', u'changed', u'location', u'short', u'walk', u'buses', u'trains', u'rate', u'travelzoo', u'definitely']",UR17873600
"[u'daughter', u'granddaughter', u'chicago', u'weekend', u'start', u'finish', u'wonderful', u'service', u'plentiful', u'free', u'breakfast', u'cleanliness', u'location', u'excellent', u'blocks', u'mag', u'mile', u'restaurants', u'nearby', u'room', u'large', u'modern', u'pool', u'clean', u'loved', u'security', u'wouldn', u't', u'hesitate', u'plan']",UR124970415
"[u'pleased', u'springhill', u'suites', u'fact', u'staff', u'reception', u'staff', u'extremely', u'polite', u'pleasant', u'friendly', u'service', u'check', u'check', u'perfect', u'location', u'blocks', u'subway', u'comfortable', u'well', u'laid', u'room', u'allowed', u'perfect', u'work', u'space']",UR119146087
