Content,ReviewID
"[u'written', u'reviews', u'convinced', u'readers', u'ambitious', u'stellar', u'qualities', u'services', u'location', u'published', u'property', u'isolate', u'concerns', u'consider', u'rectifying', u'enhance', u'hospitality', u'realize', u'thrive', u'groups', u'visit', u'colleagues', u'navigate', u'lobby', u'breakfast', u'areas', u'filled', u'sports', u'teams', u'bridal', u'parties', u'encourage', u'groups', u'congregate', u'elevator', u'passable', u'areas', u'guests', u'permitted', u'playing', u'wii', u'public', u'areas', u'drinking', u'beer', u'bottles', u'crowds', u'ushered', u'employees', u'clear', u'tables', u'breakfast', u'area', u'staff', u'hidden', u'better', u'utillized', u'appreciate', u'security', u'access', u'higher', u'floors', u'concerns', u'designers', u'idea', u'security', u'card', u'insert', u'close', u'floor', u'things', u'hand', u'negotiation', u'adventure', u'secondly', u'security', u'measures', u'place', u'lobby', u'ground', u'floors', u'monitoring', u'noise', u'rowdiness', u'upper', u'floors', u'colleague', u'platinum', u'members', u'marriott', u'rewards', u'program', u'shagrin', u'families', u'spend', u'nights', u'marriott', u'properties', u'properties', u'acknowledge', u'loyalty', u'word', u'gratitude', u'offer', u'upgrade', u'front', u'desk', u'staff', u'property', u'interested', u'finding', u'brought', u'town', u'acknowledging', u'loyalty', u'time', u'staff', u'development', u'branding', u'loyalty', u'programs']",UR99248435
"[u'tuesday', u'thursday', u'today', u'time', u'location', u'basically', u'steakhouse', u'central', u'river', u'north', u'area', u'soft', u'bed', u'mini', u'fridge', u'microwave', u'room', u'updated', u'bathroom', u'free', u'wi', u'fi', u'complimentary', u'breakfast', u'madhouse', u'lot', u'families', u'work', u'school', u'town', u'navy', u'pier', u'museums', u'bars', u'close', u'time']",UR122242016
"[u'terrific', u'definitely', u'frequent', u'husband', u'chicago', u'year', u'thanksgiving', u'birthday', u'places', u'years', u'hampton', u'monaco', u'hilton', u'garden', u'inn', u'wyndham', u'points', u'sheraton', u'knowing', u'chicago', u'chose', u'springhill', u'suites', u'dearborn', u'glad', u'location', u'couple', u'blocks', u'michigan', u'state', u'easy', u'signage', u'plain', u'shares', u'entrance', u'residence', u'inn', u'actual', u'lobby', u'chains', u'floor', u'check', u'staff', u'accommodating', u'bottle', u'wine', u'birthday', u'elevators', u'fastest', u'smoothest', u've', u'offers', u'hot', u'cold', u'complimentary', u'breakfast', u'well', u'bit', u'early', u'leisure', u'trip', u'studio', u'double', u'room', u'perfect', u'chic', u'modern', u'sitting', u'area', u'desk', u'chaise', u'sleeper', u'couch', u'separated', u'bedroom', u'area', u'frosted', u'glass', u'plenty', u'lighting', u'big', u'complaint', u'rooms', u'dark', u'microwave', u'frig', u'coffee', u'maker', u'bath', u'area', u'size', u'vanity', u'area', u'separate', u'plenty', u'top', u'space', u'items', u'issue', u'lack', u'sized', u'drawers', u'clothes', u't', u'hang', u'shallow', u'drawers', u'rate', u'excellent']",UR50244304
"[u'staying', u'springhill', u'suites', u'treat', u'months', u'location', u'minute', u'walk', u'michigan', u'avenue', u'lots', u'restaurants', u'bars', u'nearby', u'house', u'blues', u'door', u'westin', u'river', u'north', u'check', u'breeze', u'staff', u'friendly', u'efficient', u'parking', u'bit', u'steep', u'day', u'time', u'patience', u'drive', u'parking', u'lot', u'cheaper', u'hot', u'breakfast', u'buffet', u'ample', u'waffle', u'station', u'sausages', u'eggs', u'variety', u'breads', u'pastries', u'fruits', u'juices', u'coffee', u'tea', u'hot', u'cocoa', u'bit', u'odd', u'check', u'lobby', u'floor', u'shared', u'main', u'lobby', u'residence', u'inn', u'exit', u'elevator', u'springhill', u'left', u'residence', u'inn', u'rooms', u'spacious', u'clean', u'flat', u'screen', u'tv', u'conveniently', u'positioned', u'view', u'bed', u'living', u'room', u'area', u'comfy', u'shaped', u'couch', u'doubled', u'sofa', u'bed', u'beds', u'comparable', u'westin', u'heavenly', u'bed', u'suite', u'coffee', u'maker', u'microwave', u'refrigerator', u'free', u'wifi', u'hours', u'convenient', u'discounted', u'rate', u'night', u'marriott', u'website', u'happy', u'springhill', u'suites', u'definitely']",UR18749015
"[u'adjoining', u'marriott', u'residence', u'inn', u'built', u'wonderful', u'shape', u'friendly', u'service', u'employee', u'offers', u'free', u'wi', u'fi', u'computers', u'lobby', u'internet', u'access', u'printer', u'free', u'common', u'downtown', u'area', u'perk', u'affordable', u'convenient', u'downtown', u'location']",UR31641267
"[u'finally', u'convinced', u'switch', u'hilton', u'inconsistent', u'stays', u'marriotts', u'outstanding', u'arrived', u'chicago', u'fact', u'toronto', u'eaton', u'centre', u'fantastic', u'day', u'springfield', u'suites', u'stellar', u'location', u'beat', u'close', u'classic', u'lou', u'malnati', u'pizza', u'favorite', u'mexican', u'restaurant', u'country', u'frontera', u'grill', u'block', u'weather', u'pretty', u'hot', u'count', u'clean', u'fresh', u'comfortable', u'room', u'breakfasts', u'awesome', u'guys', u'hire', u'waffle', u'cook', u'adept', u'making', u'hot', u'foods', u'refilled', u'delicious', u'guests', u'hard', u'attend', u'staff', u'simply', u'class', u'free', u'problem', u'free', u'wireless', u'internet', u'access', u'rooms', u'excellent', u'coffee', u'plentiful', u'bold', u'mention', u'staff', u'member', u'named', u'veronica', u'level', u'service', u'veronica', u'keeps', u'breakfast', u'room', u'staffers', u'downstairs', u'thursday', u'morning', u'july', u'staff', u'cleaning', u'breakfast', u'room', u'asked', u'big', u'ice', u'water', u'dispenser', u'breakfast', u'empty', u'water', u'bottle', u'planned', u'simply', u'fill', u'prepared', u'tackle', u'hot', u'downtown', u'streets', u'veronica', u'insisted', u'helping', u'bottle', u'disappeared', u'bit', u'time', u'honestly', u't', u'minutes', u'appeared', u'bottle', u'full', u'ice', u'water', u'll', u'repeat', u'ice', u'water', u'idea', u'ice', u'cubes', u'bottle', u'thing', u'needed', u'water', u'colder', u'longer', u'effervescence', u'enthusiasm', u'wanted', u'exceed', u'expectations', u'ebullient', u'representative', u'springfield', u'suites', u'felt', u'shine', u'day', u'doesn', u't', u'sound', u'deserved', u'mention', u'singled', u'terrific', u'care', u'hot', u'day']",UR115768792
"[u'excellent', u'location', u'tons', u'excellent', u'restaurants', u'withing', u'walking', u'distance', u'bars', u'rooms', u'comfy', u'quiet', u'roomy', u'love', u'layout', u'separate', u'work', u'area', u'bedroom', u'amenities', u'fridge', u'microwave', u'big', u'flat', u'screen', u'wireless', u'wired', u'internet', u'big', u'bathroom', u'beds', u'comfy', u'mine', u'springhill', u'corporate', u'rates', u'overnight', u'stays', u'chicago', u'spend', u'nights', u'month', u'springhill', u'll', u'experience', u'marriott', u'staff', u'excellent', u'team', u'springhill', u'well', u'rested']",UR106516129
"[u'river', u'north', u'springhill', u'suites', u'feb', u'wonderful', u'experience', u'staff', u'accommodating', u'requests', u'friendly', u'location', u'perfect', u'weekend', u'getaway', u'walk', u'train', u'brought', u'airport', u'walked', u'needed', u'location', u'close', u'restaurants', u'bars', u'michigan', u'ave', u'shopping', u'minute', u'walk', u'theatre', u'district', u'room', u'size', u'fine', u'view', u'tribune', u'wrigley', u'buidlings', u'bonus', u'free', u'wi', u'fi', u'needed', u'map', u'pull', u'google', u'maps', u'ipod', u'plan', u'day', u'springhill', u'suites', u'time', u'chicago', u'bad']",UR55805445
"[u'favorite', u'springhill', u'suites', u'river', u'north', u'location', u'walking', u'distance', u'millenium', u'park', u'state', u'street', u'mag', u'mile', u'restaurants', u'ohio', u'street', u'window', u'base', u'things', u'chicago', u'top', u'incredible', u'room', u'felt', u'mini', u'studio', u'apartment', u'advantage', u'space', u'well', u'felt', u'james', u'bond', u'lair', u'blimp', u'mini', u'living', u'room', u'desk', u'separated', u'bedroom', u'area', u'frosted', u'glass', u'panels', u'slide', u'open', u'closed', u'tv', u'swiveled', u'watch', u'couch', u'bed', u'shower', u'tub', u'wet', u'bar', u'fridge', u'microwave', u'coffee', u'maker', u'price', u'mention', u'real', u'mugs', u'glasses', u'room', u'plastic', u'cups', u'marriott', u'limiting', u'styrofoam', u'breakfast', u'paper', u'plates', u'paper', u'containers', u'awesome', u'oatmeal', u'bar', u'consider', u'paper', u'eco', u'friendly', u'options', u'cereal', u'coffee', u'tea', u'brought', u'mugs', u'room', u'lobby', u'breakfast', u'area', u'spacious', u'comfortable', u'fire', u'place', u'wii', u'station', u'computers', u'internet', u'boarding', u'passes', u'front', u'desk', u'housekeeping', u'staff', u'friendly', u'doormen', u'busy', u'chatting', u'open', u'door', u'incredibly', u'cold', u'windy', u'snowy', u'day', u'snack', u'food', u'market', u'pricey', u'vending', u'machines', u'consider', u'eleven', u'doors', u'stock']",UR124501146
"[u'town', u'people', u'years', u'week', u'total', u'three', u'rooms', u'side', u'side', u'request', u'staff', u'friendly', u'service', u'river', u'north', u'location', u'complimentary', u'breakfast', u'place', u'definitely', u'reviews', u'commented', u'place', u'business', u'case', u'years', u'doubt', u'find', u'place', u'town', u'years', u'eve']",UR122672979
"[u'receently', u'privilege', u'staying', u'springhill', u'suites', u'room', u'clean', u'comfortable', u'staff', u'upbeat', u'genuinely', u'pleasant', u'proffessional', u'neighborhood', u'offers', u'chicago', u'finest', u'abundance', u'vivt', u'chicago', u'choice']",UR120703356
"[u'start', u'requested', u'early', u'check', u'granted', u'told', u'room', u'ready', u'pm', u'check', u'pm', u'astounded', u'expect', u'wanted', u'join', u'magnificent', u'mile', u'lights', u'festival', u'pm', u'kind', u'stow', u'luggage', u'safely', u'managed', u'check', u'pm', u'mention', u'staff', u'kind', u'supportive', u'attentive', u'check', u'desk', u'housekeeping', u'well', u'staff', u'charge', u'breakfast', u'lounge', u'suite', u'st', u'floor', u'bit', u'small', u'elevators', u'room', u'key', u'cards', u'unbidden', u'guests', u'apart', u'reviews', u'bothered', u'fire', u'department', u'duty', u'block', u'location', u'amazing', u'minute', u'walk', u'loop', u'el', u'north', u'michigan', u'avenue', u'close', u'wonderful', u'restaurants', u'harry', u'caray', u'street', u'taxis', u'front', u'needed', u'convenient', u'checked', u'pool', u'floor', u'shared', u'residence', u'inn', u'small', u'called', u'spa', u'hot', u'tub', u'clean', u'sunrise', u'wonderful', u'view', u'gold', u'coast', u'continental', u'breakfast', u'complimentary', u'wide', u'choice', u'staff', u'sure', u'plate', u'housekeeping', u'changed', u'towels', u'day', u'complain', u'extraordinary', u'definitely', u'return']",UR91430778
"[u'husband', u'enjoyed', u'springhill', u'suites', u'weekend', u'getaway', u'chicago', u'hadn', u't', u'chicago', u'weren', u't', u'sure', u'location', u'awesome', u'convenient', u'short', u'min', u'walk', u'grand', u'red', u'station', u'clark', u'lake', u'station', u'loop', u'harry', u'caray', u'house', u'blues', u'street', u'lots', u'lots', u'restaurants', u'bars', u'room', u'comfortable', u'studio', u'king', u'suite', u'room', u'sitting', u'area', u'separated', u'sleeping', u'area', u'well', u'view', u'merchandise', u'mart', u'buildings', u'room', u'suburbs', u'better', u'views', u've', u'cities', u'clean', u'microwave', u'small', u'fridge', u'coffee', u'maker', u'room', u'complimentary', u'breakfast', u've', u'nicer', u'included', u'breakfast', u'cold', u'breads', u'cereal', u'springhill', u'suites', u'breakfast', u'sausage', u'patties', u'eggs', u'lots', u'breads', u'hot', u'oatmeal', u'waffles', u'yogurts', u'fresh', u'fruit', u't', u'picky', u'cereals', u'breakfast', u'room', u'encountered', u'valets', u'opening', u'doors', u'offering', u'cab', u'felt', u'unsafe', u'chicago']",UR23897908
"[u'blocks', u'michigan', u'ave', u'located', u'fire', u'station', u'bar', u'live', u'band', u'windows', u'open', u'sirens', u'thumping', u'band', u'terrible', u'staff', u'efforts', u'move', u'room', u'limited', u'party', u'slept', u'spend', u'inordinate', u'amount', u'time', u'satisfaction', u'manager', u'staff', u'efforts', u'hoped', u'location', u'quality', u'sleep', u'priority', u'better', u'choices', u'downtown', u'chicago', u'avoid']",UR75449867
"[u'room', u'layout', u'solo', u'traveler', u'clean', u'room', u'responsive', u'courteous', u'knowledgeable', u'staff', u'courteous', u'doormen', u'wash', u'dry', u'large', u'breakfast', u'room', u'work', u'suite', u'complementary', u'newspapers', u'choose', u'local', u'wsj', u'nyt', u'usat', u'amenities', u'worked', u'perfect', u'appreciated', u'quiet', u'hvac', u'experience', u'fantastic', u'short', u'long', u'term', u'visits', u'decor', u'style', u'comfortable', u'firm', u'bed', u'street', u'noise', u'intrude', u'lower', u'floors', u'hear', u'muted', u'street', u'noise', u'fire', u'station', u'block', u'sirens', u'times', u'day', u'wireless', u'internet', u'speed', u'accessible']",UR97232177
"[u'nights', u'husband', u'son', u'chicago', u'weren', u't', u'sure', u'exactly', u'city', u'book', u'springhill', u'suites', u'turned', u'location', u'convienenant', u'magnificent', u'mile', u'shops', u'navy', u'pier', u'chicago', u'river', u'tons', u'restaurants', u'flew', u'midway', u'airport', u'rode', u'train', u'clark', u'lake', u'station', u'short', u'walk', u'shares', u'entrance', u'building', u'marriott', u'residence', u'plenty', u'cabs', u'trains', u'buses', u'walked', u'staff', u'friendly', u'concerns', u'room', u'property', u'seating', u'area', u'big', u'flat', u'screen', u'tv', u'free', u'internet', u'access', u'free', u'breakfast', u'featured', u'hot', u'cold', u'selections', u'morning', u'thumbs']",UR18962103
"[u'traveled', u'chicago', u'husband', u'sister', u'brother', u'law', u'originally', u'booked', u'double', u'suite', u'memorial', u'day', u'weekend', u'president', u'obama', u'town', u'secret', u'service', u'air', u'force', u'crew', u'staying', u'emailed', u'personally', u'manager', u'weeks', u'advance', u'advise', u't', u'double', u'bed', u'upgraded', u'corner', u'king', u'weren', u't', u'thrilled', u'sleep', u'sleeper', u'sofa', u'included', u'parking', u'decided', u'manage', u'manager', u'spoke', u'emailed', u'directly', u'customer', u'service', u'representative', u'loved', u'corner', u'king', u'awesome', u'views', u'amazing', u'windows', u'facing', u'lake', u'north', u'room', u'big', u'sofa', u'sleeper', u'comfortable', u'couldn', u't', u'feel', u'middle', u'bar', u'wifi', u'free', u'computers', u'lobby', u'breakfast', u'waffles', u'pastries', u'oatmeal', u'cereal', u'sausage', u'egg', u'patties', u'sandwiches', u'wii', u'lobby', u'play', u'parking', u'garage', u'attached', u'parking', u'breeze', u'close', u'river', u'michigan', u'ave', u'ate', u'frontera', u'topolobampo', u'super', u'close', u'eat', u'lots', u'restaurants', u'bars', u'corner', u't', u'elevators', u'floor', u'lobby', u'elevators', u'floors', u'room', u'key', u'access', u'floors', u'security', u'room', u'card', u'work', u'elevator', u'reason', u'pool', u'hot', u'tub', u'views', u'terrace', u'patio', u'locked', u'don', u't', u'unlock', u'sure', u'definitely']",UR70407659
"[u'couple', u'girlfriends', u'decided', u'needed', u'girls', u'weekend', u'city', u'drama', u'life', u'ended', u'springhill', u'suites', u'room', u'big', u'loved', u'view', u'bellmen', u'front', u'desk', u'staff', u'property', u'amazing', u'anytime', u'walked', u'aknowleged', u'felt', u'welcoming']",UR23475749
"[u'residence', u'inn', u'side', u'building', u'year', u'husband', u'planning', u'chicago', u'trip', u'decided', u'springhill', u'suites', u'bit', u'cheaper', u'location', u'absolutely', u't', u'beat', u'minute', u'walk', u'grand', u'state', u'street', u'station', u'red', u'subway', u'fyi', u'station', u'undergoing', u'renovation', u'open', u'couple', u'minutes', u'magnificent', u'mile', u'tons', u'shops', u'restaurants', u'early', u'suite', u'splurged', u'corner', u'suite', u'view', u'tribune', u'wrigley', u'buildings', u'lake', u'michigan', u'background', u'suite', u'pretty', u'spacious', u'comfortable', u'bed', u'flat', u'screen', u'tv', u'sink', u'fridge', u'area', u'fridge', u'beverage', u'cooler', u'staff', u'friendly', u'greeting', u'smile', u'front', u'desk', u'person', u'housekeeper', u'fitness', u'room', u'well', u'equipped', u'laundry', u'room', u'handy', u'convenience', u'store', u'jewel', u'osco', u'supermarket', u'el', u'station', u'pick', u'drinks', u'snacks', u'cheaper', u'price', u'simply', u't', u'better', u'springhill']",UR41417725
"[u'woke', u'bites', u'body', u'puzzled', u'figured', u'pics', u'bedbug', u'bites', u'worse', u'bags', u'floor', u'daughters', u'diaper', u'bag', u'called', u'told', u'didnt', u'inspect', u'blah', u'blah', u'blah', u'throw', u'bags', u'diapers', u'pray', u'angry', u'disappointed', u'denial', u'coming', u'funny', u'hold', u'time', u'needed', u'comment', u'dont', u'risk', u'stayimg', u'chicago']",UR103617129
"[u'spent', u'long', u'weekend', u'large', u'family', u'reunion', u'family', u'kids', u'side', u'location', u'midst', u'downtown', u'chicago', u'plenty', u'sights', u'shops', u'restaurants', u'short', u'walk', u'kid', u'friendly', u'wii', u'hookup', u'free', u'computer', u'access', u'lobby', u'lots', u'common', u'space', u'seating', u'area', u'lobby', u'course', u'perfect', u'family', u'reunion', u'type', u'gatherings', u'relaxing', u'breakfast', u'buffet', u'included', u'food', u'isn', u't', u'write', u'complain', u'side', u'room', u'small', u'double', u'beds', u'sofabed', u'tight', u'sofabed', u'closed', u'attempt', u'opening', u'sofabed', u'wasn', u't', u'room', u'open', u'bumped', u'desk', u'desk', u'attached', u'wall', u'couldn', u't', u'moved', u'eventually', u'rearrange', u'furniture', u'reposition', u'sofabed', u'long', u'story', u'short', u'cramped', u'quarters', u't', u'spend', u'time', u'room', u'sort', u'pain', u'neck', u'weirdly', u'positioned', u'sofabed', u'middle', u'night', u'bathroom', u'gym', u'pool', u'small', u'consider', u'options', u'despite', u'complaints', u'room', u'wonderful', u'time', u'chicago', u'location', u'common', u'lobby', u'areas', u'family', u'gathering']",UR81086451
"[u'location', u'wi', u'kids', u'play', u'piece', u'mind', u'breakfast', u'included', u'convenient', u'location', u'loop', u'river', u'north', u'area']",UR106986731
"[u'attended', u'activities', u'parade', u'day', u'excellent', u'staff', u'night', u'friend', u'size', u'suite', u'perfect', u'breakfast', u'amazing', u'front', u'desk', u'staff', u'extremely', u'welcoming', u'knowledgeable', u't', u'wait']",UR125058810
"[u'night', u'late', u'july', u'building', u'marriott', u'residence', u'inn', u'share', u'elevator', u'bank', u'lobby', u'check', u'areas', u'room', u'modern', u'clean', u'breakfast', u'area', u'well', u'stocked', u'plenty', u'room', u'sit', u'convenient', u'business', u'pleasure', u'number', u'restaurants', u'nearby', u'requested', u'king', u'room', u'king', u'handicapped', u'room', u'well', u'set', u'handicapped', u'admit', u'expert', u'open', u'shower', u'area', u'entire', u'tiled', u'bathroom', u'area', u'floor', u'drains', u'work', u'well', u'limited', u'mobility', u'hospital', u'bathroom', u'exactly', u'relaxing', u'spa', u'bath', u'experience', u'hoping', u'long', u'trip', u'day', u'meetings', u'worked', u'well']",UR18626357
"[u'room', u'nights', u'impressed', u'isn', u't', u'seasons', u'glaring', u'details', u'missing', u'bad', u'housekeeping', u'stingy', u'coffee', u'cups', u'drinking', u'glasses', u'room', u'kitchenette', u'expect', u'kind', u'supply', u'cups', u'paper', u'glassware', u'dirty', u'sticky', u'flourescent', u'light', u'bed', u'horrendous', u'bright', u'bedside', u'table', u'side', u'king', u'size', u'bed', u'bed', u'stand', u'lights', u'light', u'kitchenette', u'turned', u'switch', u'corner', u'hallway', u'kitchenette', u'ample', u'room', u'store', u'plates', u'plasticware', u'plates', u'stored', u'microwave', u'garbage', u'kitchenette', u'room', u'store', u'clothes', u'clothes', u'hangers', u'arrived', u'pm', u'told', u'room', u'wasn', u't', u'ready', u'waited', u'min', u'front', u'desk', u'contact', u'housekeeping', u'housekeeping', u'inconsiderate', u'cleaning', u'rooms', u'contstantly', u'slamming', u'doors', u'going', u'room', u'dirty', u'bath', u'towel', u'excellent', u'location', u'price', u'free', u'bkfst', u'early', u'free', u'internet', u'pool', u'area']",UR27122705
"[u'weekend', u'chicago', u'friends', u'arrived', u'early', u'morning', u'couldn', u't', u'check', u'front', u'desk', u'offered', u'hold', u'bags', u'room', u't', u'happen', u't', u'mind', u'rooms', u'spacious', u'clean', u'comfortable', u'beds', u'pretty', u'location', u'close', u'blue', u'red', u'lines', u'free', u'beakfast', u'crowded', u't', u'place']",UR115542213
"[u'breakfast', u'amenities', u'major', u'city', u'downtown', u'area', u'reasonably', u'affordable', u'rooms', u'bit', u'small', u'side', u'locale', u'cta', u'city', u'attractions']",UR118497106
"[u'fabulous', u'husband', u'kids', u'chicago', u'winter', u'wonderfest', u'better', u'accommodations', u'complimentary', u'breakfast', u'huge', u'help', u'savings', u'feed', u'cold', u'well', u'hot', u'items', u'choose', u'pool', u'huge', u'hit', u'kids', u'workout', u'room', u'time', u'advantage', u'staff', u'extremely', u'kind', u'accommodating', u'needed', u'top', u'meeting', u't', u'wait', u'trip', u'windy', u'city', u'book']",UR22832022
"[u'consider', u'rate', u'location', u'money', u'clean', u'modern', u'comfortable', u'lobby', u'area', u'couple', u'sync', u'meetings', u'business', u'associates', u'breakfast', u'area', u'big', u'clean', u'well', u'started', u'days', u'pretty', u'well']",UR102847787
"[u'husband', u'suggestion', u'friend', u'town', u'surprise', u'birthday', u'party', u'convenience', u'factor', u'chose', u'park', u'attached', u'parking', u'structure', u'pay', u'day', u'park', u'overnight', u'cleanest', u'cheerful', u'parking', u'structure', u've', u'checkin', u'quick', u'efficient', u'guest', u'elevator', u'requires', u'key', u'car', u'swiped', u'prior', u'pushing', u'button', u'floor', u'tricky', u'time', u'appreciated', u'security', u'room', u'modern', u'spotless', u'coffee', u'pot', u'mini', u'fridge', u'hairdryer', u'bed', u'comfortable', u'husband', u'slept', u'sold', u'time', u'felt', u'crowded', u'breakfast', u'hectic', u'guests', u'dining', u'room', u'breakfast', u'room', u'breakfast', u'long', u'lower', u'standards', u'flavorless', u'egg', u'substitute', u'bagels', u'cereal', u'yogurt', u'll', u'fine', u'surprised', u've', u'better', u'free', u'breakfast', u'night', u'holiday', u'inn', u'express', u'facility', u'better', u'holiday', u'inn', u'definitely', u'breakfast']",UR98556139
"[u'staff', u'reception', u'housekeeping', u'nicer', u'breakfast', u'eveyone', u'accomidating', u'location', u'perfect', u'walking', u'distance', u'music', u'food', u'river', u'public', u'transportion', u'musuem', u'campus', u'room', u'stunning', u'view', u'open', u'window', u'fresh', u'air', u'hear', u'sounds', u'city', u'loved', u'card']",UR115658536
"[u'place', u'checked', u'early', u'valet', u'charge', u'bags', u'directed', u'elevator', u'main', u'lobby', u'registration', u'desk', u'required', u'room', u'key', u'separate', u'elevator', u'room', u'felt', u'secure', u'staff', u'extremely', u'friendly', u'continental', u'breakfast', u'definitely', u'adequate', u'beats', u'restaurant', u'close', u'attractions', u'left', u'car', u'valet', u'parking', u'cab', u'bus', u'easy', u'town', u'help', u'staff', u'room', u'awesome', u'season', u'exceptioinal', u'rate', u'enjoyed', u'pool', u'hot', u'tub', u'area', u'night', u'overlooking', u'beautiful', u'city', u'definitely', u'place', u'location']",UR23787264
"[u'september', u'nights', u'leisure', u'location', u'hubbard', u'find', u'numerous', u'bars', u'nightclubs', u'high', u'restaurants', u'short', u'walk', u'michigan', u'ave', u'medium', u'walk', u'short', u'cab', u'ride', u'clean', u'staff', u'friendly', u'accommodating', u'rooms', u'star', u'rooms', u'opinion', u'better', u'star', u've', u'area', u'call', u'suite', u'queen', u'bed', u'side', u'couches', u'separated', u'work', u'desk', u'sliding', u'glass', u'pics', u'feature', u'wet', u'bar', u'kitchenette', u'includes', u'microwave', u'sink', u'small', u'fridge', u'don', u't', u'star', u'public', u'transportation', u'short', u'trip', u'direction', u'cta', u'bus', u'block', u'north', u'red', u'stops', u'short', u'walk', u'going', u'cubs', u'sox', u'game', u't', u'beat', u'nightlife', u'located', u'heart', u'river', u'north', u'stuff', u't', u'wrong', u'going', u'hang', u'north', u'gold', u'coast', u'area', u'recommend', u'north', u'loop', u'river', u'north', u'access', u'favorite', u'river', u'north', u'place', u'works', u'conjunction', u'aaa', u'money', u'saved', u'booking', u'night', u'aaa', u'rate', u'pay', u'year', u'single', u'aaa', u'membership', u've', u'broke', u'aaa', u'rates', u'year', u'recommend', u'travel', u'frequently', u'night']",UR119596619
"[u'family', u'returned', u'night', u'sept', u'girls', u'weekend', u'visits', u'pleasurable', u'working', u'order', u'clean', u'mold', u'showers', u'carpets', u'clean', u'beds', u'comfortable', u'plenty', u'pillows', u'sept', u'slept', u'sofa', u'bed', u'uncomfortable', u'bed', u'breakfast', u'selection', u'quality', u'employees', u'courteous', u'fitness', u'room', u'pool', u'pool', u'chilly', u'location', u'walking', u'distance', u'theater', u'district', u'shopping', u'lot', u'restaurants', u'definitely', u'recommend']",UR23866718
