Content,ReviewID
"[u'traveling', u'friends', u'picked', u'orleans', u'experience', u'don', u't', u'cookie', u'cutter', u'takes', u'orleans', u'room', u'decorated', u'orleans', u'theme', u'beds', u'small', u'doubles', u'strange', u'mood', u'experience', u'orleans', u'room', u'second', u'floor', u'opened', u'small', u'balcony', u'patio', u'shrouded', u'fog', u'glasses', u't', u'fog', u'doors', u'lock', u'key', u'years', u'abandoned', u'remodeled', u'staff', u'friendly', u'french', u'market', u'bourbon', u'street', u'close', u'saints', u'won', u'game', u'season', u'expected', u'lot', u'party', u'noise', u'heard', u'room', u'small', u'women', u'lot', u'luggage', u'continental', u'breakfast', u'limited', u'muffins', u'coffee', u'juice', u'served', u'waitress', u'patio', u'parking', u'fee', u'parking', u'lot', u'street', u'experience']",UR81873433
"[u'night', u'hated', u'bell', u'man', u'courtyard', u'beautiful', u'fine', u'room', u'size', u'historic', u'nature', u'weren', u't', u'expecting', u'holes', u'bathroom', u'wall', u'peeling', u'wallpaper', u'bed', u'smelled', u'mixture', u'bo', u'mildew', u'carpet', u'disgusting', u'walk', u'bare', u'foot', u'add', u'hearing', u'people', u'door', u'room', u'recipe', u'unhappy', u'customer', u'booked', u'three', u'nights', u'wedding', u'anniversary', u'asked', u'cancel', u'morning', u'pay', u'night', u'told', u'wait', u'manager', u'morning', u'historic', u'response', u'complaints', u'duh', u'wanted', u'historic', u'real', u'solution', u'problems', u'sir', u't', u'bad', u'blame', u'false', u'advertising', u'hope', u'leave', u'paying', u'night']",UR82538398
"[u'writer', u'native', u'french', u'quarter', u'location', u'writing', u'better', u'location', u'french', u'quarter', u'convenient', u'major', u'attractions', u'frenchman', u'st', u'marigny', u'clubs', u'well', u'easily', u'walk', u'club', u'trip', u'visit', u'family', u'chose', u'visit', u'room', u'typical', u'age', u'fq', u'size', u'room', u'spacious', u'rooms', u'fq', u'age', u'spacious', u'large', u'room', u'tower', u'monstrosities', u'sprung', u'canal', u'st', u'years', u'town', u'prefer', u'things', u'scale', u'stories', u'tall', u'elevator', u'move', u'easily', u'flight', u'stairs', u'street', u'pool', u'long', u'walks', u'bellagio', u'las', u'vegas', u'hated', u'mins', u'room', u'street', u'large', u'room', u'clean', u'shower', u'tub', u'tub', u'glad', u'step', u'tub', u'shower', u'tv', u'small', u'side', u'minimum', u'channels', u'wasn', u't', u'vacation', u'watch', u'tv', u'breakfast', u'served', u'morning', u'copy', u'times', u'picayune', u'breakfast', u'downstairs', u'patio', u'coffee', u'continental', u'breakfast', u'rave', u'continental', u'breakfast', u'worth', u'raving', u'regard', u'europeans', u'ahead', u'cares', u'breakfast', u'fq', u'walk', u'street', u'plenty', u'restaurants', u'quality', u'staff', u'orleans', u'remember', u'people', u'talk', u'norm', u'speak', u'difference', u'staying', u'small', u'staff', u'day', u'day', u'remember', u'hello', u'money', u'served', u'breakfast', u'leave', u'maid', u'cleaning', u'room', u'tipping', u'culture', u'orleans', u'expects', u'people', u'respond', u'kind', u'orleans', u'customary', u'extra', u'word', u'lagniappe', u'traveling', u'visit', u'left', u'maid', u'breakfast', u'everyday', u'day', u'difference', u'staff', u'difference', u'morning', u'respond', u'kind', u'treat', u'staff', u'peers', u'courtesy', u'pleasant', u'promise', u'parking', u'offsite', u'valet', u'parking', u'flew', u'orleans', u'rent', u'car', u'car', u'staying', u'fq', u'drive', u'orleans', u'rent', u'car', u'heard', u'complain', u'waiting', u'car', u'arrive', u'summoned', u'bottom', u'fq']",UR116375160
"[u'well', u'sure', u'start', u'excited', u'booked', u'place', u'location', u'cute', u'cozy', u'rented', u'suite', u'top', u'stairs', u'left', u'don', u't', u'wrong', u'understand', u'places', u'room', u'cobwebs', u'smell', u'inside', u'smelled', u'burnt', u'flesh', u'smell', u'call', u'times', u'smell', u'bad', u'air', u'cleaners', u'room', u'hooked', u'keep', u'entire', u'weekend', u'wanted', u'relaxing', u'vacation', u'air', u't', u'work', u'hot', u'sticky', u'bathroom', u'disgusting', u'hair', u'counter', u'towels', u'stained', u'nasty', u'bed', u'stunk', u'bad', u'refused', u'lay', u'scared', u'sheets', u'clean', u'long', u'story', u'short', u'planning', u'staying', u'days', u'hours', u'checked', u'hilton', u'clean', u'room', u'people', u'btw', u'mention', u'explained', u'lady', u'wanted', u'check', u'reasons', u'refused', u'lying', u'pay', u'dollars', u'chance', u'room', u'caused', u'loose', u'money']",UR103293712
"[u'chateau', u'married', u'quaint', u'french', u'quarter', u'knew', u'chateau', u'special', u'place', u'staff', u'sarah', u'continues', u'awesome', u'return', u'weekend', u'getaways', u'chateau', u'family', u'live', u'hour', u'star', u'quaint', u'settled', u'location', u'venture', u'quarter', u'parking', u'convenient', u'affordable', u'hard', u'find', u'quarter', u'staying', u'memories', u'continue', u'future', u'hint', u'check', u'suite', u'street', u'main', u'super', u'jack', u'laura', u'mandeville', u'la']",UR136853108
"[u'blocks', u'borbon', u'spanish', u'market', u'parking', u'breakfast', u'brought', u'room', u'pool', u'staff', u'friendly', u'welcoming', u'prices']",UR138192224
"[u'moved', u'hilton', u'chateau', u'magnified', u'difference', u'small', u'clean', u'ish', u'freshening', u'basic', u'big', u'difference', u'price', u'moved', u'hilton', u'goal', u'finding', u'cheap', u'basic', u'place', u'sleep', u'pay', u'bit', u'better', u'location', u'staff', u'pleasant', u'felt', u'safe', u'time']",UR34378239
"[u'room', u'small', u'clean', u'bathroom', u'showing', u'age', u'walls', u'thin', u'hear', u'going', u'including', u'washing', u'windows', u'slight', u'musty', u'smell', u'bad', u'worst', u'thing', u'valet', u'parking', u'parked', u'car', u'monday', u't', u'saturday', u'morning', u'checked', u'huge', u'door', u'ding', u'passenger', u'side', u'door', u'paint', u'scratched', u'valet', u'pool', u'cleaned', u'prepped', u'swimming', u'friday', u'afternoon', u'bottom', u'pool', u'monday', u'week', u'pool', u'boy', u'friday', u'place', u'worth', u'money', u'walking', u'distance', u'staying', u'choice', u'valet', u'damaging', u'car', u'internet', u't', u'work', u't', u't', u'leave', u'room', u'service', u'card', u'night', u'guess', u't', u'feed', u'left']",UR114776306
"[u'love', u'chateau', u'charm', u'location', u'perfect', u'orleans', u'dream', u'front', u'desk', u'help', u'accommodated', u'beautiful', u'room', u'night', u'move', u'second', u'disappointed', u'second', u'room', u'dingy', u'bed', u'broken', u'civilly', u'calmly', u'express', u'disappointment', u'extremely', u'defensive', u'combative', u'rude', u'lady', u'front', u'desk', u'shrieked', u't', u'leave', u'angry', u'treatment', u'desk', u'clerk', u'checkout', u'apologized', u'damper', u'evening', u'god', u'rest', u'french', u'quarter', u'friendly', u'welcoming', u'scratch', u'bumper', u'rental', u'car']",UR4328447
"[u'chateau', u'mixed', u'bag', u'husband', u'loved', u'thought', u'overpriced', u'motel', u'quality', u'prices', u'paying', u'location', u'despite', u'room', u'deal', u'definitely', u'pros', u'location', u'french', u'quarter', u'charming', u'rowdy', u'friendly', u'staff', u'clean', u'bed', u'comfortable', u'beautiful', u'high', u'ceilings', u'lovely', u'courtyard', u'small', u'pool', u'eating', u'free', u'continental', u'breakfast', u'courtyard', u'wonderful', u'start', u'day', u'll', u'deliver', u'room', u'free', u'breakfast', u'bed', u'effective', u'ac', u'mini', u'fridge', u'room', u'cons', u'peeling', u'wallpaper', u'dumpy', u'room', u'room', u'mold', u'perfume', u'sneeze', u'crazy', u'sleeping', u'cleared', u'morning', u'nature', u'orleans', u'climate', u'room', u'windows', u'close', u'street', u'street', u'noise', u'woke', u'free', u'wi', u'fi', u't', u'reach', u'room']",UR84758150
"[u'overal', u'impressed', u'accommodation', u'chateau', u'location', u'distance', u'bourban', u'street', u'noise', u'bed', u'extremely', u'comfortable', u'breakfast', u'morning', u'better', u'america', u'gripe', u'manager', u'woman', u'works', u'front', u'desk', u'rude', u'explain', u'talked', u'top', u'everytime', u'staff', u'polite']",UR122623189
"[u'warm', u'friendly', u'staff', u'room', u'clean', u'total', u'amount', u'dollars', u'nights', u'well']",UR77162387
"[u'perfectly', u'situated', u'trip', u'nola', u'walking', u'distance', u'lot', u'sights', u'sounds', u'leave', u'car', u'parkinglot', u'walk', u'special', u'house', u'court', u'yard', u'small', u'swimmingpool', u'breakfast', u'delievered', u'rooom', u'free', u'wifi', u'rooms', u'works', u'courtyard', u'friendly', u'staff']",UR125834936
"[u'beautiful', u'rustic', u'charming', u'fab', u'location', u'heart', u'french', u'quarters', u'room', u'bit', u'small', u'size', u'bit', u'cleaner', u'charm', u'expect', u'find', u'staying', u'orleans', u'location', u'better', u'walking', u'distance', u'frenchman', u'street', u'full', u'bars', u'bursting', u'music', u'close', u'bourbon', u'street', u'jackson', u'square', u'french', u'markets', u'shop', u'souvenir', u'breakfast', u'morning', u'delivered', u'door', u'leave', u'order', u'hanging', u'asleep', u'treat', u'breakfast', u'bed', u'better', u'sitting', u'balcony', u'watching', u'orleans', u'waking', u'day', u'staff', u'friendly', u'extremely', u'lillian', u'reception', u'car', u'parking', u'located', u'road', u'fine', u'orleans', u'loved', u'unique']",UR118026459
"[u'loved', u'free', u'aaa', u'parking', u'light', u'free', u'breakfast', u'cafe', u'du', u'monde', u'blocks', u'beignets', u'coffee', u'place', u'exudes', u'character', u'rooms', u'dated', u'ambience', u'rates', u'reasonable', u'forward', u'visit']",UR120038137
"[u'week', u'loved', u'charming', u'french', u'quarters', u'perfect', u'location', u'park', u'car', u'drive', u'leave', u'sarah', u'hostess', u'definitely']",UR119478367
"[u'beat', u'location', u'charm', u'people', u'office', u'friendly', u'fact', u'rude', u'internet', u'price', u'night', u'called', u'big', u'difference', u'called', u'vacancy', u'agreed', u'night', u'ppl', u'door', u'paid', u'people', u'night', u'paid', u'parking', u'third', u'night', u'parking', u'asked', u'charged', u'laughed', u'lied', u'check', u'charge', u'day', u'parking', u'lost', u'pay', u'note', u'rooms', u'clean', u'room', u'upstairs', u'noise', u'bad', u'friends', u'street', u'level', u'alot', u'trouble', u'sleeping', u'french', u'quarter', u'expected', u'rest', u'staff', u'office', u'people', u'return', u'settle', u'reasonable', u'price', u'couldn', u't', u'find', u'vacancy', u'cleaner', u'dirty', u'don', u't', u'floors', u'swept', u'weeks']",UR91438851
"[u'october', u'group', u'girls', u'arrived', u'office', u'staff', u'rude', u'girls', u'staying', u'large', u'suite', u'extra', u'room', u'told', u'time', u'booked', u'rooms', u'allowed', u'parking', u'spots', u'paying', u'car', u'day', u'allowed', u'parking', u'spots', u'saturday', u'room', u'service', u'wanted', u'towels', u'afternoon', u'pm', u'told', u'wanted', u'towels', u'room', u'service', u'brought', u'towels', u'awesome', u'time', u'orleans', u'love', u'rooms', u'office', u'staff', u'learn', u'customer', u'service', u'hospitality', u'industry', u'ecspecially', u'economy', u'today', u'people', u'grateful', u'accomodating', u'guests']",UR47569056
"[u'orleans', u'charm', u'character', u'location', u'short', u'blocks', u'jackson', u'square', u'french', u'market', u'river', u'staff', u'couldn', u't', u'pleasant', u'trip', u'orleans', u'apprehensive', u'reading', u'reviews', u'returning', u'long', u'weekend', u'friends', u'staying', u'chateau']",UR61683943
"[u'heart', u'city', u'well', u'care', u'rooms', u'small', u'tidy', u'clean', u'breakfast', u'simple', u'lovely', u'surrounded', u'flowers', u'birds', u'happy', u'people', u'welcoming', u'cook', u'short']",UR101282380
"[u'wanted', u'work', u'loved', u'charming', u'courtyard', u'excellent', u'location', u'arrived', u'held', u'misgivings', u'damp', u'moldy', u'smell', u'room', u'windows', u'open', u'option', u'leave', u'door', u'chained', u'ajar', u'clear', u'smell', u'optimal', u'solution', u'safety', u'standpoint', u'rat', u'running', u'courtyard', u'door', u'closed', u'looked', u'find', u'outlet', u'phone', u'charger', u'discovered', u'condom', u'concave', u'sinkhole', u'bed', u'bathroom', u'potential', u'death', u'trap', u'open', u'pit', u'style', u'shower', u'steps', u'elevated', u'toilet', u'ringed', u'mildew', u'rustic', u'concerns', u'tolerable', u'staff', u'friendly', u'location', u'excellent', u'frankly', u've', u'funkier', u'locales', u'youth', u'finally', u'left', u'jerry', u'springer', u'extras', u'moved', u'room', u'commenced', u'cavorting', u'blaring', u'tv', u'appalling', u'stream', u'profanity', u'loud', u'verbiage', u'reminiscent', u'scenes', u'deliverance', u'quiet', u'room', u'hoped', u'paid', u'finally', u'surrendered', u'equivalent', u'improved', u'accommodation', u'provided', u'facility', u'lot', u'pm', u'abruptly', u'relocated', u'higher', u'rated', u'surprising', u'expensive', u'accommodation', u'road']",UR86794317
"[u'spent', u'nights', u'easter', u'yr', u'mother', u'room', u'large', u'double', u'room', u'wonderful', u'external', u'balcony', u'request', u'people', u'watch', u'carpets', u'bit', u'worn', u'room', u'charm', u'well', u'stocked', u'towels', u'toiletries', u'extras', u'daily', u'continental', u'breakfast', u'newspaper', u'refridgerator', u'ramada', u'bourbon', u'higher', u'price', u'appreciated', u'chain', u'felt', u'cozy', u'pool', u'tho', u'small', u'lovely', u'bar', u'opens', u'season', u'walk', u'times', u'day', u'definitely', u'competition', u'comfortable', u'drawback', u'wifi']",UR106073260
"[u've', u'numerous', u'times', u'time', u'storm', u'staff', u'esp', u'wendall', u'bell', u'boy', u'chef', u'entire', u'staff', u'love', u'room', u'exactly', u'wanted', u'room', u'clean', u'comfy', u'roaches', u've', u'chateau', u'pricier', u'nola', u'woke', u'hey', u'nola', u'expect', u'girls', u'haunted', u'penthouse', u'haunted', u'hey', u'nola', u'god', u'bless', u'beautiful', u'city', u'don', u't', u'forget', u'people', u'waiting', u'hand', u'foot', u'live', u'people', u'fema', u'trailer', u'break', u'generous', u'lot']",UR7698218
"[u'chose', u'french', u'quarter', u'pics', u'rooms', u'arrived', u'valet', u'helped', u'unload', u'car', u'beach', u'week', u'car', u'locked', u'courtyard', u'disappointed', u'staying', u'main', u'refurbished', u'building', u'street', u'told', u'booking', u'time', u'room', u'huge', u'beds', u'sofa', u'overstuffed', u'chair', u'tv', u'armoire', u'huge', u'coffee', u'table', u'stuff', u'bathroom', u'sized', u'floor', u'keys', u'building', u'inside', u'keys', u'room', u'room', u'remodeled', u'bar', u'beautiful', u'dark', u'wide', u'plank', u'hard', u'wood', u'floors', u'dark', u'furniture', u'coffee', u'juice', u'danish', u'paper', u'brought', u'room', u't', u'pool', u'time', u'looked', u'charming', u'staff', u'friendly', u'heavy', u'lifting', u'valets', u't', u'leave', u'street', u'noise', u'orleans', u'location', u'desk', u'car', u'town', u'excursions', u'clean', u'walls', u'bathroom', u'lot', u'scuff', u'marks', u'footprint', u'wonder', u'clean', u'eraser']",UR115940836
"[u'spent', u'week', u'chateau', u'trip', u'orleans', u'decided', u'wanted', u'quarter', u'closer', u'marigny', u'area', u'location', u'perfect', u'frenchman', u'st', u'short', u'walk', u'close', u'jackson', u'square', u'bourbon', u'st', u'star', u'high', u'class', u'bunch', u'amenities', u'style', u'updating', u'money', u'chateau', u'fine', u'choice', u'queen', u'bed', u'room', u'shared', u'balcony', u'courtyard', u'room', u'small', u'sense', u'wasn', u't', u'lot', u'floor', u'space', u't', u'feel', u'small', u'high', u'ceilings', u'bathroom', u'size', u'felt', u'larger', u'wall', u'wall', u'mirror', u'pedestal', u'sinks', u't', u'practical', u'counter', u'space', u'ended', u'putting', u'towel', u'toilet', u'lid', u'counter', u'small', u'annoyance', u'manageable', u'room', u'bathtub', u'large', u'built', u'tile', u'shower', u'rooms', u'small', u'fridges', u'big', u'lot', u'offer', u'fridges', u'charge', u'room', u'closet', u'mentionned', u'wasn', u't', u'lot', u'floor', u'space', u'room', u'fridge', u'room', u'thought', u'strange', u'staff', u'courtyard', u'pretty', u'orleans', u'charm', u'small', u'pool', u'cool', u'warm', u'humid', u'day', u'doesn', u't', u'individual', u'safes', u'safety', u'deposit', u'boxes', u'safe', u'items', u'sealed', u'enveloppe', u'safe', u'offers', u'continental', u'breakfast', u'delivered', u'room', u'eat', u'courtyard', u'breakfast', u'room', u'place', u'order', u'night', u'indicate', u'time', u'meal', u'person', u'doesn', u't', u'time', u'll', u'morning', u'vacation', u'orleans', u'breakfast', u'appreciated', u'offer', u'choice', u'toast', u'english', u'muffin', u'muffin', u'tea', u'coffee', u'juice', u'pleasant', u'exception', u'couple', u'times', u'week', u'noise', u'issue', u't', u'appear', u'staying', u'room', u't', u'comment', u'room', u'room', u'noise']",UR119640462
"[u'night', u'weekend', u'chateau', u'bobby', u'front', u'desk', u'bit', u'gruff', u'misunderstood', u'engaged', u'conversation', u'bellman', u'jack', u'trades', u'moving', u'bags', u'hailing', u'cabs', u'serving', u'coffe', u'danish', u'people', u'rooms', u'poor', u'guy', u'works', u'hrs', u'day', u'weekends', u'hello', u'goodbye', u'eveything', u'room', u'street', u'side', u'small', u'clean', u'king', u'size', u'bed', u'comfy', u'pillows', u'fluffy', u'roach', u'sight', u'sunday', u'garbage', u'truck', u'street', u'cleaner', u'rumble', u'chartres', u'blocks', u'bourbon', u'noise', u'heard', u'newspaper', u'day', u'door', u'free', u'continental', u'breakfast', u'consists', u'danish', u'muffins', u'coffee', u'juice', u'sitting', u'couryard', u'enjoying', u'morning', u'start', u'day', u'ritz', u'ain', u't', u'quaint', u'trouble', u'going']",UR7225573
"[u've', u'november', u'year', u'anniversary', u'husband', u'nola', u'happened', u'place', u'online', u'awesome', u'balcony', u'room', u'clean', u'clean', u'expected', u'nola', u'historic', u'area', u'balcony', u'view', u'awesome', u'caught', u'view', u'wedding', u'coming', u'perfect', u'staff', u'friendly', u'recommend', u'tourist', u'info', u'felt', u'pushed', u'temperature', u'issue', u'south', u'course', u'heat', u'air', u'cond', u'weekend', u'second', u'trip', u'couple', u'adjoining', u'rooms', u'courtyard', u'area', u'pool', u'rooms', u'open', u'adjoining', u'door', u'visit', u'friends', u'times', u'room', u'issue', u'air', u'conditioning', u'friends', u'room', u'quit', u'second', u'day', u'trip', u'august', u'sweltering', u'full', u'day', u'room', u'day', u'opened', u'adjoining', u'door', u'cool', u'air', u'day', u'wasn', u't', u'totally', u'unbearable', u'night', u'moved', u'room', u'night', u'vacant', u'problems', u'adjusted', u'price', u'funny', u'thing', u'exact', u'room', u'husband', u'trip', u'staff', u'friendly', u'overbearingly', u'friendly', u'offered', u'advice', u'places', u'eat', u'site', u'guess', u'depends', u'quaint', u'perfect', u'location', u'needed', u'planning', u'trip', u'friends', u'fall', u'planning', u'staying']",UR125992527
"[u'traveling', u'women', u'yearly', u'trip', u'three', u'teachers', u'affordable', u'places', u'chateau', u'places', u'amazing', u'location', u'bourbon', u'st', u't', u'care', u'couple', u'blocks', u'cafe', u'beignet', u'cared', u'outsides', u'building', u'beautiful', u'super', u'excited', u'room', u'wasn', u't', u'write', u't', u'spend', u'lot', u'time', u'room', u'worked', u'fine', u'cleanliness', u'problems', u'day', u'hair', u'bathroom', u'carpet', u'room', u'cleaning', u'trash', u'left', u'previous', u'guests', u'wasn', u't', u'bad', u'sounds', u'fixed', u'day', u'problem', u'service', u'talked', u'people', u'front', u'desk', u'short', u'friendly', u'front', u'desk', u'person', u'felt', u'cared', u'man', u'talked', u'check', u'worst', u'breakfast', u'included', u'rate', u'suppose', u'delivered', u'room', u'mentioned', u'three', u'teachers', u'careful', u'money', u'remember', u'read', u'comments', u'day', u't', u'breakfast', u'call', u'pick', u'second', u'day', u'received', u'call', u'breakfast', u'guy', u'basically', u'morning', u'breakfast', u'min', u'tips', u'appreciated', u'needless', u'happy', u'called', u'asked', u'pick', u'breakfast', u't', u'tells', u'allowed', u'told', u'bring', u'kitchen', u'day', u'received', u'call', u'super', u'tired', u'wanted', u'breakfast', u'guy', u'bring', u'tipped', u'asked', u'bring', u'kitchen', u'finished', u'paying', u'guests', u'work', u'luckily', u'morning', u'working', u'smoothly', u'talked', u'desk', u'guy', u'talk', u'aggrivating', u'bell', u'staff', u'friendly', u'overly', u'concerned', u'service', u'wonderful', u'place']",UR120378929
"[u'friend', u'week', u'worried', u'wouldn', u't', u'fine', u'checked', u'bellman', u'led', u'door', u'street', u'opened', u'room', u'guessed', u'room', u'large', u'door', u'shutters', u'room', u'fine', u'year', u'women', u'strange', u'city', u'felt', u'vulnerable', u'loud', u'drunken', u'relevry', u'nearby', u'bourbon', u'street', u'passing', u'pedestrians', u'horses', u'hooves', u'clopping', u'street', u'night', u'ready', u'bars', u'passerby', u'banged', u'door', u'scared', u'guess', u'drunk', u'heard', u'girls', u'laughing', u'doors', u'incident', u'night', u'scared', u'employees', u'banged', u'door', u'hadn', u't', u'picked', u'complimentary', u'breakfast', u'lobby', u'knocked', u'call', u't', u'hesitated', u'opening', u'door', u'called', u'room', u'phone', u'hadn', u't', u'picked', u'checked', u'phone', u'wasn', u't', u'plugged', u'wall', u'reassuring', u'case', u'emergency', u'location', u'street', u'second', u'morning', u'rude', u'encounter', u'employee', u'maid', u'failed', u'leave', u'card', u'hang', u'door', u'requesting', u'breakfast', u'picked', u'office', u'woke', u'receptionist', u'told', u'fill', u'hand', u'man', u'working', u'courtyard', u'approached', u'asked', u'late', u'prepare', u'breakfast', u'repiled', u'don', u't', u'attitude', u'polite', u'caught', u'guard', u'friend', u'pointed', u'attitude', u'yorker', u'thought', u'pretty', u'rude', u'stuck', u'courtyard', u'minutes', u'brought', u'breakfast', u'polite', u'bad', u'morning', u'caught', u'friend', u'guard', u'wasn', u't', u'location', u'room', u'satisfied', u'location', u'problems', u'person', u'friend', u'booked', u'phone', u't', u'room', u'street', u'knew', u'requested', u'courtyard']",UR120555522
"[u'husband', u'nights', u'early', u'march', u'months', u'pregnant', u'chance', u'travel', u'thought', u'orleans', u'weekend', u'family', u'times', u'year', u't', u'traditional', u'tourists', u'pretty', u'well', u'location', u'wonderful', u'couple', u'blocks', u'market', u'cafe', u'du', u'monde', u'thing', u'going', u'men', u'alternated', u'front', u'desk', u'position', u'friendly', u'car', u'garage', u'huge', u'hassle', u'asked', u'policy', u'checked', u'called', u'plenty', u'notice', u'rude', u'room', u'disappointing', u'window', u'door', u'blinds', u't', u'fully', u'cover', u'felt', u'minute', u'worst', u'roaches', u'killed', u'huge', u'woke', u'find', u'pillow', u'husband', u'talk', u'man', u'front', u'desk', u'basically', u'historic', u'property', u'feel', u'historic', u'property', u'excuse', u'tourists', u'don', u't', u'buy', u'pest', u'service', u'needless', u'won', u't', u'going']",UR7148050
"[u'place', u'potential', u'exceptional', u'location', u'fantastic', u'courtyard', u'absolutely', u'lovely', u'reviewer', u'staff', u'surly', u'depressed', u'resentful', u'breakfast', u'lady', u'terror', u'infuriating', u'husband', u'causing', u'lady', u'small', u'children', u'cry', u'mon', u'people', u'quarter', u'don', u't', u'keep', u'customers', u'room', u'interiors', u'downtrodden', u'peeling', u'wallpaper', u'sad', u'bathrooms', u'touchy', u'plumbing', u'air', u'conditioner', u'settings', u'freezing', u'oppresive', u'choices', u've', u'places', u'quarter', u'garden', u'district', u'spend', u'couple', u'dollars', u'extra', u'provincial', u'doors', u'chartres']",UR35521656
"[u'chateau', u'years', u'friends', u'worried', u'reviews', u'read', u'pretty', u'bad', u'pleasantly', u'suprised', u'arrived', u'pictures', u'pretty', u'exactly', u'staff', u'friendly', u'recommend', u'wanting', u'french', u'quarter', u'doesn', u't', u'high', u'luxury', u'happy', u'chateau', u'clean', u'quaint', u'loved', u'courtyard', u'style', u'building', u'complaints', u'walls', u'pretty', u'thin', u'noise', u'issue', u'happy', u'bedding', u'basic', u'decor', u'room', u'dull', u'clean', u'matters', u'car', u'site', u'parking', u'big', u'orleans', u'double', u'check', u'directly', u'price', u'website', u'special', u'event']",UR52573386
"[u'easy', u'mill', u'comfort', u'inns', u'fine', u'expecting', u'bit', u'refined', u'heart', u'french', u'quarter', u'nope', u'girlfriend', u'forward', u'chateau', u'large', u'photos', u'chateau', u'website', u'flowery', u'description', u'ultimately', u'duped', u'booked', u'king', u'room', u'months', u'advance', u'tucked', u'windowless', u'room', u'storage', u'closet', u'noisy', u'chartres', u'street', u'tunnel', u'rooms', u'windows', u'king', u'bed', u'alright', u'bed', u'occupied', u'room', u'tiny', u'stained', u'dirty', u'bathroom', u'sporting', u'tub', u'three', u'feet', u'bed', u'desirable', u'qualities', u'toilet', u'infinitely', u'shook', u'handle', u'lighting', u'dim', u'staff', u'difficult', u'time', u'deciphering', u'difference', u'delivery', u'continental', u'breakfast', u'poolside', u'bar', u'wasn', u't', u'open', u'lastly', u'rats', u'looked', u'running', u'base', u'staffed', u'bar', u'pool', u'room', u'mention', u'chateau', u'charged', u'night', u'parking', u'website', u'aaa', u'guide', u'book', u'charge', u'parking', u'place']",UR110857021
