Content,ReviewID
"[u'central', u'location', u'price', u'reasonable', u'easy', u'access', u'transit', u'chinatown', u'union', u'square', u'rooms', u'small', u'space', u'move', u'complaint', u'street', u'noise', u'trucks', u'backing', u'hours', u'beepers', u'going', u'bit', u'hard', u'sleep']",UR117079709
"[u'baldwin', u'lovely', u'location', u'safe', u'area', u'gate', u'chinatown', u'short', u'walk', u'union', u'square', u'year', u'anniversary', u'pleased', u'front', u'desk', u'courteous', u'welcoming', u'security', u'front', u'door', u'desk', u'evening', u'hours', u'appreciated', u'rooms', u'clean', u'well', u'sparsley', u'decorated', u't', u'matter', u'renovated', u'bathrooms', u'spacious', u'charming', u'restuarant', u'lounge', u'find', u'problem', u'short', u'walking', u'distance', u'starbucks', u'located', u'minute', u'fancy', u'cafe', u'street', u'wine', u'bar', u'directely', u'warf', u'pier', u'bit', u'easy', u'cable', u'car', u'inexpensive', u'easy', u'ferry', u'bulding', u'easy', u'minute', u'walk', u'baldwin', u'recommend']",UR68178643
"[u'wife', u'baldwin', u'nights', u'enjoyed', u'pleasant', u'booked', u'online', u'service', u'pre', u'paid', u'bart', u'san', u'francisco', u'airport', u'subway', u'three', u'blocks', u'baldwin', u'check', u'quick', u'easy', u'room', u'floor', u'queen', u'size', u'bed', u'private', u'bath', u'room', u'small', u'clean', u'maid', u'service', u'day', u'thorough', u'pillows', u'bed', u'asked', u'happily', u'complied', u'read', u'complaints', u'front', u'desk', u'experience', u'friendly', u'night', u'hot', u'ceiling', u'fan', u'pretty', u'comfortable', u'temp', u'dropped', u'comfortable', u'elevator', u'slow', u'problem', u'location', u'excellent', u'block', u'chinatown', u'chinatown', u'north', u'beach', u'italy', u'bit', u'farther', u'coit', u'tower', u'slow', u'elevator', u'worth', u'charge', u'top', u'spectacular', u'views', u'union', u'square', u'cable', u'car', u'terminus', u'fisherman', u'wharf', u'trips', u'alacatraz', u'leave', u'pier', u'reservation', u'trips', u'fill', u'fast', u'summer', u'cable', u'car', u'trip', u'fun', u'long', u'waits', u'turn', u'arounds', u'bart', u'trolley', u'fisherman', u'wharf', u'worked', u'well', u'starbucks', u'block', u'baldwin', u'checkout', u'plane', u'leave', u'leave', u'bags', u'front', u'desk', u'wandered', u'chinatown', u'hours', u'depressing', u'note', u'lot', u'homeless', u'general', u'area', u'congregating', u'baldwin', u'pretty', u'aggressive', u'demanding', u'money', u'sad', u'testiment', u'society', u'inability', u'folks', u'lives', u'better', u'sleeping', u'streets', u'begging']",UR17298027
"[u'frills', u't', u'beat', u'rate', u'location', u'nearby', u'charge', u'times', u'nightly', u'rates', u'baldwin', u'conveniently', u'located', u'china', u'town', u'union', u'square', u'financial', u'district', u'bart', u'reasonable', u'walking', u'distances', u'noise', u'factor', u'lessen', u'windows', u'closed']",UR60041630
"[u'people', u'reception', u'friendly', u'room', u'small', u'clean', u'floor', u'view', u'wasn', u't', u'extraordinary', u'wall', u'pigeons', u'lot', u'street', u'noise', u'night', u'fortunately', u'location', u'drawbacks', u'pleasant']",UR34005123
"[u'terrible', u'experience', u'baldwin', u'understand', u'bellagio', u'customer', u'service', u'disgraceful', u'room', u'flooded', u'insides', u'faulty', u'toilet', u'spending', u'night', u'woken', u'noisy', u'piping', u'system', u'moved', u'smaller', u'room', u'tv', u'channels', u't', u'reception', u'departure', u'spoke', u'management', u'believed', u'moving', u'cheaper', u'room', u'sufficient', u'compensation', u'minute', u'debate', u'discount', u'experience', u'thought', u'location', u'price', u'plenty', u'places', u'area', u'trip', u'san', u'francisco', u'pretty', u'sad', u'remember', u'city']",UR84686121
"[u'people', u'heater', u'fixed', u'period', u'told', u'feel', u'cold', u'early', u'morning', u'additional', u'heater', u'services', u'efficient', u'effective', u'room', u'clean', u'space', u'price', u'free', u'coffee', u'tea', u'lobby', u'warm', u'located', u'close', u'china', u'town', u'union', u'square', u'train', u'stations', u'convenience']",UR89131184
"[u'price', u'location', u'gate', u'chinatown', u'blocks', u'union', u'square', u'clean', u'rooms', u'bath', u'friendly', u'staff', u'complaints', u'rooms', u'front', u'lower', u'noisy', u'higher', u'side', u'quiet']",UR8376489
"[u'husband', u'accompanied', u'san', u'francisco', u'day', u'business', u'trip', u'chose', u'baldwin', u'centrally', u'located', u'read', u'reviews', u'clean', u'rooms', u'price', u'night', u'room', u'san', u'francisco', u'spent', u'waking', u'hours', u'staff', u'allowed', u'check', u'hours', u'early', u'day', u'arrival', u'weren', u't', u'budget', u'prefer', u'gym', u'pool', u'luxury', u'trendy', u'don', u't', u'choose', u'baldwin', u'excellent', u'location', u'decent', u'room', u'bargain', u'place']",UR87800608
"[u'lower', u'middle', u'class', u'edge', u'china', u'town', u'walking', u'distance', u'bart', u'station', u'train', u'sf', u'international', u'breakfast', u'served', u'checking', u'asked', u'pay', u'dollar', u'checking', u'room', u'paid', u'advance', u'years', u'europe', u'amerika', u'mexico', u'north', u'africa', u'time', u'pay', u'deposit', u'damage', u'room', u'unsympathetic']",UR117417971
"[u'pros', u'well', u'located', u'easy', u'walk', u'parts', u'town', u'chinatown', u'well', u'people', u'running', u'outfit', u'friendly', u'efficient', u'rooms', u'clean', u'money', u'cons', u'small', u'rooms', u'queen', u'size', u'beds', u'persons', u'suitcases', u'shopping', u'main', u'aim', u'trip', u'space', u'walk', u'internet', u'costs', u'bucks', u'day', u'loud', u'street', u'noise', u'night', u'fashioned', u'keys', u'difficult', u'open', u'doors', u'valet', u'parking', u'park', u'car', u'nearby', u'garage', u'bucks', u'day', u'walk', u'collect', u'car']",UR78300375
"[u'definitely', u'booked', u'conference', u'attending', u'filled', u'wasn', u't', u'sure', u'don', u't', u'city', u'idea', u'type', u'price', u'points', u'provide', u'top', u'traveling', u'definitely', u'wanted', u'sure', u'safe', u'well', u'trafficked', u'area', u'solo', u'woman', u'traveler', u'well', u'turns', u'neighborhood', u'safe', u'populated', u'night', u'shopping', u'boot', u'minute', u'walk', u'market', u'street', u'moscone', u'center', u'closer', u'subway', u'style', u'boutique', u'style', u'windows', u'ac', u'gym', u'somwhere', u'baldwin', u'ceiling', u'fans', u'comfortable', u'beds', u'clean', u'modern', u'bathrooms', u'high', u'ceilings', u'wi', u'fi', u'printing', u'kiosk', u'lobby', u'beware', u'children', u'screens', u'windows', u'open', u'air', u'doors', u'rooms', u'fashioned', u'locks', u'key', u'cards', u'putting', u'people', u'absolutely', u'consider', u'staying', u'touristy', u'trip', u'husband']",UR118076826
"[u'loved', u'room', u'clean', u'quaint', u'quiet', u'san', u'fran', u'room', u'backed', u'alley', u'bit', u'barrier', u'street', u'noise', u'location', u'absolutely', u'perfect', u'half', u'block', u'bargains', u'china', u'town', u'block', u'buses', u'cable', u'cars', u'nights', u'hated', u'leave']",UR115433648
"[u'block', u'entrance', u'chinatown', u'small', u'comfortable', u'clean', u'staff', u'friendly', u'accommodating', u'inexpensive', u'beds', u'comfortable', u'shower', u'excellent', u'restaurants', u'area', u'close', u'wonderful', u'shopping', u'couldn', u't', u'asked', u'nicer', u'long', u'weekend', u'definitely', u'baldwin']",UR109867550
"[u'enjoyed', u'staying', u'baldwin', u'compliment', u'courteous', u'staff', u'easy', u'questions', u'top', u'notch', u'bunch', u'location', u'excellent', u'shopping', u'well', u'moscone', u'business', u'centers', u'rooms', u'spacious', u'clean', u'bed', u'comfortable', u'couple', u'problems', u'claw', u'foot', u'tub', u'shower', u'curtain', u'hair', u'hair', u'safe', u'refrigerator', u'lot', u'noise', u'coming', u'alley', u'morning', u'garbage', u'linens', u'picked', u'things', u'deter', u'coming', u'staff', u'worth', u'rooms', u'plentiful', u'high']",UR55544399
"[u'night', u'joined', u'tour', u'returned', u'straight', u'nights', u'complaint', u'rooms', u'clean', u'sufficient', u'lighting', u'room', u'faced', u'street', u'elevator', u'second', u'higher', u'floor', u'quiet', u'location', u'union', u'square', u'china', u'town', u'pretty', u'safe', u'solo', u'female', u'traveller', u'star', u'perks', u'swimming', u'pool', u'exercise', u'room', u'restaurants', u'shops', u'housekeeping', u'courteous', u'discreet', u'problem', u'encountered', u'wait', u'minutes', u'front', u'counter', u'person', u'finish', u'eating', u'lunch', u'door', u'exercise', u'room', u'time', u'san', u'francisco']",UR85881717
"[u'located', u'foot', u'chinatown', u'gateway', u'main', u'street', u'walking', u'distance', u'shops', u'restaurants', u'union', u'square', u'front', u'desk', u'staff', u'knowledgeable', u'san', u'fran', u'incredibly', u'polite', u'whilst', u'rooms', u'small', u'reminiscent', u'western', u'european', u'clean', u'bed', u'comfy', u'ultimately', u'price', u'paid', u'provided', u'excellent', u'money', u'area', u'couldn', u't', u'safer', u'don', u't', u'expect', u'flash', u'won', u't', u'disappointed', u'weren', u't', u'disrupted', u'noise', u'floor', u'excellent', u'fast', u'free', u'wifi', u'room', u'baldwin', u'ps', u'alcatraz', u'tour', u'book', u'advance']",UR116384515
"[u'well', u'maintained', u'importantly', u'room', u'clean', u'washroom', u'bright', u'white', u'lights', u'dirt', u'job', u'location', u'chinatown', u'easy', u'access', u'union', u'square', u'parking', u'road', u'subject', u'vacancies', u'free', u'pm', u'iirc', u'internet', u'fee', u'money', u'tighter', u'budget']",UR92244969
"[u'building', u'noisy', u'lights', u'questionable', u'tv', u'quality', u'free', u'internet', u'location']",UR89107826
"[u'baldwin', u'fantastic', u'location', u'corner', u'union', u'square', u'close', u'muni', u'bart', u'tram', u'car', u'stops', u'literally', u'steps', u'chinatown', u'doors', u'starbucks', u'pros', u'free', u'coffee', u'tea', u'lobby', u'location', u'location', u'location', u'excellent', u'price', u'lots', u'tv', u'channels', u'clean', u'decent', u'sized', u'rooms', u'secure', u'luggage', u'storage', u'front', u'desk', u'manned', u'times', u'lock', u'front', u'door', u'late', u'night', u'early', u'morning', u'security', u'cons', u'building', u'tired', u'elevator', u'sloooow', u'lock', u'room', u'door', u'bit', u'precarious', u'website', u'gym', u'doesn', u't', u'gym', u'cool', u'internet', u'lobby', u'expensive', u'bear', u'mind', u'lots', u'san', u'fran', u'price', u'location']",UR32847271
"[u'disappointed', u'basic', u'clean', u'walked', u'lobby', u'construction', u'apprehensive', u'reviews', u'accurate', u'pleasure', u'clean', u'free', u'internet', u'centrally', u'located', u'frills', u'staff', u'extremely', u'pleasant', u'responsive', u'requests', u'windows', u'open', u'night', u'room', u'hot', u'night', u'noise', u'extremely', u'loud', u'nights']",UR127041214
"[u'location', u'practically', u'walking', u'distance', u'public', u'transporation', u'corner', u'subways', u'busses', u'cable', u'cars', u'minute', u'walk', u'gates', u'chinatown', u'awesome', u'room', u'large', u'clean', u'staff', u'easygoing', u'whenevery', u'questions', u'room', u'faced', u'street', u'problem', u'noise', u'downside', u'poor', u'water', u'pressure', u'shower', u'hallway', u'bit', u'funky', u'smell', u'room', u'fine']",UR8472378
"[u'staff', u'welcoming', u'phoned', u'staff', u'member', u'helped', u'shuttle', u'welcomed', u'nicely', u'late', u'exhausted', u'staff', u'member', u'patient', u'professional', u'kind', u'room', u'lovely', u'comfy', u'morning', u'staff', u'helped', u'organising', u'return', u'shuttle', u'happily', u'looked', u'bags', u'explore', u'time', u'marvellous', u'trip', u'marvellous', u'highly', u'recommend', u'caz']",UR58199323
"[u'husband', u'three', u'nights', u'baldwin', u'location', u'chinatown', u'gate', u'price', u't', u'better', u'pretty', u'basic', u'bed', u'bathroom', u'tv', u'room', u'clean', u'staff', u'friendly', u'don', u't', u'serve', u'breakfast', u'starbucks', u'three', u'doors', u'french', u'style', u'bistro', u'street', u'serves', u'breakfast']",UR47835573
"[u'second', u'time', u'room', u'clean', u'staff', u'friendly', u'location', u'close', u'public', u'transportation', u'union', u'square', u'hesitant']",UR62306997
"[u'realy', u'enjoyed', u'rooms', u'clean', u'friendly', u'treated', u'balance', u'fares', u'services', u'trully', u'recommend', u'baldwin']",UR65115972
"[u'san', u'francisco', u'booked', u'baldwin', u'online', u'pleased', u'staff', u'helping', u'area', u'room', u'feel', u'special', u'regular', u'cleanest', u'rooms', u'day', u'oragami', u'animal', u'bed', u'towel', u'special', u'recommend', u'highly', u'close', u'chinatown', u'cable', u'cars', u'bad', u'knees']",UR85939374
"[u'loved', u'check', u'early', u'flight', u'delayed', u'hours', u'tired', u'front', u'desk', u'staff', u'super', u'older', u'room', u'size', u'comfortable', u'beds', u'flat', u'screen', u'tv', u'clean', u'location', u'chinatown', u'corner', u'walked', u'wharf', u'minutes', u'japanese', u'restaurant', u'door', u'discount', u'guests', u'baldwin', u'cafes', u'shops', u'walking', u'distance', u'negative', u'thing', u'couple', u'tv', u'channels', u'humming', u'noise', u'weren', u't', u'watch', u'channels', u'excellent', u'definitely']",UR52615754
"[u'location', u'market', u'street', u'union', u'square', u'chinatown', u'renovated', u'rooms', u'clean', u'staff']",UR114278657
"[u'money', u'centrally', u'located', u'staff', u'housekeeping', u'service', u'light', u'tidy', u'room', u'level', u'downside', u'pay', u'wireless', u'day', u'unusual', u'san', u'fran', u'place', u'wireless', u'cost', u'included', u'economical', u'option', u'caught', u'bart', u'city', u'arranged', u'shuttle', u'airport', u'cost']",UR90268681
"[u'baldwin', u'three', u'nights', u'enjoyed', u'location', u'walk', u'powell', u'street', u'station', u'bart', u'airport', u'long', u'blocks', u'grant', u'market', u'street', u'union', u'square', u'easy', u'walking', u'distance', u'chinatown', u'shops', u'restaurants', u'vicinity', u'sf', u'expensive', u'room', u'clean', u'bed', u'comfortable', u'staff', u'friendly', u'knowledgeable', u'area', u'advice', u'restaurants', u'well', u'place', u'print', u'send', u'fax', u'room', u'wifi', u'extra', u'charge', u'floor', u'noticed', u'reviews', u'mentioned', u'room', u'elevator', u'shaft', u'floor', u'room', u'guess', u'booked', u'room', u'reconsider', u'light', u'sleeper', u'room', u'service', u'wanted', u'easily', u'location']",UR126176697
"[u'location', u'price', u'luxuries', u'pool', u'restaurant', u'rooms', u'size', u'clean', u'lovely', u'bathrooms', u'roll', u'top', u'baths', u'perfect', u'budget', u'city', u'break']",UR7834225
"[u'charming', u'well', u'staffed', u'foot', u'chinatown', u'rooms', u'newer', u'tvs', u'windows', u'charming', u'working', u'radiators', u'room', u'block', u'affordable', u'expensive', u'restruants', u'small', u'market', u'corner', u'incredible']",UR89163550
"[u'inexpensive', u'clean', u'location', u'nicely', u'decorated', u'rooms', u'small', u'standards', u'europeans', u'wouldn', u't', u'call', u'small', u'money', u'high', u'standards', u'rich', u'feel', u'uncomfortable', u'unhappy']",UR124010727
"[u'bit', u'concerned', u'reasonable', u'find', u'shouldn', u't', u'worried', u'location', u'safe', u'china', u'town', u'gate', u'staff', u'pleasent', u'room', u'small', u'spotless', u'renovated', u'wouldn', u't', u'hestitate', u'staying']",UR19558860
"[u'price', u'paid', u'location', u'baldwin', u'perfect', u'blocks', u'union', u'square', u'bart', u'station', u'room', u'fine', u'working', u'properly', u'including', u'hot', u'water', u'attractive', u'sf', u'excuse', u'venture', u'drawbacks', u'construction', u'noise', u'morning', u'including', u'sunday', u'fact', u'concierge', u'aware', u'walt', u'museum', u'told', u'wrong', u'montgomery', u'street', u'presidio', u'financial', u'district', u'recommend', u'traveler', u'budget']",UR50997178
"[u'location', u'easy', u'walking', u'distance', u'union', u'square', u'cable', u'car', u'chinatown', u'locations', u'room', u'huge', u'perfectly', u'adequate', u'clean', u'functional', u'hand', u'towels', u'folded', u'animal', u'shapes', u'touch', u'commented', u'noise', u'main', u'street', u'major', u'city', u'expect', u'recommend', u'baldwin', u'friends', u'going', u'san', u'francisco']",UR115434441
"[u'surprise', u'expecting', u'sf', u'cheap', u'clean', u'comfy', u'real', u'pleasure', u'close', u'chinatown', u'union', u'square', u'tour', u'buses', u'front', u'bad', u'thing', u'heater', u'room', u'hummed', u'hurdled', u'night', u'annoying', u'sf', u'prob', u'wharf', u'doin', u'tourist', u'thing', u'wanted', u'shop', u'sure']",UR127337223
"[u'baldwin', u'nights', u'mid', u'sept', u'pleased', u'ta', u'tossed', u'gem', u'baldwin', u'fantasic', u'location', u'clean', u'front', u'desk', u'staff', u'polite', u'room', u'perfectly', u'adequate', u'coming', u'san', u'francisco', u'touristy', u'things', u'accomadation', u'live', u'baldwin', u'beauty', u'definetly', u'recommend']",UR20660311
"[u'nights', u'christmas', u'loved', u'location', u'needed', u'close', u'definitely', u'consider', u'visit']",UR122829837
"[u'hubby', u'day', u'trip', u'sf', u'baldwin', u'couldn', u't', u'pleased', u'sure', u'room', u'dated', u'adds', u'charm', u'booked', u'double', u'room', u'thinking', u'meant', u'queen', u'size', u'bed', u'full', u'size', u've', u'upgraded', u'going', u'sleep', u'city', u'elevator', u'slow', u'top', u'floor', u'amazing', u'view', u'slept', u'windows', u'open', u'fresh', u'air', u'high', u'traffic', u'noise', u'problem', u'friends', u'city', u'pick', u'couldn', u't', u'location', u'going', u'friends', u'family', u'visiting', u't', u'state', u'clearer', u'location', u'walking', u'distance', u'metro', u'bit', u'easy', u'bagel', u'shop', u'fresh', u'juice', u'corner', u'breakfast', u'ate', u'farallon', u'amazing', u'bix', u'supperclub', u'experience', u'couple', u'actors', u'questions', u'shoot', u'message']",UR19973331
"[u'baldwin', u'frills', u'immaculately', u'clean', u'simple', u'rooms', u'baths', u'fabulous', u'location', u'pretty', u'plain', u'public', u'areas', u'existent', u'sets', u'apart', u'staff', u'unfailing', u'kindness', u'efficiency', u'wonderful', u'chester', u'don', u't', u'full', u'front', u'desk', u'clientele', u'international', u'folks', u'longer', u'stays', u'vibe', u'relaxed', u'friendly', u'forced', u'jocularity']",UR121143019
"[u'baldwin', u'week', u'june', u'location', u'perfect', u'staff', u'friendly', u'rooms', u'small', u'functional', u'clean', u'rest', u'bed', u'soft', u'liking', u'aches', u'day', u'place', u'folded', u'towels', u'waist', u'level', u'help', u'lbs', u'thin', u'guy', u'bathrooms', u'clean', u'fashioned', u'baths', u'clawfoot', u'shower', u'smallish', u'curtain', u'bath', u'cling', u'place', u'soap', u'hot', u'water', u'pressure', u'flat', u'panel', u'tv', u'working', u'unbearable', u'buzzing', u'noise', u'interference', u'cable', u'channels', u'closed', u'captions', u'free', u'internet', u'access', u'bit', u'disappointing', u'satisfied', u'choice', u'baldwin']",UR114985616
"[u'husband', u'nights', u'night', u'definitely', u'worth', u'money', u'location', u'fantastic', u'rooms', u'clean', u'felt', u'safe', u'neighborhood', u'night', u'previous', u'reviews', u'room', u'elevator', u'sensitive', u'noise', u'room', u'elevator', u'luckily', u'slept', u'quiet', u'elevator', u'clean', u'comfortable', u'place', u'sleep', u'baldwin', u'perfect', u'amenities', u'plan', u'spending', u'time', u'room', u'solid', u'stars', u'rate', u'paid', u't', u'expect', u'night', u'definitely', u'star']",UR26086540
"[u'enjoyable', u'rooms', u'clean', u'blocks', u'union', u'square', u'chinatown', u'staff', u'holiday', u'business', u'shuttle', u'bus', u'airport', u'dollars', u'better', u'taxi']",UR81156752
"[u'find', u'located', u'grant', u'avenue', u'gate', u'chinatown', u'windows', u'upscale', u'location', u'excellent', u'price', u'holiday', u'special', u'night', u'queen', u'bed', u'free', u'parking', u'included', u'price', u't', u'beat', u'room', u'neat', u'clean', u'problem', u'shower', u'couldn', u't', u'figure', u'turn', u'shower', u'head', u'pleased', u'location', u'service', u'room', u'recommend', u'friends']",UR50012837
"[u'price', u'visiting', u'san', u'francisco', u'staff', u'friendly', u'rooms', u't', u'huge', u'granted', u'clean', u'well', u'tended', u'location', u'winner', u'timid', u'nature', u'feels', u'safe', u'night', u'transport', u'wise', u'cable', u'cars', u'busses', u'couple', u'blocks', u'market', u'street', u'union', u'square', u'shopping', u'inclined', u'nature', u'short', u'walk', u'mere', u'leap', u'start', u'chinatown', u'visiting', u'sf', u'shouldn', u't', u'couped', u'room', u'apart', u'coming', u'wash', u'change', u'going', u'highly', u'recommend', u'tin', u'well', u'pretentions']",UR21398851
"[u'arrived', u'late', u'welcomed', u'clerk', u'happily', u'clerks', u'kind', u'expected', u'room', u'bathroom', u'outdated', u'renovated', u'super', u'clean', u'room', u'small', u'course', u'large', u'closet', u'queen', u'beds', u'linens', u't', u'opened', u'windows', u'turned', u'ceiling', u'fan', u'three', u'night', u'time', u'elevator', u'wasn', u't', u'minutes', u'measured', u'thing', u't', u'coffeemaker', u'room', u'kind', u'garbage', u'truck', u'nights', u'awake', u'problem', u'floor', u'location', u'absolutely']",UR120505583
"[u'booked', u'opodo', u'reasonable', u'deal', u'night', u'coffee', u'breakfast', u'collegue', u'cheaper', u'rate', u'door', u'astoria', u'night', u'included', u'small', u'breakfast', u'pleased', u'fancy', u'clean', u'secure', u'friendly', u'staff', u'wireless', u'laptops', u'internet', u'lobby', u'hour', u'location', u'excellent', u'entrance', u'china', u'town', u'nob', u'hill', u'italy', u'favourable', u'experience']",UR6840653
"[u'baldwin', u'location', u'easy', u'access', u'restaurants', u'bars', u'stores', u'place', u'staffs', u'room', u'clean', u'place', u'definitely', u'visit', u'sf']",UR16206383
"[u'baldwin', u'nights', u'staying', u'sf', u'rooms', u'outdated', u'spotlessly', u'clean', u'staff', u'friendly', u'cleaning', u'ladies', u'leave', u'cute', u'towel', u'shaped', u'animals', u'bed', u'place', u'sf']",UR119699050
"[u'place', u'real', u'steal', u't', u'beat', u'price', u'jan', u'paid', u'night', u'clean', u'comfortable', u'room', u'excellent', u'service', u'rooms', u'small', u'side', u'tight', u'large', u'walk', u'closet', u'staff', u'job', u'creating', u'atmosphere', u'rooms', u'ideal', u'place', u'location', u'blocks', u'union', u'square', u'market', u'street', u'shops', u'restaurants', u'close', u'cable', u'car', u'ride', u'fisherman', u'wharf', u'alcatraz', u'entrance', u'gate', u'chinatown', u'wonderful', u'place', u'terrific']",UR94266404
"[u'baldwin', u'three', u'night', u'bay', u'breakers', u'race', u'weekend', u'completely', u'enjoyable', u'spartan', u'well', u'scrubbed', u'well', u'rooms', u'pleasant', u'staff', u'compares', u'favorably', u'expensive', u'places', u've', u'san', u'francisco', u'location', u'chinatown', u'gate']",UR7694450
"[u'nights', u'loved', u'location', u'close', u'chinatown', u'union', u'square', u'staff', u'rooms', u'big', u'sf', u'standard', u'room', u'clean', u'looked', u'return']",UR86791621
"[u'well', u'appointed', u'conveniently', u'located', u'room', u'excellent', u'quiet', u'considering', u'location', u'easy', u'downtown', u'business', u'entertainment', u'shopping', u'chinatown', u'short', u'walk', u'moscone', u'waterfront']",UR87409348
"[u'free', u'internet', u'refrigrator', u'room', u'poor', u'service', u'worth', u'money', u'loacation', u'spend', u'stuff', u'internet', u'breakfast', u'choose', u'better', u'service']",UR68869532
"[u'place', u'convenient', u'downtown', u'chinatown', u'union', u'square', u'moscone', u'room', u'small', u'space', u'bed', u'comfy', u'shower', u'tub', u'curtain', u'worked', u'room', u'clean', u'service', u'big', u'city', u'hear', u'dumpster', u'emptied', u'late', u'night', u'early', u'morning', u'nut', u'job', u'expects', u'stars', u'star', u'price', u'pick', u'place', u'recommend', u'budget', u'centrally', u'located', u'pleasantly', u'surprised']",UR10873401
"[u'small', u'location', u'chinatown', u'gates', u'restaurant', u'services', u't', u'lot', u'restaurants', u'room', u'small', u'clean', u'needed', u'relation', u'quality', u'price']",UR126387278
"[u'pro', u'located', u'gates', u'china', u'town', u'french', u'breakfast', u'place', u'corner', u'room', u'service', u'clean', u'quiet', u'tour', u'sightseeing', u'buses', u'spot', u'front', u'gates', u'don', u't', u'walk', u'con', u'wouldn', u't', u'brother', u'marathon', u'place', u'family', u'decor', u'side', u'clean']",UR100647687
"[u'chinese', u'years', u'celebration', u'year', u'ox', u'baldwin', u'perfect', u'reservations', u'familiy', u'members', u'happy', u'rooms', u'exceptionally', u'clean', u'comfortable', u'staff', u'members', u'help', u'hop', u'skip', u'chinatown', u'loved']",UR46243389
"[u'deal', u'considering', u'location', u'bells', u'whistles', u'clean', u'place', u'sleep', u'centrally', u'located', u'sf', u'front', u'gate', u'chinatown', u'union', u'square', u'blocks', u'south', u'easy', u'walk', u'financial', u'district', u'ferry', u'terminal', u'front', u'doors', u'lock', u'front', u'desk', u'feel', u'safe', u'people', u'traveling', u'expensive', u'turned', u'block', u'tenderloin', u'district', u'sketchy', u'town', u'baldwin', u'better', u'better', u'location']",UR119756435
