Content,ReviewID
"[u'mom', u'traveled', u'sf', u'short', u'vacation', u'baldwin', u'happy', u'entire', u'small', u'lot', u'character', u'newly', u'renovated', u'room', u'floor', u'advice', u'reviewers', u'requested', u'room', u'front', u'elevator', u't', u'view', u'side', u'building', u't', u'mind', u'quiet', u'room', u'spotlessly', u'clean', u'room', u'flat', u'screen', u'tv', u'regular', u'tub', u'bathroom', u'claw', u'foot', u'tub', u'room', u'small', u'beds', u'closet', u'spacious', u'bathroom', u'plenty', u'room', u'safe', u'closet', u'hair', u'dryer', u'iron', u'ironing', u'board', u'usual', u'amentities', u'coffee', u'lobby', u'coffee', u'tea', u'ice', u'vending', u'machines', u'lobby', u'radiator', u'loud', u'strange', u'squealing', u'noises', u'called', u'pig', u'pig', u'woke', u'night', u'heat', u'turned', u'called', u'downstairs', u'turn', u'man', u'shut', u'valve', u'squealed', u'night', u't', u'hear', u'nights', u'shut', u'pipes', u'squeal', u'shower', u't', u'bother', u'travel', u'ear', u'plugs', u'snoring', u'weren', u't', u'bothered', u'noises', u'slept', u'well', u'staff', u'baldwin', u'impressive', u'friendly', u'telling', u'city', u'places', u'public', u'transportation', u'restaurants', u'eat', u'towel', u'animals', u'bed', u'day', u'location', u'incredible', u'walk', u'front', u'door', u'left', u'gates', u'chinatown', u'restaurants', u'shops', u'trips', u'chinatown', u'high', u'clothing', u'stores', u'armani', u'betsy', u'johnson', u'coach', u'blocks', u'buses', u'cable', u'cars', u'spent', u'days', u'sightseeing', u'day', u'baldwin', u'location', u'cleanliness', u'friendly', u'staff', u'recommend']",UR125079678
"[u'returned', u'spending', u'days', u'san', u'francisco', u'girlfriend', u'town', u'conference', u'presenting', u'decided', u'week', u'enjoy', u'town', u'searching', u'tripadvisor', u'close', u'conference', u'center', u'close', u'transportation', u'dump', u'wouldn', u't', u'break', u'budget', u'man', u'baldwin', u'deliver', u'arrived', u'checked', u'room', u'problem', u'room', u'clean', u'updated', u'bathroom', u'flat', u'panel', u'tv', u'comfortable', u'queen', u'sized', u'bed', u'room', u'faced', u'main', u'street', u'central', u'air', u'ac', u'weather', u'cool', u'seconds', u'opening', u'windows', u'ceiling', u'fan', u'room', u'cool', u'everyday', u'town', u'day', u'returned', u'evening', u'place', u'going', u'wondering', u'san', u'fran', u'money', u'saved', u'budget', u'wine', u'country', u'alcatraz', u'mission', u'fishermans', u'warf', u'china', u'town', u'located', u'union', u'square', u'steps', u'shopping', u'public', u'transportation', u'bart', u'airport', u'buses', u'mission', u'trollies', u'warf', u't', u'beat', u't', u'problems', u'noise', u'people', u'bothered', u'trucks', u'night', u'nights', u'picked', u'trash', u'hear', u'pretty', u'well', u'closed', u'window', u'seasons', u'hilton', u'don', u't', u'expect', u'glitz', u'glammour', u'expect', u'recieve', u'essentials', u'comfortable', u'room', u'location', u'staff', u'sleep', u'budget', u'time', u'san', u'fran', u'staying', u'negative']",UR127138334
"[u'booked', u'price', u'low', u'expecting', u'sort', u'marginal', u'terms', u'comfort', u'cleanliness', u'wonderfully', u'surprised', u'room', u'comfortable', u'bed', u'beautiful', u'bathroom', u'll']",UR118573391
"[u'booked', u'based', u'feedback', u'rating', u'expedia', u'sites', u'wasn', u't', u'disappointed', u'based', u'reviews', u'reminded', u'fashioned', u'british', u'seaside', u'resorts', u'door', u'system', u'operated', u'keys', u'opposed', u'modern', u'card', u'system', u'renovations', u'going', u'reception', u'area', u'small', u'amount', u'time', u'inconvenience', u'hindrance', u'staff', u'friendly', u'keen', u'assist', u'questions', u'public', u'transport', u'restaurants', u'bars', u'ideally', u'shopping', u'perfect', u'bag', u'drop', u'returning', u'shops', u'ideally', u'public', u'transport', u'bart', u'muni', u'system', u'runs', u'couple', u'blocks', u'likewise', u'cable', u'cars', u'street', u'cars', u'bus', u'system', u'fit', u'walkable', u'expecting', u'mod', u'cons', u'breakfast', u'dinner', u'flashy', u'rooms', u'ac', u'multi', u'channel', u'satellite', u'tv', u'flat', u'screen', u'hd', u'tv', u'book', u'step', u'time', u'crash', u'night', u'nights', u'eat', u'daily', u'free', u'wifi', u'bonus', u'allowing', u'check', u'nightly', u'basis', u'keep', u'ers', u'sharks', u'games', u'ideal', u'location', u'close', u'public', u'transport', u'close', u'bars', u'restaurants', u'shops', u'friday', u'saturday', u'nights', u'loud', u'coffee', u'bar', u'opposite', u'seemingly', u'work', u'night', u'noise', u'well', u'bin', u'men', u'turn', u'early', u'morning', u'rest', u'week', u'reasonably', u'quiet', u'enjoyed', u'towel', u'origami', u'daily', u'basis', u'fun', u'returning', u'room', u'evening', u'wondering', u'animal', u'young', u'kids', u'easily', u'pleased', u'enjoy', u'return']",UR123584638
"[u'place', u'san', u'francisco', u'price', u'problem', u'wi', u'fi', u'system', u't', u'work', u'ipad', u'starbucks', u'meters']",UR79731545
"[u'baldwin', u'central', u'location', u'staff', u'rooms', u'clean', u'spacious', u'money']",UR86690090
"[u'location', u'gateway', u'chinatown', u'short', u'walk', u'shops', u'union', u'square', u'room', u'fine', u'staff', u'friendly']",UR114753372
"[u'husband', u'three', u'nights', u'wider', u'trip', u'california', u'march', u'april', u'paid', u'average', u'tax', u'night', u'standard', u'double', u'room', u'san', u'francisco', u'felt', u'excellent', u'room', u'large', u'stylish', u'adequate', u'size', u'clean', u'comfortable', u'bathroom', u'size', u'included', u'tub', u'well', u'shower', u'shower', u'tub', u'location', u'excellent', u'steps', u'china', u'town', u'easy', u'felt', u'safe', u'area', u'reading', u'comments', u'site', u'requested', u'room', u'lift', u'shaft', u't', u'problems', u'noise', u'wi', u'fi', u'daily', u'charge', u'better', u'local', u'cafe', u'free', u'wi', u'fi', u'breakfast', u'provided', u'coffee', u'lobby', u'day', u'lots', u'cafes', u'nearby', u'finding', u'breakfast', u'wasn', u't', u'problem', u'definitely', u'recommend', u'clean', u'comfortable', u'base', u'exploring', u'san', u'francisco']",UR28732906
"[u'recommend', u'budget', u'limited', u'funding', u'staff', u'absolutely', u'provided', u'accommodated', u'rooms', u'small', u'night', u'loud', u'construction', u'sums']",UR82033624
"[u'nights', u'baldwin', u'located', u'blocks', u'downtown', u'china', u'district', u'rom', u'big', u'bathroom', u'small', u'clean', u'everyday', u'towels', u'soap', u'staff', u'friendly', u'helpfull', u'rooms', u'renovated', u'bit', u'fancy', u'place', u'place', u'pleace', u'sleep', u'price', u'range']",UR120699497
"[u'prime', u'point', u'location', u'gate', u'china', u'town', u'couple', u'blockas', u'union', u'square', u'price', u'superb', u'staff', u'superb', u'rooms', u'sparten', u'spacious', u'comfortable', u'advice', u'room', u'luift', u'shaft', u'noisey', u'st', u'night', u'day', u'requested', u'room', u'change', u'staff']",UR8605891
"[u'block', u'chinatown', u'gate', u'union', u'square', u'rooms', u'smaller', u'usual', u'massive', u'american', u'plenty', u'big', u'bed', u'extremely', u'comfortable', u'room', u'clean', u'bathroom', u'clawfoot', u'bath', u'clean', u'free', u'wifi', u'room', u'computer', u'lobby', u'required', u'credit', u'card', u'payment', u'coffee', u'tea', u'ice', u'vending', u'machine', u'downstairs', u'lobby', u'general', u'typical', u'european', u'small', u'staff', u'friendly', u'fast', u'registration', u'despite', u'late', u'big', u'free', u'room', u'safe', u'inner', u'city', u'find', u'price']",UR120042937
"[u'enjoyed', u'location', u'accomodations', u'recommend', u'better', u'fitting', u'sheets', u'beds']",UR49457146
"[u'baldwin', u'san', u'francisco', u'times', u'future', u'price', u'convenient', u'comfortable', u'short', u'walk']",UR80018118
"[u'san', u'francisco', u'conference', u'chose', u'baldwin', u'location', u'price', u'minute', u'walk', u'montgomery', u'bart', u'station', u'close', u'market', u'street', u'chinatown', u'room', u'small', u'comfortable', u'thought', u'room', u'faced', u'street', u'room', u'quiet', u'windows', u'closed', u'doesn', u't', u'amenities', u'cares', u'san', u'francisco', u'hang', u'room', u'clean', u'inexpensive', u'safe', u'place', u'vacation', u'business', u'recommend', u'baldwin']",UR62255048
"[u'staff', u'baldwin', u'ways', u'including', u'helping', u'unfamiliarity', u'time', u'visit', u'san', u'francisco', u'additionally', u'minor', u'glitches', u'handled', u'swiftly', u'satisfactory', u'conclusion', u'personal', u'service', u'attention', u'expectations', u'staff', u'visit', u'enjoyable', u'helping', u'spend', u'quality', u'time', u'local', u'areas', u'tourist', u'interest', u'clean', u'well', u'situated', u'couple', u'blocks', u'chinatown', u'blocks', u'beautiful', u'union', u'square', u'bravo', u'baldwin', u'wonderful', u'big', u'viet', u'attention']",UR40061322
"[u'baldwin', u'nights', u'september', u'years', u'ago', u'result', u'knew', u'expect', u'location', u'rooms', u'clean', u'staff', u'friendly', u'time', u'room', u'front', u'bit', u'noisy', u'traffic', u'time', u'room', u'rear', u'quieter', u'view', u'definitely', u'location', u'offers', u'excellant', u'money']",UR80832252
"[u'baldwin', u'pleasant', u'surprise', u'luxury', u'characteristics', u'safe', u'central', u'location', u'clean', u'rooms', u'professional', u'friendly', u'staff', u'affordable', u'price']",UR82302102
"[u'firstly', u'talk', u'nearby', u'amenities', u'walking', u'distance', u'bart', u'ride', u'walking', u'distance', u'sear', u'diners', u'chinatown', u'walking', u'distance', u'union', u'square', u'walking', u'distance', u'garage', u'parked', u'car', u'walking', u'distance', u'mini', u'mart', u'turn', u'left', u'starbucks', u'secondly', u'talk', u'accommodating', u'friendly', u'staff', u'questions', u'glady', u'help', u'safe', u'vicinity', u'beggars', u'dirty', u'places', u'clubs', u'quiet', u'area', u'street', u'reviews', u'mentioned', u'noisy', u'street', u'clean', u'room', u'bugs', u'smell']",UR97217094
"[u'baldwin', u'nights', u'location', u'close', u'chinatown', u'union', u'square', u'comfortable', u'bed', u'decent', u'size', u'rooms', u'sleep', u'renovated', u'bathroom', u'decent', u'price', u'bad', u'noisy', u'garbage', u'truck', u'pick', u'nights', u'heater', u'making', u'weird', u'noises', u'gas', u'oil', u'heater', u'room', u'renovated', u'toilet', u'case', u'check', u'late', u'front', u'door', u'shuts', u'pm']",UR71720059
"[u'baldwin', u'rating', u'location', u'comparisons', u'sf', u'price', u'extra', u'edge', u'mistake', u'style', u'bare', u'bones', u'extra', u'amenities', u'ac', u'creaky', u'slow', u'elevator', u'sloooow', u'front', u'desk', u'sevice', u'management', u'room', u'smelled', u'fresh', u'paint', u'bathroom', u'newly', u'redone', u'immaculately', u'white', u'grout', u'tiles', u'fixtures', u'effort', u'sense', u'decent', u'toiletries', u'ac', u'large', u'ceiling', u'fan', u'job', u'spring', u'evening', u'front', u'desk', u'manned', u'people', u'multi', u'task', u'europeans', u'language', u'barrier', u'well', u'ridiculous', u'amount', u'paperwork', u'check', u'well', u'antiquated', u'computer', u'system', u'fashioned', u'metal', u'keys', u'leads', u'lengthy', u'wait', u'check', u'check', u'minutes', u'decent', u'free', u'coffee', u'lobby', u'hours', u'day', u'touch', u'beds', u'lot', u'desired', u'pillows', u'synthetic', u'flat', u'pillows', u'queen', u'bed', u'cheap', u'thin', u'cover', u'extra', u'blanket', u'closet', u'side', u'large', u'safe', u'closet', u'hold', u'laptops', u'large', u'personal', u'items', u'leave', u'room', u'deadbolt', u'lock', u'addition', u'handle', u'lock', u'locks', u'front', u'door', u'hours', u'pm', u'keep', u'guests', u'guests', u'enter', u'key', u'front', u'desk', u'late', u'early', u'hours', u'security', u'location', u'beat', u'turn', u'direction', u'front', u'door', u'union', u'square', u'restaurants', u'shops', u'gate', u'chinatown', u'well', u'close', u'financial', u'district', u'boutique', u'sf', u'lower', u'price', u'ranges', u'baldwin', u'pretty', u'meets', u'average', u'expectations', u'negative', u'surprises', u'positive', u'clean', u'security', u'feeling', u'effort', u'neighborhood', u'vibrant', u'union', u'square', u'turn', u'shady', u'fast', u'location', u'favored', u'luxury', u'seasonally', u'priced', u'range', u'choice', u'excellent', u'setting']",UR17109614
"[u't', u'bells', u'whistles', u'hilton', u'omni', u'westin', u'job', u'clean', u'rooms', u'soft', u'comfortable', u'beds', u'incredibly', u'reasonable', u'prices', u'friendly', u'staff', u'gripe', u'television', u'service', u'reception', u'bathroom', u'fan', u'loud', u'things', u'pretty', u'close', u'perfect', u'staying', u'visit', u'bay', u'area']",UR98261378
"[u'location', u'service', u'poor', u'sleep', u'friday', u'night', u'trash', u'pick', u'window', u'loud', u'furnace', u'room', u'funny', u'noises', u'night', u'morning', u'personnel', u'shut', u'helped', u'lot', u'staff', u'friendly']",UR10043286
"[u'people', u'friendly', u'bedroom', u'clean', u'everyday', u'outstanding', u'location', u'recommend']",UR116721266
"[u'sf', u'regular', u'basis', u'baldwin', u'moderately', u'priced', u'staff', u'reliable', u'attentive', u'course', u'location', u'primo', u'rooms', u'small', u'frills', u'bed', u'small', u'tv', u'desk', u'night', u'stands', u'bathroom', u'barely', u'fits', u't', u'rats', u'roaches', u'clean', u'marriott', u'paying', u'close', u'bart', u'union', u'square']",UR25481884
"[u'extensive', u'budget', u'san', u'francisco', u'glad', u'find', u'gem', u'well', u'reviewed', u'trip', u'advisor', u'pleasant', u'location', u'smack', u'center', u'wanted', u'husband', u'walked', u'entire', u'city', u'location', u'price', u'biggest', u'draw', u'room', u'basic', u'needed', u'including', u'bathroom', u'comfortable', u'bed', u'maids', u'cutest', u'towel', u'animals', u'day', u'biggest', u'complaint', u'reason', u'stars', u'street', u'noise', u'excited', u'city', u'view', u'entered', u'room', u'slept', u'well', u'friday', u'saturday', u'nights', u'sunday', u'night', u'awoken', u'banging', u'screeching', u'beeping', u'garbage', u'trucks', u'going', u'nearby', u'alley', u'sets', u'cleaned', u'dumpsters', u'night', u'hour', u'time', u'idea', u'separate', u'trucks', u'thing', u'evening', u'figured', u'dumpsters', u'empty', u'wouldn', u't', u'deal', u't', u'friday', u'saturday', u't', u'change', u'rooms', u'wrong', u'thing', u'remaining', u'nights', u'retrospect', u'absolutely', u'recommend', u'location', u'price', u'comfortable', u'room', u'request', u'room', u'side', u'nights', u'sleep']",UR118080796
"[u'girlfriend', u'august', u'nights', u'place', u'location', u'excellent', u'gate', u'china', u'town', u'close', u'centre', u'thee', u'room', u'clean', u'comfortable', u'nicely', u'decorated', u'street', u'view', u'problems', u'traffic', u'noise', u'downside', u'room', u'elevator', u'wich', u'bit', u'noisy', u'experience', u'returned', u'sf', u'book']",UR120812151
"[u'perfect', u'wife', u'wanting', u'center', u'city', u'place', u'rest', u'recommend', u'long', u'place', u'feel', u'pampered', u'spend', u'portion', u'vacation']",UR116088497
"[u'location', u'price', u'close', u'shopping', u'fun', u'night', u'life', u'quiet', u'luxurious', u'staff']",UR64430182
"[u'left', u'baldwin', u'night', u'mixed', u'feelings', u'reminds', u'better', u'find', u'london', u'paris', u'clean', u'room', u'spotless', u'bath', u'amenities', u'lobby', u'coffee', u'foul', u'watch', u'loading', u'unloading', u'zone', u'front', u'parked', u'ten', u'minutes', u'unloading', u'bags', u'checking', u'find', u'ticket', u'returned', u'move', u'car', u'parking', u'garage', u'blocks', u'front', u'desk', u'smiled', u'size', u'rear', u'corner', u'room', u'double', u'bed', u'nicely', u'furnished', u'view', u'rooftops', u'heat', u'attempted', u'repairs', u'weekend', u'offered', u'portable', u'electric', u'numerous', u'years', u'baldwin', u'recession', u'find', u'deal', u'star', u'nearby', u'bother', u'bare', u'bones', u'baldwin']",UR24609825
"[u'love', u'location', u'close', u'chinatown', u'starbucks', u'bart', u'union', u'square', u'cable', u'cars', u'short', u'walk', u'room', u'clean', u'surprised', u'quiet', u'closed', u'windows', u'night', u'hear', u'noise', u'floor', u'staff', u'friendly', u'loved', u'towel', u'animals', u'drawback', u'clingy', u'shower', u'curtain', u'definately']",UR125377850
"[u'arrived', u'baldwin', u'three', u'night', u'location', u'excellent', u'minutes', u'walk', u'bart', u'station', u'minutes', u'chinatown', u'union', u'square', u'market', u'street', u'fishermans', u'wharf', u'minutes', u'ride', u'cable', u'car', u'street', u'tram', u'extremley', u'clean', u'well', u'maintained', u'room', u'dark', u'overlooked', u'dirty', u'yard', u'pigeons', u'roosting', u'window', u'ledges', u'windows', u'overlooked', u'imagine', u'smell', u'meant', u'impossible', u'open', u'window', u'askedfor', u'room', u'staff', u'friendly', u'obliged', u'room', u'view', u'street', u'total', u'contrast', u'previous', u'room', u'dispite', u'room', u'street', u'view', u'notice', u'noise', u'window', u'open', u'read', u'older', u'posts', u'room', u'dwas', u'cool', u'equipped', u'air', u'conditioning', u'room', u'safe', u'iron', u'telephone', u'tv', u'wifi', u'reasonable', u'charge', u'bathroom', u'clean', u'stocked', u'usual', u'soap', u'shower', u'gel', u'recommend', u'return', u'san', u'fransisco', u'baldwin']",UR41894893
"[u'husband', u'enjoy', u'easy', u'everyway', u'service', u'walking', u'distance', u'train', u'station', u'union', u'square', u'steps', u'china', u'town', u'clean']",UR126255620
"[u'perfectly', u'adequate', u'school', u'ideal', u'location', u'blocks', u'union', u'square', u'side', u'chinatown', u'gate', u'tenderloin', u'side', u'heard', u'price', u'book', u'night', u'weekend', u'paid', u'queen', u'room', u'small', u'dated', u'clean', u'window', u'opened', u'fresh', u'air', u'bed', u'comfortable', u'pillows', u't', u'tweak', u'neck', u'room', u'fabulous', u'claw', u'foot', u'bathtub', u'soak', u'neck', u'hot', u'water', u'husband', u'running', u'marathon', u'night', u'sleep', u'noisy', u'noisy', u'people', u'floor', u't', u'problem', u'street', u'noise', u'well', u'city', u'big', u'city', u'downtown', u'style', u'windows', u'contract', u'sutter', u'garage', u'hours', u'privileges', u'front', u'desk', u'friendly', u'check', u'noon', u'eleven', u'downsides', u'coffeemaker', u'coffee', u'service', u'lobby', u'pretty', u'grim', u'powdered', u'creamer', u'cafe', u'street', u'live', u'locally', u'bring', u'coffeemaker', u'time', u'hairdryer', u'work', u'elevator', u'slooooooow', u'price', u'totally', u'location', u'absolutely', u'ideal']",UR18588823
"[u'decided', u'spend', u'lots', u'money', u'traveling', u'budget', u'simply', u'don', u't', u'feel', u'spending', u'dollars', u'room', u'baldwin', u'located', u'chinatown', u'gate', u'close', u'chinatown', u'union', u'square', u'market', u'st', u'bart', u'station', u'don', u't', u'powell', u'street', u'station', u'offended', u'bothered', u'beggars', u'likes', u'walk', u'market', u'st', u'station', u'perfectly', u'walking', u'fisherman', u'wharf', u'takes', u'minutes', u'three', u'nights', u'late', u'march', u'room', u'expected', u'night', u'bit', u'three', u'star', u'european', u'capitals', u'bathroom', u'large', u'clean', u'thing', u'rooms', u'staff', u'location', u'beat', u'wouldn', u't', u'consider', u'staying', u'plenty', u'opportunities', u'spend', u'money']",UR7300439
"[u'booked', u'baldwin', u'overwhelming', u'recommendations', u'tripadvisor', u'users', u'completely', u'lived', u'expectations', u'fantastic', u'location', u'short', u'walk', u'china', u'town', u'montgomery', u'bart', u'station', u'sfo', u'airport', u'union', u'square', u'shopping', u'nicer', u'areas', u'town', u'pretty', u'sketchy', u'neighborhoods', u'tenderloin', u'night', u'san', u'francisco', u'class', u'public', u'transport', u'network', u'll', u'fisherman', u'wharf', u'pier', u'golden', u'gate', u'bridge', u'park', u'easily', u'room', u'decent', u'size', u'spotless', u'serviced', u'well', u'housekeeping', u'paid', u'rate', u'baldwin', u'money', u'well', u'spent', u'place', u'laundromat', u'corner', u'negative', u'lack', u'free', u'wifi', u'starbucks', u'doors', u'check', u'email', u'coffee', u'definitely', u'recommend', u'kind', u'traveler']",UR98157192
"[u'nights', u'concert', u'bay', u'oakland', u'clean', u'room', u'claw', u'foot', u'tub', u'bathroom', u'frills', u't', u'beat', u'location', u'feet', u'chinatown', u'gate', u'blocks', u'bart', u'subway', u'station', u'area', u'bay', u'oakland', u'cab', u'ride', u'golden', u'gate', u'park', u'fisherman', u'wharf', u'lots', u'places', u'eat', u'bars', u'mini', u'marts', u'close', u'free', u'coffee', u'tea', u'lobby', u'starbucks', u'door', u'noise', u'deliveries', u'garbage', u'trucks', u'alley', u'keep', u'awake', u'staff', u'friendly', u'quick', u'phone', u'call', u'front', u'desk', u'cab', u'front', u'door', u'printed', u'airline', u'boarding', u'passes', u'glad']",UR119605745
"[u'third', u'time', u've', u'baldwin', u'location', u'excellent', u'close', u'union', u'square', u'chinatown', u'financial', u'district', u'staff', u'rooms', u'clean', u'comfortable']",UR49079894
"[u'late', u'evening', u'saturday', u'night', u'room', u'front', u'floor', u'elevator', u'requested', u'room', u'elevator', u'told', u'change', u'room', u'day', u'problem', u'coming', u'room', u'feeling', u'big', u'problem', u'whatswhoever', u'elevator', u'decided', u'wiith', u'open', u'window', u'hear', u'garbage', u'truck', u'pass', u'jetleg', u'awake', u'easily', u'reached', u'public', u'transportation', u'bart', u'montgomery', u'min', u'walk', u'absolutely', u'safe', u'time', u'littel', u'problem', u'wakeup', u'call', u'guy', u'reception', u'asleep', u'table', u'leave', u'happy', u'pleased', u'baldwin']",UR26184727
"[u'fantastic', u'location', u'block', u'union', u'square', u'close', u'shops', u'restaurants', u'couldn', u't', u'room', u'inself', u'fairly', u'standard', u'top', u'marks', u'cleanliness', u'double', u'bed', u'small', u'thing', u'open', u'window', u'fresh', u'air', u'usa', u'air', u'conditioning', u'tea', u'coffee', u'making', u'facilities', u'reception', u'room', u'big', u'deal', u'lift', u'quick', u'mins', u'grab', u'hot', u'drink', u'staff', u't', u'housekeeping', u'staff', u'receptionists', u'couldn', u't', u'recommend']",UR21785361
"[u'night', u'provided', u'experience', u'memory', u'location', u'service', u'deal', u'towel', u'orgami', u'crab', u'remind', u'visit', u'fisherman', u'wharf', u'san', u'francisco', u'love', u'definitely', u'list', u'visit']",UR122442551
"[u'location', u'clean', u'amount', u'space', u'staff']",UR123716846
"[u'clean', u'neat', u'location', u'highly', u'recommend', u'money']",UR7846801
"[u'nights', u'early', u'december', u'worried', u'disaster', u'considering', u'low', u'cost', u'fantastic', u'place', u'side', u'union', u'square', u'designer', u'stores', u'doorstep', u'honestly', u'work', u'travel', u'top', u'location', u'place', u't', u'beaten', u'don', u't', u'expect', u'luxury', u'facilities', u'existent', u'rooms', u'perfect', u'location', u'price', u't', u'beat', u'gem', u'staff', u'friendly', u'extremely', u'pleasant']",UR22935151
"[u'location', u'excellent', u'money']",UR75235148
"[u'excellent', u'location', u'steps', u'chinatown', u'blocks', u'union', u'square', u'bart', u'cable', u'cars', u'clean', u'room', u'bathroom', u'bearable', u'noise', u'room', u'tired', u't', u'pay', u'attention', u'friendly', u'staff', u'cheap', u'rate', u'doubt', u'pleased']",UR20783126
"[u'position', u'friendly', u'staff', u'reasonable', u'price', u'free', u'internet', u'breakfast', u'city', u'tour']",UR68881756
"[u'central', u'location', u'walking', u'distance', u'chinatown', u'financial', u'district', u'clean', u'staff', u'friendly', u'rates', u'reasonable']",UR89117230
"[u'thing', u'location', u'super', u'close', u'union', u'square', u'bart', u'metro', u'major', u'stores', u'macy', u'gate', u'chinatown', u'actual', u'chinatown', u'area', u'blocks', u'north', u'area', u'peaceful', u'safe', u'advantage', u'nights', u'free', u'tour', u'package', u'deal', u'free', u'tour', u'operated', u'party', u'tour', u'company', u'hour', u'ride', u'main', u'locations', u'sf', u'queen', u'room', u'queen', u'bed', u'small', u'room', u'bathroom', u'clean', u'tidy', u'special', u'surprise', u'lcd', u'tv', u'room', u'buzzed', u'channels', u'heating', u'system', u'fan', u'ceiling', u'summers', u'funny', u'sound', u'time', u'time', u'night', u'unpleasant', u'room', u'specific', u'recommend', u'budget', u'conscience', u'wanting', u'private', u'comfortable', u'location', u'top', u'notch', u'easy', u'bus', u'ride', u'bus', u'fisherman', u'wharf', u'staying', u'days', u'sure', u'unlimited', u'metro', u'travel', u'days', u'visitor', u'centre', u'opposite', u'macy', u'allows', u'travel', u'unlimited', u'bus', u'muni', u'tram', u'tram', u'novelty', u'viable', u'transport', u'solution', u'pass', u'doesn', u't', u'cover', u'bart', u'note', u'flying', u'sfo', u'oakland', u'sf', u'airports', u'linked', u'bart', u'staying', u'baldwin', u'bart', u'straight', u'airport', u'montgomery', u'easy', u'fast', u'staff', u'friendly', u'well']",UR53473222
"[u'nights', u'place', u'perfectly', u'well', u'located', u'sf', u'enjoy', u'city', u'room', u'floor', u'quiet', u'bright', u'add', u'cleaning', u'day', u'room', u'spick', u'span', u'advise', u'solo', u'traveller', u'affordable', u'well', u'located', u'reach', u'night']",UR61669117
"[u'location', u'close', u'china', u'town', u'shops', u'restaurants', u'clean', u'staff', u'courteous', u'arrived', u'early', u'check', u'time', u'wasn', u't', u'leave', u'luggage', u'price']",UR118489529
