Content,ReviewID
"[u'december', u'staff', u'friendly', u'price', u'excellent', u'location', u'minute', u'walk', u'pier', u'centre', u'town', u'room', u'laid', u'well', u'exit', u'double', u'bed', u'side', u'unique', u'room', u'recommend', u'requesting', u'room', u'street', u'facing', u'street', u'cleaning', u'san', u'francisco', u'noisy', u'woke', u'lot', u'revisit', u'location']",UR122337331
"[u'modern', u'condition', u'clean', u'cozy', u'location', u'couldn', u't', u'better']",UR55538139
"[u'cockroackes', u'ice', u'machine', u'weird', u'stains', u'carpet', u'room', u'clean', u'maids', u'awful', u'trip', u'pan', u'handlers', u'door', u'place', u'wrong', u'turn', u'area', u'heard', u'scary', u'forget', u'incredible', u'rude', u'woman', u'desk']",UR7419172
"[u'night', u'single', u'room', u'queen', u'bed', u'booked', u'months', u'advance', u'basic', u'location', u'main', u'gate', u'chinatown', u'lots', u'places', u'eat', u'shop', u'area', u'maid', u'service', u'reception', u'minute', u'walk', u'moscone', u'center']",UR94982985
"[u'arrival', u'checked', u'bed', u'bathroom', u'hair', u'long', u'black', u'hairs', u'bed', u'sheets', u'pillow', u'cases', u'eyelashes', u'towels', u'ball', u'blonde', u'hair', u'ball', u'black', u'hair', u'asked', u'sheets', u'towels', u'room', u'better', u'hairs', u'sheets', u'sheets', u'bed', u'hairs', u'sheets', u'yuk', u'random', u'hairs', u'bathroom', u'walls', u'bath', u'location', u'paid', u'full', u'rooms', u'cash', u'incidentals', u'incidentals', u'buy', u'mini', u'bar', u'bad', u'tea', u'coffee', u'foyer', u'internet', u'cash', u'mins', u'time', u'visit', u'website', u'slow', u'man', u'unhelpful', u'check', u't', u'check', u'time', u'net', u'drinks', u'corner', u'worried', u'lost', u'keys', u'holiday', u'called', u'la', u'airport', u'chester', u'check', u'room', u'emailed', u'follow']",UR120246329
"[u'things', u'excellent', u'close', u'sights', u'public', u'transport', u'size', u'room', u'clean', u'bathroom', u'cant', u'fault', u'baldwin', u'definately', u'return']",UR16483343
"[u'fantastic', u'exploring', u'san', u'francisco', u'baldwin', u'excellently', u'located', u'exploring', u'china', u'town', u'nob', u'hill', u'union', u'square', u'rooms', u'dated', u'spotlessly', u'clean', u'towel', u'arrangements', u'bed', u'day', u'fun', u'tv', u'channel', u'selection', u'excellent', u'dedinately', u'return', u'exploring', u'city']",UR123228163
"[u'service', u'frontdesk', u'fm', u'housekeeping', u'cordial', u'hv', u'std', u'rm', u'windows', u'bright', u'airy', u'clean', u'prefer', u'hv', u'wall', u'attached', u'bathtub', u'standalone', u'bath', u'water', u'easily', u'splashed', u'wet', u'floor', u'wud', u'bath', u'mat', u'tub', u'safety', u'favorite', u'room', u'type', u'windows', u'shut', u'street', u'noise', u'comfortably', u'quiet', u'sleep', u'high', u'floors', u'fm', u'unblock', u'views', u'location', u'perfect', u'short', u'walking', u'distance', u'bart', u'eateries', u'shoppings', u'chinatown', u'union', u'square', u'fel', u'safe', u'vicinity']",UR34199182
"[u'baldwin', u'staff', u'friendly', u'location', u'chinatown', u'windows', u'open', u'fresh', u'air', u'fact', u'affiliated', u'chain', u'complaint', u'frumpy', u'interesting', u'furnishings', u'chosen', u'forgotten', u'glasses', u'randomly', u'picked', u'things', u'depot', u'closeout', u'sale']",UR18253842
"[u'fine', u'place', u'low', u'price', u'place', u'lot', u'bells', u'whistles', u'bit', u'front', u'desk', u'help', u'excellent', u'rooms', u'small', u'normal', u'size', u'room', u'dated', u'quaint', u'absolutely', u'spotless', u'clean', u'hall', u'smelled', u'musty', u'room', u'fine', u'location', u'middle', u'action', u'union', u'square', u'block', u'chinatown', u'gate', u'don', u't', u'll', u'find', u'better', u'low', u'market', u'fancy', u'place']",UR63063259
"[u'location', u'pleasant', u'staff', u'positives', u'day', u'san', u'francisco', u'staff', u'help', u'recommendations', u'restaurants', u'tours', u'corridor', u'room', u'smelled', u'toilet', u'room', u'looked', u'clean', u'hairs', u'bed', u'noise', u'night', u'elevator', u'area']",UR115431956
"[u'day', u'baldwin', u'supposed', u'days', u'caught', u'flight', u'cancellations', u'europe', u'volcano', u'book', u'extra', u'nights', u'staff', u'extremely', u'sympathetic', u'situation', u'small', u'fairly', u'fashioned', u'location', u'excellent', u'rooms', u'comfortable', u'quiet', u'apart', u'dumpster', u'trucks', u'operate', u'night', u'long', u'return']",UR62158417
"[u'read', u'lot', u'positive', u'comments', u'baldwin', u'disappointed', u'well', u'located', u'close', u'union', u'square', u'people', u'reception', u'room', u'large', u'clean', u'small', u'negative', u'point', u'baldwin', u'propose', u'real', u'breakfast', u'free', u'wifi', u'paid', u'taxes', u'king', u'size', u'bed', u'price', u'interesting', u'compared', u'service', u'recommend', u'reserve']",UR55526667
"[u'deal', u'combination', u'price', u'location', u'chinatown', u'gate', u'safe', u'walkable', u'neighborhood', u'plenty', u'restaurants', u'shops', u'chinatown', u'short', u'walking', u'distance', u'rooms', u'basic', u'clean', u'shape', u'don', u't', u'microwave', u'refrigerator', u'doesn', u't', u'guest', u'laundry', u'service', u'walk', u'steep', u'hill', u'laundromat', u'don', u't', u'option', u'roll', u'bed', u'charge', u'day', u'crib', u'coffee', u'making', u'facilities', u'short', u'pay', u'staff', u'young', u'polite', u'indifferent', u'inattentive', u'guests', u'location', u'expect']",UR116116024
"[u'girlfriend', u'nights', u'november', u'location', u'fantastic', u'central', u'shops', u'public', u'transport', u'minute', u'walk', u'fisherman', u'wharf', u'sort', u'thing', u'room', u'small', u'clean', u'bed', u'fresh', u'linen', u'internet', u'slow', u'required', u'sign', u'time', u'bathroom', u'door', u'wouldn', u't', u'lock', u'lift', u'well', u'clanking', u'grinding', u'noises', u'night', u'place', u'niggles', u'warrant', u'time', u'san', u'francisco', u'rooms', u'better', u'rooms', u'elevator']",UR120994839
"[u'location', u'lobby', u'bit', u'dingy', u'room', u'smart', u'decent', u'size', u'staff', u'top', u'union', u'square']",UR126180853
"[u'clean', u'comfortable', u'convenient', u'city', u'wished', u'checked', u'parking', u'arrangements', u'advance', u'beggars', u'streets', u'detracted', u'experience', u'towel', u'animals', u'works', u'art']",UR115707543
"[u'close', u'china', u'town', u'blocks', u'bart']",UR61420239
"[u'spent', u'nights', u'baldwin', u'november', u'pleased', u'rooms', u'basic', u'artwork', u'walls', u'real', u'view', u'small', u'side', u'spotlessly', u'clean', u'excellent', u'maid', u'service', u'deep', u'claw', u'foot', u'bathtub', u'big', u'flat', u'screen', u'tv', u'rooms', u'quiet', u'long', u'leave', u'windows', u'closed', u'keep', u'city', u'noise', u'beds', u'comfortable', u'front', u'counter', u'staff', u'pleasant', u'location', u'central', u'china', u'town', u'gate', u'surrounded', u'restaurants', u'sushi', u'restaurant', u'door', u'starbucks', u'doors', u'true', u'money']",UR86789745
"[u'well', u'thought', u'place', u'central', u'close', u'union', u'square', u'chinatown', u'gate', u'perfectly', u'clean', u'comfy', u'bed', u'towel', u'shaped', u'animal', u'day', u'left', u'bed', u'granted', u'dated', u'guests', u'lift', u'sympathetic', u'cosmetic', u'makeover', u'example', u't', u'spend', u'time', u'wanted', u'handy', u'city', u'attractions', u'remember', u'building', u'charm', u'staff', u'fine', u'explain', u'place', u'keep', u'coffee', u'guests', u'rear', u'lobby', u'chance', u'proved', u'handy', u'wanted', u'coffee', u'evening', u'brekky', u'bought', u'buns', u'times', u'empty', u'irritating', u'remember', u'star', u'front', u'street', u'facing', u'room', u'noisy', u'bin', u'lorries', u'traffic', u'consider', u'light', u'sleeper']",UR119014520
"[u'traveling', u'daughter', u'pleased', u'experience', u'baldwin', u'asked', u'better', u'location', u'easy', u'city', u'located', u'gates', u'chinatown', u'lots', u'shopping', u'union', u'square', u'walk', u'till', u'night', u'entire', u'area', u'busy', u'lots', u'things', u'staff', u'wonderful', u'time', u'hesitate', u'book', u'older', u'clean', u'comfortable', u'base', u'explore', u'city', u'room', u'ninth', u'floor', u'hear', u'city', u'noises', u'sax', u'player', u'played', u'evening', u'sounded', u'wonderful']",UR125731896
"[u'bottom', u'super', u'high', u'acommodations', u'wouldn', u't', u'clean', u'straight', u'forward', u'older', u'school', u'place', u'service', u'conveniently', u'located', u'spot']",UR50697077
"[u'definitely', u'luxury', u'accommodations', u'staff', u'friendly', u'room', u'clean', u'location', u'downside', u'noisy', u'slow', u'elevator']",UR49800116
"[u'husband', u'decided', u'spend', u'night', u'sf', u'sanoma', u'luxury', u'noise', u'od', u'trucks', u'backing', u'late', u'night', u'early', u'morn', u'amenities', u'didnt', u'work', u'well', u'iron', u'humming', u'tv', u'annoying', u'staff', u'located', u'china', u'town', u'stores', u'restaurants']",UR117881231
"[u'apart', u'enjoying', u'chinatown', u'meters', u'pagoda', u'gate', u'deparment', u'stores', u'fine', u'dinnings', u'walking', u'distance', u'rates', u'reasonable', u'place', u'close', u'wanted', u'front', u'dest', u'helpfull', u'cordial', u'frills', u'rooms', u'comfortable', u'perfect', u'place', u'relax', u'muscles', u'day', u'walking', u'experience', u'ms', u'viet', u'voung', u'helped', u'rooms', u'busy', u'season', u'discount', u'frequent', u'guest']",UR76495985
"[u'staff', u'friendly', u'location', u'walking', u'distance', u'cafes', u'commercial', u'center', u'public', u'transportation', u'tour', u'bus', u'room', u'spacious', u'quiet', u'busy', u'street', u'region', u'walk', u'night']",UR65322304
"[u'location', u'clean', u'confortable', u'realy', u'cheaper', u'location', u'noise', u'street', u'plumbing', u'inside', u'room', u'dificulty', u'sleep', u'well', u'thing', u'worth', u'comment', u'guy', u'stole', u'front', u'safe', u'area', u'nights', u'maximum', u'don', u't', u'problem', u'budget']",UR89076805
"[u'partner', u'baldwin', u'nights', u'april', u'lot', u'entire', u'usa', u'trip', u'reviews', u'money', u'arrived', u'late', u'flight', u'australia', u'arrived', u'pm', u'didnt', u'city', u'ish', u'met', u'warm', u'thankfully', u'swift', u'reception', u'cosy', u'feel', u'boutique', u'feel', u'preferred', u'rows', u'sf', u'lobby', u'hot', u'coffee', u'tea', u'night', u'room', u'level', u'elevator', u'modern', u'fast', u'turned', u'case', u'easily', u'walk', u'stairs', u'room', u'room', u'comfy', u'large', u'closet', u'area', u'safe', u'tv', u'big', u'comfy', u'bed', u'bathroom', u'clean', u'practical', u'water', u'pressure', u'shower', u'apart', u'location', u'china', u'town', u'public', u'transport', u'walking', u'distance', u'city', u'centre', u'memory', u'minutes', u'secure', u'lock', u'door', u'time', u'night', u'key', u'inside', u'helped', u'arrange', u'transfers', u'sfo', u'departed', u'room', u'instantly', u'welcoming', u'felt', u'walked', u'door', u'definitely', u'recommend', u'deal', u'cosy', u'boutique', u'lower', u'level', u'floor', u'avoid', u'lifts', u'recommend', u'requesting', u'room', u'directly', u'facing', u'main', u'road', u'located', u'noisy', u'day', u'alot', u'foot', u'traffic', u'arriving', u'usa', u'time', u'enjoyed', u'watching', u'people', u'window', u'listening', u'noises']",UR25743040
"[u'husband', u'lovely', u'clean', u'nights', u'location', u'gate', u'chinatown', u'restaurants', u'minute', u'walk', u'union', u'square', u'market', u'street', u'everyday', u'glad', u'chose', u'location', u'room', u'floor', u'facing', u'grant', u'avenue', u'room', u'clean', u'spacious', u'double', u'clean', u'bathroom', u'big', u'cupboard', u'clothes', u'suitcases', u'safe', u'reception', u'staff', u'happy', u'help', u'exceeded', u'expectations', u'amazing', u'time', u'money', u'better', u'star', u'coffee', u'tea', u'facilities', u'ground', u'floor', u'reception', u'breakfast', u'tacobel', u'market', u'street', u'cheap', u'breakfast', u'buritos', u'minus', u'wi', u'fi', u'charge', u'day', u'starbucks', u'couple', u'houses', u'check', u'emails', u'highly', u'recommended']",UR108491392
"[u'definately', u'recommend', u'visiting', u'years', u'day', u'trips', u'treated', u'three', u'year', u'girls', u'birthday', u'spend', u'weekend', u'plenty', u'room', u'lobby', u'rooms', u'clean', u'bathroom', u'plenty', u'towels', u'comfortable', u'bed', u'pillows', u'staff', u'friendly', u'parking', u'bad', u'price', u'pay', u'staying', u'day', u'place', u'breakfast', u'cheap', u'starbucks', u'door', u'subway', u'block', u'china', u'gate', u'union', u'square', u'blocks', u'cable', u'cars', u'updated', u'condition', u'older', u'big', u'city', u'forward', u'future']",UR97504754
"[u'baldwin', u'affordable', u'clean', u'comfortable', u'friendly', u'location', u'chinatown', u'union', u'square', u'close', u'cable', u'car', u'lines', u'perfect', u'place', u'venture', u'morning', u'wanted', u'easy', u'excursions', u'change', u'rest', u'places', u'eat', u'short', u'distance', u'chinatown', u'walk', u'terrific', u'san', u'francisco', u'pleased', u'choice', u'baldwin', u'small', u'suggestion', u'don', u't', u'lobby', u'coffee', u'darn', u'strong']",UR100147914
"[u'baldwin', u'clean', u'tidy', u'conveniently', u'entrance', u'chinatown', u'room', u'size', u'ensuite', u'ensuite', u'natural', u'light', u'bed', u'comfortable', u'lovely', u'noisy', u'read', u'reviews', u'trip', u'advisor', u'mentioned', u'noise', u'location', u'decided', u'risk', u't', u'pay', u'rooms', u'issues', u'trucks', u'street', u'window', u'night', u'investment', u'double', u'glazing', u'amiss']",UR116092000
"[u'place', u'traveler', u'san', u'francisco', u'require', u'incredible', u'location', u'easy', u'travel', u'room', u'clean', u'spacious', u'front', u'desk', u'friendly', u'efficient']",UR58636018
"[u'location', u'price', u'close', u'walk', u'lots', u'placesand', u'close', u'transit', u'lines', u'noisy', u'expected', u'middle', u'densely', u'packed', u'city', u'rooms', u'clean', u'bathrooms', u'sparkle', u've', u'baldwin', u'three', u'times', u'room', u'basic', u'tv', u'buzzing', u'noise', u'enjoying', u'san', u'francisco', u'minor', u'issues', u'starbucks', u'door']",UR94766157
"[u'pretty', u'noisy', u'saturday', u'night', u'room', u'price', u'bed', u'comfortable', u'room', u'clean', u'view', u'noise', u'elevator', u'horrible', u'chunking', u'noise', u'easily', u'hear', u'people', u'adjacent', u'room', u'pipes', u'shrieked', u'larger', u'rooms', u'queens', u'suites', u'closer', u'elevator', u'double', u'bring', u'earplugs', u'loud', u'sunday', u'monday', u'night', u'guests', u'elevator']",UR22274348
"[u'clean', u'room', u'location', u'secure', u'safe', u'women', u'traveling']",UR115796030
"[u'nights', u'decided', u'reading', u'ta', u'reviews', u'wasn', u't', u'disappointed', u'location', u'short', u'walk', u'takes', u'cable', u'car', u'busses', u'streetcars', u'union', u'square', u'room', u'comfortable', u'clean', u'downside', u'noise', u'lift', u'inevitable', u'street', u'noise', u'balance', u'choice', u'time', u'visit']",UR103381734
"[u'loved', u'san', u'fran', u'pretty', u'find', u'comfortable', u'rooms', u'amazing', u'location', u'minor', u'things', u'annoying', u'shower', u'rod', u'holding', u'shower', u'broken', u'cleaning', u'lady', u'walking', u'asleep', u'things', u'small', u'annoyance', u'recommend', u'friendly', u'staff', u'accommodating', u'hold', u'luggage', u'late', u'flight', u'price', u'thing', u'bit', u'pain', u'wi', u'fi', u'free', u'usa', u'internet', u'included', u'free', u'highly', u'recommend']",UR63279035
"[u'pleased', u'staff', u'friendly', u'polite', u'don', u't', u'helped', u'coke', u'machine', u'people', u'room', u'immaculate', u'condition', u'time', u'feel', u'appearance', u'large', u'safe', u'closet', u'big', u'laptop', u'left', u'room', u'elevator', u'small', u'door', u'big', u'inside', u'guess', u'time', u'period', u'building', u'satisfied', u'recommend', u'baldwin']",UR63209187
"[u'location', u'perfect', u'staff', u'area', u'well', u'room', u'comfortable', u'clean', u'quiet', u'charmingly', u'antique', u'ambiance', u'nervous', u'room', u'air', u'conditioning', u'absolutely', u'september', u'typically', u'warmest', u'month', u'year', u'granted', u'fancy', u'seasons', u'don', u't', u'find', u'better', u'money', u'staying', u'baldwin', u'visit', u'san', u'francisco', u'definitely', u'baldwin']",UR126614147
"[u'rooms', u'nights', u'clean', u'comfortable', u'rooms', u'small', u'adequate', u'handy', u'location', u'city', u'better', u'located', u'recommend']",UR83496119
"[u'nights', u'side', u'location', u'convenient', u'chinatown', u'easy', u'walk', u'sfmoma', u'ferry', u'building', u'bus', u'stops', u'room', u'bathroom', u'clean', u'asked', u'extra', u'pillow', u'pillow', u'flat', u'hard', u'ceiling', u'fan', u'hot', u'room', u't', u'help', u'ancient', u'radiator', u'room', u'technically', u'turned', u'running', u'bit', u'hot', u'water', u'front', u'desk', u'guy', u'couldn', u't', u'room', u'faced', u'street', u'definitely', u'noise', u'deal', u'wasn', u't', u'constant', u'banging', u'sound', u'building', u'rattling', u'elevator', u'shaft', u'loud', u'hear', u'earplugs', u'couldn', u't', u'sleep', u'day', u'left', u'disturb', u'sign', u'door', u'room', u'cleaned', u'annoying', u'reason', u'sign', u'don', u't', u'towels', u'day', u'room', u'cleaned', u've', u'barely', u'morning', u'water', u'pressure', u'shower', u'time', u'room', u'cleaned', u'bar', u'soap', u'days', u'thrown', u'replaced', u'wrapped', u'plastic', u'eco', u'conscious', u'travelers', u'irritating', u'save', u'money', u'prices', u'high']",UR18190480
"[u'arrived', u'check', u'time', u'staff', u'happy', u'check', u'early', u'sized', u'room', u'ensuite', u'queen', u'sized', u'bed', u'clean', u'quiet', u'comfortable', u'keep', u'mind', u'arrived', u'sunday', u'checked', u'day', u'sunday', u'night', u'indicative', u'noise', u'level', u'friday', u'saturday', u'night', u'bit', u'tired', u'bit', u'reno', u'fresh', u'well', u'located', u'fabulous', u'location', u'china', u'town', u'shops', u'short', u'walk', u'cable', u'car', u'ticks', u'boxes', u'clean', u'location', u'quiet', u'affordable', u'comfortable']",UR53506018
"[u'pros', u'baldwin', u'location', u't', u'beat', u'husband', u'chose', u'easily', u'accessible', u'montgomery', u'bart', u'station', u'venue', u'wedding', u'attending', u'block', u'chinatown', u'literally', u'chinatown', u'gate', u'doorway', u'north', u'beach', u'amidst', u'downtown', u'sf', u'shopping', u'staff', u'housekeeping', u'service', u'room', u'decor', u'classy', u'clean', u'cons', u'free', u'internet', u'service', u'crazy', u'day', u'age', u'city', u'san', u'francisco', u'elevator', u'loud', u'machine', u'room', u'happened', u'request', u'room', u'adjacent', u'elevator', u'tossing', u'turning', u'saturday', u'nite', u'people', u'return', u'hours', u'night', u'downside', u'ice', u'machine', u'lobby']",UR20017412
"[u'things', u'baldwin', u'written', u'online', u'review', u'wanted', u'place', u'budget', u'safety', u'top', u'concerns', u'booking', u'trip', u'female', u'graduate', u'student', u'friend', u'traveled', u'thorough', u'san', u'francisco', u'price', u'location', u'honestly', u'don', u't', u'understand', u'manage', u'keep', u'costs', u'low', u'expensive', u'city', u'passed', u'online', u'decided', u'three', u'times', u'price', u'located', u'block', u'baldwin', u'looked', u'baldwin', u'well', u'maintained', u'short', u'walk', u'museums', u'shopping', u'restaurants', u'bars', u'felt', u'comfortable', u'bus', u'haight', u'night', u'going', u'plenty', u'public', u'transportation', u'stops', u'market', u'street', u'blocks', u'room', u'frills', u'spacious', u'clean', u'quiet', u'staff', u'wonderful', u'providing', u'directions', u'recommendations', u'places', u'eat', u'shuttle', u'airport', u'definitely', u'cheaper', u'cab', u'downside', u'wasn', u't', u'fridge', u'room', u't', u'provide', u'free', u'internet', u'starbucks', u'block', u'wifi', u'service', u'super', u'luxury', u'isn', u't', u'place', u'spotless', u'room', u'incredibly', u'reasonable', u'rate', u'heart', u'city', u'definitely', u'book', u'steal', u'definitely', u'recommend', u'friends', u'return', u'trip', u'san', u'francisco']",UR76221058
"[u'conveniently', u'located', u'shopping', u'buses', u'food', u'cable', u'car', u'rooms', u'compact', u'leg', u'space', u'luggage', u'room', u't', u'spend', u'time', u'room', u'clawed', u'foot', u'tub', u'wobbly', u'kind', u'quaint', u'staff', u'knowledgeable', u'directions']",UR84836574
"[u'attended', u'seminar', u'nearby', u'baldwin', u'saved', u'night', u'consider', u'baldwin', u'exceptional', u'location', u'ideal', u'recognize', u'maid', u'staff', u'room', u'consistently', u'clean', u'number', u'based', u'observed', u'baldwin', u'better', u'maid', u'staffs', u'pleased', u'opted', u'baldwin', u'visit', u'san', u'francisco']",UR115086864
"[u'leg', u'trip', u'don', u't', u'ordinary', u'lobby', u'baldwin', u'small', u'english', u'bathrooms', u'perfectly', u'clean', u'well', u'serviced', u'star', u'clean', u'open', u'windows', u'excellent', u'money', u'avg', u'usd', u'night', u'booked', u'rooms', u'double', u'twin', u'teenage', u'children', u'booking', u'rooms', u'small', u'standards', u'large', u'walk', u'wardrobes', u'luggage', u'storage', u'staff', u'provided', u'early', u'morning', u'checkin', u'hr', u'flight', u'australia', u'usd', u'booked', u'taxis', u'held', u'luggage', u'day', u'happily', u'provided', u'requested', u'breakfast', u'facility', u'starbucks', u'corner', u'excellent', u'french', u'cafe', u'opposite', u'easy', u'walking', u'amenities', u'union', u'square', u'cable', u'car', u'restaurants', u'effort', u'catch', u'marrikesh', u'magic', u'fabulous', u'definitely']",UR80368031
"[u'baldwin', u'location', u'union', u'square', u'easy', u'cable', u'car', u'public', u'transport', u'problens', u'small', u'room', u'noise', u'air', u'conditioner', u'full', u'size', u'bed', u'small', u'couple', u'parking', u'lot', u'cost', u'day', u'ithe', u'internet', u'access', u'fast', u'cost', u'hours', u'exigent', u'choice']",UR82117252
"[u'nights', u'november', u'room', u'charge', u'reasonable', u'location', u'seconds', u'china', u'town', u'reach', u'place', u'foot', u'shops', u'restaurants', u'close', u'san', u'francisco', u'business']",UR85698578
"[u'visited', u'san', u'francisco', u'birthday', u'november', u'loved', u'linens', u'room', u'location', u'china', u'town', u'gate', u'small', u'rooms', u'surrounding', u'elevator', u'floors', u'room', u'sizes', u'vary', u'rear', u'corner', u'rooms', u'smallest', u'chose', u'read', u'garbagemen', u'pick', u'trash', u'early', u'morning', u'front', u'well', u'friends', u'front', u'heard', u'trash', u'pickup', u'thursday', u'night', u'complaint', u'recommend', u'front', u'larger', u'quieter', u'room']",UR87086754
"[u'thankfully', u'nights', u'location', u'union', u'square', u'dated', u'high', u'expectations', u'photos', u'booked', u'wasn', u't', u'expecting', u'ritz', u'disappointed', u'arrived', u'property', u'dated', u'expected', u'elevator', u'servicing', u'storey', u'walk', u'stairs', u'sick', u'waiting', u'long', u'rooms', u'ceiling', u'fan', u'floor', u'noisy', u'open', u'windows', u'entry', u'room', u'turn', u'key', u'lock', u'room', u'difficult', u'open', u'door', u'jam', u'time', u'tv', u'buzzing', u'noise', u'side', u'clean', u'staff', u'friendly', u'free', u'wifi', u'towel', u'animals', u'bed', u'day', u'cute', u'wouldn', u't', u'dated']",UR118830251
"[u'union', u'square', u'area', u'sf', u'pricey', u'baldwin', u'excellent', u'older', u'building', u'single', u'elevator', u'small', u'rooms', u'nyc', u'europe', u'extremely', u'clean', u'orderly', u'bathroom', u'decent', u'closet', u'surprisingly', u'large', u'location', u'excellent', u'stone', u'throw', u'chinatown', u'minute', u'walk', u'union', u'square', u'bart', u'definitely', u'recommend', u'budget']",UR118699112
"[u'complete', u'gem', u'location', u'absolutely', u'fantastic', u'walking', u'distance', u'bart', u'stations', u'cable', u'car', u'union', u'square', u'chinatown', u'front', u'desk', u'staff', u'rooms', u'tired', u'looked', u'cleaned', u'lot', u'years', u'cleaned', u'lot', u'bad', u'thing', u'room', u'shower', u'elevator', u'slow', u'apart', u'people', u'planning', u'lots', u'shopping', u'partying', u'san', u'francisco']",UR20817216
