Content,ReviewID
"[u'beautiful', u'staff', u'amazing', u'poolside', u'pleasure', u'convenient', u'local', u'shops', u'main', u'area', u'clarke', u'quay', u'walk', u'desinations', u'ease', u'single', u'problem', u'staff', u'housekeeping', u'staff', u'kind', u'pleasant', u'experience', u'planning', u'trip', u'singapore', u'february', u'cant', u'wait', u'park', u'clarke', u'quay', u'wonderful', u'exciting', u'experience']",UR38445283
"[u'enjoyed', u'staying', u'location', u'rooms', u'modern', u'clean', u'swimming', u'pool', u'area', u'real', u'bonus', u'negatives', u'perspective']",UR123201930
"[u'clean', u'modern', u'size', u'nite', u'break', u'pool', u'large', u'clean', u'review', u'problem', u'noise', u'choice', u'food', u'breakfast', u'situated', u'lively', u'clarke', u'quay', u'area', u'close', u'bar', u'restaurants', u'nite', u'club']",UR60419962
"[u'wonderful', u'upgraded', u'paid', u'extra', u'business', u'lounge', u'breakfast', u'afternoon', u'snack', u'evening', u'drinks', u'room', u'small', u'nicely', u'furnished', u'clean', u'bathroom', u'modern', u'real', u'floor', u'appeared', u'full', u'doors', u'started', u'banging', u'shut', u'early', u'hours', u'morning', u'sleepwise', u'wasn', u't', u'room', u'service', u'food', u'fresh', u'hot', u'drinks', u'chilled', u'busy', u'sightseeing', u'reached', u'pool', u'evenings', u'blissfully', u'quiet', u'relax', u'warmth', u'breakfast', u'pancakes', u'offer', u'problem', u'holiday', u'service', u'business', u'lounge', u'attentive', u'complaint', u'girls', u'reception', u'laughing', u'husband', u'checked', u'checked', u'address', u'staff', u'rude']",UR116643782
"[u'min', u'walk', u'clarke', u'quay', u'nights', u'enjoyed', u'night', u'staff', u'friendly', u'buffet', u'breakfast', u'decent', u'selection', u'foods', u'choose', u'room', u'pretty', u'views', u'city', u'pool', u'clarke', u'quay', u'night', u'lit', u'room', u'modern', u'furnishings', u'small', u'side', u'hey', u'place', u'crash', u'recharge', u'pool', u'hugh', u'day', u'beds', u'supermarket', u'road', u'cheap', u'beer', u'snacks', u'bad', u'thing', u'pillows', u'room', u'friends', u'hard', u'rock']",UR102025668
"[u'spent', u'three', u'nights', u'park', u'facilities', u'excellent', u'staff', u'friendly', u'ten', u'minute', u'walk', u'clark', u'quay', u'mrt', u'depending', u'mobility', u'well', u'cbd', u'island', u'level', u'cleanliness', u'exemplary', u'room', u'reasonable', u'size', u'city', u'problem', u'stowing', u'bags', u'wardrobe', u'provided', u'bathroom', u'facilities', u'superb', u'large', u'walk', u'shower', u'breakfast', u'excellent', u'wide', u'range', u'fresh', u'freshly', u'cooked', u'food', u'suite', u'reasonable', u'tastes', u'dining', u'area', u'busy', u'breakfast', u'large', u'busy', u'well', u'establishment', u'excellent', u'swimming', u'pool', u'dip', u'relaxing', u'sunbeds', u'night', u'time', u'flight', u'reception', u'late', u'check', u'time', u'extra', u'cost', u'hours', u'checking', u'free', u'room', u'shower', u'freshen', u'collecting', u'luggage', u'stored', u'excellent', u'visit', u'singapore', u'work', u'park', u'employee']",UR126211296
"[u'service', u'received', u'prompt', u'efficient', u'room', u'tad', u'bit', u'small', u'side', u'don', u't', u'bring', u'big', u'suitcase', u'space', u'cupboard', u'insufficient', u'perfect', u'description', u'cozy', u'rooms', u'clean', u'club', u'room', u'club', u'facilities', u'smoking', u'room', u'smoker', u'location', u'perfect', u'min', u'clark', u'quay', u'mrt', u'complimentary', u'shuttle', u'service', u'amenities', u'definitely']",UR65031825
"[u'park', u'clark', u'quay', u'eve', u'year', u'family', u'relax', u'rejuvenate', u'perfect', u'location', u'pore', u'river', u'singapore', u'clark', u'quay', u'bungy', u'max', u'room', u'small', u'super', u'clean', u'comfortable', u'room', u'stylish', u'design', u'well', u'pool', u'jacuzzi', u'well', u'view', u'night', u'experience']",UR60300759
"[u'close', u'action', u'clarke', u'quay', u'days', u'stopover', u'rooms', u'small', u'adequate', u'pool', u'area', u'cooling', u'breakfast', u'previousley', u'mentioed', u'bit', u'scrum', u'table', u'space', u'guests', u'sit', u'early', u'don', u't', u'leave', u'table', u'unattended', u'sitting']",UR114733252
"[u'town', u'singapore', u'air', u'nights', u'staff', u'wonderful', u'crystal', u'club', u'lounge', u'serves', u'breatfast', u'wonderful', u'happy', u'hour', u'easy', u'walking', u'distance', u'variety', u'restuarants', u'nightlife', u'ckark', u'quay', u'singapore', u'river', u'pool', u'outdoor', u'bar', u'drink', u'food', u'class', u'reasonable', u'rates']",UR125078378
"[u'service', u'bad', u'improvement', u'asked', u'aroom', u'bathtub', u'weeks', u'beforedeparture', u'arrival', u'request', u'handled', u'well', u've', u'room', u'changed', u'day', u'smoking', u'floor', u'hv', u'considered', u'travelled', u'kids', u'smoking', u'room', u'accept', u'changing', u'room', u'smoking', u'floor', u'work', u'professionally', u'location', u'mins', u'walk', u'clarke', u'quay', u'swimming', u'pool', u'big']",UR61870206
"[u'spent', u'weekend', u'weekend', u'wife', u'thing', u'stood', u'service', u'initially', u'upgraded', u'deluxe', u'higher', u'floor', u'request', u'river', u'pleasant', u'relaxing', u'pool', u'view', u'xin', u'yuan', u'help', u'staff', u'generally', u'friendly', u'breakfast', u'staff', u'appeared', u'wore', u'frowns', u'faces', u'high', u'volume', u'traffic', u'location', u'wise', u'question', u'ideally', u'clarke', u'quay', u'singapore', u'river', u'minutes', u'orchard', u'road', u'cab', u'nuff', u'amenities', u'lobby', u'cozy', u'flanked', u'internet', u'terminals', u'corner', u'restaurant', u'side', u'lifts', u'spanking', u'overheard', u'guests', u'marvel', u'interior', u'swimming', u'pool', u'centrepiece', u'jacuzzi', u'side', u'huge', u'stone', u'slabs', u'people', u'cross', u'minus', u'sauna', u'shower', u'facilities', u'pool', u'level', u't', u'thought', u'parking', u'spaces', u'space', u'cars', u'lots', u'restaurants', u'filling', u'lots', u'trays', u'dishes', u'strangely', u'guests', u't', u'enter', u'directly', u'lobby', u't', u'impression', u'goodness', u'rest', u'experience', u'room', u'wise', u'small', u'equipped', u'fridge', u'coffee', u'tea', u'lcd', u'tv', u'desk', u'table', u'visited', u'equal', u'admittedly', u'better', u'calibre', u'singapore', u'surprised', u'things', u'amiss', u'bathtub', u'explanation', u'needed', u'placement', u'tv', u'ports', u'plug', u'tv', u'provide', u'dedicated', u'panel', u'display', u'audio', u'jacks', u'conveniently', u'users', u'plug', u'surprising', u'considering', u'newest', u'singapore', u'complimentary', u'water', u'default', u'fair', u'cozy', u'room', u'view', u'spent', u'lots', u'time', u'enjoying', u'relaxing', u'view', u'room', u'amenities', u'wise', u'package', u'locals', u'tickets', u'river', u'taxi', u'return', u'trip', u'fullerton', u'extended', u'checkout', u'time', u'pm', u'breakfast', u'complimentary', u'internet', u'park', u'keep', u'promo']",UR46607147
"[u'days', u'melbourne', u'lovely', u'staff', u'breakfast', u'location', u'close', u'clarke', u'quay', u'highly', u'recommend']",UR122918960
"[u'booked', u'agent', u'uk', u'premier', u'travel', u'booked', u'dec', u'january', u'nights', u'arrived', u'room', u'whilst', u'beautifully', u'decorated', u'smallest', u'room', u'wardrobe', u'ft', u'inches', u'wide', u'accommodate', u'suit', u'pair', u'trousers', u'shirt', u'bearing', u'mind', u'nights', u'room', u'totally', u'inadequate', u'complaints', u'management', u'fell', u'deaf', u'ears', u'insisted', u'rooms', u'size', u'live', u'suitcases', u'nights', u'large', u'cases', u'apart', u'storing', u'vertically', u'top', u'oneanother', u'nights', u'totally', u'inadequate', u'nights']",UR91661589
"[u'dont', u'mislead', u'booking', u'website', u'absolutely', u'star', u'staff', u'service', u'improved', u'offered', u'room', u'poor', u'view', u've', u'booked', u'deluxe', u'room', u'travel', u'agent', u'coz', u'paid', u'called', u'front', u'desk', u'mistake', u'offered', u'room', u'city', u'view', u'nicer', u'generally', u'room', u'small', u'breakfast', u'emmm', u'simply', u'edible', u'brought', u'towel', u'bathroom', u'towel', u'bad', u'quality']",UR86737946
"[u'nights', u'stopover', u'en', u'route', u'australia', u'spotlessly', u'clean', u'comfortable', u'small', u'room', u'adequate', u'bathroom', u'drainage', u'system', u'bit', u'noisy', u'hear', u'people', u'shower', u'irritating', u'early', u'morning', u'late', u'night', u'lovely', u'view', u'overlooking', u'water', u'easy', u'walking', u'distance', u'clarke', u'quay', u'metro', u'system', u'singapore', u'quick', u'easy', u'free', u'wi', u'fi', u'lobby', u'print', u'things', u'required', u'staff', u'extremely', u'friendly', u'trouble', u'advice', u'definitely', u'visiting', u'singapore']",UR117121524
"[u'wonderful', u'place', u'brand', u'feeling', u'rooms', u'restaraunts', u'gym', u'lifts', u'glowing', u'expecting', u'noise', u'construction', u'noise', u'nights', u'rest', u'locaton', u'ideal', u'clark', u'quay', u'orchard', u'raffles', u'place', u'doorstep', u'brand', u'city', u'singapore', u'highly', u'reccomend']",UR33779064
"[u'nights', u'three', u'days', u'whilst', u'waiting', u'join', u'cruise', u'ship', u'staff', u'extremely', u'attentive', u'rooms', u'massive', u'adequate', u'purposes', u'sleep', u'rooms', u'sightseeing', u'day', u'breakfast', u'die', u'people', u'poor', u'selection', u'beautiful', u'start', u'day', u'rooms', u'spotless', u'bathroom', u'fitted', u'choice', u'shower', u'heads', u'full', u'range', u'power', u'spray', u'pattern', u'class', u'fault', u'single', u'service']",UR125855623
"[u'location', u'thing', u'opposite', u'robinson', u'quarter', u'missed', u'thought', u'residential', u'area', u'fantastic', u'places', u'eat', u'person', u'met', u'sentosa', u'well', u'worth', u'visit', u'shopping', u'die']",UR116085851
"[u'located', u'close', u'robertson', u'quai', u'city', u'center', u'singapore', u'service', u'stuff', u'lobby', u'rooms', u'clean', u'crystalclub', u'floor', u'lounge', u'outstanding', u'service', u'team', u'roomservice', u'friendly', u'internet', u'minibar', u'room', u'cable', u'tv', u'international', u'channels', u'poolside', u'clean', u'star', u'deservers', u'stars', u'breakfast', u'rich', u'fresh', u'lot', u'bars', u'restaurants', u'located', u'walking', u'distance', u'small', u'shoppingmall', u'side', u'street', u'taxis', u'availeble', u'hours', u'ordered', u'front', u'lobby', u'special', u'team', u'crystalclub', u'recomend']",UR115659892
"[u'rooms', u'small', u'regular', u'neighboring', u'guest', u'bigger', u'room', u'corner', u'room', u'guessing', u'compact', u'well', u'club', u'lounge', u'small', u'busy', u'staff', u'walk', u'merlion', u'lovely', u'lots', u'places', u'eat', u'drink', u'relax', u'enroute', u'location', u'reviews', u'functional', u'special']",UR124414125
"[u'january', u'three', u'nights', u'location', u'short', u'walk', u'clarke', u'quay', u'pool', u'decent', u'size', u'sunbeds', u'located', u'pool', u'view', u'singapore', u'river', u'cbd', u'deck', u'room', u'small', u'basics', u'free', u'wireless', u'internet', u'lobby', u'tedious', u'sign', u'process', u'gym', u'latest', u'equipment', u'represent', u'money']",UR96119121
"[u'completed', u'days', u'park', u'location', u'easy', u'access', u'town', u'centre', u'locations', u'close', u'metro', u'buses', u'taxis', u'staff', u'friendly', u'ready', u'assist', u'issues', u'arranged', u'breakfast', u'quality', u'varied', u'well', u'worth', u'considering', u'provided', u'money']",UR126656183
"[u'metre', u'bed', u'wall', u'tv', u'protruding', u'people', u'pass', u'time', u'luggage', u'square', u'metre', u'carpet', u'walk', u'literally', u'inch', u'fullest', u'space', u'luxury', u'place', u'space', u'deal', u'pay', u'extra', u'service', u'room', u'clean', u'breakfast', u'runny', u'omelettes', u'pool', u'easy', u'access', u'elderly', u'advertises', u'disable', u'friendly', u'elevator', u'rest', u'disable', u'friendly']",UR105898216
"[u'park', u'three', u'night', u'business', u'trip', u'absolutely', u'fine', u'special', u'price', u'happily', u'recommend', u'points', u'early', u'check', u'overnight', u'flight', u'london', u'pm', u'late', u'check', u'arranged', u'problems', u'extra', u'charge', u'breakfast', u'fine', u'fairly', u'priced', u'location', u'excellent', u'travelling', u'perfect', u'early', u'morning', u'jog', u'singapore', u'river', u'endless', u'options', u'bars', u'restaurants', u'doorstep', u'people', u'watching', u'dinner', u'points', u'wi', u'fi', u'rooms', u'free', u'wi', u'fi', u'reception', u'pool', u'restaurant', u'small', u'crowded', u'breakfast', u'sleep', u'quality', u'distinctly', u'average', u'poor', u'noise', u'insulation', u'low', u'quality', u'pillows', u'service', u'cheerful', u'efficient', u'round', u'perfectly', u'option', u'central', u'dependable']",UR124278089
"[u'husband', u'nights', u'fabulous', u'weeks', u'vietnam', u'singapore', u'favourite', u'destination', u'arrival', u'smoking', u'floor', u'notice', u'stepped', u'lift', u'smell', u'hit', u'rang', u'reception', u'told', u'equal', u'room', u'day', u'requested', u'smoking', u'better', u'assume', u'guests', u'smoke', u'round', u'staying', u'singapore', u'birthday', u'celebrations', u'disappointing', u'rooms', u'tiny', u'ledges', u'cases', u'floor', u'space', u'cases', u'open', u'position', u'convenient', u'mrt', u'station', u'opens', u'better', u'young', u'girl', u'desk', u'checked', u'raise', u'smile']",UR126952509
"[u'rooms', u'service', u'pleasant', u'view', u'room', u'overlooked', u'lovely', u'pool', u'area', u'reception', u'desk', u'help', u'kinds', u'info', u'proximity', u'eateries', u'bars', u'clarke', u'quay']",UR120488988
"[u'arrived', u'delayed', u'flight', u'staff', u'couldn', u't', u'room', u'staff', u'continued', u'attentive', u'room', u'wee', u'bit', u'small', u'adequate', u'room', u'second', u'floor', u'overlooking', u'pool', u'avoid', u'room', u'gents', u'toilet', u'problem', u'flush', u'noisy', u'course', u'toilet', u'time', u'day', u'night', u'room', u'free', u'tea', u'coffee', u'usual', u'minibar', u'internet', u'connection', u'charged', u'lacks', u'pack', u'outlining', u'services', u'amenities', u'concierge', u'reception', u'views', u'rooms', u'front', u'views', u'side', u'well', u'worth', u'making', u'sure', u'view', u'breakfasts', u'queue', u'eggs', u'cooked', u'choice', u'suit', u'tastes', u'basics', u'day', u'day', u've', u'curried', u'chickpeas', u'breakfast', u'well', u'worth', u'location', u'minutes', u'walk', u'large', u'choice', u'restaurants', u'bars', u'exit', u'turn', u'left', u'walk', u'river', u'river', u'sights', u'attractions', u'shopping', u'malls', u'walking', u'distance', u'taxis', u'cheap', u'alternative', u'days', u'returning']",UR49199211
"[u'location', u'minutes', u'walk', u'river', u'clarke', u'quay', u'unexpectedly', u'meal', u'clean', u'room']",UR83094695
"[u'returned', u'weeks', u'crystal', u'club', u'superior', u'room', u'reviewers', u'stated', u'room', u'small', u'sqm', u'struggled', u'weeks', u'person', u'room', u'rooms', u'well', u'set', u'scrupulously', u'clean', u'room', u'service', u'day', u'package', u'excellent', u'money', u'singapore', u'daily', u'breakfast', u'items', u'laundry', u'unlimited', u'internet', u'afternoon', u'tea', u'hours', u'drinks', u'canap', u'evening', u'area', u'lots', u'restaurant', u'choices', u'ten', u'minute', u'walk', u'clark', u'quay', u'mrt', u'taxi', u'science', u'park', u'morning', u'wait', u'taxis', u'front', u'definitely']",UR121712226
"[u'nights', u'booking', u'website', u'hubby', u'arrived', u'hour', u'woww', u'entered', u'room', u'surpriseee', u'yeaayy', u'corner', u'room', u'river', u'view', u'pool', u'view', u'breakfast', u'boring', u'standard', u'menu', u'better', u'explore', u'breakfast', u'oww', u'mrt', u'station', u'minutes', u'walk', u'bit', u'tortured', u'arrived', u'changi', u'mrt', u'bring', u'luggage', u'tired', u'walking', u'spore']",UR122854357
"[u'neat', u'clean', u'reception', u'staff', u'cooperative', u'room', u'comfortable', u'bathroom', u'small', u'wisely', u'designed', u'lobby', u'staff', u'informative', u'kind', u'senior', u'citizens', u'thing', u'room', u'service', u'poor', u'upto', u'mark', u'comfortable', u'thing', u'write', u'location', u'excellent', u'tourist']",UR82592722
"[u'nights', u'en', u'route', u'uk', u'bali', u'arrived', u'mid', u'afternoon', u'overnight', u'flight', u'check', u'separate', u'members', u'staff', u'massive', u'amounts', u'staff', u'location', u'ideal', u'minutes', u'walk', u'bars', u'restaurants', u'clarke', u'quay', u'riverside', u'path', u'leading', u'boat', u'quay', u'cbd', u'merlion', u'rooms', u'small', u'adequate', u'night', u'clean', u'modern', u'breakfast', u'usual', u'buffet', u'mix', u'east', u'meets', u'west', u'omelettes', u'swimming', u'pool', u'fairly', u'quiet', u'place', u'cool', u'heat', u'find', u'shade']",UR116816229
"[u'wife', u'park', u'clarke', u'quay', u'nights', u'leaving', u'april', u'crystal', u'club', u'attentativeness', u'staff', u'evelyn', u'sue', u'alexis', u'trouble', u'produced', u'birthday', u'cake', u'wife', u'birthday', u'forget', u'surprises', u'wife', u'faces', u'singing', u'happy', u'birthday', u'views', u'room', u'clarke', u'quay', u'night', u'location', u'access', u'clarke', u'quay', u'central', u'major', u'shopping', u'centres', u'attractions', u'staff', u'assist', u'negatives', u'check', u'impersonal', u'informative', u'counted', u'staff', u'crystal', u'club', u'towels', u'provided', u'rooms', u'updated', u'renewed', u'defintely']",UR127800531
"[u'well', u'situated', u'explore', u'main', u'delights', u'singapore', u'jsut', u'minutes', u'walk', u'singapore', u'river', u'hitch', u'ride', u'famous', u'bum', u'boats', u'explore', u'harbour', u'room', u'superior', u'room', u'describe', u'small', u'well', u'understaing', u'truth', u'internet', u'pictures', u'superior', u'room', u'spacious', u'airy', u'reality', u'polar', u'opposite', u'small', u'wardrobe', u'storage', u'draws', u'room', u'impossible', u'unpack', u'clothes', u'living', u'suitcases', u'left', u'room', u'removes', u'remaining', u'space', u'staff', u'friendly', u'rated', u'average', u'poor', u'space', u'issue', u'walk', u'bed', u'consider']",UR124540351
"[u'nights', u'stopover', u'singapur', u'clarke', u'quay', u'lots', u'entertainment', u'restaurants', u'walk', u'easily', u'river', u'marina', u'orchard', u'road', u'rooms', u'modern', u'small', u'difficult', u'find', u'space', u'suitcases', u'room', u't', u'view', u'better', u'rooms', u'upper', u'floors', u'poolarea', u'spacious', u'breakfast', u'dissapointing', u'decided', u'breakfast', u'paid', u'choice', u'food', u'poor', u'quality', u'breakfast', u'area', u'small', u'big', u'wait', u'seated', u'restaurant', u'basically', u'lobby', u'short', u'find', u'better', u'singapur', u'price']",UR120466981
"[u'nights', u'independent', u'tour', u'malaysia', u'flown', u'singapore', u'airlines', u'club', u'floor', u'room', u'witrh', u'access', u'special', u'lounge', u'day', u'free', u'soft', u'drinks', u'happy', u'hour', u'free', u'cocktails', u'hors', u'oeuvres', u'booked', u'room', u'river', u'views', u'unhelpfully', u'facing', u'opposite', u'direction', u'eventually', u'changed', u'room', u'remarkably', u'small', u'space', u'suitcase', u'mine', u'laid', u'floor', u'clothes', u'drawers', u'hanging', u'rails', u'room', u'looked', u'fashioned', u'renovation', u'flat', u'screen', u'tv', u'tv', u'channels', u'dreadful', u'location', u'fairly', u'short', u'walk', u'bright', u'lights', u'clarke', u'quay', u'cross', u'clemenceau', u'avenue', u'circuitous', u'route', u'underpass', u'staff', u'breakfast', u'average', u'limited', u'choice', u'small', u'size', u'room', u'considering', u'staying']",UR115968349
"[u'looked', u'reservation', u'staff', u'sadly', u'number', u'issue', u'sat', u'side', u'evening', u'ordered', u'drinks', u'told', u'wait', u'mins', u'drinks', u'room', u'clean', u'small', u'basically', u'case', u'bed', u'clothes', u'asked', u'upgrading', u'floor', u'told', u'type', u'room', u'upgrade', u'floor', u'space', u'difference', u'higher', u'floor', u'better', u'view', u'staff', u'general', u'lacked', u'consistency', u'question', u'staff', u'mixed', u'messages', u'customers', u'pan', u'pacific', u'singapore', u'better', u'experience', u'definatelly', u'park']",UR125923997
"[u'imagine', u'paying', u'room', u'night', u'imagine', u'room', u'small', u'standard', u'star', u'room', u'imagine', u'breakfast', u'internet', u'access', u'bathtub', u'alarm', u'clock', u'hairdryer', u'included', u'don', u't', u'alarm', u'clock', u'woken', u'noise', u'service', u'crew', u'ringing', u'doorbells', u'hall', u'sound', u'flushing', u'water', u'running', u'sewage', u'pipes', u'rooms', u'don', u't', u'dare', u'touching', u'water', u'basin', u'hear', u'sewage', u'water', u'running', u'feet', u'find', u'unacceptable', u'star', u'morning', u'overzealous', u'staff', u'member', u'rang', u'doorbell', u'waking', u'opened', u'door', u'laying', u'half', u'naked', u'beds', u'fancy', u'praised', u'internet', u'pay', u'ridiculous', u'singapore', u'opinion', u'overpriced', u'big', u'fancy', u'names', u'absolutely', u'content', u'low', u'quality']",UR92230598
"[u'clean', u'staff', u'location', u'clarke', u'quay', u'restaurants', u'provide', u'shuttle', u'bus', u'parts', u'city', u'minutes', u'walk', u'closest', u'mrt', u'station', u'pool', u'outdoor', u'area', u'breakfast', u'simple', u'pointed', u'bed', u'bit', u'comfy']",UR119407603
"[u'approx', u'mins', u'drive', u'changi', u'airport', u'taxi', u'sd', u'well', u'located', u'singapore', u'river', u'clarke', u'quay', u'robertson', u'quay', u'minutes', u'lots', u'bars', u'restaurants', u'incl', u'european', u'food', u'shopping', u'malls', u'nearby', u'nearest', u'mrt', u'station', u'mins', u'clarke', u'quay', u'shopping', u'heaven', u'orchard', u'road', u'mins', u'walking', u'lobby', u'big', u'staff', u'efficient', u'free', u'wifi', u'ground', u'floor', u'floor', u'floor', u'ethernet', u'outlet', u'room', u'wired', u'internet', u'connection', u'free', u'superiour', u'rooms', u'small', u'lot', u'space', u'luggage', u'clean', u'condition', u'beds', u'sleep', u'well', u'airco', u'quiet', u'bathroom', u'well', u'equipped', u'rainshower', u'refreshing', u'size', u'outdoors', u'swimming', u'pool', u'whirlpool', u'showers', u'changeroom', u'bar', u'restaurant', u'serves', u'food', u'seafood', u'buffet', u'coffee', u'disappointing', u'luckily', u'starbucks', u'mins', u'croissants', u'muffins', u'don', u't', u'big', u'breakfast', u'conclusion', u'fine', u'location', u'friendly', u'staff']",UR125704467
"[u'husband', u'regular', u'visitors', u'singapore', u'occasion', u'park', u'weeks', u'pretty', u'long', u'time', u'staff', u'friendly', u'apart', u'sullen', u'barman', u'restaurant', u'rooms', u'clean', u'comfortable', u'albeit', u'small', u'side', u'pool', u'fine', u'service', u'men', u'carkpark', u'major', u'downside', u'reception', u'restaurant', u'area', u'side', u'ground', u'floor', u'meaning', u'breakfast', u'esp', u'manic', u'sit', u'breakfast', u'carpark', u'coach', u'area', u'meaning', u'vehicle', u'fumes', u'table', u'ideal', u'atmosphere', u'pretty', u'chaotic', u'guests', u'check', u'tour', u'groups', u'coming', u'going', u'relaxing', u'day', u'enjoy', u'weeks', u'staff', u'knew', u'felt', u'sad', u'leave', u'second', u'choice', u'lots', u'singapore', u'discover', u'overly', u'attached', u'enjoyable', u'excited', u'singapore', u'offer']",UR105133114
"[u'staff', u'park', u'assist', u'request', u'front', u'door', u'staff', u'men', u'white', u'club', u'room', u'staff', u'joy', u'interact', u'raj', u'pool', u'cheerful', u'despite', u'heat', u'day', u'sell', u'beers', u'soft', u'drinks', u'downside', u'rooms', u'order', u'twin', u'room', u'beware', u'large', u'piece', u'glass', u'table', u'bed', u'find', u'middle', u'night', u'face', u'glass', u'extends', u'table', u'edge', u'pillow', u'queen', u'rooms', u'size', u'small', u'extended', u'room', u'order', u'room', u'swing', u'cat', u'luggage', u'floor', u'room', u'showing', u'signs', u'age', u'poor', u'build', u'quality', u'years', u'ceiling', u'cornices', u'edges', u'beware', u'glossy', u'reviews', u'staff', u'unashamedly', u'prompt', u'write', u'review', u'assistance', u'course']",UR103351685
"[u'modern', u'located', u'close', u'popular', u'clarke', u'quay', u'restaurant', u'area', u'smart', u'inside', u'rooms', u'modern', u'clean', u'rooms', u'public', u'spaces', u'spacious', u'lobby', u'restaurant', u'bar', u'pretty', u'small', u'size', u'mins', u'walk', u'clarke', u'quay', u'restaurant', u'area', u'mins', u'mrt', u'subway', u'station', u'offer', u'free', u'bus', u'shuttle', u'loops', u'mrt', u'raffles', u'place', u'orchard', u'road', u'hour', u'clarke', u'quay', u'theme', u'park', u'lots', u'european', u'style', u'restaurants', u'branded', u'franchises', u'preferred', u'boat', u'quay', u'extra', u'mins', u'walk', u'river', u'singaporean', u'fare', u'better', u'views', u'river', u'night']",UR115886917
