Content,ReviewID
"[u'returned', u'singapore', u'nights', u'accommodation', u'park', u'late', u'checking', u'club', u'room', u'separate', u'check', u'desk', u'check', u'seamless', u'room', u'floor', u'virtually', u'opposite', u'club', u'lounge', u'breakfast', u'hot', u'cold', u'drinks', u'biscuits', u'day', u'pm', u'pm', u'alcoholic', u'beverages', u'served', u'buffet', u'substantial', u'meal', u'drinks', u'staff', u'extremely', u'attentive', u'cheerful', u'jessica', u'looked', u'time', u'ensured', u'wanted', u'generally', u'staff', u'club', u'lounge', u'extremely', u'advice', u'asked', u'breakfast', u'variety', u'eggs', u'bacon', u'toast', u'croissants', u'singapore', u'dishes', u'tea', u'coffee', u'flowing', u'evening', u'buffet', u'equally', u'set', u'minutes', u'walk', u'clarke', u'quay', u'shops', u'river', u'rooms', u'small', u'bit', u'juggling', u'suitcases', u'reception', u'desk', u'ground', u'floor', u'busy', u'lot', u'time', u'staff', u't', u'cope', u'well', u'busy', u't', u'realize', u'left', u'club', u'rooms', u'reception', u'club', u'lounge', u'finally', u'arrangement', u'room', u'facility', u'freshen', u'depart', u'change', u'served', u'arrangement', u'booking', u'system', u'needed', u'fully', u'booked', u'day', u'departure', u'leave', u'room', u'noon', u'understood', u'room', u'prior', u'departure', u'couldn', u't', u'book', u'room', u'swim', u'pm', u'told', u'couples', u'front', u'couldn', u't', u'room', u'hour', u'realized', u'queue', u'earlier', u'leave', u'pm', u't', u'time', u'shower', u'change', u'manager', u'early', u'manage', u'rush', u'room', u'decided', u'club', u'lounge', u'snack', u'drink', u'changed', u'hair', u'wet', u'fed', u'situation', u'decided', u'club', u'lounge', u'noticed', u'room', u'cleaned', u'pm', u'room', u'disappointing', u'apart', u'late', u'check', u'club', u'room']",UR126616183
"[u'failry', u'rooms', u'tiny', u'tiy', u'place', u'suitcase', u'closet', u'suitcase', u'ended', u'moving', u'furniture', u'corner', u'putting', u'suitcases', u'ground', u'bearly', u'move', u'room', u'room', u'itselve', u'well', u'appointed', u'small', u'service', u'wasn', u't', u'suspected', u'priciest', u'week', u'trip', u'friendly', u'smile', u'help', u'service', u'breakfast', u'joke', u't', u'room', u'seat', u'people', u'stand', u'day', u'inside', u'prayer', u'glass', u'juice', u'availabl', u'day', u'clean', u'glasses', u'brought', u'people', u'juice', u'machine', u'wouldn', u't', u'chance', u'clean', u'glass', u'service', u'rude', u'directions', u't', u'work', u'shuvved', u'taxi', u'altough', u'minute', u'walk', u'walked', u'main', u'shopping', u'road', u'malls', u'day', u'minutes', u'middle', u'things', u'bit', u'recommand', u'price', u'service', u'rooms', u'free', u'internet', u'btw']",UR77692215
"[u'located', u'river', u'short', u'walk', u'nightlife', u'area', u'clarke', u'quey', u'swimming', u'pool', u'excellent', u'restaurant', u'rooms', u'small', u'side', u'receptionists', u'arrogant', u'generally', u'unfriendely', u'internet', u'computers', u'lobby', u'secure', u'accounts', u'hijacked', u'computers', u'restaurant', u'staff', u'friendely', u'touble']",UR115235274
"[u'chance', u'list', u'company', u'selected', u'week', u'elegant', u'clean', u'rooms', u'comfortable', u'things', u'disappointing', u'room', u'universal', u'adapter', u'colleague', u'mine', u'staying', u'room', u'reception', u'told', u'find', u'room', u'returned', u'evening', u'happen', u'conversations', u'escalation', u'sales', u'manager', u'find', u'offer', u'buy', u'investment', u'bad', u'note', u'visit', u'service', u'breakfast', u'concierge', u'bellhops', u'proximity', u'clarke', u'quay', u'restaurant', u'choices', u'return', u'singapore', u'compare', u'sure', u'enjoy', u'thing', u'strike', u'odd', u'weeks', u'staff', u'serving', u'breakfast', u'day', u'sure', u'long', u'allow', u'familiarity', u'build', u'staff', u'note', u'people', u'person', u'personal', u'links', u'service', u'kind', u'felt', u'training', u'environment', u'day']",UR114623922
"[u'arrived', u'expecting', u'wait', u'afternoon', u'room', u'settled', u'clean', u'room', u'views', u'pool', u'small', u'hey', u'sleeping', u'easy', u'walk', u'clarke', u'quay', u'mrt', u'fact', u'short', u'walk', u'places', u'poolside', u'bar', u'service', u'slow', u'exsistant', u'days', u'small', u'detail', u'restaurant', u'looked', u'places', u'sing', u'eat', u'cheaper', u'night']",UR77619157
"[u'room', u'clean', u'supposed', u'superior', u'room', u'small', u'pool', u'lovely', u'staff', u'bus', u'service', u'singapore']",UR96061456
"[u'loved', u'paid', u'extra', u'club', u'room', u'room', u'clean', u'modern', u'quiet', u'slept', u'well', u'club', u'lounge', u'staff', u'incredibly', u'friendly', u'free', u'high', u'speed', u'internet', u'free', u'generous', u'alcoholic', u'drinks', u'substantial', u'snacks', u'hours', u'evening', u'lounge', u'included', u'club', u'buffet', u'breakfast', u'day', u'staff', u'bring', u'unlimited', u'alcoholic', u'drinks', u'lounge', u'smaller', u'snacks', u'afternoon', u'tea', u'included', u'club', u'room', u'rate', u'benefit', u'free', u'items', u'laundry', u'day', u'staff', u'advice', u'places', u'late', u'check', u'final', u'day', u'brilliant', u'offers', u'free', u'bus', u'shuttle', u'service', u'main', u'sights', u'singapore', u'brilliant', u'sure', u'timetable', u'check', u'swimming', u'pool', u'pool', u've', u'huge', u'loungers', u'size', u'complaint', u'jacuzzi', u'jets', u'definitely', u'swim', u'lengths', u'pool', u'definitely']",UR88388961
"[u'reviewers', u'modern', u'clean', u'location', u'staff', u'encountered', u'exception', u'efficient', u'rooms', u'well', u'fitted', u'quality', u'linen', u'towels', u'small', u'couple', u'bit', u'space', u'surprised', u'room', u'free', u'wi', u'fi', u'access', u'lobby', u'area', u'laptop', u'reception', u'staff', u'type', u'code', u'bit', u'strange', u't', u'eat', u'food', u'drink', u'expensive', u'lot', u'singapore', u'subway', u'mall', u'opposite', u'basic', u'breakfast', u'deal', u'singapore', u'dollars', u'free', u'tea', u'coffee', u'room', u'prices', u'general', u'singapore', u'felt', u'fair', u'deal', u'room', u'night', u'complimentary', u'shuttle', u'bus', u'saves', u'bit', u'money', u'eating', u'local', u'food', u'stalls', u'cafes', u'corner', u'central', u'singapore', u'recommend', u'price']",UR122173476
"[u'luxurious', u'frienldy', u'professional', u'staff', u'close', u'bus', u'station']",UR46452048
"[u'couple', u'times', u'business', u'trips', u'room', u'location', u'minutes', u'walking', u'clarke', u'quay', u'singapore', u'river', u'plenty', u'bars', u'restaurants', u'shops', u'concierge', u'supre', u'friendly', u'outdoor', u'pool', u'money']",UR119347268
"[u'stopover', u'brisbane', u'realy', u'reception', u'arrived', u'early', u'room', u'floor', u'crystal', u'club', u'floor', u'business', u'class', u'kids', u'breakfast', u'floor', u'restaraunt', u'ground', u'floor', u'rest', u'guests', u'included', u'drinks', u'nibbles', u'floor', u'pool', u'area', u'decided', u'book', u'crystal', u'club', u'deluxe', u'well', u'looked']",UR119867702
"[u'nights', u'imagine', u'clean', u'room', u'entering', u'walk', u'round', u'corner', u'bathroom', u'left', u'frosted', u'door', u'continue', u'bedroom', u'turn', u'wall', u'bathroom', u'clear', u'glass', u'fantastic', u'shower', u'room', u'toilet', u'sink', u'area', u'strange', u'couples', u'starting', u'relationship', u'views', u'window', u'pool', u'shopping', u'food', u'place', u'malls', u'don', u't', u'going', u'mid', u'afternoon', u'evenings', u'china', u'town', u'going', u'evening', u'food', u'stalls', u'food', u'street', u'cheap', u'find', u'small', u'shopping', u'centre', u'upstairs', u'food', u'hall', u'locals', u'food', u'cheap', u'thought', u'raffles', u'lunch', u'dressed', u'arrived', u'people', u'walking', u'round', u'shorts', u'flip', u'flops', u'guess', u'allowed', u'restaurants', u'dressed', u'decide', u'long', u'bar', u'sit', u'eat', u'peanuts', u'throwing', u'shells', u'floor', u'coke', u'beer', u'cost', u'singapore', u'dollars', u'ouch', u'pool', u'lovely', u'depth', u'parts', u'plenty', u'towels', u'comfortable', u'beds', u'word', u'advise', u'flag', u'taxi', u'pm', u'find', u'taxi', u'rank', u'ages', u'realising']",UR67623923
"[u'park', u'clarke', u'quay', u'nicely', u'located', u'busy', u'city', u'limits', u'coupled', u'fantastic', u'view', u'crystal', u'lounge', u'wonderful', u'spend', u'weekends', u'walking', u'distance', u'water', u'drinking', u'holes', u'clarke', u'quay', u'well', u'team', u'attentive', u'parts', u'warm', u'serviceis', u'local', u'internationial', u'guests', u'highly', u'recommended', u'peopole', u'regret']",UR77197474
"[u'park', u'situated', u'minute', u'walk', u'lovely', u'bars', u'clubs', u'expensive', u'worth', u'clubbing', u'zouk', u'buy', u'lonely', u'planet', u'guide', u'amazing', u'views', u'breakfast', u'road', u'starbucks', u'deli', u'france', u'night', u'flash', u'enjoy']",UR122176846
"[u'upgraded', u'crystal', u'club', u'tenth', u'floor', u'friendly', u'convenient', u'location', u'chinatown', u'orchard', u'road', u'locations', u'view', u'fantastic']",UR121902703
"[u'chose', u'park', u'clarke', u'quay', u'location', u'cheap', u'taxi', u'ride', u'orchard', u'road', u'chinatown', u'tiong', u'bahru', u'market', u'shopping', u'excellent', u'undercover', u'parking', u'front', u'taxis', u'pick', u'friends', u'underground', u'carpark', u'friends', u'relatives', u'longer', u'visit', u'free', u'parking', u'bonus', u'room', u'small', u'sufficient', u'including', u'walkers', u'three', u'wheels', u'wheels', u'view', u'club', u'lounge', u'fantastic', u'view', u'singapore', u'river', u'surrounds', u'joy', u'watching', u'bum', u'boats', u'river', u'staff', u'crystal', u'club', u'attentive', u'providing', u'service', u'happy', u'hour', u'pm', u'pm', u'daily', u'pleasant', u'break', u'shopping', u'drinks', u'nibbles', u'served', u'club', u'lounge', u'club', u'members', u'attended', u'enjoyed', u'second', u'visit', u'return', u'third', u'year']",UR126087892
"[u'november', u'shuttle', u'bus', u'close', u'undrerground', u'hop', u'hop', u'bus', u'room', u'overlooking', u'pool', u'floor', u'restaurant', u'staff', u'excellent', u'departments']",UR121398787
"[u'singapore', u'night', u'vacation', u'meet', u'friends', u'reviews', u'tripadvisor', u'entered', u'room', u'impression', u'clean', u'urban', u'style', u'room', u'bit', u'small', u'people', u'wise', u'place', u'furnitures', u'interior', u'chic', u'modern', u'bathroom', u'layout', u'bed', u'comfortable', u'recommended', u'friends', u'enjoyed', u'staff', u'friendly', u'warm', u'definitely']",UR66005442
"[u'checked', u'told', u'room', u'reserved', u'reminded', u'favorite', u'tv', u'reservation', u'don', u't', u'hold', u'reservation', u'room', u'overlooking', u'pool', u'skyline', u'singapore', u'tiny', u'room', u'overlooking', u'living', u'room', u'checking', u'inquired', u'breakfast', u'curtly', u'told', u'creep', u'reservation', u'doesn', u't', u'breakfast', u'breakfast', u'buy', u'pointed', u'coffee', u'shop', u'doubled', u'restaurant', u'breakfast', u'mall', u'street', u'guy', u'problem', u'reception', u'working', u'cave', u'room', u'tiny', u'close', u'building', u'street', u'keep', u'curtains', u'closed', u'glass', u'appeared', u'tinted', u'lovely', u'huge', u'pool', u'saving', u'grace', u'pool', u'bar', u'wrong', u'side', u'pool', u'forget', u'serving', u'asked', u'business', u'centre', u'told', u'internet', u'access', u'sing', u'half', u'hour', u'needless', u'told', u'business', u'centre', u'paying', u'room', u'add', u'high', u'free', u'internet', u'included', u'breakfast', u'included', u'well', u'club', u'floors', u'amenities', u'mentioned', u'imagine', u'pay', u'friendly', u'people', u'place', u'doormen', u'help', u'bags', u'friendly', u'greeting', u'reception', u'rudest', u'experienced', u'life', u'traveling', u'years', u'travel', u'pleasure', u'business', u'guess', u'caters', u'business', u'people', u'singapore', u'business', u'company', u'pays', u'travel', u'expenses', u'guess', u'fine', u'club', u'floors', u'singapore', u'vacation', u'avoid', u'horror']",UR88454540
"[u'clarke', u'quay', u'singapore', u'trendy', u'area', u'huge', u'number', u'food', u'outlets', u'bars', u'cuisines', u'rubbing', u'shoulders', u'chose', u'park', u'proximity', u'eating', u'drinking', u'places', u'knowledge', u'well', u'reviewed', u'restaurant', u'operate', u'complimentary', u'shuttle', u'places', u'interest', u'utility', u'orchard', u'road', u'local', u'metro', u'stations', u'easy', u'resorting', u'taxis', u'opted', u'upgrade', u'crystal', u'club', u'class', u'room', u'floor', u'private', u'check', u'lounge', u'complementary', u'breakfast', u'morning', u'afternoon', u'tea', u'snacks', u'drinks', u'included', u'upgrade', u'price', u'deal', u'modest', u'amount', u'laundry', u'package', u'help', u'traveler', u'club', u'floor', u'lovely', u'high', u'ceilinged', u'rooms', u'room', u'comfortable', u'queen', u'size', u'bed', u'space', u'luggage', u'appreciated', u'city', u'centre', u'well', u'thought', u'night', u'enjoyable', u'touches', u'switch', u'bathroom', u'light', u'side', u'bed', u'waking', u'spouse', u'thought', u'room', u'design', u'dinner', u'evening', u'chose', u'typical', u'dishes', u'share', u'hainanese', u'chicken', u'rice', u'laksa', u'beautifully', u'flavoured', u'impeccably', u'served', u'preceded', u'version', u'raffles', u'inspired', u'singapore', u'sling', u'happy', u'compared', u'favorably', u'real', u'thing', u'tasted', u'raffles', u'day', u'food', u'drink', u'cheap', u'singapore', u'portions', u'ample', u'cost', u'reasonable', u'context', u'public', u'areas', u'light', u'spacious', u'efficiently', u'manned', u'reception', u'desk', u'concierge', u'service', u'bell', u'captain', u'front', u'door', u'staff', u'super', u'smart', u'appearance', u'service', u'anticipated', u'aplomb', u'sized', u'open', u'air', u'swimming', u'pool', u'second', u'floor', u'spa', u'facilities', u'pool', u'side', u'bar', u'popular', u'review', u'park', u'crystal', u'club', u'floor', u'complete', u'praising', u'evelyn', u'guest', u'feel', u'special', u'mission', u'keep', u'happy', u'perfect', u'hostess', u'highly', u'proficient', u'concierge', u'masses', u'ideas', u'things', u'singapore', u'environs', u'simply', u'evelyn', u'icing', u'cake', u'cake', u'hesitate', u'park', u'clarke', u'quay']",UR117439343
"[u'brand', u'singapore', u'middle', u'city', u'convinient', u'reach', u'walking', u'distance', u'room', u'comfortable', u'size', u'big', u'asia', u'fair', u'clean', u'course', u'brand', u'reception', u'friendly', u'efficient', u'smoking', u'floor', u'avaiable', u'outstanding', u'sin', u'location', u'middle', u'walking', u'distance', u'tons', u'restaurants', u'pubs', u'central', u'quiet', u'business', u'areas', u'max', u'taxi', u'sin', u'rates', u'relativly', u'low', u'including', u'breakfast', u'point', u'ready', u'waiting', u'time', u'case', u'breakfast', u'restaurant', u'number', u'guests', u'service', u'education', u'alternative', u'exsisting', u'big', u'city']",UR70857271
"[u'staff', u'couteous', u'friendly', u'prices', u'icluded', u'serices', u'drinks', u'expensive']",UR56414634
"[u'beautiful', u'small', u'modern', u'pool', u'clean', u'super', u'tiny', u'rooms', u'pm', u'grueling', u'hot', u'sticky', u'day', u'sight', u'hot', u'exhausted', u'quick', u'dip', u'lovely', u'pool', u'shower', u'hit', u'hay', u'adjoining', u'rooms', u'teens', u'shower', u'worked', u'times', u'call', u'housekeeping', u'front', u'desk', u'service', u'manager', u'avail', u'answered', u'pool', u'husband', u'soaking', u'wet', u'robe', u'front', u'desk', u'find', u'girl', u'worked', u'front', u'desk', u'chatting', u'friend', u'apologized', u'called', u'engineering', u'fixed', u'shower', u'weren', u't', u'share', u'shower', u'checking', u'mentioned', u'front', u'desk', u'apologized', u'basically', u't', u'care', u'asked', u'speak', u'manager', u'weren', u't', u'email', u'american', u'express', u'recommended', u'guess', u'expected', u'better', u'customer', u'service', u'vicinity', u'sure', u'comparable', u'better', u'customer', u'service']",UR103960239
"[u'staff', u'exceptionally', u'friendly', u'experience', u'remember', u'breakfast', u'beautiful', u'location', u'definitely', u'central', u'walking', u'distance', u'taxi', u'costs', u'rooms', u'bit', u'small', u'hopefully', u'going', u'singapore', u'spend', u'time', u'room', u'definitely', u'reccommend']",UR120097057
"[u'impression', u'days', u'awesome', u'view', u'clubbing', u'hub', u'boat', u'quay', u'rooms', u'small', u't', u'expect', u'singapore', u'lounge', u'services', u'free', u'drinks', u'free', u'internet', u'spa', u'staff', u'friendly', u'cleanliness', u'definitely', u'trip']",UR124173215
"[u'park', u'couple', u'nights', u'passing', u'singapore', u'male', u'hk', u'bland', u'smallish', u'rooms', u'staff', u'friendy', u'price', u'high', u'side', u'cheaper', u'better', u'orchard', u'st', u'walking', u'distance', u'clark', u'quays', u'major', u'area', u'restaurants', u'bars', u'singapore', u'easy', u'access', u'mrt', u'singapore', u'problem', u'notice', u'popular', u'business', u'community', u'tourists']",UR124495907
"[u'family', u'arrived', u'impressed', u'exterior', u'deceiving', u'main', u'lobby', u'reeked', u'perfume', u'cologne', u'thought', u'passing', u'thing', u'people', u'wear', u'excessive', u'smelly', u'stuff', u'continued', u'pump', u'rank', u'awful', u'odor', u'lobby', u'mask', u'smell', u'guest', u'thought', u'pleasing', u'scent', u'clientele', u'allergic', u'perfumes', u'sister', u'checked', u'room', u'floor', u'small', u'place', u'luggage', u'floor', u'windows', u'happy', u'single', u'beds', u'pretty', u'entire', u'room', u'clean', u'room', u'small', u'claustrophobia', u'mind', u'upgraded', u'suite', u'floor', u'surcharge', u'sgd', u'relevant', u'room', u'service', u'charge', u'gst', u'suites', u'decent', u'attached', u'rooms', u'queen', u'bed', u'king', u'room', u'pull', u'bed', u'room', u'alarm', u'clock', u'rooms', u'electrical', u'outlets', u'bathrooms', u'basic', u'amenities', u'missing', u'hook', u'electrical', u'razor', u'hair', u'dryer', u'room', u'bathroom', u'gift', u'shop', u'restaurant', u'bar', u'small', u'located', u'main', u'lobby', u'rank', u'odor', u'cologne', u'perfume', u'permeating', u'area', u'ladies', u'floor', u'care', u'clientele', u'staying', u'suites', u'exceptionally', u'afternoon', u'happy', u'hour', u'breakfast', u'pleasant', u'ideal', u'location', u'headache', u'cab', u'drivers', u'transportation', u'taxi', u'drvers', u'pull', u'turn', u'face', u'thoroughfare', u'summation', u'regular', u'rooms', u'extremely', u'small', u'foul', u'smell', u'lobby', u'total', u'turnoff', u'consider', u'staying', u'recommend', u'place', u'odd', u'strange', u'layout', u'positive', u'area', u'better', u'provide', u'guest', u'friendly', u'experience']",UR66860525
"[u'park', u'well', u'appointed', u'service', u'furnishings', u'rate', u'room', u'sizes', u'small', u'bring', u'memories', u'ibis', u'unpack', u'clothes', u'hangers', u'felt', u'cramped', u'location', u'bit', u'walk', u'nearest', u'station', u'centre', u'clarke', u'quay', u'minute', u'walk', u'problem', u'price', u'range', u'close', u'clarke', u'quay', u'breakfast', u'pool', u'facilities', u'middle', u'range', u'newe', u'feeling']",UR47450900
"[u'upgraded', u'normal', u'accommodations', u'club', u'deluxe', u'lovely', u'park', u'fabulous', u'location', u'clark', u'quay', u'boat', u'tours', u'canal', u'wonderful', u'walking', u'areas', u'sides', u'river', u'floor', u'concierge', u'services', u'wonderful', u'free', u'full', u'breakfast', u'mornings', u'till', u'free', u'drinks', u'appetizers', u'floor', u'pm', u'till', u'pm', u'english', u'singapore', u'newspaper', u'canvas', u'bag', u'morning', u'rooms', u'extremely', u'clean', u'bit', u'small', u'hd', u'flat', u'screen', u'free', u'wifi', u'lan', u'internet', u'services', u'pc', u'floor', u'guest', u'free', u'lovely', u'polite', u'unobtrusive', u'staff', u'ways', u'assist', u'answer', u'questions']",UR127387130
"[u'nights', u'september', u'grand', u'prix', u'weekend', u'describe', u'service', u'experienced', u'service', u'staff', u'reception', u'men', u'front', u'offer', u'assistance', u'morning', u'chucking', u'man', u'reception', u'offer', u'umbrella', u'accommodating', u'western', u'cities', u'expected', u'greatly', u'appreciated', u'room', u'room', u'clean', u'modern', u'spacious', u'stopped', u'superior', u'room', u'brilliant', u'wi', u'fi', u'free', u'free', u'higher', u'grade', u'rooms', u'talk', u'location', u'amenities', u'clare', u'quay', u'lively', u'location', u'plenty', u'restaurants', u'places', u'drink', u'metro', u'ten', u'minute', u'walk', u'top', u'ignore', u'monks', u'people', u'calling', u'lucky', u'man', u'ignored', u'walking', u'imagine', u'harmless', u'money', u'walk', u'river', u'brilliant', u'pool', u'enjoyed', u'relaxing', u'heat', u't', u'reckon', u'food', u'breakfast', u'morning', u'money', u'cost', u'disappointment', u'unable', u'free', u'wi', u'fi', u'computers', u'reception', u'minimum', u'time', u'buy', u'minutes', u'asked', u'shorter', u'duration', u'free', u'minute', u'code', u'bits', u'pool', u'location', u'sitting', u'pool', u'singapore', u'skyline', u'backdrop', u'brilliant', u'food', u'eat', u'singapore', u'restaurants']",UR121690200
"[u'position', u'main', u'benefit', u'pool', u'area', u'free', u'wifi', u'room', u'pool', u'area', u'public', u'areas', u'free', u'floor']",UR123614427
"[u'loved', u'location', u'ideal', u'round', u'holiday', u'fun', u'despite', u'earthquakes', u'zealand', u'asked', u'room', u'shower', u'late', u'departure', u'pm', u'airport', u'confusion', u'reigned', u'told', u'room', u'pm', u'strictly', u'served', u'basis', u'facility', u'pm', u'told', u'pm', u'sounds', u'pretty', u'small', u'gripe', u'degree', u'climate', u'shower', u'couple', u'missed', u'chance', u'shame', u'avoided', u'better', u'communication']",UR99543934
"[u'idea', u'going', u'wonderful', u'location', u'super', u'shuttle', u'airport', u'orchard', u'staff', u'delight', u'spoilt', u've', u'travelling', u'years', u'planning', u'going', u'passing', u'singapore', u'big', u'favour', u'eileen', u'parsons', u'adelaid', u'south', u'australia']",UR121067576
"[u'fairly', u'set', u'tours', u'business', u'runs', u'efficiently', u'tours', u'house', u'fairly', u'busy', u'business', u'guests', u'executive', u'floor', u'opened', u'breakfast', u'facilitate', u'guests', u'breakfast', u'view', u'marina', u'sand', u'bay', u'astonishing', u'well', u'parts', u'city', u'rooms', u'neat', u'clean']",UR123902682
"[u'previous', u'stopover', u'singapore', u'occasion', u'copthorne', u'kings', u'park', u'clarke', u'quay', u'poor', u'choice', u'comparison', u'room', u'small', u'space', u'dimensions', u'main', u'room', u'space', u'crammed', u'double', u'bed', u'bedside', u'cabinets', u'desk', u'armchair', u'fairness', u'tasteful', u'design', u'ordinates', u'well', u'wood', u'panelling', u'keeping', u'general', u'lack', u'living', u'space', u'wardrobe', u'cm', u'wide', u'storing', u'wekend', u'three', u'day', u'clothing', u'don', u't', u'suffice', u'week', u'luggage', u'piled', u'side', u'room', u'store', u'direct', u'contrast', u'rest', u'room', u'bathroom', u'extremely', u'generous', u'space', u'sized', u'shower', u'sink', u'counter', u'rate', u'included', u'breakfast', u'afraid', u'fare', u'pretty', u'tasteless', u'stuff', u'mattered', u'plenty', u'fortunately', u'wide', u'range', u'restaurants', u'vicinity', u'including', u'excellent', u'restaurants', u'cheap', u'cheerful', u'food', u'courts', u'front', u'desk', u'staff', u'dour', u'crowd', u'making', u'minimal', u'eye', u'contact', u'showing', u'interest', u'guests', u'bell', u'boy', u'staff', u'evry', u'concierge', u'excellent', u'source', u'suggestion', u'food', u'entertainment', u'excellent', u'free', u'shuttle', u'service', u'town', u'clarke', u'quay', u'subway', u'station', u'reliable', u'timetable', u'points', u'barely', u'justify', u'room', u'fee', u'charged', u'consideration', u'couldn', u't', u'recommend', u'park', u'clarke', u'quay', u'option', u'kind', u'visit', u'singapore']",UR127128131
"[u'highly', u'recommend', u'park', u'crystal', u'club', u'room', u'comfortable', u'clean', u'small', u'executive', u'suite', u'view', u'staff', u'friendly', u'recommend', u'happy', u'hour', u'dinner', u'cake', u'birthday', u'ideally', u'situated', u'river', u'walk', u'round', u'singapore', u'thoroughly', u'enjoyed', u'loved', u'singapore']",UR128100104
"[u'perfect', u'days', u'staff', u'friendly', u'location']",UR127705540
"[u'june', u'october', u'time', u'club', u'room', u'second', u'time', u'superior', u'room', u'superior', u'room', u'small', u'poor', u'view', u'location', u'excellent', u'restaurants', u'bars', u'breakfast', u'wait', u'restaurant', u'space', u'small', u'serve', u'guests', u'friendly', u'staff']",UR121276529
"[u'clean', u'service', u'adequate', u'rooms', u'small', u'location', u'short', u'walk', u'restaurants', u'bars', u'clarke', u'quay', u'river']",UR66995991
"[u'previous', u'reviews', u'special', u'adequate', u'location', u'clarke', u'quay', u'sure', u'mortgage', u'night', u'breakfast', u'restaurant', u'airy', u'arrived', u'flight', u'london', u'room', u'ready', u'offer', u'letting', u'shower', u'chill', u'wander', u'couple', u'hours', u'room', u'ready', u'location', u'china', u'town', u'mrt', u'station', u'close']",UR124424636
"[u'wasn', u't', u'sure', u'expect', u'read', u'mixed', u'reviews', u'lobby', u'cramped', u'seating', u'internet', u'booths', u'sqashed', u'corner', u'lobby', u'privacy', u'noise', u'lobby', u'horrendous', u'view', u'room', u'clean', u'location', u'rooms', u'small', u'adequate']",UR115198507
