Content,ReviewID
"[u'grand', u'canal', u'prestige', u'room', u'wonderful', u'views', u'grand', u'canal', u'magical', u'water', u'taxis', u'boats', u'chug', u'windows', u'room', u'beautifully', u'decorated', u'rich', u'fabrics', u'spotlessly', u'clean', u'staff', u'minute', u'walk', u'train', u'station', u'bit', u'walk', u'st', u'mark', u'square', u'idea', u'meandering', u'neighborhoods', u'perfect', u'real', u'negative', u'feedback', u'buffet', u'breakfast', u'hot', u'food', u'items', u'omelettes', u'require', u'surcharge', u'considering', u'room', u'prices']",UR123135123
"[u'venice', u'charm', u'beauty', u'better', u'place', u'start', u'visit', u'captures', u'unique', u'atmosphere', u'golden', u'age', u'venice', u'modern', u'cons', u'require', u'website', u'clear', u'directions', u'min', u'walk', u'bus', u'staff', u'frendly', u'welcoming', u'provide', u'guidence', u'venice', u'special', u'rooms', u'beautifuly', u'decorated', u'defenetly', u'feel', u'living', u'dream', u'vivaldi', u'suite', u'bathrooms', u'breakfast', u'room', u'beautiful', u'views', u'canal', u'quiet', u'location', u'engaged', u'venice', u'll', u'defenetly', u'honeymoon']",UR51102852
"[u'returned', u'ambitious', u'visit', u'italy', u'cities', u'days', u'completely', u'lived', u'expectations', u'high', u'reading', u'trip', u'advisor', u'reviews', u'rooms', u'lovely', u'location', u'terrific', u'staff', u'couldn', u't', u'pleasant', u'staff', u'encountered', u'check', u'restaurant', u'servers', u'bellman', u'bartender', u'enjoying', u'nightcap', u'terrace', u'grand', u'canal', u'night', u'short', u'spectacular', u'memory', u'savor', u'forever']",UR127153467
"[u'fantastic', u'night', u'canal', u'grande', u'arrived', u'orient', u'express', u'hoping', u'continued', u'levels', u'service', u'luxury', u'experience', u'train', u'disappointed', u'room', u'overlooked', u'grand', u'canal', u'poster', u'bed', u'ornate', u'furnishings', u'terrific', u'quiet', u'square', u'grand', u'canal', u'peaceful', u'crowds', u'minute', u'walk', u'railway', u'station', u'minutes', u'piazzale', u'roma', u'staff', u'incredibly', u'friendly', u'recommended', u'couple', u'nearby', u'restaurants', u'trattoria', u'povoledo', u'opposite', u'grand', u'canal', u'fantastic', u'location', u'food', u'real', u'find', u'nearby', u'pizzeria', u'anfora', u'serves', u'superb', u'pizzas', u'salads', u'al', u'fresco', u'courtyard', u'restaurant', u'money']",UR69859138
"[u'daughter', u'august', u'immaculate', u'staff', u'pleasant', u'enjoyable', u'thought', u'room', u'bit', u'small', u'moved', u'adjoining', u'building', u'day', u'lovely', u'small', u'terrace', u'overlooking', u'grand', u'canal', u'sat', u'watched', u'venice', u'tomorrow']",UR117486241
"[u'staff', u'outstanding', u'strength', u'warmly', u'greeted', u'arrived', u'handing', u'map', u'person', u'front', u'desk', u'minutes', u'time', u'explain', u'things', u'service', u'knocked', u'socks', u'quality', u'room', u'excellent', u'clean', u'bed', u'comfortable', u'small', u'room', u'bathroom', u'adequate', u'complaint', u'noise', u'level', u'main', u'building', u'room', u'separate', u'buildings', u'front', u'door', u'buzzed', u'open', u'front', u'desk', u'people', u'time', u'wake', u'people', u'walking', u'quiet', u'impossible', u'building', u'creating', u'racket', u'marble', u'floors', u'echo', u'halls', u'incredible', u'padded', u'runner', u'stairs', u'padded', u'carpets', u'hall', u'care', u'problem', u'nicely']",UR66913954
"[u'originally', u'booked', u'sister', u'antiche', u'figure', u'yards', u'grand', u'canal', u'choice', u'original', u'room', u'overlooking', u'canal', u'perfectly', u'newly', u'refurbished', u'room', u'overlooking', u'canal', u'beautiful', u'poster', u'bed', u'brand', u'bathroom', u'footpath', u'canal', u'cut', u'noise', u'chose', u'canal', u'grande', u'sure', u'equally', u'holiday', u'original', u'choice', u'canal', u'grande', u'class', u'staff', u'obliging', u'professional', u'fault', u'spotlessly', u'clean', u'convenient', u'arriving', u'departing', u'venice', u'walk', u'st', u'marks', u'fine', u'bearings', u'lost', u'venice', u'enjoyment', u'recommend', u'visiting', u'top', u'campanile', u'st', u'marks', u'square', u'view', u'fantastic', u'breakfast', u'typical', u'continental', u'fare', u'perfectly', u'fine', u'deck', u'canal', u'piece', u'heaven', u'sitting', u'drink', u'watching', u'memory', u'wonderful', u'celebrated', u'years', u'marriage', u'imagine', u'disappointed', u'gem']",UR104646967
"[u'sure', u'raves', u'simple', u'small', u'boutique', u'quaint', u'grand', u'canal', u'special', u'price', u'paid', u'room', u'views', u'canal', u'courtyard', u'alley', u'breakfast', u'area', u'three', u'tables', u'canal', u'chance', u'breakfast', u'potential', u'real', u'shame', u'waste', u'location', u'tables', u'chairs', u'huge', u'courtyard', u'front', u'door', u'start', u'wonderful', u'view', u'canal']",UR83885392
"[u'location', u'bus', u'rooms', u'wonderful', u'staff']",UR88101562
"[u'spring', u'room', u'overlooking', u'canal', u't', u'better', u'accommodation', u'breakfast', u'lovely', u'morning', u'included', u'avoid', u'free', u'murano', u'tour', u'total', u'sales', u'pitch', u'overpriced', u'murano', u'glass', u'cheaper', u'states', u'don', u't', u'drop', u'feel', u'venice', u'hike', u'fault', u'optional', u'tour', u'offer', u'place', u'romantic', u'poem']",UR118067953
"[u't', u't', u'leave', u'review', u'sooner', u'husband', u'absolutely', u'loved', u'trip', u'italy', u'picked', u'based', u'proximity', u'train', u'station', u'pictures', u'website', u'thrilled', u'room', u'amazing', u'view', u'grand', u'canal', u'bed', u'super', u'comfortable', u'staff', u'terrifically', u'friendly', u'turn', u'corner', u'main', u'sights', u'city', u'pretty', u'short', u'walk', u'vaporetto', u'ride', u'incredible', u'priced', u'class', u'grand', u'canal', u'second']",UR115631981
"[u'easily', u'recommend', u'place', u'room', u'spotless', u'wife', u'approved', u'bathroom', u'staff', u'friendly', u'incredibly', u'location', u'convenient', u'train', u'station', u'plaza', u'roma', u'quieter', u'san', u'marco', u'square', u'neat', u'stuff', u'minute', u'walk', u'vaporetto', u'water', u'bus', u'takes', u'rialto', u'san', u'marco', u'things', u'breakfast', u'charming', u'deck', u'grand', u'canal', u'place', u'sip', u'morning', u'coffee', u'breakfast', u'free', u'wifi', u'upload', u'photos', u'friends', u'family', u'jealous', u'real', u'time', u'quiet', u'square', u'front', u'door', u'opens', u'plan', u'return', u'venice', u'canal', u'grande']",UR77120855
"[u'goodness', u'trip', u'advisor', u'booked', u'purely', u'based', u'reviews', u'read', u'disappointed', u'nights', u'days', u'mid', u'october', u'weather', u'sunny', u'warm', u'conveniently', u'located', u'bus', u'station', u'opposite', u'train', u'station', u'vaporetta', u'couple', u'alleyways', u'small', u'bridge', u'boyfriend', u'map', u'trouble', u'top', u'door', u'numbers', u'number', u'booked', u'san', u'giorgio', u'room', u'ground', u'floor', u'room', u'main', u'building', u'doors', u'room', u'decorated', u'high', u'standard', u'wallpaper', u'fabric', u'interesting', u'touch', u'bathroom', u'decent', u'size', u'shower', u'hot', u'running', u'water', u'showerheads', u'detachable', u'offered', u'upgrade', u'view', u'grand', u'canal', u'euros', u't', u'room', u'lovely', u'downside', u'hear', u'footsteps', u'lady', u'boots', u'presumed', u'room', u'wooden', u'floors', u'breakfast', u'fine', u'toast', u'cereal', u'mini', u'crusty', u'rolls', u'selection', u'meats', u'cake', u'yoghurts', u'fresh', u'fruit', u'offered', u'morning', u'venice', u'charming', u'place', u'full', u'character', u'canals', u'bridges', u'alleyways', u'buildings', u'falling', u'apart', u't', u'lost', u'directions', u'main', u'tourist', u'spots', u'safe', u'clean', u'place', u'expensive', u'ate', u'restaurant', u'opposite', u'paid', u'euros', u'bowl', u'spaghetti', u'bolognaise', u'child', u'size', u'portion', u'left', u'hungry', u'find', u'reasonable', u'places', u'grand', u'canal', u'worth', u'mentioning', u'restaurants', u'add', u'cover', u'charge', u'bills', u'euros', u'person', u'table', u'cloth', u'bread', u'include', u'service', u'charge', u'enjoy', u'venice', u'worth', u'noting', u'gondella', u'ride', u'costs', u'euros', u'day', u'euros', u'night']",UR83561320
"[u'charming', u'steps', u'scalzi', u'bridge', u'train', u'station', u'located', u'quiet', u'piazza', u'gianni', u'gracious', u'informative', u'host', u'breakfast', u'ample', u'service', u'polite', u'thoughtful', u'goldoni', u'room', u'special', u'venetian', u'dream', u'spotless', u'perfectly', u'appointed', u'highly', u'recommend']",UR51011734
"[u'arrived', u'late', u'approx', u'pm', u'welcomed', u'receptionists', u'checked', u'room', u'luggage', u'receptionist', u'worked', u'room', u'map', u'explain', u'things', u'morning', u'sleep', u'night', u'sleep', u'bed', u'comfortable', u'canal', u'view', u'room', u'room', u'side', u'quiet', u'private', u'sqaure', u'traffic', u'couple', u'benches', u'courtyard', u'place', u'sit', u'watch', u'canal', u'boats', u'gondolas', u'room', u'small', u'needed', u'beautifully', u'furnished', u'tv', u'built', u'mirror', u'feel', u'room', u'ruined', u'tv', u'room', u'desk', u'area', u'wardrobe', u'free', u'safe', u'inside', u'free', u'wi', u'fi', u'code', u'arrival', u'hours', u'internet', u'bathroom', u'superb', u'rain', u'shower', u'body', u'jets', u'free', u'toilettries', u'provided', u'room', u'clean', u'serviced', u'daily', u'beakfast', u'continental', u'served', u'day', u'selction', u'juices', u'cereals', u'breads', u'cakes', u'toast', u'pastries', u'fruit', u'meats', u'cheeses', u'yogurts', u'waitresses', u'fresh', u'tea', u'coffee', u'latte', u'cappuccino', u'expresso', u'breakfast', u'staff', u'attentive', u'reception', u'staff', u'map', u'explained', u'english', u'perfect', u'check', u'noon', u'flight', u'pm', u'happy', u'bags', u'day', u'trouble', u'staff', u'genuinely', u'interested', u'assistance', u'info', u'venice', u'flew', u'venices', u'treviso', u'airport', u'london', u'stansted', u'shuttle', u'bus', u'waiting', u'flight', u'euros', u'return', u'person', u'catch', u'shuttle', u'bus', u'takes', u'approx', u'hour', u'time', u'takes', u'marco', u'polo', u'airport', u'venice', u'boat', u'bus', u'arrives', u'main', u'bus', u'terminal', u'piazzale', u'roma', u'short', u'min', u'walk', u'driver', u'return', u'timetable', u'return', u'journey', u'well', u'organised', u'quick', u'travelling', u'venice', u'purchased', u'hour', u'unlimited', u'waterbus', u'ticket', u'euros', u'gondalas', u'water', u'taxis', u'expensive', u'water', u'buses', u'venice', u'ventured', u'murano', u'island', u'famous', u'glass', u'burano', u'island', u'famous', u'couloured', u'houses', u'favourite', u'place', u'venice', u'lido', u'venices', u'seaside', u'island', u'forget', u'travel', u'foot', u'venice', u'foot', u'lost', u'eating', u'venice', u'closer', u'water', u'famous', u'landmark', u'san', u'marco', u'square', u'expensive', u'food', u'drink', u'worse', u'food', u'cater', u'tourists', u'italians', u'example', u'litre', u'beer', u'approx', u'euros', u'san', u'marco', u'square', u'compared', u'euros', u'side', u'street', u'canal', u'view', u'venice', u'island', u'italian', u'food', u'better', u'pasta', u'dish', u'grande', u'canal', u'dry', u'bland', u'ate', u'small', u'italian', u'cafe', u'lido', u'fresh', u'full', u'flavour']",UR100955689
"[u'booked', u'reviews', u'trip', u'advisor', u'nt', u'disappointed', u'small', u'friendly', u'perfect', u'explore', u'venice', u'return', u'lovely', u'room', u'don', u't', u'expect', u'wealth', u'amenities', u'landing', u'dock', u'free', u'wifi', u'computer', u'recepton', u'don', u't', u'disaster', u'venice', u'italian', u'airports', u'strike', u'arrived', u'ten', u'hours', u'late', u'ended', u'arriving', u'venice', u'train', u'station', u'boy', u'glad', u'short', u'walk', u'bridge', u'saving', u'catch', u'ferries', u'exhausting', u'day', u'handy', u'left', u'walk', u'bus', u'land', u'taxi', u'terminal', u'saving', u'lot', u'private', u'water', u'taxi', u'direct', u'bus', u'euros', u'caught', u'train', u'verona', u'day', u'anf', u'location', u'helped', u'people', u'prefer', u'location', u'closer', u'san', u'marco', u'explored', u'lot', u'city', u'base', u'main', u'attractions', u'lot', u'real', u'city', u'coffee', u'bars', u'shop', u'room', u'lovely', u'huge', u'romantic', u'breakfast', u'pretty', u'continental', u'buffet', u'complaint', u'room', u'service']",UR61243274
"[u'pretty', u'opposite', u'railway', u'station', u'short', u'walk', u'piazzale', u'roma', u'parking', u'lots', u'stands', u'dodgy', u'lodgings', u'glamorous', u'venice', u'cosy', u'piazza', u'grand', u'canal', u'obligatory', u'gondolas', u'bobbing', u'front', u'steps', u'rooms', u'public', u'areas', u'clean', u'personnel', u'appears', u'cheerful', u'well', u'trained', u'happy', u'provide', u'extras', u'late', u'breakfast', u'short', u'mistake', u'proper', u'venetian', u'luxury', u'decided', u'smallish', u'rooms', u'venetian', u'murano', u'glass', u'lamps', u'sure', u'fake', u'antique', u'writing', u'desk', u'massive', u'gilded', u'mirror', u'frames', u't', u'wrong', u'baldachin', u'bed', u'result', u'oriental', u'fake', u'opulence', u'absolutely', u'hilarious', u'bad', u'staying', u'weekend', u'joke', u'wear', u'bit', u'thin']",UR52110523
"[u'trouble', u'finding', u'bags', u'minute', u'walk', u'main', u'bus', u'station', u'lost', u'couple', u'times', u'unhappy', u'campers', u'time', u'arrived', u'reception', u'tho', u'receptionist', u'lovely', u'spoke', u'fluent', u'english', u'straight', u'room', u'beautiful', u'walls', u'lined', u'silk', u'big', u'poster', u'bed', u'sooooo', u'comfortable', u'marble', u'bathroom', u'spotlessly', u'clean', u'view', u'grand', u'canal', u'watch', u'comings', u'goings', u'breakfast', u'buffet', u'continental', u'fresh', u'lovely', u'choice', u'left', u'feeling', u'spoilt', u'lucky', u'lovely']",UR122820033
"[u'friendly', u'staff', u'experienced', u'brilliant', u'well', u'spotlessly', u'clean', u'location', u'visiting', u'major', u'sites', u'interest', u'venice']",UR127875976
"[u'reason', u'read', u'bad', u'review', u'simply', u'perfect', u'staff', u'friendly', u'location', u'spot', u'arrival', u'explained', u'giovanni', u'fiance', u'birthday', u'wanted', u'surprise', u'arrival', u'arrange', u'beautiful', u'flower', u'arrangement', u'prosecco', u'ice', u'upgraded', u'private', u'suite', u'awesome', u'book', u'hesitation', u'better', u'price']",UR69112857
"[u'rode', u'trains', u'week', u'italian', u'holiday', u'rome', u'venice', u'florence', u'pisa', u'pleasant', u'surprise', u'arrived', u'venice', u'grande', u'canal', u'train', u'station', u'steps', u'train', u'station', u'high', u'bridge', u'lots', u'steps', u'second', u'smaller', u'bridge', u'bit', u'bridges', u'bit', u'difficult', u'transport', u'luggage', u'eventually', u'wife', u'picked', u'based', u'trip', u'advisor', u'ratings', u'weren', u't', u'disappointed', u'family', u'suite', u'overlooking', u'grande', u'canal', u'suite', u'rooms', u'master', u'normal', u'queen', u'size', u'bed', u'sitting', u'room', u'sleeper', u'sofa', u'queen', u'sleeper', u'sofa', u'acceptable', u'preferred', u'normal', u'queen', u'rooms', u'tastefully', u'decorated', u'murana', u'glass', u'sconces', u'flat', u'screen', u'tvs', u't', u'watch', u'tv', u'downside', u'canal', u'facing', u'room', u'diesel', u'engined', u'boat', u'traffic', u'passed', u'hours', u'suffering', u'jet', u'lag', u'noise', u'boats', u'bit', u'annoying', u'fault', u'windows', u'insulated', u'continental', u'breakfast', u'wished', u'special', u'order', u'eggs', u'extra', u'euro', u'wifi', u'connection', u'excellent', u'fast', u'minute', u'walk', u'san', u'marcus', u'piazza', u'doge', u'palace', u'located', u'spent', u'three', u'days', u'venice', u'fell', u'love', u'city', u'special', u'place', u'canal', u'grande', u'fits', u'ambience', u'venice', u'cozy', u'intimate', u'comfortable', u'place', u'returning', u'venice', u'point', u'future', u'canal', u'grande', u'add', u'pizza', u'italy', u'restaurant', u'minutes', u'forget', u'italian', u'english', u'translates', u'antique', u'well', u'ate', u'lot', u'average', u'tourist', u'restaurants', u'holiday', u'pizza', u'place', u'outstanding', u'favorite', u'parma', u'ham', u'artichoke', u'pizza']",UR92490984
"[u'trip', u'rome', u'venice', u'venice', u'nights', u'booked', u'antiche', u'figure', u'based', u'reviews', u'arrival', u'staff', u'informed', u'promotion', u'star', u'room', u'canal', u'grand', u'couple', u'blocks', u'amazing', u'service', u'perfect', u'location', u'train', u'station', u'main', u'waterbus', u'stations', u'room', u'charming', u'clean', u'well', u'spaced', u'venice', u'amazing', u'bed', u'slept', u'babies', u'large', u'spotless', u'bathroom', u'staff', u'lovely', u'beautiful', u'breakfast', u'terrace', u'directly', u'grand', u'canal', u'experiences', u'europe', u'definitely']",UR74391136
"[u'daunting', u'task', u'choosing', u'venice', u'trip', u'advisor', u'listed', u'chose', u'canal', u'grande', u'star', u'rating', u'fantastic', u'pricing', u'overjoyed', u'arrived', u'entire', u'suite', u'renovated', u'doge', u'suite', u'overlooked', u'canal', u'room', u'tastefully', u'decorated', u'draped', u'poster', u'bed', u'hardwood', u'floors', u'television', u'located', u'mirror', u'beautiful', u'damask', u'wallpaper', u'bathroom', u'totally', u'modern', u'large', u'suite', u'beautiful', u'sitting', u'area', u'suites', u'share', u'service', u'provided', u'unparalleled', u'giovanna', u'staff', u'catered', u'sure', u'perfect', u'morning', u'breakfast', u'start', u'day', u'location', u'close', u'train', u'station', u'don', u't', u'pack', u'luggage', u'jewel']",UR60042243
"[u'find', u'close', u'train', u'station', u'room', u'well', u'appointed', u'staff', u'place', u'time', u'venice', u'wonderful']",UR62034202
"[u'couple', u'months', u'ago', u'lovely', u'located', u'north', u'island', u'close', u'railway', u'station', u'don', u't', u'worry', u't', u'excellent', u'corner', u'room', u'views', u'grand', u'canal', u'water', u'bus', u'stops', u'nearby', u'staff', u'friendly', u'breakfast', u'adequate', u'return', u'stretch', u'arrange', u'water', u'taxi', u'airport', u'approach', u'venice', u'buy', u'season', u'ticket', u'water', u'bus', u'internet', u'advance', u'ticket', u'includes', u'bus', u'airport', u'walking', u'rialto', u'st', u'mark', u'square', u'points', u'venice', u'expensive', u'st', u'mark', u'excellent', u'recommendations']",UR114695835
"[u'star', u'easily', u'beat', u'star', u'region', u'proximity', u'train', u'station', u'minutes', u'train', u'car', u'vaporetto', u'bit', u'piazza', u'san', u'marco', u'dorsoduro', u'buying', u'vaporetto', u'tickets', u'entire', u'length', u'wise', u'well', u'managed', u'clean', u'breakfasts', u'platform', u'canal', u'scene', u'unbelievable', u'staff', u'friendly', u'careful', u'mistakes', u'room', u'decoration', u'breathtaking']",UR115480694
"[u'magical', u'experience', u'requested', u'standard', u'double', u'room', u'overwhelmed', u'fabulous', u'standard', u'room', u'attached', u'terrace', u'happened', u'overlook', u'grande', u'canal', u'wonderful', u'spend', u'holidays', u'location', u'easily', u'located', u'tourist', u'hoards', u'st', u'marks', u'minutes', u'lots', u'walk', u'staff', u'excellent', u'suggested', u'shopping', u'areas', u'food', u'market', u'helped', u'confirm', u'taxi', u'flights', u'worth', u'money', u'boat', u'taxi', u'airport', u'direct', u'approx', u'feel', u'james', u'bond', u'couldn', u't', u'convenient', u'insideveneto', u'reservations', u'time', u'reliable', u'venice', u'general', u'lots', u'bridges', u'stairs', u'challenging', u'older', u'folks', u'kids', u'strollers', u'watch', u'service', u'fee', u'cover', u'charge', u'addition', u'food', u'bill', u'closer', u'attractions', u'expensive', u'food', u'worth', u'walk', u'minutes', u'eat', u'real', u'italian', u'return', u'canal', u'grande', u'york', u'minute']",UR122185066
"[u'reviews', u'perfect', u'perfect', u'location', u'staff', u'rooms', u'immaculate', u'watch', u'euro', u'water', u'taxi', u'easy', u'catch', u'bus', u'vaparetto', u'fraction', u'price', u'going', u'venice']",UR63341276
"[u'trip', u'venice', u'chosen', u'better', u'facilities', u'excellent', u'staff', u'simply', u'find', u'better', u'venice']",UR115520710
"[u'canal', u'grande', u'january', u'package', u'deal', u'room', u'small', u'cozy', u'comfortable', u'bed', u'soft', u'room', u'luxurious', u'feel', u'location', u'conveniently', u'bus', u'station', u'main', u'street', u'sightseeing', u'foot', u'easy', u'staff', u'friendly', u'breakfast', u'bathroom', u'sewage', u'smell', u'keep', u'door', u'closed', u'vent', u'day', u'wall', u'shower', u'small', u'patches', u'mold', u'air', u'circulation', u'bathroom', u'ground', u'floor', u'elevator', u'loud']",UR120697600
"[u'fun', u'girly', u'days', u'perfect', u'surprise', u'grade', u'canal', u'grande', u'visited', u'venice', u'top', u'quality', u'europe', u'accompanying', u'husband', u'business', u'trips', u'pleasantly', u'surprised', u'offered', u'visited', u'staff', u'management', u'room', u'cleaning', u'staff', u'friendly', u'high', u'quality', u'rooms', u'recommend', u'room', u'quiet', u'ear', u'plugs', u'provided', u'setting', u'day', u'visit', u'perfect', u'feel', u'special', u'returned', u'night', u'wait', u'gem', u'find', u'business', u'class', u'upgrade', u't', u'wait', u'return', u'husband', u'enjoy', u'experience', u'advice', u'future', u'visitors', u'bellini', u'cocktail', u'terrace', u'rain', u'proof', u'walking', u'shoes', u'pack', u'mac', u'june']",UR67807969
"[u'days', u'cruise', u'mediterrean', u'boutique', u'clean', u'beautiful', u'arrived', u'ny', u'location', u'fantastic', u'canal', u'arrive', u'taxi', u'public', u'boat', u'airport', u'tire', u'public', u'boat', u'tickets', u'purchase', u'airport', u'save', u'euros', u'arrived', u'room', u'ready', u'space', u'canal', u'quiet', u'nights', u'close', u'place', u'la', u'fenice', u'opera', u'house', u'venice', u'academia', u'guggenheim', u'museum', u'breakfast', u'healthy', u'coffee', u'amazing', u'tasted', u'mexico', u'coffee', u'chiapas', u'veracruz', u'staff', u'working', u'making', u'place', u'spotless', u'opinion', u'directions', u'cultural', u'travel', u'longer', u'distances', u'definitely', u'place', u'consider', u'going', u'venice', u'flor', u'pablo']",UR120956898
"[u'anniversary', u'view', u'canal', u'beautiful', u'location', u'convenient', u'airport', u'train', u'station', u'disappointed', u'room', u'expectation', u'set', u'room', u'big', u'windows', u'blue', u'decor', u'wrong', u'room', u'persuaded', u'canal', u'view', u'room', u'romantic', u'choose', u'suite', u'view', u'cold', u'windows', u'big', u'wasn', u't', u'view', u'room', u'didnt', u'room', u'romantic', u'canal', u'view', u'surprised', u'offer', u'complimentary', u'drinks', u'chocolate', u'fruit', u'special', u'occassion', u've', u'offer', u'recommendation', u'restaurants', u'staff', u'hit', u'spot', u'clearly', u'local', u'pizza', u'fantastic', u'local', u'restaurant', u'breakfast', u'reviews', u'write', u'wider', u'selection', u'pastry', u'fresh', u'fruit', u'cakey', u'biscuity', u'options', u'close', u'san', u'marco', u'vaporette', u'walk', u'enjoyed', u'walk', u'cheap', u'pretty', u'standard', u'touristy', u'city', u'rome', u'expensive', u'improving', u'breakfast', u'touch', u'celebrating', u'occassion', u'visitors', u'improve', u'experience', u'making', u'feel', u'money']",UR124395597
"[u'week', u'canal', u'grande', u'celebrate', u'wedding', u'anniversary', u'experience', u'years', u'extensive', u'travel', u'staff', u'incredibly', u'welcoming', u'offer', u'assistance', u'leave', u'decisions', u'immaculate', u'location', u'superb', u'atmosphere', u'completely', u'relaxing', u'small', u'perfectly', u'formed']",UR128050244
"[u'wife', u'pleasure', u'staying', u'honeymoon', u'staff', u'wonderful', u'rooms', u'simply', u'amazing', u'service', u'outstanding', u'view', u'grand', u'canal', u'patio', u'sitting', u'water', u'passers', u'envious', u'loved']",UR86560821
"[u'loved', u'small', u'breakfast', u'afternoon', u'coffee', u'grand', u'canal', u'watching', u'boats', u'gondolas', u'passing', u'aahh', u'relaxing', u'unknown', u'reason', u'change', u'room', u'second', u'night', u't', u'kindly', u'upgraded', u'room', u'junior', u'suit', u'compensated', u'inconvenience', u'moved', u'stuff', u'treat', u'staff', u'courteous', u'welcoming', u'room', u'design', u'totally', u'unique', u'enhanced', u'experience', u'venice', u'highly', u'recommend']",UR67797054
"[u'place', u'amazing', u'gorgeously', u'decorated', u'rooms', u'conveniently', u'located', u'staff', u'fantastico', u'hugely', u'friendly', u'choice', u'food', u'breaky', u'delicious', u'frizzante', u'wine', u'tasted', u'complaints', u'perfect', u'reviewer', u'place', u'starry', u'eyed', u'young', u'couples', u'wrong', u'well', u'starry', u'eyed', u'stage', u'highly', u'recommended']",UR127397145
"[u'venice', u'family', u'vacation', u'amazing', u'time', u'canal', u'grande', u'favorite', u'europe', u'loved', u'interiors', u'room', u'pretty', u'elegant', u'feel', u'parents', u'disappointed', u'suite', u'bedroom', u'bathroom', u'smaller', u'regular', u'room', u'fairly', u'noiseless', u'night', u'night', u'rest', u'thing', u'loved', u'free', u'wifi', u'bedroom', u'absolutely', u'delightful', u'expensive', u'charge', u'wifi', u'staff', u'incredibly', u'friendly', u'feel', u'manager', u'female', u'brown', u'curly', u'hair', u'hospitable', u'downside', u'breakfast', u'wasn', u't', u'superb', u'consisted', u'bread', u'cereal', u'definitely', u'recommend', u'visiting', u'venice', u'unforgettably', u'wonderful', u'experience', u'someday', u'return']",UR67273501
