Content,ReviewID
"[u'expresssing', u'gratitude', u'gianni', u'front', u'desk', u'feel', u'family', u'bent', u'backwards', u'ensure', u'memorable', u'succeeded', u'accommodations', u'excellent', u'rooms', u'choose', u'opted', u'room', u'main', u'building', u'location', u'extremely', u'convenient', u'train', u'station', u'easily', u'walk', u'carry', u'luggage', u'bridge', u'grand', u'canal', u'quieter', u'desireable', u'breakfast', u'plentiful', u'thoroughly', u'enjoyed']",UR110637767
"[u'booked', u'room', u'antiche', u'figure', u'arrival', u'offered', u'free', u'upgrade', u'sister', u'canal', u'grande', u'quiet', u'square', u'located', u'grand', u'canal', u'walking', u'distance', u'train', u'station', u'convenient', u'location', u'close', u'vaporetto', u'station', u'save', u'expensive', u'water', u'taxi', u'rides', u'rooms', u'canal', u'view', u'fronted', u'quiet', u'square', u'room', u'well', u'equipped', u'comfortable', u'luxurious', u'bathroom', u'breakfasts', u'high', u'quality', u'staff', u'wireless', u'internet', u'provided', u'free', u'charge', u'glad']",UR106826765
"[u'quick', u'night', u'visit', u'city', u'needed', u'lot', u'longer', u'booked', u'regular', u'double', u'room', u'located', u'separately', u'block', u'secured', u'buzzed', u'pressing', u'front', u'door', u'bell', u'answered', u'time', u'offered', u'junior', u'suite', u'arrival', u'extra', u'euros', u'thought', u'matter', u'smaller', u'room', u'planned', u'time', u'staff', u'friendly', u'pleasure', u'day', u'breakfast', u'cereals', u'fruits', u'coffee', u'choices', u'cooked', u'options', u'request', u'juices', u'cold', u'meats', u'cheeses', u'lots', u'breads', u'yoghurts', u'happy', u'traveller', u'petite', u'terrace', u'water', u'meant', u'quick', u'dead', u'view', u'crazy', u'american', u'tourist', u'decided', u'join', u'morning', u'table', u'hilarious', u'considered', u'appropriate', u'lay', u'special', u'area', u'familiar', u'people', u'location', u'convenient', u'bus', u'international', u'airport', u'euros', u'piazzale', u'roma', u'bus', u'terminal', u'easy', u'find', u'bridges', u'duh', u'venice', u'minutes', u'foot', u'luggage', u'tow', u'train', u'station', u'santa', u'lucia', u'closer', u'restaurants', u'directly', u'canal', u'fresh', u'food', u'plenty', u'chosen', u'junior', u'suite', u'actual', u'building', u'canal', u'bigger', u'regular', u'room', u'chose', u'cheapest', u'rooms', u'extremely', u'petite', u'bathroom', u'super', u'tiny', u'buzzed', u'sleep', u'light', u'room', u'called', u'san', u'marco', u't', u'room', u'top', u'stairs', u'heard', u'buzzer', u'front', u'door', u'clearly', u'people', u'climbing', u'stairs', u'wandering', u'corridor', u'audible', u'longer', u'venice', u'days', u'lost', u'maze', u'shops', u'happy', u'people', u'food', u'satisfied', u'pasta', u'wine', u'pizza', u'wishes', u'location', u'lovely', u'staff', u'delicious', u'breakfast', u'chosen', u'junior', u'suite', u'time']",UR119093593
"[u'location', u'close', u'piazza', u'roma', u'train', u'station', u'rooms', u'service', u'absolutely', u'top', u'notch', u'match', u'worth', u'position', u'venice', u'trip', u'advisor', u'forced', u'constructive', u'critisism', u'element', u'improved', u'coffee', u'served', u'breakfast', u'hesitate', u'book']",UR123936352
"[u'giovamme', u'grand', u'canal', u'venice', u'amazing', u'friendliest', u'courteous', u'staff', u'beautiful']",UR109219203
"[u'fabulous', u'find', u'place', u'front', u'desk', u'staff', u'exceptional', u'problem', u'arranging', u'water', u'taxi', u'recommending', u'tours', u'directions', u'boutique', u'doesnt', u'room', u'numbers', u'names', u'room', u'room', u'downstairs', u'didnt', u'view', u'comfortable', u'small', u'adequate', u'bathroom', u'continental', u'breakfast', u'substantial', u'start', u'day', u'views', u'grand', u'canal', u'downstairs', u'breakfast', u'buffet', u'area', u'free', u'wifi', u'draw', u'card', u'considering', u'larger', u'chains', u'expected', u'pay', u'charge', u'wounded', u'buffalo', u'thing', u'place', u'minute', u'walk', u'rialto', u'bridge', u'minute', u'walk', u'san', u'marcos', u'adventure', u'exploring', u'tiny', u'alley', u'ways', u'shops', u'restaurants', u'well', u'worth', u'cent']",UR119584572
"[u'reviewers', u'booked', u'sister', u'upgraded', u'canal', u'grande', u'number', u'year', u'business', u'pleasure', u'shame', u'warm', u'overbearing', u'staff', u'genuinely', u'pleased', u'guest', u'wanted', u'experience', u'unique', u'city', u'staff', u'sixth', u'sense', u'wanted', u'assistance', u'glance', u'time', u'day', u'night', u'drink', u'refilled', u'question', u'venice', u'expertly', u'answered', u'room', u'lovely', u'spotlessly', u'clean', u'location', u'tucked', u'corner', u'tourist', u'crowds', u'perfectly', u'located', u'exploring', u'city', u'british', u'hoteliers', u'forced', u'spend', u'week', u'understand', u'meaning', u'hospitality']",UR99781101
"[u'staff', u'impress', u'room', u'upgrade', u'arrival', u'room', u'fantastic', u'romantic', u'lot', u'space', u'room', u'balcony', u't', u'cold', u'bit', u'shock', u'lights', u'timed', u'couple', u'times', u'key', u'wasn', u't', u'properly', u'seated', u'slot', u'breakfast', u'bed', u'staff', u'absolutely', u'fantastic', u'going', u'help', u'memorable', u'comfortable']",UR122541832
"[u'family', u'canaletto', u'suite', u'overlooking', u'canal', u'wonderful', u'room', u'adjoining', u'fantastic', u'views', u'boy', u'spent', u'lots', u'happy', u'moments', u'boat', u'spotting', u'windows', u'excellent', u'breakfasts', u'delightful', u'terrace', u'overlooking', u'canal', u'perfect', u'early', u'evening', u'glass', u'prosecco', u'definitely', u'recommend']",UR117402937
"[u'partner', u'loved', u'room', u'comfortable', u'decor', u'venitian', u'cheaper', u'priced', u'room', u'imagine', u'expensive', u'gorgeous', u'breakfast', u'included', u'price', u'minute', u'walk', u'main', u'train', u'station', u'venice', u'touristy', u'places', u'rialto', u'bridge', u'san', u'marco', u'square', u'half', u'hour', u'foot', u'direction', u'touristy', u'streets', u'loved', u'staff', u'friendly', u'restaurant', u'recommendation', u'absolutely', u'highlight', u'trip']",UR112103300
"[u'loved', u'suite', u'main', u'canal', u'worked', u'wonderfully', u'traveling', u'year', u'daughter', u'large', u'rooms', u'large', u'bathroom', u'staff', u'charming', u'breakfast', u'area', u'small', u'tables', u'outdoor', u'deck', u'breakfast', u'adequate', u'limited', u'standards', u'thing', u'aware', u'main', u'canal', u'busy', u'highway', u'facing', u'beautiful', u'boats', u'running', u'night', u'main', u'canal', u'room', u'bring', u'earplugs', u'pretty', u'wonderful', u'window', u'waiving', u'goodbye', u'husband', u'caught', u'water', u'taxi', u'airport', u'location']",UR119813261
"[u'attended', u'weekend', u'engaged', u'arrival', u'offered', u'complementary', u'bottle', u'prosecco', u'mark', u'occassion', u'perfect', u'location', u'grand', u'canal', u'expect', u'staff', u'day', u'walking', u'venice', u'grabbed', u'bottle', u'wine', u'nibbles', u'sitting', u'canal', u'realising', u't', u'cork', u'screw', u'asked', u'staff', u'bent', u'backwards', u'find', u'opener', u'offer', u'glasses', u'bring', u'small', u'touch', u'breakfast', u'morning', u'expect', u'quality', u'european', u'start', u'day', u'meats', u'cheeses', u'bread', u'pastries', u'fruit', u'yoghurt', u'coffee', u'tea', u'juices', u'room', u'air', u'conditioning', u'worked', u'well', u'change', u'holidays', u'europe', u'bathroom', u'big', u'bedroom', u'quiet', u'night', u'free', u'wi', u'fi', u'working', u'well']",UR127535114
"[u'lovely', u'gem', u'center', u'venice', u'travelled', u'honeymoon', u'perfect', u'place', u'friendly', u'staff', u'clean', u'rooms', u'lovely', u'suroundings', u'grand', u'canal', u'main', u'tourist', u'areas', u'lovely', u'calm', u'athmosphere', u'close', u'reach', u'parts', u'town', u'foot']",UR74328055
"[u'arriving', u'long', u'train', u'ride', u'france', u'arrived', u'destination', u'italy', u'venice', u'easy', u'find', u'kind', u'train', u'station', u'discovering', u'venice', u'easy', u'find', u'winding', u'streets', u'confusing', u'laneways', u'bridges', u'close', u'train', u'station', u'warm', u'friendly', u'customer', u'service', u'impeccable', u'offered', u'choice', u'rooms', u'inspected', u'gianni', u'kindly', u'advised', u'woman', u'choose', u'jokingly', u'recommendation', u'casanova', u'room', u'attic', u'grand', u'canal', u'rooms', u'spotless', u'beautiful', u'spacious', u'bathrooms', u'incredible', u'shower', u'heads', u'giant', u'ufo', u'location', u'perfect', u'lost', u'find', u'small', u'bar', u'drink', u'euro', u'fontdamenta', u'dei', u'tolentini', u'street', u'bar', u'called', u'barcaert', u'da', u'lele', u'easy', u'walk', u'close', u'main', u'ferry', u'stops', u'highly', u'recommend', u'friends', u'family', u'location', u'service', u'breakfast', u'room', u'comfortable', u'price']",UR101524592
"[u'spent', u'week', u'honeymoon', u'full', u'sunshine', u'year', u'fault', u'small', u'boutique', u'photos', u'trully', u'represent', u'quality', u'decor', u'rooms', u'rooms', u'small', u'traditional', u'buildings', u'narrower', u'compact', u'amsterdam', u'based', u'centre', u'noisy', u'local', u'restaurants', u'excellent', u'staff', u'arrange', u'wanted', u'recommending', u'booking', u'restaurants', u'arranging', u'water', u'taxis', u'trips', u'accomodating', u'sooooo', u'canal', u'grande']",UR120353941
"[u'researching', u'lots', u'canal', u'grande', u'looked', u'perfect', u'arrived', u'greeted', u'front', u'desk', u'located', u'canal', u'train', u'station', u'location', u'middle', u'crowds', u'quieter', u'visiting', u'areas', u'venice', u'glad', u'chose', u'location', u'wasn', u't', u'midst', u'crowds', u'rialto', u'room', u'located', u'courtyard', u'main', u'building', u'room', u'beautiful', u'long', u'hallway', u'led', u'lovely', u'bedroom', u'decorated', u'gold', u'decor', u'wood', u'floors', u'room', u'clean', u'comfortable', u'bathroom', u'lovely', u'sparkling', u'shower', u'awesome', u'room', u'comfortable', u'quiet', u'hard', u'leave', u'breakfast', u'sit', u'ride', u'canal', u'watching', u'boats', u'pass', u'start', u'day', u'breakfast', u'offered', u'croissants', u'rolls', u'cookies', u'pastries', u'yogurt', u'meats', u'cheeses', u'thy', u'egg', u'costs', u'extra', u'staff', u'extremely', u'friendly', u'enjoyable', u'originally', u'thought', u'canal', u'grande', u'perfect']",UR85092644
"[u'room', u'annexe', u'overlooking', u'square', u'craned', u'head', u'window', u'canal', u'view', u'intended', u'april', u'trip', u'cancelled', u'courtesy', u'icelandic', u'ash', u'cloud', u'attempt', u'rebook', u'september', u'thwarted', u'bookers', u'misunderstood', u'plans', u'failed', u'book', u'eventually', u'arrived', u'november', u'find', u'canal', u'grande', u'well', u'worth', u'wait', u'thirty', u'minute', u'walk', u'tourist', u'attractions', u'st', u'mark', u'square', u'canal', u'grande', u'vaporetto', u'travelling', u'venice', u'train', u'station', u'travelling', u'afield', u'arrival', u'marco', u'polo', u'airport', u'book', u'water', u'taxi', u'shuttle', u'direct', u'private', u'mooring', u'taxi', u'public', u'bus', u'careful', u'return', u'transfer', u'buy', u'ticket', u'bus', u'piazzalle', u'roma', u'big', u'bus', u'station', u'car', u'park', u'ten', u'minutes', u'canal', u'grande', u'well', u'situated', u'walks', u'canarreggio', u'tintoretto', u'parish', u'church', u'well', u'worth', u'visit', u'plenty', u'local', u'churches', u'santa', u'croce', u'practical', u'note', u'breakfasts', u'tasty', u'filling', u'rooms', u'sumptiously', u'decorated', u'venice', u'reasonably', u'sized', u'efficient', u'friendly', u'staff']",UR120692109
"[u'outstanding', u'friendly', u'service', u'arrived', u'worked', u'company', u'helped', u'escort', u'entire', u'staff', u'wonderful', u'upgraded', u'suite', u'checked', u'room', u'beautiful', u'amazing', u'clean', u'beautifully', u'decorated', u'spacious', u'location', u'convenient', u'close', u'train', u'station', u't', u'lug', u'luggage', u'countless', u'bridges', u'high', u'nicest', u'higher', u'rankings', u'venice', u'breakfast', u'delicious', u'including', u'blood', u'orange', u'juice']",UR64870394
"[u'booked', u'despite', u'high', u'cost', u'partly', u'driven', u'reviews', u'alright', u'expectations', u'room', u'fine', u'overdone', u'venice', u'appeals', u'starry', u'eyed', u'young', u'couples', u'honeymoon', u'location', u'excellent', u'disappointments', u'advertised', u'glass', u'blowing', u'excursion', u'meant', u'included', u'people', u'wanted', u'day', u't', u'care', u'fuss', u'thought', u'poor', u'form', u'breakfast', u'space', u'small', u'number', u'people', u'meaning', u'hard', u'table', u'regard', u'crowd', u'starry', u'eyed', u'young', u'couples']",UR122949330
"[u'husband', u'visit', u'venice', u'driving', u'holiday', u'europe', u'parked', u'car', u'tronchetto', u'well', u'signposted', u'instructions', u'website', u'vaporetto', u'haven', u't', u'top', u'star', u'rating', u'expections', u'exceeded', u'establishment', u'quality', u'room', u'excellent', u'service', u'staff', u'fabulous', u'trouble', u'met', u'smile', u'feel', u'breakfast', u'morning', u'don', u't', u'fact', u'main', u'square', u'tourist', u'season', u'bonus', u'purchased', u'hr', u'vaparetto', u'card', u'unlimited', u'travel', u'islands', u'lasting', u'memory', u'returning', u'dinner', u'sitting', u'balcony', u'canal', u'live', u'music', u'played', u'opposite', u'drink', u'hand', u'quiet', u'lap', u'water', u'bliss', u'highly', u'recommend', u'visiting', u'venice']",UR117703888
"[u'spent', u'nights', u'venice', u'canal', u'grande', u'teenage', u'daughters', u'location', u'perfect', u'convenient', u'room', u'gorgeous', u'staff', u'gracious', u'return', u'venice', u'definitely', u'return', u'canal', u'grande', u'visit']",UR117655073
"[u'canal', u'grande', u'charming', u'property', u'comfortable', u'rooms', u'located', u'canal', u'grande', u'min', u'foot', u'bus', u'station', u'railway', u'station', u'landlady', u'friendly', u'comfortable', u'rooms', u'small', u'cosy', u'beds', u'comfortable', u'allow', u'sleep', u'area', u'quiet', u'night', u'breakfast', u'variety', u'bred', u'cereals', u'cheese', u'fruits', u'cold', u'cuts', u'egg', u'dishes', u'extra', u'charge', u'money', u'better', u'high', u'season', u'rates', u'recommended']",UR124163284
"[u'lovely', u'min', u'walk', u'train', u'station', u'canal', u'lovely', u'breakfast', u'staff', u'accommodating', u'highly', u'recommend']",UR117251739
"[u'wife', u'anniversary', u'break', u'excellent', u'spotless', u'room', u'location', u'friendly', u'staff', u'arrival', u'coffee', u'balcony', u'overlooking', u'grand', u'canal', u'perfect', u'definitely', u'recommend']",UR114860559
"[u'well', u'perfect', u'wonderful', u'full', u'wonderful', u'staff', u'attentive', u'caring', u'trouble', u'wonderful', u'smiley', u'lady', u'reception', u't', u'spell', u'work', u'hard', u'special', u'remembered', u'guests', u'trouble', u'asked', u'day', u'time', u'finished', u'shift', u'reply', u'hours', u'ago', u'love', u'job', u'leave', u'attention', u'detail', u'outstanding', u'ensured', u'friend', u'felt', u'princesses', u'hope', u'maralyn', u'beswick', u'brown']",UR117277250
"[u'birthday', u'treat', u'staff', u'brilliant', u'trouble', u'offered', u'room', u'terrace', u'night', u'afternoon', u'venice', u'sun', u'shone', u'terrace', u'lovely', u'start', u'resturant', u'suggestions', u'spot', u'lots', u'advice', u'provided', u'sought', u'lovely', u'location', u'airport', u'orange', u'waterbus', u'drops', u'guglie', u'walk', u'cheaper', u'private', u'water', u'taxi', u'buy', u'return', u'ticket', u'euros', u'venice', u'wander', u'number', u'vaperetto', u'trip', u'missed', u'second', u'st', u'marks', u'square', u'stops', u'bridge', u'sighs', u'water', u'return', u'love', u'italy', u'icing', u'cake']",UR127793428
"[u'arrived', u'water', u'taxi', u'direct', u'airport', u'moment', u'stepped', u'taxi', u'direct', u'front', u'door', u'wowed', u'clean', u'appeared', u'completely', u'refurbished', u'bedroom', u'unbelievable', u'views', u'directly', u'canal', u'whilst', u'grand', u'canal', u'st', u'marks', u'square', u'main', u'canal', u'entrance', u'doesn', u't', u'matter', u'train', u'station', u'water', u'bus', u'stations', u'day', u'ticket', u'euros', u'trip', u'round', u'island', u'venice', u'side', u'routes', u'water', u'taxi', u'glass', u'blowing', u'murano', u'grab', u'taxi', u'hospital', u'save', u'mins', u'venice', u'small', u'city', u'easily', u'walk', u'amble', u'hour', u'breakfast', u'area', u'small', u'continental', u'breakfast', u'fine', u'stocked', u'day', u'till', u'evening', u'meal', u'care', u'prices', u'vary', u'massively', u'venice', u'staff', u'superb', u'answers', u'difficult', u'tips', u'restaurants', u'recommend', u'favourites', u'full', u'italians', u'tourists', u'excellent', u'food', u'reasonable', u'prices', u'venice', u'beautiful', u'sun', u'unbelievable', u'early', u'january', u'quiet']",UR123058459
"[u'pleased', u'moved', u'travel', u'order', u'elegant', u'suite', u'days', u'canal', u'grande', u'location', u'closed', u'water', u'shuttle', u'train', u'station', u'bus', u'station', u've', u'tourists', u'drag', u'bags', u'long', u'distance', u'order', u'lucky', u'mins', u'pleasant', u'walk', u'bus', u'station', u'managed', u'day', u'trip', u'milan', u'train', u'cross', u'bridge', u'closed', u'private', u'location', u'crowded', u'noisy', u'petite', u'nicely', u'decorated', u'elegant', u'suite', u'spacious', u'well', u'equipped', u'staffs', u'friendly', u'trip', u'murano', u'included', u'room', u'breakfast', u'plenty', u'food', u'quality', u'thing', u'complain', u'quietness', u'room', u'don', u't', u'mind', u'hearing', u'traffic', u'grand', u'canal', u'rooms', u'well', u'sound', u'proofed', u'morning', u'hear', u'people', u'upstairs', u'walking', u'room', u'talking', u'flushing', u'toilet', u'happened', u'early', u'morning', u'surely', u'sleep', u'quality', u'book', u'room', u'top', u'floor', u'help', u'love', u'venice', u'april', u'time', u'visit', u'definitely', u'recommend', u'friends', u'families', u'planning', u'venice']",UR105346864
"[u'nights', u'canal', u'view', u'room', u'top', u'floor', u'unusable', u'table', u'chairs', u'extremely', u'low', u'ceiling', u'sharp', u'step', u'bathroom', u'dangerous', u'night', u'forget', u'tired', u'arrived', u't', u'aout', u'things', u'unpacked', u'amenities', u'reminded', u'holiday', u'inn', u'express', u'plastic', u'drinking', u'cups', u'room', u'powered', u'juice', u'tang', u'beakfast', u'buffet', u'half', u'price', u'luxury', u'rates', u'staff', u'polite', u'recommended', u'lousy', u'restaurant', u't', u'area', u'quiet', u'convenient', u'train', u'station', u'loved', u'vencie', u'won', u't']",UR111896199
"[u'trip', u'advisor', u'positive', u'reviews', u'accurate', u'chose', u'upgrade', u'junior', u'suite', u'extra', u'payment', u'arrival', u'choice', u'rooms', u'suite', u'rooms', u'separate', u'building', u'small', u'beautifully', u'decorated', u'directions', u'catching', u'blue', u'bus', u'airport', u'euros', u'person', u'walked', u'piazza', u'de', u'rome', u'walk', u'bridges', u'minutes', u'route', u'easy', u'follow', u'staff', u'friendly', u'asked', u'checkout', u'improvements', u'couldn', u't', u'terrace', u'small', u'larger', u'tables', u'enjoy', u'breakfast', u'drinks', u'canal', u'free', u'internet', u'access', u'hours', u'code', u'niggle', u'location', u'convenient', u'vaporetto', u'water', u'buses', u'walking', u'main', u'sights', u'venice', u'recommend', u'traveling', u'venice', u'recommendation', u'evening', u'activity', u'opera', u'musica', u'palazzo', u'musicapalazzo']",UR75034343
"[u'suggests', u'located', u'grand', u'canal', u'min', u'walk', u'trainstation', u'min', u'walk', u'bus', u'terminal', u'easily', u'reach', u'train', u'airport', u'room', u'beautifully', u'decorated', u'style', u'antique', u'interior', u'combined', u'high', u'tech', u'facilities', u'beautiful', u'bathroom', u'well', u'doesn', u't', u'restaurant', u'serving', u'dinner', u'breakfast', u'small', u'selection', u'pastries', u'restaurants', u'minutes', u'walk', u'problem', u'aware', u'queensize', u'bed', u'italy', u'twin', u'beds', u'standing', u'eachother', u'handyman', u'tape', u'beds', u'avoid', u'falling', u'beds', u'unusual', u'course', u'couples', u'sleep', u'seperate', u'beds', u'walking', u'distance', u'places', u'central', u'venice', u'recommended']",UR117670863
"[u'beautiful', u'rooms', u'small', u'luxurious', u'decorated', u'classic', u'venetian', u'decor', u'staff', u'kind', u'friendly', u'breakfast', u'morning', u'delicious', u'restaurant', u'serves', u'breakfast', u'eat', u'close', u'main', u'train', u'station', u'pleasant', u'experience', u'return', u'venice']",UR116737816
"[u'rare', u'review', u'place', u'positive', u'surprised', u'oddly', u'skeptical', u'noticed', u'nary', u'negative', u'review', u'trip', u'advisor', u'despite', u'fact', u'dark', u'horse', u'late', u'debate', u'choose', u'venice', u'booked', u'fortunate', u'choice', u'turns', u'glowing', u'reviews', u'canal', u'grande', u'perfect', u'place', u'venice', u'staff', u'member', u'encountered', u'solicitous', u'rooms', u'lovely', u'spotless', u'location', u'bit', u'removed', u'center', u'touristic', u'melee', u'town', u'consider', u'thing', u'couple', u'minutes', u'walk', u'nearest', u'vaporetto', u'convey', u'fray', u'night', u'arrival', u'rooms', u'newer', u'building', u'adjacent', u'main', u'appointed', u'cream', u'silks', u'photos', u'ground', u'level', u'windows', u'facing', u'alley', u'room', u'dark', u'smelled', u'air', u'freshener', u'opening', u'windows', u'chilly', u'november', u'lived', u'scent', u'darkness', u'depressing', u'morning', u'asked', u'desk', u'blue', u'rooms', u'looked', u'nicer', u'website', u'mark', u'accommodated', u'request', u'graciously', u'demur', u'compelling', u'reason', u'wrong', u'room', u'color', u'blue', u'better', u'cream', u'second', u'room', u'casanova', u'attic', u'higher', u'price', u'windows', u'faced', u'grand', u'canal', u'staff', u't', u'mention', u'fulfilled', u'request', u'remembered', u'remove', u'air', u'freshener', u'room', u'casanova', u'room', u'smaller', u'original', u't', u'matter', u'decorated', u'gorgeous', u'sky', u'blue', u'silk', u'website', u'bright', u'sunny', u'day', u'snug', u'night', u'top', u'building', u'quieter', u'upstairs', u'neighbors', u'treading', u'head', u'continental', u'breakfast', u'included', u'cheery', u'breakfast', u'room', u'staff', u'perfect', u'cheerful', u'accommodating', u'room', u'service', u'items', u'order', u'room', u'day', u'evening', u't', u'small', u'bar', u'pick', u'drink', u'evening', u'room', u'honor', u'bar', u'mine', u't', u'rooms', u'free', u'wifi', u'left', u'computer', u'computer', u'lobby', u'case', u'burning', u'check', u'facebook', u'couple', u'free', u'entries', u'desk', u'workers', u'mentioned', u'casino', u'glass', u'blower', u'murano', u'final', u'observation', u'checked', u'nights', u'desk', u'person', u'asked', u'leave', u'better', u'differently', u'wasn', u't', u'canal', u'grande', u'delivered', u'perfect']",UR121746782
"[u'wife', u'month', u'reading', u'positive', u'reviews', u'disappointed', u'outstanding', u'breakfast', u'staff', u'service', u'esp', u'breakfast', u'staff', u'check', u'process', u'mention', u'extremely', u'convenient', u'location', u'train', u'station', u'vaporetto', u'water', u'bus', u'santa', u'lucia', u'room', u'canal', u'spectacular', u'mentioned', u'early', u'breakfast', u'deck', u'rejuvenating', u'wifi', u'difficult', u'access', u'android', u'phones', u'fine', u'laptops', u'absolutely']",UR112478109
"[u'family', u'kids', u'ages', u'quadruple', u'room', u'offered', u'comfort', u'amenities', u'luxury', u'venetian', u'style', u'blew', u'ownership', u'paid', u'attention', u'detail', u'designing', u'keeping', u'rooms', u'mosaic', u'bathroom', u'bathrooms', u'room', u'wall', u'covers', u'canopy', u'bed', u'brought', u'venice', u'duke', u'palace', u'atmosphere', u'room', u'kids', u'wife', u't', u'leave', u'continue', u'italy', u'trip', u'breakfast', u'dock', u'facing', u'canal', u'experience', u'highly', u'recommended', u'talking', u'return', u'trip']",UR123758530
"[u'booked', u'room', u'antique', u'figure', u'opposite', u'railway', u'station', u'santa', u'lucia', u'entering', u'manager', u'greated', u'asked', u'upgrade', u'room', u'checking', u'couple', u'rooms', u'canal', u'grande', u'choice', u'easy', u'selected', u'room', u'annex', u'arranged', u'twin', u'bed', u'room', u'room', u'faulted', u'room', u'brand', u'finished', u'high', u'spec', u'location', u'room', u'quiet', u'night', u'staff', u'friendly', u'effort', u'feel', u'offered', u'boat', u'trip', u'murano', u'opted', u'read', u'experiences']",UR58816477
"[u'husband', u'chose', u'sibling', u'star', u'antiche', u'figure', u'don', u't', u'impressed', u'service', u'amazingly', u'professional', u'venice', u'excellent', u'service', u'staff', u'happily', u'upgraded', u'star', u'day', u'ipafter', u'breakfast', u'manager', u'alessandro', u'impressed', u'delighted', u'amazing', u'service', u'escorted', u'luggage', u'patience', u'professionalism', u'staff', u'smile', u'faces', u'extra', u'mile', u'feel', u'room', u'tastefully', u'decorated', u'grand', u'venetian', u'style', u'egyptian', u'bath', u'towels', u'clean', u'loved', u'tv', u'screen', u'mirror', u'delicious', u'breakfast', u'guys', u'helped', u'veggies', u'fruits', u'portions', u'day', u'don', u't', u'blood', u'orange', u'capuccino', u'location', u'vaporetto', u'grazie', u'mille', u'giovana', u'giani', u'natasha', u'alessandros', u'team', u'forgot', u'names', u'making', u'trip', u'venice', u'indimenticabile']",UR127767368
