Content,ReviewID
"[u'spent', u'weekend', u'amsterdam', u'spending', u'ages', u'researching', u'looked', u'tripadvisor', u'site', u'booked', u'location', u'poor', u'sense', u'direction', u'night', u'find', u'tram', u'bus', u'stops', u'central', u'station', u'directions', u'station', u'hosts', u'room', u'ground', u'floor', u'ground', u'level', u'problem', u'noise', u'apart', u'night', u'decided', u'beep', u'horn', u'loud', u'double', u'glazing', u'wouldn', u't', u'cope', u'room', u'simple', u'free', u'wi', u'fi', u'change', u'identikit', u'chain', u'rooms', u'wooden', u'wardrobe', u'clothes', u'sweet', u'treat', u'pillow', u'day', u'breakfast', u'fresh', u'bread', u'juices', u'cereal', u'yogurt', u'cheese', u'special', u'day', u'case', u'fresh', u'melon', u'yogurt', u'fruit', u'walking', u'distance', u'red', u'light', u'district', u'places', u'area', u'walking', u'round', u'bad', u'area', u'amsterdam', u'laid', u'place', u'treat', u'walk', u'round', u't', u'honesty', u'bar', u'reasonably', u'priced', u'pay', u'chain']",UR121431823
"[u'spent', u'nights', u'mauro', u'mansion', u'wonderful', u'experience', u'fantastic', u'location', u'close', u'train', u'station', u'canal', u'restaurants', u'room', u'third', u'floor', u'faced', u'canal', u'lovely', u'memorable', u'view', u'room', u'large', u'clean', u'fresh', u'bathroom', u'modern', u'clean', u'bed', u'comfortable', u'refrigerator', u'room', u'free', u'wifi', u'greatly', u'appreciated', u'large', u'flat', u'screen', u'tv', u'dvd', u'player', u'large', u'selection', u'dvds', u'owners', u'berry', u'marcel', u'wonderful', u'hosts', u'offered', u'excellent', u'restaurant', u'suggestions', u'well', u'touring', u'city', u'environs', u'breakfast', u'morning', u'special', u'touches', u'fresh', u'melon', u'strawberries', u'pineapple', u'charming', u'unique', u'recommend', u'heartbeat', u'amsterdam', u'time']",UR109561950
"[u'wonderfully', u'located', u'main', u'train', u'station', u'canal', u'walking', u'distance', u'attractions', u'rooms', u'original', u'nights', u'teenage', u'kids', u'marcel', u'berry', u'extremely', u'friendly', u'planning', u'activities', u'red', u'light', u'district', u'corner', u'provided', u'interesting', u'evening', u'strolls', u'kids', u'problems', u'definitely', u'recommend', u'place', u'friends']",UR108445616
"[u'mauro', u'mansion', u'rooms', u'service', u'breakfast', u'superb', u'location', u'perfect', u'recommendations', u'berry', u'nearby', u'restaurants', u'including', u'eat', u'excellent', u'dinner', u'won', u't', u'amsterdam']",UR90382467
"[u'perfect', u'close', u'station', u'small', u'lovely', u'clean', u'breakfast', u'rooms', u'perfect', u'destination', u'start', u'discovery', u'forget', u'owners', u'lovely', u'funny', u'conversations', u'evening', u'morning', u'amsterdam', u'visits']",UR102855597
"[u'berry', u'marcel', u'guest', u'house', u'fort', u'amsterdam', u'conveniently', u'road', u'doors', u'planning', u'disappointed', u'booked', u'directed', u'boutique', u'booked', u'hesitation', u'won', u't', u'repeat', u'people', u'amazing', u'breakfast', u'personal', u'touches', u'friendly', u'warm', u'nature', u'hosts', u'add', u'money', u'location', u'orange', u'bike', u'hire', u'road', u'sooo', u'convenient', u'perfect', u'room', u'barbar', u'chair', u'looked', u'canal', u'lovely', u'raining', u'cats', u'dogs', u'content', u'lovely', u'room', u'passed', u'spa', u'lovers', u'grab', u'bike', u'jump', u'train', u'haarlem', u'check', u'sauna', u'van', u'egmond', u'van', u'egmond', u'straat', u'amazing', u'place', u'berry', u'marcel', u'sam', u'neville', u'xx']",UR75081016
"[u'husband', u'street', u'level', u'canal', u'room', u'agree', u'positive', u'comments', u'mauro', u'honesty', u'bar', u'breakfast', u'free', u'ipad', u'friendly', u'owners', u'staff', u'person']",UR124725732
"[u'staff', u'extremely', u'friendly', u'solo', u'traveller', u'recommendations', u'places', u'visit', u'buying', u'museum', u'tickets', u'saving', u'time', u'queuing', u'deco', u'typical', u'dutch', u'style', u'breakfast', u'lovely', u'breakfast', u'room', u'music', u'playing', u'start', u'day', u'top', u'surprise', u'guest', u'morning', u'enjoy', u'needless', u'superb', u'location', u'amsterdam', u'station', u'centraal', u'opp', u'road']",UR87458407
"[u'enjoyed', u'mauro', u'mansion', u'touches', u'arrived', u'valentines', u'day', u'red', u'white', u'heart', u'shaped', u'balloons', u'alongside', u'chocolate', u'bed', u'mini', u'fridge', u'stocked', u'juice', u'beer', u'sparkling', u'wine', u'free', u'charge', u'evening', u'treat', u'left', u'pillow', u'waffle', u'cookies', u'morning', u'extra', u'surprise', u'breakfast', u'freshly', u'cut', u'pineapple', u'mini', u'pancakes', u'pastries', u'top', u'delicious', u'breakfast', u'fresh', u'fruit', u'local', u'bread', u'meats', u'cheeses', u'stored', u'funky', u'red', u'fridge', u'breakfast', u'table', u'coffee', u'machine', u'selection', u'teas', u'tea', u'coffee', u'reception', u'day', u'honesty', u'bar', u'bonus', u'munchies', u'late', u'night', u'fancied', u'extra', u'glass', u'wine', u'beer', u'selection', u'dvds', u'books', u'borrowed', u'ipad', u'macbook', u'reception', u'times', u'rooms', u'spacious', u'well', u'equipped', u'ipod', u'docking', u'station', u'flatscreen', u'tv', u'dvd', u'player', u'bathroom', u'deep', u'bath', u'walk', u'shower', u'fragrant', u'toiletries', u'mauro', u'mansion', u'located', u'minutes', u'central', u'station', u'walking', u'distance', u'squares', u'local', u'attractions', u'lucky', u'ice', u'melt', u'canals', u'enjoy', u'hour', u'cruise', u'city', u'totally', u'recommend', u'mauro', u'mansion']",UR124823740
"[u'find', u'fresh', u'flowers', u'room', u'find', u'fresh', u'squeezed', u'orange', u'juice', u'breakfast', u'morning', u'marcel', u'barry', u'wonder', u'hosts', u'time', u'visiting', u'amsterdam', u'marcel', u'help', u'orient', u'city', u'looked', u'bus', u'schedules', u'book', u'museum', u'tickets', u'minutes', u'walk', u'centraal', u'station', u'room', u'bathroom', u'sparkling', u'clean', u'bed', u'comfortable', u'appreciated', u'bed', u'lamp', u'integrated', u'pod', u'dock', u'missing', u'elevator', u'shouldn', u't', u'problem', u'travel', u'diana', u'ross', u'tour']",UR67481848
"[u'mauro', u'mansion', u'met', u'expectations', u'perfectly', u'location', u'blocks', u'train', u'station', u'ideal', u'easily', u'walk', u'major', u'sites', u'interest', u'room', u'third', u'floor', u'comfortable', u'enjoyed', u'lovely', u'view', u'canal', u'bathroom', u'clean', u'functional', u'breakfast', u'high', u'quality', u'local', u'ingredients', u'excellent', u'selection', u'tasty', u'meats', u'cheeses', u'juices', u'freshly', u'baked', u'breads', u'coffee', u'maker', u'day', u'night', u'computer', u'ipad', u'importantly', u'pleasant', u'hosts', u'wise', u'advice', u'activities', u'restaurants', u'charming', u'justifiably', u'small', u'lovely', u'recommend', u'mauro', u'mansion', u'reservations', u'climb', u'circular', u'staircase', u'architectural', u'feature', u'canal', u'house']",UR121493219
"[u'boyfriend', u'spent', u'nights', u'mauro', u'mansion', u'booked', u'based', u'trip', u'advisor', u'reviews', u'lived', u'expectations', u'brilliant', u'location', u'room', u'lovely', u'pristine', u'owners', u'welcoming', u'definitely', u'recommending', u'friends']",UR124377969
"[u'visit', u'amsterdam', u'traveling', u'lot', u'amsterdam', u'wonderful', u'beautiful', u'live', u'amazing', u'city', u'choice', u'shifted', u'amsterdam', u'goa', u'india', u'type', u'city', u'location', u'location', u'reach', u'walking', u'station', u'taxi', u'reach', u'indian', u'restaurant', u'apposite', u'crossing', u'canal', u'views', u'exactly', u'thing', u'tourist', u'crowded', u'live', u'place', u'amsterdam', u'centre', u'dam', u'square', u'enjoy', u'moment', u'live', u'amsterdam', u'luxer', u'small', u'street', u'full', u'tourists', u'bars', u'restaurants', u'morning', u'night', u'clock', u'door', u'amazing', u'life', u'amazing', u'night', u'laughing', u'drinking', u'eating', u'crowd', u'tourists', u'asians', u'indians', u'better', u'luxer', u'europeans', u'mauro', u'mansion', u'better', u'calm', u'quiet', u'place', u'comfortable', u'rooms']",UR117665412
"[u'berry', u'marcel', u'lovely', u'hospitality', u'rooms', u'breakfast', u'location', u'top', u'class', u'felt', u'straight', u'knew', u'help', u'assistance', u'needed']",UR114635231
"[u'booked', u'trip', u'abroad', u'couple', u'girlfriend', u'looked', u'trip', u'advisor', u'decent', u'amsterdam', u'read', u'previous', u'fantastic', u'reviews', u'decided', u'check', u'wholly', u'agree', u'word', u'mauro', u'mansion', u'true', u'location', u'ideal', u'dropped', u'central', u'station', u'minute', u'walk', u'arrived', u'early', u'greeted', u'warmly', u'hosts', u'allowed', u'drop', u'bags', u'recommended', u'places', u'nearby', u'head', u'lunch', u'returned', u'room', u'luggage', u'delivered', u'room', u'magical', u'top', u'floor', u'delight', u'room', u'barbers', u'chair', u'lovely', u'addition', u'beautiful', u'room', u'bed', u'magnificently', u'comfy', u'knew', u'nights', u'sleep', u'complimentary', u'chocolates', u'drinks', u'bathroom', u'products', u'impressive', u'opinion', u'bathroom', u'jacuzzi', u'type', u'bathtub', u'walk', u'shower', u'benefit', u'floor', u'heating', u'honesty', u'bar', u'touch', u'allowing', u'pick', u'drinks', u'snacks', u'time', u'day', u'night', u'declare', u'checking', u'reasonable', u'price', u'fine', u'selection', u'dvds', u'enjoy', u'room', u'leisure', u'trouble', u'hosts', u'allowed', u'leave', u'bags', u'care', u'enjoy', u'day', u'sightseeing', u'lumbering', u'bags', u'breakfast', u'exquisite', u'fresh', u'bread', u'ham', u'cheese', u'salami', u'yoghurts', u'well', u'lovely', u'addition', u'strawberries', u'yoghurt', u'start', u'easy', u'walking', u'distance', u'hustle', u'bustle', u'amsterdam', u'centre', u'set', u'ensure', u'night', u'sleep', u'enjoyed', u'impressive', u'love', u'future', u'downside', u'night']",UR86681087
"[u'highly', u'recommend', u'small', u'boutique', u'thinking', u'staying', u'amsterdam', u'minute', u'walk', u'central', u'station', u'clean', u'hip', u'decor', u'excellent', u'breakfast', u'incredibly']",UR96169660
"[u'amsterdam', u'mauros', u'mansion', u'time', u'feel', u'write', u'somthing', u'lovely', u'friendly', u'persons', u'clean', u'rooms', u'service', u'morning', u'special', u'breakfast', u'coffee', u'tasts', u'drinks', u'room', u'free', u'posibility', u'boiling', u'water', u'coffee', u'tee', u'room', u'amsterdam', u'll', u'forget', u'days', u'mauros', u'mansion']",UR102406515
"[u'excellent', u'central', u'location', u'main', u'places', u'minutes', u'walk', u'train', u'station', u'excellent', u'hosts', u'excellent', u'establishment', u'lovely', u'breakfast', u'morning', u'happy', u'share', u'local', u'knowledge', u'wanted', u'eat', u'local', u'traditional', u'dutch', u'restaurants', u'mauro', u'mansion', u'hesitation']",UR118423307
"[u'place', u'opened', u'well', u'hidden', u'gem', u'moment', u'availability', u'sure', u'book', u'room', u'floor', u'courtyard', u'room', u'featured', u'jacuzzi', u'bath', u'ritual', u'bath', u'products', u'ipod', u'dock', u'tv', u'dvd', u'player', u'main', u'room', u'service', u'exemplary', u'full', u'breakfast', u'buffet', u'morning', u'runs', u'enjoy', u'things', u'slowly', u'holiday', u'crack', u'dawn', u'disappointed']",UR67386713
"[u'place', u'location', u'breakfasts', u'lot', u'better', u'rooms', u'owners', u'enjoyed', u'sure', u'deserves', u'ranking', u'convenient', u'location', u'decent', u'accomodations']",UR113160638
"[u'mention', u'hosts', u'berry', u'marcel', u'difficult', u'find', u'nowadays', u'kind', u'careful', u'people', u'unforgettable', u'interested', u'travellers', u'visit', u'maps', u'guides', u'suggested', u'visit', u'unique', u'places', u'amsterdam', u'breakfasts', u'astonishing', u'products', u'stylish', u'fridge', u'day', u'hosts', u'surprise', u'bread', u'baked', u'morning', u'started', u'relax', u'music', u'calm', u'atmosphere', u'enjoy', u'meal', u'room', u'clean', u'flowers', u'vase', u'pointed', u'hosts', u'unique', u'atmosphere', u'comfort', u'delight', u'travellers', u'berry', u'marcel', u'cordiality', u'oleg', u'sergey', u'russia']",UR73399489
"[u'location', u'quiet', u'street', u'overlooking', u'canal', u'nicely', u'decorated', u'theme', u'rooms', u'marcel', u'berry', u'incredible', u'hosts', u'accommodating', u'enjoyed', u'morning', u'breakfast', u'provided', u'fresh', u'breads', u'cold', u'cuts', u'cheese', u'yogurt', u'special', u'treat', u'morning', u'bike', u'rentals', u'directly', u'canal', u'town']",UR69267042
"[u'spending', u'year', u'amsterdam', u'fantastic', u'time', u'mauro', u'mansion', u'ideally', u'situated', u'central', u'station', u'alongside', u'canal', u'close', u'close', u'china', u'town', u'red', u'light', u'district', u'lucky', u'cancellation', u'room', u'lovely', u'views', u'canal', u'owners', u'ear', u'plugs', u'didnt', u'room', u'equipped', u't', u'dvd', u'player', u'lots', u'dvd', u'borrow', u'mini', u'fridge', u'filled', u'complimentary', u'drinks', u'including', u'bottle', u'champagne', u'celebrate', u'year', u'bed', u'comfy', u'shower', u'deep', u'bath', u'underfloor', u'heating', u'bathroom', u'breakfast', u'continental', u'plenty', u'choice', u'lots', u'fresh', u'coffee', u'juices', u'warm', u'breads', u'cheeses', u'meat', u'owners', u'warm', u'friendly', u'ordered', u'amsterdam', u'tickets', u'charge', u'valid', u'year', u'worked', u'laptop', u'pad', u'wanting', u'book', u'place']",UR122418931
"[u'fourth', u'time', u'city', u'place', u'excellent', u'greeted', u'food', u'rooms', u'cant', u'fault', u'relaxing', u'personally', u'definitely', u'berrie']",UR124219892
"[u'location', u'breakfast', u'service', u'rooms', u'immaculate', u'clean', u'week', u'business', u'trip', u'recommend']",UR80854835
"[u'typically', u'time', u'write', u'reviews', u'mauro', u'mansion', u'experiences', u'spent', u'roughly', u'weeks', u'portion', u'base', u'station', u'traveled', u'cities', u'paris', u'rome', u't', u'match', u'details', u'care', u'thought', u'people', u'forgot', u'lost', u'larger', u'chains', u'loud', u'party', u'zone', u'stuffy', u'star', u'atmosphere', u'isn', u't', u'place', u'cherish', u'amount', u'extravagance', u'mixed', u'comfort', u'amazing', u'hosts', u'spot']",UR99699390
"[u'mauro', u'mansion', u'darling', u'tiny', u'heart', u'amsterdam', u'easy', u'walk', u'list', u'staff', u'extremely', u'suggestions', u'reservations', u'sights', u'planning', u'weather', u'visit', u'memorable', u'breakfast']",UR115130800
"[u'loved', u'place', u'terrific', u'location', u'husband', u'love', u'travel', u'wanted', u'spend', u'holidays', u'amsterdam', u'pleased', u'mauro', u'mansion', u'arrived', u'berry', u'wonderful', u'owner', u'stocked', u'breakfast', u'food', u'meet', u'husband', u'strict', u'dietary', u'restrictions', u'emailed', u'prior', u'allergies', u'researched', u'restaurants', u'loved', u'catered', u'diet', u'couldn', u't', u'affordable', u'rate', u'amazing', u'view', u'canal', u'room', u'rocked', u'romantic', u'room', u'decorated', u'beautifully', u'bed', u'incredibly', u'comfortable', u'perfect', u'busy', u'day', u'heated', u'floor', u'tiles', u'bathroom', u'husband', u'favorite', u'well', u'spacious', u'room', u'clean', u'literally', u'eaten', u'floors', u'lastly', u'loved', u'central', u'location', u'traveling', u'quaint', u'city', u'easy', u't', u'wait', u'mauro', u'hopefully', u'summer']",UR91132767
"[u'love', u'love', u'guys', u'challenge', u'title', u'helped', u'enjoyable', u'weekends', u'guys']",UR97018123
"[u'marcel', u'berry', u'wonderful', u'hosts', u'manage', u'caring', u'help', u'carry', u'luggage', u'stairs', u'intrusive', u'location', u'perfect', u'walked', u'despite', u'edge', u'red', u'light', u'district', u'oasis', u'busy', u'city', u'breakfast', u'wonderful', u'hot', u'fresh', u'breads', u'platters', u'cheeses', u'meats', u'containers', u'yogurt', u'accompaniments', u'lovely', u'red', u'refrigerator', u'coffees', u'espresso', u'day', u'special', u'side', u'treat', u'prepared', u'marcel', u'morning', u'prepared', u'skewers', u'fresh', u'mini', u'pancakes', u'alternating', u'strawberries', u'morning', u'rolled', u'pancakes', u'cup', u'fresh', u'fruit', u'yogurt', u'front', u'rooms', u'facing', u'canal', u'floor', u'second', u'floor', u'small', u'fold', u'luggage', u'racks', u'loved', u'room', u'whimsically', u'designed', u'comfortable', u'bed', u'beverages', u'mini', u'fridge', u'free', u'wifi', u'signal', u'bit', u'weak', u'room', u'warn', u'mosquitoes', u'criticism', u'fact', u'amsterdam', u'canals', u'air', u'conditioning', u'opening', u'window', u'berry', u'marcel', u'knowledgeable', u'restaurants', u'advice', u'husband', u'contracted', u'cold', u'berry', u'knew', u'direct', u'nearest', u'pharmacy', u'helped', u'decide', u'gift', u'business', u'associate', u'visiting', u'young', u'man', u'assists', u'berry', u'marcel', u'desk', u'amsterdam', u'book', u'advance', u'place', u'perfect', u'combination', u'vacation', u'business', u'trip', u'berry', u'marcel']",UR118674028
"[u'berry', u'marcel', u'perfect', u'hosts', u'staff', u'exceedingly', u'friendly', u'drawback', u'elevator', u'luggage', u'room', u't', u'struggle', u'flights', u'stairs', u'building', u'historical', u'structural', u'changes', u'approved', u'elevators', u'rooms', u'large', u'high', u'ceilings', u'breakfasts', u'variety', u'cheeses', u'meats', u'grain', u'bread', u'yogart', u'fruits', u'cereal', u'morning', u'special', u'dish', u'freshly', u'prepared', u'guest', u'chocolate', u'crepes', u'fruit', u'yogart', u'parfait', u'drinks', u'lobby', u'breakfast', u'area', u'checking', u'tv', u'vcr', u'room', u'large', u'selection', u'dvds', u'cds', u'books', u'borrow', u'lighting', u'room', u'poor', u'read', u'bed', u'loved', u'location', u'walking', u'distance', u'everyplace', u'wanted', u'don', u't', u'walk', u'rent', u'bicycle', u'street', u'red', u'light', u'house', u'notice', u'second', u'evening', u'ladies', u'stood', u'narrow', u'windows', u'beckoned', u'knocked', u'passerbys', u'lots', u'inexpensive', u'restaurants', u'nearby', u'eat', u'small', u'refrigerator', u'rooms', u'serving', u'utensils', u'breakfast', u'area', u'highly', u'recommend', u'place']",UR124781614
"[u'location', u'confortable', u'cosy', u'room', u'bathroom', u'delicious', u'breakfast', u'choice']",UR89743614
"[u'blast', u'staying', u'amsterdam', u'berry', u'marcel', u'hospitable', u'helped', u'reserve', u'private', u'canal', u'tour', u'highlights', u'rooms', u'unique', u'fresh', u'modern', u'style', u'location', u'excellent', u'area', u'train', u'station', u'definitely', u'return', u'amsterdam']",UR71211643
"[u'berry', u'marcel', u'warming', u'boutique', u'nights', u'lovely', u'place', u't', u'leave', u'amsterdam', u'mauro', u'mansion', u'boutique', u'top', u'secret', u'address', u'comfortable', u'newly', u'refurbished', u'ans', u'decorated', u'excellent', u'taste', u'style', u'rooms', u'comfortable', u'lot', u'things', u'ans', u'services', u'comfort', u'breakfast', u'wonderful', u'delicious', u'top', u'products', u'moment', u'mauro', u'mansion', u'boutique', u'amsterdam', u'won', u't']",UR73162477
"[u'booked', u'nights', u'based', u'stellar', u'reviews', u'site', u'close', u'central', u'station', u'early', u'flight', u'service', u'alot', u'offer', u'terms', u'guide', u'books', u'well', u'priced', u'range', u'snacks', u'wines', u'free', u'coffee', u'breakfast', u'including', u'pancake', u'nicer', u'amsterdam', u'ambassade', u'suppose', u'highly', u'rated', u'extras', u'ipad', u'free', u'drinks', u'philips', u'wakeup', u'lights', u'touch', u'manual', u'figure', u'bought', u'issues', u'managed', u'turn', u'heat', u'figure', u'hard', u'morning', u'freezing', u'bedroom', u'typically', u'expecting', u'guests', u'turn', u'heat', u'winter', u'bathroom', u'smelled', u'bit', u'taste', u'vent', u'wise', u'choice', u'stated', u'website', u'street', u'level', u'rooms', u'bit', u'noisy', u'mentioned', u'hear', u'building', u'people', u'respectful', u'owners', u'job', u'place', u'small', u'place', u'doesn', u't', u'corporate', u'feel', u'advise', u'place']",UR123037313
"[u'wife', u'loved', u'mauro', u'arrived', u'amsterdam', u'hbf', u'easily', u'walked', u'minutes', u'quiet', u'street', u'canal', u'staff', u'exactly', u'reviews', u'state', u'room', u'overlooking', u'street', u'canal', u'streets', u'center', u'action', u'close', u'crowds', u'room', u'huge', u'owners', u'thoughtful', u'laying', u'rose', u'petal', u'heart', u'bed', u'providing', u'champagne', u'anniversary', u'huge', u'windows', u'opened', u'breakfast', u'wonderful', u'bad', u'absolutely', u'amazing', u'perfect', u'base', u'explore', u'amsterdam', u'offer', u'book', u'won', u't', u'disappointed']",UR113139534
"[u'fiance', u'mauro', u'mansion', u'unforgetable', u'nigths', u'celebrate', u'aniversary', u'couldn', u't', u'berry', u'marcel', u'excelent', u'hosts', u'feel', u'autentic', u'concern', u'confort', u'number', u'unpersonal', u'chain', u'purpose', u'visit', u'advices', u'sugestions', u'romantic', u'prepare', u'wellcome', u'drink', u'recomended', u'romantic', u'place', u'special', u'dinner', u'don', u't', u'romantic', u'visiting', u'amsterdam', u'reasons', u'usefull', u'tips', u'tipical', u'tourist', u'routes', u'places', u'trust', u'better', u'reflect', u'dutch', u'life', u'location', u'min', u'centraal', u'station', u'easy', u'walk', u'main', u'tourist', u'points', u'dam', u'square', u'min', u'famous', u'red', u'light', u'distrit', u'don', u't', u'afraid', u'isn', u't', u'red', u'light', u'street', u'quiet', u'safe', u'day', u'easily', u'reach', u'night', u'life', u'corners', u'rooms', u'spacious', u'wouldn', u't', u'excpect', u'channel', u'house', u've', u'top', u'floor', u'channel', u'view', u't', u'hear', u'noise', u'street', u'rooms', u'private', u'bathube', u'large', u'lcd', u'coffee', u'tea', u'supllies', u'bed', u'breakfast', u'better', u'homemade', u'bread', u'natural', u'fruit', u'juice', u'coffee', u'machine', u'anytime', u'sure', u'amsterdam']",UR80937193
"[u'husband', u'returned', u'trip', u'europe', u'nights', u'amsterdam', u'mauro', u'mansion', u'decided', u'book', u'reading', u'comments', u'trip', u'advisor', u't', u'imagine', u'better', u'place', u'amsterdam', u'feels', u'staying', u'friends', u'house', u'staying', u'selection', u'nutritious', u'breakfast', u'items', u'choose', u'mornings', u'location', u'close', u'quiet', u'street', u'places', u'eat', u'close', u'yummy', u'chocolates', u'pillow', u'everyday', u'stock', u'fridge', u'room', u'drinks', u'gifts', u'rooms', u'front', u'canal', u'quiet', u'problems', u'noise', u'barry', u'marcel', u'friendly', u'happy', u'answer', u'questions', u'absolutely', u'loved', u'staying', u'definitely', u'time', u'amsterdam']",UR104568275
"[u'well', u'perfect', u'sublime', u'luxurious', u'heaven', u'chic', u'boutique', u'well', u'marcel', u'berry', u'thing', u'achieve', u'lifetime', u'difference', u'boy', u'style', u'valentines', u'days', u'amazing', u'experience', u'helped', u'berry', u'marcel', u'unforgetable', u'situated', u'walking', u'distance', u'location', u'situated', u'mins', u'walk', u'central', u'station', u'turn', u'left', u'station', u'keep', u'walking', u'street', u'yds', u'street', u'rooms', u'snobs', u'don', u't', u'mind', u'admitting', u'bathrooms', u'bath', u'power', u'showers', u'sublime', u'bedding', u'free', u'mini', u'bar', u'tv', u'info', u'trouble', u'breakfasts', u'keep', u'going', u'day', u'chill', u'kitchen', u'lounge', u'area', u'recommend', u'ciel', u'bleu', u'resturant', u'money', u'option', u'friend', u'valentines', u'warned', u'pay', u'lot', u'money', u'lifetime', u'experience', u'experience', u'perfect', u'food', u'courses', u'perfect', u'views', u'amsterdam', u'course', u'michelin', u'class', u'service', u'valentines', u'day', u'roses', u'chocolates', u'lovely', u'card', u'waiting', u'return', u'bottle', u'champagne', u'honesty', u'bar', u'touch', u'soooooo', u'cheap', u'berry', u'marcel', u'change', u'thing', u'achieved', u'promise', u'stars', u'visit', u'city']",UR97733793
"[u'bf', u'mauro', u'mansion', u'nights', u'loved', u'minute', u'location', u'perfect', u'touristy', u'sites', u'well', u'local', u'neighborhoods', u'difficult', u'call', u'owners', u'friendly', u'help', u'provide', u'guidance', u'tourist', u'locations', u'directions', u'well', u'recommendations', u'excellent', u'restaurants', u'area', u'street', u'level', u'room', u'turned', u'better', u'expected', u'bed', u'comfortable', u'room', u'spacious', u'beautifully', u'decorated', u'loved', u'bottle', u'prosecco', u'honesty', u'bar', u'fantastic', u'idea', u'feeling', u'house', u'guests', u'customers', u'looked', u'forward', u'daily', u'breakfast', u'dining', u'area', u'food', u'delicious', u'amsterdam', u'definitely', u'mauro', u'mansion']",UR115702117
